id,bug详情,复现步骤,审核状态,重复情况,提交时间
1,打开界面后，看不到安全短信,打开主界面，点击防骚扰，再点击右上方的圈圈，没有安全短信,审核通过,19,2015-01-16 10:34:00
2,打开时候出现无响应，然后选择等待，再次刷新进入,打开时候出现无响应，然后选择等待，再次刷新进入,审核通过,11,2015-01-16 10:36:00
3,无法发送信息，出现闪退现象,当输入手机号码按发送时，出现了“工作停止”字样，然后自动退出操作的界面。,审核通过,10,2015-01-16 10:42:00
4,进入放骚扰页面后，点击小圈圈，没有安全短信,打开主页，进入放骚扰页面后，点击小圈圈，没有安全短信的按钮，找不到,审核通过,19,2015-01-16 10:43:00
5,bug概述，打开百度手机卫士，手机会有短暂的卡顿，不知道怎么回事，短信功能能正常收发。,bug概述，打开百度手机卫士，手机会有短暂的卡顿，不知道怎么回事，短信功能能正常收发。希望以后会有好的改善。,审核通过,7,2015-01-16 10:45:00
6,没有找到安全短信的按钮啊,进入主页面，点击防骚扰，再次点击右上方按钮，进入后找不到安全短信啊,审核通过,19,2015-01-16 10:53:00
7,魅族mx3找不到安全短信的选项,魅族mx3找不到安全短信的选项，现在没有办法发安全短信,审核通过,5,2015-01-16 10:58:00
8,红米1s发送短信没反映,防骚扰-设置-安全短信-新建短信。发送给10000无反映,审核通过,2,2015-01-16 10:58:00
9,魅蓝note找不到安全短信那个选项,"1、进入百度手机卫士主页
2、点击“防骚扰”
3、点击右上角“设置”按钮
4、点击“安全短信”条目（找不到安全短信这一条选项）",审核通过,2,2015-01-16 11:04:00
10,百度手机卫士停止运行。,"按照上述步骤操作的：点击“点击开启”，开启收件箱服务
点击下方的“+”按钮新建短信
在收件人输入框中输入任意有效的手机号码或店家下方的常用联系人列表中联系人
输入短信内容，点击“发送”按钮",审核通过,0,2015-01-16 11:04:00
11,发送时百度卫士停止运行,"1、进入百度手机卫士主页
2、点击“防骚扰”
3、点击右上角“设置”按钮
4、点击“安全短信”条目，进入安全短信主界面
1.jpg
5、点击“点击开启”，开启收件箱服务
6、点击下方的“+”按钮新建短信
7、在收件人输入框中输入10010
8、输入短信内容，点击“发送”按钮",审核通过,3,2015-01-16 11:11:00
12,打开时候自动关闭死机了,安装完后点击打开，手机出现错误提示 自动关闭或者等待。多重新打开几次就没事了,审核通过,11,2015-01-16 11:13:00
13,无法测试，防骚扰中没有安全短信短信,"打开百度手机卫士主页，点击防骚扰，点击右上角设置按钮，没有安全短信选项，无法测试（魅族mx2,flyme 4.1.3.5a,基于android 4.4.4）",审核通过,5,2015-01-16 11:14:00
14,出现百度卫士停止运行,"1、进入百度手机卫士主页
2、点击“防骚扰”
3、点击右上角“设置”按钮
4、点击“安全短信”条目，进入安全短信主界面
5、点击“点击开启”，开启收件箱服务
6、点击下方的“+”按钮新建短信
7、在收件人输入框中输入10010
8、输入短信内容：hf，点击“发送”按钮",审核通过,3,2015-01-16 11:24:00
15,无法发送短信，发送时自动退出,点击发送后，客户端 黑屏，然后直接退出，,审核通过,10,2015-01-16 11:28:00
16,骚扰拦截设置里没有安全短信项目,骚扰拦截设置里没有安全短信项目，见截图，无法进行操作,审核通过,5,2015-01-16 11:32:00
17,"错误概述,打开百度手机卫士,手机会有短暂的卡顿,不知道怎么回事,短信功能能正常收发。希望以后会有好的改善。","错误概述,打开百度手机卫士,手机会有短暂的卡顿,不知道怎么回事,短信功能能正常收发。希望以后会有好的改善。",审核通过,7,2015-01-16 11:37:00
18,有时不能发送，接受正常。,我给10010发了4条短信，只收到2条回复，有2条发送不成功。,审核通过,16,2015-01-16 11:39:00
19,不能正常发送，一发送就停止,不能正常发送，一点发送就出现“很抱歉，百度手机卫士已停止运行”,审核通过,17,2015-01-16 11:40:00
20,短信发布出去，也看不到发出的信息,"进入百度手机卫士主页，点击防骚扰,点击设置，再点击安全短信，进入短信页面，发送短信",审核通过,19,2015-01-16 11:41:00
21,点击发送时，提示卫士停止运行！,按要求在安全短信里发送短信，点击发送时，提示卫士停止运行！导致无法发送！,审核通过,17,2015-01-16 11:48:00
22,老是出现安全警告，点击很多次才退出，比较麻烦。,打开手机信息安全卫士，老是会有安全卫士警告。点击多次才退出。,审核通过,10,2015-01-16 11:54:00
23,安全短信安全短信安全短信,没有安全短信安全短信安全短信安全短信安全短信,审核不通过,5,2015-01-16 12:11:00
24,第一次发送短信的时候崩溃,第一次发送短信的时候崩溃，再次发送问题消失,审核通过,15,2015-01-16 12:15:00
25,能单独在桌面上出现发短信的，快捷方便就好了,进入防骚扰后，安全短信，就可以进入发送短信了方便好用，直观。好,审核通过,19,2015-01-16 12:16:00
26,骚扰拦截设置中没有“安全短信”一项,在“骚扰拦截设置”中没有找到“安全短信”一项。,审核通过,5,2015-01-16 12:23:00
27,很抱歉，“百度手机卫士”已停止运行,"1、点击“点击开启”，开启收件箱服务
2、点击下方的“+”按钮新建短信
3、在收件人输入框中输入10086
4、，编辑短信cxgll，点击“发送”按钮",审核通过,3,2015-01-16 12:35:00
28,发送给10010没收到回复短信,发送给10010，短信内容：102，结果没收到回复短信,审核通过,16,2015-01-16 12:40:00
29,停止运行了，试了两次都是停止运行，没法发送,需要多次重启，很麻烦，不知道要怎么弄，只能再试试了,审核通过,6,2015-01-16 12:46:00
30,发完短信后，在短信列表中有一个null短信。,按照上面的操作完，短信也发出去了，我朋友也接收到短信了，然后退出百度卫士软件后，用系统自带的短信查看，短信列表中有一个null短信,审核通过,7,2015-01-16 12:56:00
31,在安全短信界面不能发送短信,打开百度卫士后，按照步骤执行，发送短信给10086，发送不过去，重新开始操作，还是没有发送成功。,审核通过,15,2015-01-16 13:20:00
32,发送短信出现闪退现象。,开启收件箱服务，点击下方的“+”按钮新建短信，在收件人输入框中输入任意有效的手机号码，点击“发送”按钮，出现闪退现象。,审核通过,10,2015-01-16 13:20:00
33,短信发不出去，总是停留在发送中,"1、进入百度手机卫士主页
2、点击“防骚扰”
3、点击右上角“设置”按钮
4、点击“安全短信”条目，进入安全短信主界面点击“点击开启”，开启收件箱服务
6、点击下方的“+”按钮新建短信
7、在收件人输入框中输入10086  cxll查询流量
8、输入短信内容，点击“发送”按钮    然后发不出去",审核通过,3,2015-01-16 13:32:00
34,可能下载安装完卫士手机时间显示错误！,下午1点半下载完卫士安装后做测试时无意中发现华为荣耀3c畅玩版（已root刷机）时间变成下午十点多，不知是否与卫士有关，还是我刷过了手机出现的问题！,审核通过,8,2015-01-16 13:38:00
35,发不出短信去，不知道什么情况,发送短信到10086，发送的1，手机提示了禁止还是允许，我选了禁止，结果就发不出去了，再发也不提示了，但是还是发不出去。,审核通过,13,2015-01-16 13:47:00
36,双卡的手机，发短信时候没发成功,双卡的手机，发短信时候没发成功，没有选择功能，不能发短信的卡片。,审核通过,13,2015-01-16 14:03:00
37,发送信息第一次提示发送信息失败，点红色感叹号重新发送又正常,发送信息第一次提示发送信息失败，点红色感叹号重新发送又正常,审核通过,12,2015-01-16 14:04:00
38,没有安全短信菜单选择,"按提示步骤，1、进入百度手机卫士主页
2、点击“防骚扰”
3、点击右上角“设置”按钮
4、没有找到“安全短信”",审核通过,2,2015-01-16 14:37:00
39,发短信到10086提示“百度手机卫士停止运行”,发短信到10086提示“百度手机卫士停止运行”，重复操作问题如故,审核通过,17,2015-01-16 14:55:00
40,没有出现安全短信选项,"1、进入百度手机卫士主页
2、点击“防骚扰”
3、点击右上角“设置”按钮
4、没有出现“安全短信”条目",审核通过,2,2015-01-16 15:05:00
41,发不出短信，显示安全卫士停止运行,点击安全短信，发送给10086，点发送信息后，发不出去，安全卫士停止运行，回到安全短信界面,审核通过,6,2015-01-16 15:20:00
42,无法发送短信，无法开启信息,点此开起开启不了默认短信，然后无非发送短信！！！,审核通过,3,2015-01-16 15:22:00
43,小米青春版手机 安全短信发送失败,"1、进入百度手机卫士主页
2、点击“防骚扰”
3、点击右上角“设置”按钮
4、点击“安全短信”条目，进入安全短信主界面
5、点击“点击开启”，开启收件箱服务
6、点击下方的“+”按钮新建短信
7、在收件人输入框中输入任意有效的手机号码或店家下方的常用联系人列表中联系人
8、输入短信内容，点击“发送”按钮

然后提示失败。。。",审核通过,3,2015-01-16 15:38:00
44,我点通知类短信，然后查看我发送给10086的短信及弹异常了。直接谈终止了，但是我再次进入的时候又是正常的,就是上面操作完后，我点通知类短信，然后查看我发送给10086的短信及弹异常了。直接谈终止了，但是我再次进入的时候又是正常的，我的手机是华为的h300，图片已经上传了,审核通过,15,2015-01-16 16:08:00
45,短信的时候提示错误，一点发送短信就提示百度手机卫士已停止运行,进百度卫士主页---选防骚扰--选设置---点安全短信--点点击开启---点击下方的“+”按钮新建短信----在收件人输入框中输入10086---输入短信内容“192”，点击“发送”按钮----然后跳出提示“百度手机卫士已停止运行”,审核通过,17,2015-01-16 16:08:00
46,发短信的过程中，手机卫士自动停止,开启安全短信后，点+号，新建信息，输入收件人10010，信息内容102，点发送，出现自动停止的提示。,审核通过,17,2015-01-16 16:11:00
47,不确定短信是否顺利发送,"1、进入百度手机卫士主页
2、点击“防骚扰”
3、点击右上角“设置”按钮
4、点击“安全短信”条目，进入安全短信主界面
5、点击“点击开启”，开启收件箱服务
6、点击下方的“+”按钮新建短信
7、发给10086 “余额查询”
但不确定短信是否顺利发送",审核通过,3,2015-01-16 16:11:00
48,百度手机卫士已停止运行,联系人写的10086，短信内容1，点击发送 提示 百度手机卫士已停止运行,审核通过,17,2015-01-16 16:16:00
49,百度手机卫士已停止问题,从1-7步骤都正常，就是执行8、输入短信内容，点击“发送”按钮 就出现百度手机卫士已停止,审核通过,17,2015-01-16 16:18:00
50,百度手机卫士停止运行,"在收件人输入框中输入任意有效的手机号码或店家下方的常用联系人列表中联系人
，输入短信内容，点击“发送”按钮后，出现百度手机卫士停止运行。",审核通过,0,2015-01-16 16:36:00
51,短信低端菜单无效，点进去不是我想要的,在给10086发送信息后，地下显示“话费充值”“话费查询”“更多”，点击“话费查询”原以为会自动给10086发送信息，点进去看完全不是查话费的。。很失望,审核通过,12,2015-01-16 16:44:00
52,不能正常发送和接收短信,按照题目一步步做，给10086发送短信后完全没反应，用手机自带的短信发送很快发出去并收到了,审核通过,18,2015-01-16 16:44:00
53,"发送短信时页面很卡,基本上无提醒短信发送成功,很容易漏发 或者多发.",编辑短信--发送短信--页面无任何发送提示,审核通过,15,2015-01-16 16:51:00
54,安全短信安全短信安全短信,没有安全短信没有安全短信没有安全短信没有安全短信,审核不通过,5,2015-01-16 16:52:00
55,短信发不出去。不知道短信是否能正常接收。,短信发不出去。不知道短信是否能正常接收。,审核通过,13,2015-01-16 16:57:00
56,打开软件时，提示无响应,打开软件时，提示软件无响应，是否等待还是确定关闭,审核通过,11,2015-01-16 17:08:00
57,给运营上发短信时，出现闪退,给运营商发cxhf短信，点击发送按钮时，软件出现闪退，从新启动软件，无信息发送信息,审核通过,8,2015-01-16 17:17:00
58,安全短信界面无法读取短信内容,点击进入安全短信界面，显示的是无法显示短信,审核通过,19,2015-01-16 17:17:00
59,选择联系人的时候不能识别本机存的号码，需要手动输入，非常麻烦，希望能改进。,选择联系人的时候不能识别本机存的号码，需要手动输入，非常麻烦，希望能改进。,审核通过,14,2015-01-16 17:18:00
60,有一个还不错，在安全短信页面上有更细的分类,打开安全短信界面，在左上角有一个四个正方形的图形，打开之后，有更详细的分类，比如费用账单何话费账单等等，挺方便的,审核通过,7,2015-01-16 17:24:00
61,在信号满格状态下 安全短信界面发送短信 百度卫士就停止运行 发送不超过 多长尝试都这样,在信号满格状态下 安全短信界面发送短信到10086 百度卫士就停止运行 发送不超过 多长尝试都这样,审核通过,9,2015-01-16 17:27:00
62,不能发短信和接收短信。。。。。。,"打开百度手机卫士进入主页
点击“防骚扰”
点击右上角“设置”按钮
点击“安全短信”条目，进入安全短信主界面
发短信就发不出去",审核通过,4,2015-01-16 17:38:00
63,一直在等待无法发送信息,点击以上9点步骤，发送信息，一直发不出去等待,审核通过,11,2015-01-16 17:46:00
64,收到短信，上面不显示未读,收到短信后只有手机自带短信显示未读，这个短信不显示未读，让我找了好久,审核通过,16,2015-01-16 18:01:00
65,给10086发送时候显示发送失败，都是按照任务操作的,给10086发送时候显示发送失败，都是按照任务操作的,审核通过,12,2015-01-16 18:10:00
66,选择系统短信界面，会自动跳转安全短信。?,从手机桌面点自带短信的标志，出现两个选择，，一个是短信，，一个是安全短信，，我点击的是系统自带的那个短信，然后会自动跳转至安全短信，，  短信发送不出去。,审核通过,18,2015-01-16 18:18:00
67,安全短信发不出去。。。。。。。。。。,按上述步骤，执行到8   我选择发送对象是10010，，  一点发送  应用就停止了。。  没有发送成功。,审核通过,13,2015-01-16 18:18:00
68,每次发短信，手机卫士就会崩溃,直接点击下方的“+”按钮新建短信，然后按发送,审核通过,0,2015-01-16 19:16:00
69,一发送短信，百度卫士就关闭,一发送短信，百度卫士就关闭，无法发送短信。,审核通过,11,2015-01-16 19:20:00
70,魅族flyme4.1.3.5a没有安全短信,魅族flyme4.1.3.5a没有安全短信，无法完成测试。,审核通过,5,2015-01-16 19:54:00
71,不能正常发送或接受短信,输入短信内容和联系人后，一点击发送就提示百度手机卫士停止运行。,审核通过,17,2015-01-16 19:55:00
72,移动号码无法发送短信到电信,1.向电信服务号码 10000 发送短信 “0”。2.短信发送不成功。,审核通过,16,2015-01-16 20:32:00
73,手机信号报告虚假信号，一会满信号，一会无信号,选择安全短信，进入添加，输入电话号码和短信内容，发送失败提示无信号。,审核通过,1,2015-01-16 20:33:00
74,进入安全短信，点击发送没反应,进入安全短信，写好收信人，编辑好短信，点击发送，没有反应,审核通过,19,2015-01-16 20:48:00
75,手机上安装程序结束时，出现闪退，,微任务上下载后安装快结束时，程序出现闪退，连同微任务也一起闪退了。,审核通过,8,2015-01-16 20:53:00
76,百度手机卫士软件停止,输入收件人号码和内容后，点击发送，，然后就卡住了。出现百度手机卫士软件停止。系统是安卓4.4.4 。,审核通过,10,2015-01-16 20:54:00
77,点击发送后出现黑屏，应用停止,编辑好信息后，点击发送短信出现黑屏，应用停止运行,审核通过,17,2015-01-16 21:01:00
78,出现闪退，在发送过程中突然闪退,按照操作指南一步步操作的，但是在发送瞬间闪退，手机为红米note。,审核通过,8,2015-01-16 21:08:00
79,在短信界面上下拉动会卡屏，不流畅，建议改善。,在短信界面上下拉动会卡屏，不流畅，建议改善。,审核通过,7,2015-01-16 21:41:00
80,我给10086发送短信查询积分，发送失败,我给10086发送短信查询积分，发送失败,审核通过,12,2015-01-16 21:45:00
81,"按照官方提示的操作发送短信到10010,百度卫士就挂了","6、点击下方的“+”按钮新建短信
7、在收件人输入框中输入任意有效的手机号码或店家下方的常用联系人列表中联系人
8、输入短信内容，点击“发送”按钮
9、很抱歉，百度手机卫士已停止工作",审核通过,0,2015-01-16 21:48:00
82,信息发送不成功，也接收不到。,发信息到运营商发不出，过了一分钟重发还是发不出。给本机号码发信息也发不出。,审核通过,13,2015-01-16 22:32:00
83,点击开启，无法开启安全短信,按步骤进入，点击开启，无法开启安全短信收件箱服务,审核通过,3,2015-01-16 22:45:00
84,短信有一定几率发送失败。,尝试发送两条短信给运营商，第一条发送失败。第二条才成功。,审核通过,7,2015-01-16 22:46:00
85,短信发不出去，短信发不出去短信发不出去,开启安全短信，短信发不出去短信发不出去短信发不出去,审核通过,13,2015-01-16 23:04:00
86,很抱歉，百度手机卫士已停止运行,编辑短信完成后，点击发送按钮，就出现提示，停止运行,审核通过,17,2015-01-16 23:31:00
87,发出短信后，弹出的界面上未显示我发出的短信,按以上图解步骤进行操作，向电信营业厅发送短信，但弹出的界面上未显示我发出的短信，等了几分钟后，也并没有收到任何回复，应是发送未成功。,审核通过,16,2015-01-16 23:54:00
88,短信发不了，又收不了，又没提示,按题示操作，百度手机卫士停止工作，不见短信发送成功字样，收件箱里没有收到短信,审核通过,17,2015-01-16 23:59:00
89,比较麻烦，要一直进入进入，进入了四次，过于麻烦,按你的要求进入设置，很麻烦。。。。。。。,审核通过,19,2015-01-17 00:27:00
90,发送联通查询流量信息失败，,查询联通流量信息发送失败，发送无法顺利完成。,审核通过,12,2015-01-17 07:21:00
91,整个程序闪退，闪退点进去还是在原来那里,在微任务打开后进入手机百度卫士的安全信息哪里点开启，然后编辑好要发的短信内容，一点发送就闪退了,审核通过,8,2015-01-17 08:50:00
92,不能发送短信，出现bug,点击发送短信之后，就会出现死机，不能正常发送,审核通过,11,2015-01-17 08:57:00
93,写好短信后，点击发送就提示百度卫士停止运行了！不知道是什么原因。我用的是大神f1移动版。,按要求进入安全短信，写好短信后，点击发送就提示百度卫士停止运行了！不知道是什么原因。我用的是大神f1移动版。,审核通过,17,2015-01-17 09:05:00
94,发不了短信，也接收不了。,收件人填10086，写好短信后，按发送，出现百度手机卫士已停止运行。,审核通过,17,2015-01-17 09:36:00
95,信息经多次尝试，均发送失败,信息经多次尝试，均发送失败，已经获取全部权限，仍旧发送失败。,审核通过,12,2015-01-17 09:40:00
96,点击发送之后就退回到发个骚扰模式页面了,输入联系人手机，输入短信内容，然后就退回到发个骚扰模式页面了。短信根本没发出去。,审核通过,14,2015-01-17 09:47:00
97,在安全短信中新建短信发出，安全卫士自动停止，见截图,在安全短信中新建短信发出，点击发送，安全卫士自动停止，见截图,审核通过,9,2015-01-17 11:23:00
98,发短信后百度卫士已停止运行,可能是受乐安全的影响，打开后，按步骤操作时，发送短信不成功，并停止运行,审核通过,17,2015-01-17 11:44:00
99,第一次试验的时候显示百度手机卫士已停止,第一次试验的时候显示百度手机卫士已停止，没截到图,审核通过,6,2015-01-17 13:19:00
100,发短信时，百度卫士秒退,根据项目要求，发短信时，百度卫士没有响应，自动退出，返回到设置界面，试了几次都一样,审核通过,9,2015-01-17 13:50:00
101,双卡手机无法选择卡1或卡2发送,我的是双卡手机，无法选择卡1还是卡2发送短信,审核通过,18,2015-01-17 14:07:00
102,百度手机卫士程序死掉了,进入微任务安装百度手机卫士后打开，手机卫士程序崩溃了,审核通过,8,2015-01-17 14:23:00
103,设置按钮界面下面没有安全短信条目,"1、进入百度手机卫士主页
2、点击“防骚扰”
3、点击右上角“设置”按钮
4、进入后发现没有“安全短信”条目，无法进入安全短信主界面",审核通过,2,2015-01-17 15:20:00
104,操作比较繁琐，可以在简单一些,下载-安装-打开-防骚扰-设置-安全短信-开启-新建-收件人-发送,审核通过,3,2015-01-17 15:44:00
105,给10086和1008611均发了短信，等了大概5分钟均没任何反应,给10086和1008611均发了短信，等了大概5分钟均没任何反应,审核通过,18,2015-01-17 18:27:00
106,在点击发送信息的时候，突然闪退。要重新开启百度卫士。,"1、进入百度手机卫士主页
2、点击“防骚扰”
3、点击右上角“设置”按钮
4、点击“安全短信”条目，进入安全短信主界面
5、点击“点击开启”，开启收件箱服务
6、点击下方的“+”按钮新建短信
7.编辑短信
8.点击发送
闪退",审核通过,3,2015-01-17 18:29:00
107,双卡双待的手机在发送短信时无法选择哪个卡发送短信,根据上述步骤，我输入10086运营商的电话号码，点击发送短信时，由于我是电信+移动手机，发送短信没有选择，不知道发送到哪张卡上去了，现在也没有正常接受到运营商的回复短信。,审核通过,16,2015-01-17 18:47:00
108,短信一直在发送中，是否是没有获得手机发送短信权限？这个要自动获得，手动设置很不方便,按照指示正常操作，出现短信发送失败提示，认为可能是没有权限,审核通过,12,2015-01-17 19:22:00
109,竟然没有安全短信条目，竟然没有安全短信条目！,"1、进入百度手机卫士主页
2、点击“防骚扰”
3、点击右上角“设置”按钮",审核通过,2,2015-01-17 19:27:00
110,发短信后一直旁边是。。。感觉像是在发送，但是又收到回复的短信了,发短信后一直旁边是。。。感觉像是在发送，但是又收到回复的短信了,审核通过,16,2015-01-17 20:12:00
111,百度手机卫士安全短信点击发送后崩溃,进入百度手机卫士，到达安全短信功能点击加号，新建短信点击发送后崩溃，提示百度手机卫士已停止运行,审核通过,17,2015-01-17 20:42:00
112,刚开始的时候短信发送不了，后来可以。,在步骤9的时候点击发送，发送不了，然后该界面立马崩溃（发送0000到10086，发送三次，都崩溃），在微任务里面上传截图后，我又发送了几次，却成功了，经过观察，前三次发送时在“安全短信”界面没有短信记录（以前收发的短信），而最后几次（成功的那几次）“安全短信”界面是有之前的记录的。截图已经上传了。,审核通过,15,2015-01-17 21:10:00
113,发不出去短信，可以收到短信，但不是用百度手机卫士收到的,打开百度手机卫士，点击防骚扰，然后点击安全短信，然后是点击开启，然后点加号，但是发不出去短信,审核通过,18,2015-01-17 21:21:00
114,可以输入联系人及短信内容，点击发送百度卫士闪退,可以输入联系人及短信内容，点击发送百度卫士闪退,审核通过,14,2015-01-17 21:40:00
115,向1700号段虚拟运营商发送短信，发不出去，一直处于发送中,"输入号码，短信内容，发送
发不出去，一直处于发送中",审核通过,13,2015-01-17 22:08:00
116,第8部点击发送出现错误提示,第8部点击发送出现错误提示“很抱歉百度手机卫士已停止运行”,审核通过,17,2015-01-17 23:47:00
