id,bug详情,复现步骤,审核状态,重复情况,提交时间
117,百度卫士提醒停此响应,点击发送短信后弹出百度卫士停止响应的信息。,审核通过,9,2015-01-18 00:00:00
118,每次发送短信后百度卫士停止运行,按要求进入手机安全短信 给10086发送1 点击发送后显示百度卫士停止运行,审核通过,6,2015-01-18 00:33:00
119,bug概述，打开百度手机卫士，手机会有短暂的卡顿，不知道怎么回事，短信功能能正常收发。希望以后会有好的改善。,bug概述，打开百度手机卫士，手机会有短暂的卡顿，不知道怎么回事，短信功能能正常收发。希望以后会有好的改善。,审核通过,7,2015-01-18 02:19:00
120,按照要求发送短信，短信未发送成功,"1. 按照操作步骤，联系人选择“10010”
2. 新建短信，内容为10010
3. 点击发送

预期结果：短信发送成功
实际结果：短信未发送出去",审核通过,14,2015-01-18 10:42:00
121,我的手机卫士虽然可以正常发短信，但是没有安全短信这个条目,首先，为了确保能完整的使用手机卫士，我登陆了个人账户。其次，找到防骚扰，进入防骚扰，点击右上角的设置，进入页面后没有找到安全短信这个条目。,审核通过,19,2015-01-18 10:47:00
122,运行软件时手机死机了！我用的是红米note标准版,在百度微任务里打开软件时就死机了！怎么操作手机还是没反应最后只有拔电池了,审核通过,11,2015-01-18 11:36:00
123,无法正常发送短信，，进度条为空,在联系人界面输入10086，再输入内容，，选择发送后，卡主了,审核通过,14,2015-01-18 13:40:00
124,编辑完成短信后点击发送自动退出软件，短信也没有发送成功,在“安全短信”页面点击“+”按钮添加短信，输入移动“10086”号码，分别发送内容为“1”、“3”的短信，点击发送按钮时均自动退出软件，无法发送成功。,审核通过,10,2015-01-18 15:20:00
125,"无法删除短消息会话, 删除了会重新出现","进入安全短信, 可以看到所有会话列表, 我的列表有3个, 选择第二项, 左划, 点击删除按钮, 该项目依然存在.
系统: cm11",审核通过,4,2015-01-18 15:25:00
126,如果一个联系人有多个手机，从联系人选择界面里看不见，必须用编辑联系人,写短信内容，选择联系人，编辑联系人，修改手机号,审核通过,14,2015-01-18 15:37:00
127,在输入短信内容的时候，联系人名字不见了,输入完联系人名字后，再输入短信内容，联系人名字不见了。,审核通过,14,2015-01-18 16:25:00
128,给运营商发送短信，一直处于发送状态，发不出去也收不到,给运营商发送短信，一直处于发送状态，发不出去也收不到,审核通过,13,2015-01-18 19:23:00
129,设置中没有安全短信选项,按步骤进入防骚扰，设置，里面没有安全短信的选项。,审核通过,5,2015-01-18 20:35:00
130,右上角设置里没有安全短信,选择右上角设置，里面根本没有安全短信！！！,审核通过,5,2015-01-18 23:26:00
131,发送短信时提示“很抱歉，百度卫士停止运行”,根据要求操作-安全短信-新建信息-输入我的另一部手机号码-输入短信内容123-发送时提示：很抱歉，百度卫士停止运行，另一部手机没有收到短信。,审核通过,17,2015-01-19 01:29:00
132,同上。。。。。。。。,按照步骤，小米手机发短信输入10086，弹出是否允许百度卫士读取联系人，拒绝，再输入ye，发短信的时候就崩溃了，然后自带短信给10086发送ye，百度卫士没收到短信。,审核通过,18,2015-01-19 09:38:00
133,提示，很抱歉百度手机卫士已停止运行,百度手机卫士主页点击“防骚扰”，点击右上角“设置”按钮，点击“安全短信”条目，进入安全短信主界面点击开启，点击发送立即跳出提示，很抱歉百度手机卫士已停止运行,审核通过,3,2015-01-19 14:36:00
134,点击设置按钮后无安全短信条目,点击设置按钮后无安全短信条目，无法进行后续操作,审核通过,4,2015-01-19 15:08:00
135,点击右上角“设置”按钮，无安全短信条目,点击右上角“设置”按钮，无安全短信条目，无法进行后续操作,审核通过,4,2015-01-19 15:32:00
136,流量监控无效，没反应,进入手机流量监控，选择联通2g校准，等了几分钟也没有校准结果,审核通过,19,2015-01-19 15:34:00
137,"1、进入百度手机卫士主页
2、点击“防骚扰”
3、点击右上角“设置”按钮，没有安全短信模块","1、进入百度手机卫士主页
2、点击“防骚扰”
3、点击右上角“设置”按钮，没有安全短信模块",审核通过,2,2015-01-19 15:34:00
138,无法发出短信，显示“百度手机卫士已停止运行”,按照短信发送及接收的测试要求向运营商发送短信，试了5次都是显示“百度手机卫士已停止运行”,审核通过,6,2015-01-19 16:24:00
139,收件人只能添加三个  添加三个后就无法继续添加,新建短信-点击收件人的框-选择联系人  选择满三个后就无法继续添加,审核通过,1,2015-01-19 17:40:00
140,点击发送按钮，弹出停止运行提示,按照提示操作，点击发送按钮后，弹出百度手机卫士已停止运行提示,审核通过,17,2015-01-19 19:10:00
141,点击发送短信后，出现对话框显示百度手机卫士停止运行,按步骤操作后点击发送短信后，出现对话框显示百度手机卫士停止运行,审核通过,6,2015-01-19 22:04:00
142,双卡双待手机，发不出也收不到,双卡双待手机，发不出也收不到。不能选择使用那个sim卡来发送,审核通过,13,2015-01-19 22:14:00
143,发短信，无法正常发出，失败,"在收件人输入框中输入任意有效的手机号码或店家下方的常用联系人列表中联系人

输入短信内容，点击“发送”按钮，短信发送失败。",审核通过,0,2015-01-20 08:51:00
144,"1、进入百度手机卫士主页
2、点击“防骚扰”
3、点击右上角“设置”按钮
4、没有发现安全短信界面","1、进入百度手机卫士主页
2、点击“防骚扰”
3、点击右上角“设置”按钮
4、没有发现安全短信界面",审核通过,2,2015-01-20 09:29:00
145,点击发送短信，手机信号断开,输入手机号码――输入短信信息――发送  手机信号断开,审核通过,1,2015-01-20 10:29:00
