id,bug详情,复现步骤,审核状态,重复情况,提交时间
212,获取验证码后直接 白屏,在首页注册  点击获取验证码后，第一无反应  等待20s后 第二次点击 直接白屏,审核通过,8,2015-12-03 13:34:11
213,显示发表成功，但是在内容里面无法动态更新,虽然显示发表成功，但是在内容里面无法动态更新，响应速度太慢了,审核不通过,6,2015-12-03 13:34:11
214,签到功能有问题，签到成功没反应,签到功能有问题，签到成功没反应，我离胡歌和罗晋的距离没有减少，那个签字仍然显示是个签，没有显示已签到,审核通过,24,2015-12-03 13:41:42
215,咨询无法加载图片，都是白框,点进咨询栏，等待一分多，始终没有加载出图片，咨询总栏图片无法显示,审核通过,13,2015-12-03 13:41:42
216,咨询无法刷新，或者说刷新后跟先前相同,下拉后，没有出现刷新的提示，而且有些卡，只出现了一个黑框，然后内容也没有改变,审核不通过,13,2015-12-03 13:41:42
217,发表的内容无法显示出来,发表动态，它提示我成功了，以及需要刷新才会显示，但是我刷新几次后，我发的动态也没有显示,审核不通过,6,2015-12-03 13:41:42
218,明星榜关注功能有问题，关注成功后没反应,点入明星榜后关注了胡歌和罗晋之后，他们的人气依旧显示是0，没有增加，,审核不通过,24,2015-12-03 13:41:42
219,资讯界面左侧未显示内容,打开资讯界面，子选项左侧空白。内容不充实,审核不通过,25,2015-12-03 14:01:57
220,圈子发布后，无法显示发送的动态,"根据要求按步骤进入圈子发布动态，显示发送成功，但是内容不显示，退出软件重新登入还是没找到
手机：华为荣耀4x
系统：安卓
网络正常",审核通过,9,2015-12-03 14:51:50
221,无法注册登陆，收不到短信验证码 登陆界面白屏,注册界面输入手机号 点短信验证 没反应 白屏 无法进入软件内部,审核通过,21,2015-12-03 14:53:36
222,解释一下，无法登陆app内部，故截下来的界面截图都没有,解释一下，无法登陆app内部，故截下来的界面截图都没有,审核不通过,2,2015-12-03 14:53:36
223,和任务第三步一样重新进入多次都没有反映，测试手机小米4，安卓4.4.4,和任务第三步一样，重新进入多次都没有反映，测试手机小米4，安卓4.4.4,审核通过,11,2015-12-03 14:58:27
224,进入app后就没有响应了,任务第一步能正常打开，点击圈子后就没有响应了，再次重新进入app主页面就没有响应,审核通过,10,2015-12-03 14:58:27
225,初次进入app，显示“手机号”“验证码”“邀请码”三个需要输入的地方，输入完手机号，然后点击“获取验证码”无反应，即无法完成手机验证注册登录，因为无法注册登录所以无法继续往下的测试,"初次进入app，显示“手机号”“验证码”“邀请码”三个需要输入的地方，输入完手机号，然后点击“获取验证码”无反应，即无法完成手机验证注册登录，因为无法注册登录所以无法继续往下的测试
手机型号：htc one m7 801  安卓5.0.2",审核不通过,21,2015-12-03 15:01:01
226,无法进入程序主界面，一直是白屏状态,打开程序出现启动画面后，就一直是白屏无任何显示,审核通过,26,2015-12-03 15:08:41
227,进入软件，白屏幕。。,进入软件，等候一段时间依然没有反应，维持白屏，单击后退返回的桌面，多次进入均是白屏。。,审核通过,16,2015-12-03 16:22:00
228,进入圈子发表动态，不可以显示动态,下载安装app，进入圈子发表动态，不可以显示动态,审核通过,6,2015-12-03 16:39:13
229,"点击资讯按钮,出现闪退","下载安装app，进入明显咨询，点击资讯按钮,出现闪退过一次",审核通过,25,2015-12-03 16:39:13
230,进入咨询和圈子都加载不出图片,下载安装app，进入明显咨询和圈子图片加载不出来,审核不通过,13,2015-12-03 16:39:13
