id,bug详情,复现步骤,审核状态,重复情况,提交时间
1,直接闪退，无法进入体验。可能是机型不兼容。,直接闪退，无法进入体验。可能是机型不兼容。,审核通过,1,2015-12-14 21:11:16
2,安装完成后无法打开app，两种途径都不能打开！,安装完成后无法打开app，两种途径都不能打开！酷派9150，安卓4.1,审核通过,15,2015-12-14 21:36:55
3,小米2s无法运行软件,"小米2s 安卓4.4.4
软件奔溃，无法运行。",审核通过,14,2015-12-14 21:41:16
4,无法打开软件？？？？？？？？,"打开都是黑屏，手机要扣电池重启，手机是三星note3 n9008s,安卓4.3",审核通过,21,2015-12-14 21:44:29
5,打开app停止运行停止运行停止运行,打开app停止运行停止运行停止运行停止运行停止运行停止运行,审核通过,4,2015-12-14 21:47:57
6,安装过程正常，启动后闪退,"安装过程正常，启动后闪退
安装过程正常，启动后闪退",审核通过,5,2015-12-14 21:50:00
7,安装完成后，app打开就是黑屏闪了一下，然后就没有然后了，。。。截图也是截不到，只能发个截图表示已安装了,安装完成后，app打开就是黑屏闪了一下，然后就没有然后了，。。。截图也是截不到，只能发个截图表示已安装了,审核通过,17,2015-12-14 21:53:29
8,打开软件的时候出现闪退,打开软件的时候出现闪退，显示已停止，连续出现几次,审核通过,8,2015-12-14 21:59:26
9,闪退闪退闪退闪退闪退,无法进入软件，点击后直接闪退回到移动测试界面。手机：荣耀3c ，网络：wifi,审核通过,12,2015-12-14 22:00:10
10,无法打开应用，从微任务点击打开app按钮，显示错误信息，无法进入主界面,无法打开应用，从微任务点击打开app按钮，显示错误信息，无法进入主界面.安卓4.4.2，原生系统,审核通过,2,2015-12-14 22:00:12
11,安装后，打开程序后闪退，并弹出错误框,魅族mx3两次安装，多次打开程序后闪退，并弹出错误框,审核通过,15,2015-12-14 22:00:13
12,安装后根本无法打开该app,正常安装后，点击进入黑屏后就退出了，尝试多次都无法使用，测试手机：红米note2,审核通过,21,2015-12-14 22:00:43
13,无法打开应用，应用闪退,无论从众测客户端打开，还是手机直接打开，应用均无法打开，闪退。,审核通过,2,2015-12-14 22:01:10
14,程序闪退：在微任务下载安装好以后，点打开，手机转为黑屏，随后转回微任务界面。,程序闪退：在微任务下载安装好以后，点打开，手机转为黑屏，随后转回微任务界面。手机进程里没有app历史运行记录。,审核通过,20,2015-12-14 22:04:34
15,反复多次测试包括重启手机，都是能够安装，无法打开，有闪退现象。,反复多次测试包括重启手机，都是能够安装，无法打开，有闪退现象。测试环境，红米手机，wi-fi网络。,审核通过,10,2015-12-14 22:05:33
16,安装完成后无法打开app，提示停止运行,安装完成后无法打开app，提示停止运行，华为p6，安卓4.4,审核通过,4,2015-12-14 22:07:57
17,闪退，无法使用。闪退，无法使用。,打开软件，闪退，无法使用。测试手机华为荣耀7,审核通过,7,2015-12-14 22:09:05
18,在微任务领取任务后，点打开后打不开雅思君app,"在微任务领取任务后，点打开后页面闪一下又跳回到微任务app界面，打不开雅思君app，但手机打开的程序列表里面有。
小米手机3",审核通过,16,2015-12-14 22:15:37
19,软件安装后 无法正常运行,"本人手机魅蓝note1电信版 安卓版本4.4.4 网络环境50m电信光纤 网络畅通
软件安装完成后 点击微任务中的打开按钮 转到软件 但是软件闪退 无法打开 提示 很抱歉，“雅思君”已停止运行",审核通过,13,2015-12-14 22:20:37
20,黑屏，不能打开软件，尝试两次都不行,黑屏，不能打开软件，尝试两次都不行，全是黑屏，不能正常进入软件界面，无法继续测试，请检查。,审核通过,21,2015-12-14 22:24:03
21,app 无法打开 点击app后 又跳回手机桌面,app 无法打开 点击app后 又跳回手机桌面,审核通过,16,2015-12-14 22:27:00
22,应用闪退，无法进入应用,下载安装后点击应用图标，屏幕一黑瞬间闪退，无法进入应用。华为荣耀4x电信版,审核通过,2,2015-12-14 22:27:36
23,打开程序闪一下就退出了,打开程序闪一下就退出了，不论百度微任务还是直接打开,审核通过,19,2015-12-14 22:27:57
24,打不开软件，闪退，无任何提示。,点击软件无反应，打不开软件，闪退，无任何提示。,审核通过,18,2015-12-14 22:29:37
25,"能正常安装，安装后点击图标，手机黑一下，然后又返回手机界面，没有打开程序，应该发生了闪退。重复几次都是如此。如截图所示
手机 红米2 系统4.4.4","能正常安装，安装后点击图标，手机黑一下，然后又返回手机界面，没有打开程序，应该发生了闪退。重复几次都是如此。如截图所示
手机 红米2 系统4.4.4",审核通过,20,2015-12-14 22:35:55
26,软件闪退，无法登入完成测试,软件闪退，无法登入完成测试，点击软件直接黑屏闪退,审核通过,10,2015-12-14 22:39:09
27,无法正常使用，程序崩溃退出,"无法正常使用，程序崩溃退出
手机型号索尼z2
版本：安卓5.1.1",审核通过,15,2015-12-14 22:40:21
28,华为c8818无法进入软件，先黑屏后退出,无法进入软件，先黑屏后自动退出，手机是华为c8818，android4.4.4,审核通过,6,2015-12-14 22:42:06
29,无法登入软件，黑屏后，就闪退，无法打开，尝试多次不行,打开软件后，只有输入手机号码选项，输入后无法操作，进入不了首页,审核通过,21,2015-12-14 22:42:28
30,"闪退,点击闪退,不能进入应用","点击应用后,闪退,在红米手机上.点击闪退,不能进入应用",审核通过,2,2015-12-14 22:43:25
31,第一次打开程序异常自动退出，第二次打开程序停止运行,第一次打开程序异常自动退出，第二次打开程序停止运行，bug日志已截图上传,审核通过,15,2015-12-14 22:43:38
32,"点击打开软件,软件提示""很抱歉,雅思君已停止运行""","点击打开软件,软件提示""很抱歉,雅思君已停止运行""",审核通过,4,2015-12-14 22:43:58
33,下载安装后无法正常打开，出现闪退,下载安装后无法正常打开，出现闪退，无法检测各功能,审核通过,8,2015-12-14 22:45:24
34,完全无法打开app界面,微任务端安装后打开，打开过程中经历多次以黑底亮屏暗屏过程后回到微任务，无法打开app，红米note，miui7,审核通过,5,2015-12-14 22:49:05
35,闪退，无法打开软件，一直闪退。,闪退，无法打开软件，一直闪退。手机红米note，网络wifi，手机系统安卓。,审核通过,7,2015-12-14 22:49:24
36,软件无法登录，出现闪退,在微任务下载软件，之后安装，点击打开，自动退出，没有任何软件登录页面，直接退出来。下面有手机截图。,审核通过,19,2015-12-14 22:51:54
37,无法正常登陆，显示雅思君已停止.........,无法正常登陆，显示雅思君已停止.........,审核通过,11,2015-12-14 22:55:00
38,安装软件成功，打开软件出现闪退,安装软件成功，打开软件出现闪退，无法打开页面。,审核通过,8,2015-12-14 22:56:55
39,闪退！根本没有办法运行！无论是从微任务客户端打开还是点击图标直接打开都一直是闪退！整个手机屏幕黑一下，然后就自动退出了！,"一直在闪退！屏幕黑一下就没有了，费了老大劲才截到黑屏的图片！开始以为是手机上的猎豹清理大师等安全清理类app对待测试app运行产生干扰，于是先卸载这些可能干扰其他app运行的安全清理类软件，保险起见再将手机重启，然后再重新测试，但问题依旧没有改善！
测试用的手机是三星i739，运行的是百度云os v6正式版。手机上其他app主要有：高德地图 滴滴出行 jj斗地主 流量宝 qq 免费wifi电话 截图工具 二维码扫描 pp助手 一淘 2345影视大全 掌悦ireader 直播吧 军棋 悦动浏览器 讯飞手机输入法 无线鼠标 soundwire es文件浏览器 百度地图等。",审核通过,17,2015-12-14 23:03:01
40,软件无法打开，黑屏，然后闪退,点击打开，先黑屏，然后闪退。从百度打开，还有直接从自己手机打开，都是先黑屏，后闪退,审核通过,21,2015-12-14 23:08:33
41,系统不兼容，打开app就提示已经停止工作,系统不兼容，打开app就提示“雅思君”已停止运行。手机是酷派大神f2 8675-a,审核通过,13,2015-12-14 23:17:24
42,从平台打开软件，不能运行。,从微任务客户端打开雅思君，黑屏两秒之后跳出，雅思君停止响应的提示。我是康佳976，刷的小米系统。,审核通过,13,2015-12-14 23:19:07
43,可安装，但是无法正常运行，提示“雅思君”已停止运行！,手机型号：小米4移动版，安卓4.4，可安装，但是无法正常运行，提示“雅思君”已停止运行！,审核通过,4,2015-12-14 23:30:00
44,软件打不开，有闪退现象。,软件能正常下载，但是打不开，有闪退现象。,审核通过,18,2015-12-14 23:53:55
45,打开就是黑屏，根本不显示,打开就是黑屏，根本不显示，重启依然如此 手机型号 青城n1y wifi,审核通过,11,2015-12-14 23:55:48
46,点击打开，黑屏了以后秒退,点击打开，黑屏了以后秒退。我的手机是华为4c。,审核通过,21,2015-12-15 00:04:26
47,软件无法打开，打开软件屏幕为黑，无法加载画面，手机疯狂震动,软件无法打开，打开软件屏幕为黑，无法加载画面，手机疯狂震动,审核通过,19,2015-12-15 00:43:32
48,一直闪退，无法登陆软件,从百度众测打开软件后不是直接链接该软件，而是退回移动测试项目界面，如果直接打开软件也是闪退。,审核通过,12,2015-12-15 00:48:17
49,小米2s android 5.0.2  一按打开就闪退,小米2s android 5.0.2  一按打开就闪退,审核通过,7,2015-12-15 01:18:49
50,安装正常，无法打开软件。,正常安装，完成安装，点击软件，无法打开，崩溃出错退出,审核通过,19,2015-12-15 01:21:58
51,根本就打不开，一打开就报错，反复尝试了多次至少10次以上，都是打开就报错,根本就打不开，一打开就报错，反复尝试了多次至少10次以上，都是打开就报错,审核通过,18,2015-12-15 01:25:15
52,与我的手机型号不兼容,软件打开后，即显示停止工作，手机型号vivo x5v  ，宽带：电信50m,审核通过,11,2015-12-15 06:07:41
53,"你的要求是:功能使用正常，不会出现闪退,但你这个app就根本打不开啊,如图,打开后是黑的,然后一闪就没了,app已经完成退出去.手机内存2g,4核.测试别的app都可以正常打开.找技术看看吧.问题很严重啊,进都进不去,还谈什么功能使用正常呢?","你的要求是:功能使用正常，不会出现闪退,但你这个app就根本打不开啊,如图,打开后是黑的,然后一闪就没了,app已经完成退出去.手机内存2g,4核.测试别的app都可以正常打开.找技术看看吧.问题很严重啊,进都进不去,还谈什么功能使用正常呢?",审核通过,18,2015-12-15 06:49:09
54,"黑屏!!根本进不去,一直卡在图中那个地方,黑屏.最后只能结束任务","黑屏!!根本进不去,一直卡在图中那个地方,黑屏.最后只能结束任务",审核通过,21,2015-12-15 07:09:31
55,下载安装后无法打开 下载安装后无法打开 下载安装后无法打开,下载安装后无法打开 下载安装后无法打开 下载安装后无法打开,审核通过,9,2015-12-15 07:23:11
56,"黑屏,进不去,打不开.根本就无法再测试下去了.","黑屏,进不去,打不开.根本就无法再测试下去了.",审核通过,18,2015-12-15 07:35:37
57,点击进入软件1秒黑屏后无法进入。,点击进入软件1秒黑屏后无法进入闪退。安卓4.1.1 wifi环境 htc  t329t,审核通过,6,2015-12-15 07:49:25
58,软件闪退，无法打开并进行下一步测试。,"软件闪退，无法打开并进行下一步测试。
手机型号：mx4 手机系统：安卓5.1",审核通过,3,2015-12-15 08:09:15
59,闪退，不能打开应用，提示停止运行。,反复卸载安装3次，问题相同，不能打开应用闪退，机型中兴m901c 系统安卓4.2.2 网络环境wifi,审核通过,13,2015-12-15 08:20:17
60,从百度微任务中或者是手机app中都开不开雅思君,"1、安装好了，但是从微任务中打不开雅思君这个app
2、从手机app中直接打开也打不开",审核通过,18,2015-12-15 08:21:55
61,软件安装后无法打开，显示停止,软件安装后无法打开，显示停止 测试机型：三星i9300 测试系统：andriod 4.1.2,审核通过,11,2015-12-15 08:24:01
62,闪退无法完成测试闪退无法完成测试,闪退无法完成测试闪退无法完成测试闪退无法完成测试闪退无法完成测试  华为畅玩wifi,审核通过,10,2015-12-15 08:24:47
63,进入app时，显示很抱歉，“雅思君”已停止运行,下载app后，打开页面进入app，桌面显示：很抱歉，“雅思君”已停止运行,审核通过,9,2015-12-15 08:29:58
64,应用安装后无法打开。,应用安装后无法打开，点击后屏幕一闪而过，登录不了界面。,审核通过,2,2015-12-15 08:30:01
65,下载后打开，无法打开，直接停止运行。,下载后打开，无法打开，直接停止运行。下载后打开，无法打开，直接停止运行。,审核通过,4,2015-12-15 08:30:08
66,打开无法运行.小米3 miui7.0稳定版7.0.5.0  4.4.4 ktu84p,打开无法运行.小米3 miui7.0稳定版7.0.5.0  4.4.4 ktu84p,审核通过,14,2015-12-15 08:40:31
67,无法打开程序，一打开即闪退，无法截图。安卓系统4.4.4,无法打开程序，一打开即闪退，无法截图。安卓系统4.4.4,审核通过,15,2015-12-15 08:42:55
68,软件安装完毕后无法打开,软件安装完毕后根本无法打开，直接屏幕闪动下“背景为黑色”后直接退出。,审核通过,19,2015-12-15 08:43:40
69,在微任务中打开时闪退,微任务中点击打开，出现黑屏1秒钟，然后就出现“很抱歉，雅思君已停止运行”,审核通过,14,2015-12-15 08:44:21
70,打开应用进入出现自动退出现象,"1.安装应用后，打开应用进入

预期结果：能正常进入应用
实际结果：出现自动退出现象",审核通过,2,2015-12-15 08:47:32
71,下载之后，安装成功了，但是打不开，一点击打开就闪退，并提示已停止运行。,下载之后，安装成功了，但是打不开，一点击打开就闪退，并提示已停止运行。,审核通过,4,2015-12-15 08:47:40
72,软件显示安装成功后不能打开，直接点桌面软件图标闪退,从百度微任务中心下载并安装雅思君，显示安装成功，在该页面点开打开按钮时页面自动跳转至微任务移动测试项目页面，从手机桌面打开雅思君图标闪腿,审核通过,12,2015-12-15 08:58:23
73,安装打开后黑屏，多次结束任务打开依旧，测试机型为安卓台电平板，测试网路为wifi,安装打开后黑屏，多次结束任务打开依旧，测试机型为安卓台电平板，测试网路为wifi,审核通过,3,2015-12-15 09:02:28
74,无法打开应用，出现闪退情况,"安装app,点击应用图标，打开应用，马上退出",审核通过,2,2015-12-15 09:04:13
75,打不开..........................................,"打不开..........................................打开黑屏,过一会就退了.",审核通过,20,2015-12-15 09:08:56
76,程序停止运行，无法测试,下载安装app，点击进入，显示程序停止运行，无法测试,审核通过,9,2015-12-15 09:13:46
77,app打开闪退，无法测试,点击app后闪退，无法测试。。。。。。。。,审核通过,10,2015-12-15 09:17:55
78,无法进入软件，连续提示‘已停止运行’,安装完雅思君后，点击‘打开’，马上得到错误提示‘很抱歉，雅思君已停止运行’；该错误提示会连续弹出数次。请参考截图。手机是红米，android4.4.4,审核通过,4,2015-12-15 09:35:35
79,无法打开无法登录无法打开无法登录,无法打开无法登录无法打开无法登录 华为4x  wifi,审核通过,19,2015-12-15 09:37:47
80,"app有严重的问题,运行后,黑屏,退出.再打开,还是黑的,我不知道在别的手机上怎么样,至少说,我的手机测试别的程序没有这样的问题","app有严重的问题,运行后,黑屏,退出.再打开,还是黑的,我不知道在别的手机上怎么样,至少说,我的手机测试别的程序没有这样的问题",审核通过,17,2015-12-15 09:41:27
81,正常安装软件后不能打开软件,机型：小米2s  在安装软件后，马上弹出软件停止运行状态，重新卸载在安装后也是同样的反馈结果。多次尝试无果,审核通过,14,2015-12-15 09:47:34
82,app打不开，无论从众测客户端打开，还是从手机桌面点击图标打开,"app打不开，无论从众测客户端打开，还是从手机桌面点击图标打开，都显示的是黑屏，确实下载安装了，打不开截图只好截图众测的。确实尝试多次都是黑屏。
测试手机红米，最新安卓系统",审核通过,16,2015-12-15 09:53:41
83,下载安装后，打点开，屏显示一下黑屏，就返回到微任务的主页面。,下载安装后，打点开，屏显示一下黑屏，就返回到微任务的主页面。,审核通过,20,2015-12-15 10:10:09
84,打开软件闪退，未出现软件界面,打开软件闪退，未出现软件界面。打开软件闪退，未出现软件界面。三星s3,审核通过,8,2015-12-15 10:14:27
85,程序打开闪退，无法运行,程序打开屏幕黑一下，就退出了，无法运行。手机nexus5系统android5.1.1,审核通过,15,2015-12-15 10:20:33
86,"程序有问题,根本打不开,不,是打开后黑屏,等一会就退出.","程序有问题,根本打不开,不,是打开后黑屏,等一会就退出.",审核通过,18,2015-12-15 10:26:34
87,安装软件后在微任务和直接从手机中打开都闪退，无法进入,"1、下载并安装软件；
2、从微任务中打开软件，闪退；
3、直接通过手机打开软件，也闪退。这个不好截屏，只能有打开前和闪退后的截屏，抱歉。
手机：红米2，miui7",审核通过,7,2015-12-15 10:39:03
88,点击打开软件，软件闪退，无法进入软件，闪退速度过快无法截图,点击打开软件，软件闪退，无法进入软件，闪退速度过快无法截图,审核通过,0,2015-12-15 10:41:48
89,无法成功打开app，显示停止运行,"小米4  电信版  wifi
安装完成后，打开app失败，提示已停止运行，多次重启依然如此",审核通过,4,2015-12-15 10:50:28
90,功能无法正常使用，根本打不开。,"下载应用程序，安装，点击打开后，显示：很抱歉，“雅思君”已经停止运行。卸载重新安装，仍如此。
手机型号：华为y511，系统：安卓4.2.2",审核通过,9,2015-12-15 10:59:44
91,我使用的是红米1s电信版，打开app后，软件出现闪退现象，重复操作3次均出现闪退,我使用的是红米1s电信版，打开app后，软件出现闪退现象，重复操作3次均出现闪退,审核通过,8,2015-12-15 11:00:29
92,安装后点击打开，显示软件已停止，无法打开。,安装正常，但是安装后点击打开，显示软件已停止，无法打开。推出测试，点击app也是失败无法打开,审核通过,11,2015-12-15 11:07:53
93,"app无法启动,启动即崩溃","安装后首次启动即崩溃,提供系统崩溃提示对话框截图一张及app崩溃日志截图数张",审核通过,5,2015-12-15 11:09:24
94,下载下来后，打不开，停止运行,"下载后，打不开软件，显示‘很抱歉，""雅思君""已停止运行’",审核通过,9,2015-12-15 11:12:19
95,app打不开，尝试多次，都出现闪屏现象，无法正常进入程序。,下载，安装成功后，打开软件，出现闪屏现象，无法正常进入程序。,审核通过,16,2015-12-15 11:14:21
96,雅思君app正常下载后，无法打开,"下载雅思君app，
根据任务要求进行操作
在打开雅思君app时出现：“很抱歉。雅思君已停止运行”
再三进行打开，依然无法打开",审核通过,9,2015-12-15 11:15:42
97,软件安装以后打开不了闪退,软件安装以后一打开就闪退，然后自己回到移动测试项目。,审核通过,12,2015-12-15 11:18:59
98,不能正常打开app，提示停止运行。,打不开雅思君软件，进入后出现黑屏，然后弹出对话框“很抱歉，“雅君思”已停止运行”。反复多次都出现这种情况。,审核通过,14,2015-12-15 11:21:41
99,下载安装以后打开软件屏幕黑一下，然后跳到移动测试项目。,下载安装以后打开软件屏幕黑一下，然后跳到移动测试项目。,审核通过,12,2015-12-15 11:28:46
100,无法打开app，程序闪退,无法打开app，程序闪退。无法进行测试。,审核通过,15,2015-12-15 11:33:25
101,闪退，无法打开。。。。。。。。。。。。。。。。。。。,闪退，无法打开。。。。。。。。。。。。。。。。。。。,审核通过,7,2015-12-15 11:38:31
102,打开程序闪退。打开程序闪退。,打开程序闪退。打开程序闪退。打开程序闪退。,审核通过,15,2015-12-15 11:38:46
103,安装后启动显示一个黑屏，然后过一会出现“张思君 已停止。”,安装后启动显示一个黑屏，然后过一会出现“张思君 已停止。”,审核通过,5,2015-12-15 11:41:03
104,安装后无法进入游戏，黑屏,安装后无法进入游戏，黑屏，点什么都没反应  甚至不能返回，只能强行关闭应用。再次进入仍然黑屏。  机型：酷派大神f1  系统4.4,审核通过,6,2015-12-15 11:45:04
105,app无法在众测微任务中打开,app下载安装后，点击打开后，仅出现一个黑屏后就又返回来微任务页面。app无法正常运行,审核通过,20,2015-12-15 11:48:57
106,一打开软件app崩溃！！,在移动测试项目中，一打开软件app崩溃！！,审核通过,12,2015-12-15 11:52:41
107,打不开软件，点击之后就闪退,我手机是荣耀6plus移动标准版，网络环境是wifi，点击软件图标的时候就黑屏一下就闪退，打不开应用软件。,审核通过,18,2015-12-15 11:56:10
108,不能进入软件，可能是兼容问题,不能进入软件，可能是不兼容我的手机，我是酷派大神f2全网通手机,审核通过,1,2015-12-15 12:16:34
109,点击打开软件，软件闪退，无法进入软件，闪退速度过快无法截图,点击打开软件，软件闪退，无法进入软件，闪退速度过快无法截图,审核通过,0,2015-12-15 12:27:53
110,app打不开         ....,在百度微任务里面点击打开，直接返回测试项目页面，多次尝试无法打开。。单击桌面的app仍无法打开,审核通过,16,2015-12-15 12:39:46
111,app安装后无法启动，黑屏！无法试用和测试！,app安装后无法启动，黑屏！无法试用和测试！,审核通过,5,2015-12-15 12:40:41
112,打开该app 出现闪退,"1、打开该app
2、闪退，根本就打不开，",审核通过,18,2015-12-15 12:42:09
113,下载完软件后打不打，一直是黑屏状态，然后就回到了屏幕首页。,下载完软件后打不打，一直是黑屏状态，然后就回到了屏幕首页。分不同的时间段都打不开，测试好几次。,审核通过,18,2015-12-15 12:58:18
114,"下载安装app后打开,无法进入程序直接跳出来","下载安装app后打开,无法进入程序直接跳出来",审核通过,15,2015-12-15 12:59:43
115,无法成功启动程序，启动后闪退。,"无法成功启动程序，启动后闪退。如截图所示 程序停止运行。
机型红米2a",审核通过,5,2015-12-15 13:00:12
116,无法成功启动程序，启动后闪退。,"无法成功启动程序，启动后闪退。如截图所示黑屏1-2s后退出程序。
 机型三星note3",审核通过,5,2015-12-15 13:02:26
117,不能登录软件，自动跳出程序,在微任务客户端下载任务之后安装，不能正常打开，自动关闭程序跳出。,审核通过,15,2015-12-15 13:09:35
118,测试无法打开 点打开直接闪退,点打开直接闪退到测试界面  无法进入app,审核通过,10,2015-12-15 13:10:32
119,安装后运行程序失败，出现程序停止提示。,安装后运行程序失败，黑屏几秒后出现程序停止提示。重复尝试运行几次，都没有启动起来。,审核通过,15,2015-12-15 13:14:47
120,"打开软件,软件出现闪退，由于速度快，未能截图","打开软件,软件出现闪退，由于速度快，未能截图",审核通过,0,2015-12-15 13:21:39
121,软件无法打开。无法进行测试！！！,下载  安装软件无法打开，也无法进行测试。！！！,审核通过,3,2015-12-15 13:27:28
122,安装完成后软件无法开启。,按照要求下载安装后，在平台里面点击打开，无法开启，返回到众测页面尝试多次都是如此，在平台外面直接点击软件也无法打开，手机为魅蓝n2.,审核通过,20,2015-12-15 13:31:37
123,打开软件后无任何操作，闪退,"打开软件后无任何操作，闪退，测试手机为三星s4，移动制式,wifi网络下进行",审核通过,3,2015-12-15 13:37:27
