id,bug详情,复现步骤,审核状态,重复情况,提交时间
124,app根本无法打开。。。,下载安装以后点击无法打开，屏幕黑了一下又返回了，我以为在微任务里打不开，退出去直接点击还是一样黑了一下，打不开,审核通过,20,2015-12-15 13:46:07
125,安装完后打不开，软件闪退,"手机：华为荣耀4x
系统：安卓4.4.2
使用网络正常
打开程序出现闪退",审核通过,18,2015-12-15 14:03:43
126,打开软件启动到黑屏时自动退出,打开软件启动到黑屏时自动退出，不能成功启动，手机型号是小米note.,审核通过,5,2015-12-15 14:06:23
127,在微任务李点击打开，闪退，返回微任务，在桌面打开已然闪退，,在微任务李点击打开，闪退，返回微任务，在桌面打开已然闪退，,审核通过,16,2015-12-15 14:07:38
128,安装应用后启动，直接进入黑屏画面，无法进入应用。,安装应用后启动，直接进入黑屏画面，无法进入应用。,审核通过,2,2015-12-15 14:13:30
129,安装完成后，无法打开app，且弹出停止运行的对话框,安装完app，通过微任务打开app，屏幕黑闪一下，直接就弹出对话框“停止运行”,审核通过,14,2015-12-15 14:18:30
130,无法打开软件，点打开就停止运行,无法打开软件，点打开就停止运行，尝试多次都无法打开,审核通过,4,2015-12-15 14:22:38
131,软件下载到最后时，下得非常慢,从众测微任务上下载软件，下载到最后时，下得非常慢，最后一点用了将近一个小时才下完,审核通过,8,2015-12-15 14:39:06
132,软件下载安装完成，无法正常打开,软件下载完成，无法正常打开，安装完成后，点击打开软件，手机就黑屏，并一直震动,审核通过,21,2015-12-15 14:39:07
133,小米手机无法打开软件,红米2的手机下载安装完毕，就是无法打开软件，重新安装还是不行。一打开的界面就回到了移动测试项目。,审核通过,12,2015-12-15 14:49:37
134,打开软件报错，软件“停止运行”，无法启动软件,下载后直接打开软件，无法启动，机型：nubia z7mini,审核通过,5,2015-12-15 15:00:28
135,安装完成该app 无法进入该app，只会黑屏，马上退出。,安装完成该app 无法进入该app，只会黑屏，马上退出。,审核通过,6,2015-12-15 15:01:56
136,安装后无法打开，点击打开app闪退,安装后无法打开，点击打开app闪退。手机：小米4c，网络：wifi，移动4g都无法打开,审核通过,17,2015-12-15 15:11:59
137,下载安装app后无法打开软件，显示已停止运行,下载安装app后无法打开软件，显示已停止运行,审核通过,9,2015-12-15 15:15:53
138,程序无法运行，提示雅思君已经停止运行,程序无法运行，提示雅思君已经停止运行，再试手机自动重启。华为3x移动版,审核通过,4,2015-12-15 16:03:33
139,无法登陆界面，出现黑屏，且一直不能打开,无法登陆界面，出现黑屏，且一直不能打开，没有发应。,审核通过,21,2015-12-15 16:06:24
140,点击打开欢迎页面，系统崩溃,"1.安装软件成功后
2.点击打开软件
3.进入欢迎页面，点击欢迎页面，
系统崩溃",审核通过,19,2015-12-15 16:10:48
141,下载安装软件成功后，点击打开软件系统崩溃,"1.下载软件
2.安装软件
3.点击打开软件，
系统崩溃，停止运行",审核通过,13,2015-12-15 16:10:48
142,闪退，不能打开软件。安装过程无异常。,荣耀4x电信版，安装完成后点击打开，自动跳转到移动测试页面,审核通过,12,2015-12-15 16:34:46
143,小米note手机，打开软件出现闪退现象,小米note手机安卓4.4，打开软件出现闪退现象，直接跳回测试初始页面,审核通过,8,2015-12-15 16:37:24
144,闪退，打不开，试过多次都不行,在微任务中打开app结果退回上一界面，使用安卓系统做过多次都闪退,审核通过,18,2015-12-15 16:38:08
145,"像上传图中的这样,打开就这样,等了多长时间也没反应,应该是app出问题了.也连网了,手机也没问题.","像上传图中的这样,打开就这样,等了多长时间也没反应,应该是app出问题了.也连网了,手机也没问题.",审核通过,17,2015-12-15 16:49:18
146,无法打开，打开黑屏后闪退,安装成功后，点击打开，然后黑屏，然后闪退。,审核通过,21,2015-12-15 16:52:32
147,软件根本无法打开，软件打开就提示已停止运行,软件根本无法打开，软件打开就提示已停止运行，无法进行测试,审核通过,4,2015-12-15 16:58:57
148,下载安装完成后无法进入该app,下载-安装完成-点击打开无法进入，闪退到下载界面,审核通过,6,2015-12-15 17:05:14
149,"你这真是测试闪退的问题,确实是闪退啊,还挺严重的,人家闪退是打开后,点一点才退.你这闪退是,根本就打不开.改改吧.","你这真是测试闪退的问题,确实是闪退啊,还挺严重的,人家闪退是打开后,点一点才退.你这闪退是,根本就打不开.改改吧.",审核通过,18,2015-12-15 17:22:42
150,软件无法运行，软件运行后无法进入，闪退！,软件无法运行，软件运行后无法进入，闪退！,审核通过,4,2015-12-15 17:24:14
151,下载安装该软件后无法打开，提示“雅思君已停止”。,三星i959，铁通光钎10m：下载安装该软件后无法打开，提示“雅思君已停止”，经多次安装打开测试，仍是如此，无法继续测试。希望我的测试能给你提供帮助。,审核通过,9,2015-12-15 17:37:30
152,"发现闪退bug,图已经上传了,现象是,打开后黑屏,然后又退到这个界面中.app根本就进不去.","发现闪退bug,图已经上传了,现象是,打开后黑屏,然后又退到这个界面中.app根本就进不去.",审核通过,16,2015-12-15 17:46:51
153,这个软件太差了，直接闪退，根本不兼容。,这个软件太差了，直接闪退，根本不兼容。我估计很多测试者都是一样的情况，建议直接关闭这个任务。,审核通过,1,2015-12-15 18:30:11
154,安装后，点击打开，没有任何提示，闪退,"安装后，点击打开，没有任何提示，闪退。
安装后，点击打开，没有任何提示，闪退。",审核通过,17,2015-12-15 18:33:30
155,点击打开，黑屏，然后退出，无任何提示和显示,点击打开，黑屏，然后退出，无任何提示和显示....,审核通过,11,2015-12-15 18:33:52
156,安装完成，点击进入软件 然后闪退回桌面,安装完成，点击进入软件 然后闪退回桌面，多次尝试进入软件任然回到桌面，无法进入软件。,审核通过,6,2015-12-15 19:01:29
