id,bug详情,复现步骤,审核状态,重复情况,提交时间
1,在定位页面无法自动定位到正确地点,下载安装app在定位页面无法自动定位到正确地点,审核不通过,2,2015-12-21 22:11:24
2,点击打开软件，进入主界面后，软件突然闪退，由于时间快未能截到图,点击打开软件，进入主界面后，软件突然闪退，由于时间快未能截到图,审核不通过,14,2015-12-21 22:11:38
3,应该自动定位手机和上牌及比价，砍价所在城市,应该自动定位手机和上牌及比价，砍价所在城市，方便用户用,审核不通过,18,2015-12-21 22:11:57
4,在我的主页里--我的账户中有个10000元钱，不知道是怎么来的，很容易给顾客造成上当受骗的危害,在我的主页里--我的账户中有个10000元钱，不知道是怎么来的，很容易给顾客造成上当受骗的危害,审核不通过,25,2015-12-21 22:12:34
5,在我准备退出买车达人软件的时候，突然提醒我我的账号在别的地方登陆，存在很大的风险,在我准备退出买车达人软件的时候，突然提醒我我的账号在别的地方登陆，存在很大的风险,审核不通过,21,2015-12-21 22:13:06
6,当选择一款车型发起砍价时，在账户有余额的情况下默认选择支付宝支付，在用户没注意的情况下，开启支付宝小额免密码支付非常容易引起误操作，建议工程师默认选择买车达人余额账户支付。,当选择一款车型发起砍价时，在账户有余额的情况下默认选择支付宝支付，在用户没注意的情况下，开启支付宝小额免密码支付非常容易引起误操作，建议工程师默认选择买车达人余额账户支付。,审核不通过,12,2015-12-21 22:16:03
7,技术测试中车系页和经销商地图页点击后不能跳转，直接关闭app,在进入技术测试后，点击车系页和和经销商地图页时，出现链接询问，点击确定后直接关闭app，跳转到手机桌面,审核通过,20,2015-12-21 22:17:06
8,微信分享发起投票是可否自动关注,"微信分享发起投票是可否自动关注 微信分享发起投票是可否自动关注 华为4x wifi
]",审核通过,5,2015-12-21 22:18:10
9,找回密码页面输入正确的手机但未注册，提示该手机号不存在,找回密码页面输入正确的手机但未注册，提示该手机号不存在,审核通过,15,2015-12-21 22:18:28
10,我的页面点击右上角的搜索按钮，在搜索框中输入关键字“车”，搜索出结果后删除关键字，还显示搜索出的结果,"1.进入我的页面
2.点击右上角的搜索按钮
3.在搜索框中输入关键字“车”，搜索出结果后删除关键字",审核通过,11,2015-12-21 22:18:42
11,完善资料时昵称输入文字加空格提示错误，后面的英文不需要,"1.登录成功后进入完善资料页面
2.在昵称一栏输入文字，文字中间加空格，提示错误",审核通过,25,2015-12-21 22:18:52
12,特价车页面搜索地区时搜索伊犁时，搜索出内蒙古，搜索石家庄时搜索出的地区为全部；搜索错误,"1.进入首页，点击特价车
2.在全部地区下筛选地区伊犁或石家庄，查询搜索结果",审核通过,11,2015-12-21 22:18:58
13,对评论用户点赞成功后不能取消点赞,"1.进入讨论页面
2.选择一个讨论进入详情页面
3.对发表评论用户点赞成功后，取消点赞",审核通过,0,2015-12-21 22:19:04
14,进入我发起的讨论页面，选择一个讨论长按或左滑，不能删除,"1.进入我的页面
2.点击我的讨论进入
3.选择一个我发起的讨论，长按钮或左滑屏幕",审核通过,19,2015-12-21 22:19:10
15,搜索页面没有取消按钮，也没有返回按钮，只能通过手机返回键返回我的页面,"1.进入我的页面
2.点击右上角的搜索按钮
3.进入搜索页面，无法取消搜索",审核通过,11,2015-12-21 22:19:17
16,分享到朋友圈，进入分享页面后点击发送，没任何提示直接跳转到好友投票页面,"1.进入讨论
2.进入一个讨论详情页面
3.点击查看好友投票进入
4.点击分享到朋友圈",审核通过,5,2015-12-21 22:19:23
17,进入轮播图片“特惠购车季。。。”下拉页面，点击活动咨询电话，没反应,"1.进入首页
2.点击轮播图片“特惠购车季。。。”下拉页面，点击活动咨询电话",审核通过,7,2015-12-21 22:19:29
18,进入页面点比价、砍价反应慢,1、进入界面点“我”登陆 2、点比价、砍价半天没反应 ，还以为点不开3、手机型号：红米 网络：电信wifi,审核不通过,18,2015-12-21 22:19:44
19,进入首页轮播图片“买车送现金”进入，上传买车发票时从相册中选择图片上传失败，不显示图片,"1.进入首页
2.点击轮播图片“买车送现金”进入，
3.点击已购车，领奖励进入页面
4.上传购车发票，选择从相册中上传图片",审核通过,7,2015-12-21 22:19:55
20,修改昵称时输入空格，点击确定，没反应也没提示；期望结果：会提示内容不能为空,"1.进入我的页面
2.点击头像进入个人信息页面，
3.点击昵称，在昵称输入框中输入空格，点击确定",审核通过,25,2015-12-21 22:20:05
21,查看红旗h7时，界面滚动的图片，一直显示不出来,1、进入选车界面，选择红旗h7时，界面滚动图片，一直加载不出来,审核通过,17,2015-12-21 22:20:40
22,选择任意车型后加入对比，选择pk车型没有限制,1、选择任意车型加入对比，当选择16款车型时，加入对比，查看对比界面，只有5种车型，建议增加pk车型的限制,审核通过,23,2015-12-21 22:20:59
23,在自己发起的讨论详情界面，删除某一留言时，直接删除，没有进一步的确认提示,在自己发起的讨论详情界面，删除某一留言时，直接删除，没有进一步的确认提示,审核通过,19,2015-12-21 22:21:10
24,在对比投票界面，点击邀请微信好友，不能进入好友列表界在，闪一下微信好友列表后又回到当前界面,在对比投票界面，点击邀请微信好友，不能进入好友列表界在，闪一下微信好友列表后又回到当前界面,审核通过,3,2015-12-21 22:21:26
25,当输入错误的密码进行登录时，提示语出现代码,在登录过程中，输入错误的密码，进行登录时，提示语有误,审核通过,8,2015-12-21 22:21:36
26,找回密码界面，输入没有注册的手机号，获取验证码时，提示语不准确,找回密码界面，输入没有注册的手机号，获取验证码时，提示语不准确,审核通过,15,2015-12-21 22:21:44
27,发起砍价后，当输入的价格与出价建议价一样时，提示出价过低,发起砍价后，当输入的价格与出价建议价一样时，提示出价过低，提示不好理解,审核通过,12,2015-12-21 22:21:57
28,设置密码界面，当输入的新密码是一位时，提示语出现代码,设置密码界面，当输入的新密码是一位时，提示语出现代码,审核通过,8,2015-12-21 22:22:06
29,设置界面修改手机号，输入正确的手机号后，点击获取验证码没有任何反应,设置界面修改手机号，输入正确的手机号后，点击获取验证码没有任何反应,审核通过,15,2015-12-21 22:22:21
30,在修改昵称界面，输入空格后，点击确定没有任何提示,在修改昵称界面，输入空格后，点击确定没有任何提示,审核通过,25,2015-12-21 22:22:36
31,清除缓存成功，当缓存为0时，再次清理，还提示确认清除缓存，应该提示缓存已经为0，不需要再清理,清除缓存成功，当缓存为0时，再次清理，还提示确认清除缓存，应该提示缓存已经为0，不需要再清理,审核通过,4,2015-12-21 22:22:56
32,在修改头像时，选择拍照上传图片，拍照成功后，上传图片时提示“未知错误，请重试”,在修改头像时，选择拍照上传图片，拍照成功后，上传图片时提示“未知错误，请重试”，不可以修改成功,审核通过,7,2015-12-21 22:23:21
33,首页右侧字母导航条在滑动时，汽车品牌列表有跳动,右侧字母导航条从z向a滑动到uv时，汽车品牌列表会跳动到a,审核通过,23,2015-12-21 22:24:26
34,应用安装成功，打开应用，选择铃铛标志，选择左上角箭头无法返回,应用安装成功，打开应用，选择铃铛标志，选择左上角箭头无法返回,审核不通过,1,2015-12-21 22:24:52
35,应用安装成功，打开应用，在讨论页面选择发起讨论，填写所有选项，提交后转到讨论详情页面，选择左上角箭头无法返回。,应用安装成功，打开应用，在讨论页面选择发起讨论，填写所有选项，提交后转到讨论详情页面，选择左上角箭头无法返回。,审核不通过,1,2015-12-21 22:25:19
36,手机收不到验证码。。。。。,尝试几次均无法收到验证码。。。。。。。。。。。。,审核不通过,22,2015-12-21 22:26:06
37,应用安装成功，打开应用，选择铃铛标志，选择左上角箭头无法返回,应用安装成功，打开应用，选择铃铛标志，选择左上角箭头无法返回,审核不通过,1,2015-12-21 22:26:20
38,应用安装成功，打开应用，在讨论页面选择发起讨论，填写所有选项，提交后转到讨论详情页面，选择左上角箭头无法返回。,应用安装成功，打开应用，在讨论页面选择发起讨论，填写所有选项，提交后转到讨论详情页面，选择左上角箭头无法返回。,审核不通过,1,2015-12-21 22:26:30
39,是使用软件时候有电话打进来会卡死,是使用软件时候有电话打进来会卡死 是使用软件时候有电话打进来会卡死 华为畅玩 wifi,审核通过,10,2015-12-21 22:26:53
40,是使用软件时候有电话打进来会卡死,是使用软件时候有电话打进来会卡死 是使用软件时候有电话打进来会卡死 华为畅玩 wifi,审核通过,10,2015-12-21 22:47:10
41,注册，输入自己的手机号，反复获取验证码，都收不到验证码。手机本身没问题,注册，输入自己的手机号，反复获取验证码，都收不到验证码。手机本身没问题,审核不通过,22,2015-12-21 22:48:31
42,手机很难成功打开这个软件,点击打开软件后，长时间无反应，并跳出无响应的界面，重复尝试5次后才打开软件,审核不通过,22,2015-12-21 23:01:15
43,打开软件后不能进行操作，软件就自己停止运行，有时导致手机黑屏,打开软件后，想进入各操作页面，软件却停止运行，多次重复，全部停止运行，无法输入账号登陆，进行其他方面的测试,审核通过,21,2015-12-21 23:01:27
44,使用app我的比价，选择好下单后使用支付宝支付定金时无法跳转完成支付,使用app我的比价，选择好下单后使用支付宝支付定金时无法跳转完成支付，使用抵用金额能够正常支付,审核不通过,12,2015-12-21 23:01:49
45,打开程序，程序就停止运行，无法完成进一步测试,打开程序，程序就停止运行，无法完成进一步测试........,审核通过,26,2015-12-21 23:02:02
46,能下载app，安装，打开不到2秒，出现闪退，无法进行测试，，,能下载app，安装，打开不到2秒，出现闪退，无法进行测试，，,审核通过,14,2015-12-21 23:02:12
47,账号12111111085登陆不上显示账号或者密码错误,账号12111111085登陆不上显示账号或者密码错误,审核不通过,6,2015-12-21 23:15:12
48,"无法修改昵称,提示已存在","用账号登陆后,修改昵称时提示昵称已存在,无论输入什么昵称都不能修改",审核不通过,25,2015-12-21 23:15:45
49,在买车页签内 选择试驾 进去后填写试驾信息，填写完后点提价页面提示 信息已提交。但是返回我页签在预约试驾 里面 显示没有预约试驾。重复两次均如此。如截图所示,"在买车页签内 选择试驾 进去后填写试驾信息，填写完后点提价页面提示 信息已提交。但是返回我页签在预约试驾 里面 显示没有预约试驾。重复两次均如此。如截图所示
手机 红米2 系统安卓4.4.4 网络wifi",审核通过,9,2015-12-21 23:17:43
50,小米note安卓4.4，注册账号无法登录,打开小米note安卓4.4，注册账号无法登录，用测试账号登录出现白屏卡顿现象，无法进入交互界面,审核不通过,6,2015-12-21 23:18:42
51,下载安装app输入指定帐号12111111055无法登陆,下载安装app输入指定帐号12111111055无法登陆,审核不通过,10,2015-12-21 23:19:30
52,注册账号的验证码收不到,使用全部功能时，账号的登录就十分的重要，注册时，输入手机号向软件开发商发送获取验证码的短信可等了太长的时间也没等来验证码。,审核不通过,22,2015-12-21 23:19:47
53,编辑昵称重复时，提示语错误，后面存在乱码,"1.点击打开软件
2.登录帐号，
3.编辑昵称信息，
4.提示语错误，存在乱码",审核通过,25,2015-12-21 23:20:33
54,打开活动页面，点击分享到微信，点击无效，无法分享,"1.点击打开软件
2.点击打开活动页面，
3.点击分享到微信，
分享失败",审核不通过,5,2015-12-21 23:20:54
55,"打开活动页面，点击分享到qq,分享失败","1.点击打开软件，
2.点击打开活动页面
3.点击分享到qq
分享失败",审核不通过,5,2015-12-21 23:21:48
56,打开他人评论，成功点赞后，无法取消点赞,"1.点击打开软件
2.点击查看他人评论，
3.点赞成功，取消点赞，
无法取消",审核通过,0,2015-12-21 23:21:58
57,登录帐号时，输入错误的验证码时，提示语中存在乱码,"1.点击打开软件，
2.打开登录页面，
输入手机号和错误的验证码，点击登录，
提示语中存在乱码",审核不通过,15,2015-12-21 23:24:11
58,注册帐号时，输入错误的手机号也可成功获取验证码,"1.打开软件
2.进入登录页面，
3.点击注册，输入错误的手机号码，点击获取验证码，获取成功",审核通过,15,2015-12-21 23:24:25
59,活动页面，点击分享到微博，点击无效，无法,"1.点击打开软件
2.点击打开活动页面
3.点击分享到微博
分享失败",审核不通过,5,2015-12-21 23:24:44
60,打开搜索页面，页面出现两个搜索符号,"1.点击打开软件
2.点击打开搜索，
3.输入奥迪，查看搜索页面，
页面存在两个搜索符号",审核通过,11,2015-12-21 23:24:58
61,定位当前位置，定位失败。,"1.点击打开软件
2.点击定位当前位置，
3.定位失败，无法获取",审核通过,2,2015-12-21 23:25:41
62,点击经销商列表出现了，网络异常，请检查网络连接！,进入技术测试界面，点击经销商列表，弹出对话框，点确定，出现了网络异常，请检查网络连接！画面全白,审核不通过,20,2015-12-21 23:26:10
63,账号12111111001无法登陆换成另外的又可以,账号12111111001无法登陆换成另外的又可以,审核不通过,21,2015-12-21 23:27:05
64,安装成功打开后，闪退,安装成功，点击打开，提示“停止运行”，闪退。,审核不通过,14,2015-12-21 23:27:28
65,登录账户12111111044，密码123456后，点击“技术测试”这个banner，在界面点击“经销商列表”，在弹窗上点击确定后跳转到一个空白页面，并提示“网络异常，请检查网络连接”。,登录账户12111111044，密码123456后，点击“技术测试”这个banner，在界面点击“经销商列表”，在弹窗上点击确定后跳转到一个空白页面，并提示“网络异常，请检查网络连接”。,审核不通过,20,2015-12-21 23:28:21
66,登录账户12111111044，密码123456后，点击“技术测试”这个banner，在界面点击“车系页”，在弹窗上点击确定后应用停止运行。,登录账户12111111044，密码123456后，点击“技术测试”这个banner，在界面点击“车系页”，在弹窗上点击确定后应用停止运行。,审核通过,20,2015-12-21 23:28:45
67,打开app，点击最上方“我”，点击“我的账户”，点击“账户余额”，点击“提现”，在倒数第二个输入框中输入一个随意的11位数字，例如“12345678912”，点击获取验证码，会提示“请输入注册时的手机号statuscode=200”。,打开app，点击最上方“我”，点击“我的账户”，点击“账户余额”，点击“提现”，在倒数第二个输入框中输入一个随意的11位数字，例如“12345678912”，点击获取验证码，会提示“请输入注册时的手机号statuscode=200”。,审核通过,15,2015-12-21 23:30:12
68,查看长安汽车――奔奔mini，3张轮播图无法显示，点击去之后详细图片也无法显示，是灰色的。,查看长安汽车――奔奔mini，3张轮播图无法显示，点击去之后详细图片也无法显示，是灰色的。,审核通过,17,2015-12-21 23:33:08
69,首页，在车型列表中选保时捷，然后选boxster，点上方经销商，在经销商页面点右上角地址定位到北京，可以看到北京有不少经销商。然后返回到boxster车型介绍页面，点全部在售下方任意一辆车中的发起砍价，在发起砍价页面点购车城市，购车城市列表中并没有北京。。。。。,首页，在车型列表中选保时捷，然后选boxster，点上方经销商，在经销商页面点右上角地址定位到北京，可以看到北京有不少经销商。然后返回到boxster车型介绍页面，点全部在售下方任意一辆车中的发起砍价，在发起砍价页面点购车城市，购车城市列表中并没有北京。。。。。,审核通过,24,2015-12-21 23:51:47
70,在首次登陆时候，会进入到个人资料填写页面，填写昵称时候，输入一下特殊字符，如逗号，系统会提示错误信息，在错误信息中会出现“status=200”的字样,在首次登陆时候，会进入到个人资料填写页面，填写昵称时候，输入一下特殊字符，如逗号，系统会提示错误信息，在错误信息中会出现“status=200”的字样,审核通过,25,2015-12-21 23:52:34
71,在验证码登陆页面，输入错误的验证码，登陆，错误提示信息中会出现“status=200”字样,在验证码登陆页面，输入错误的验证码，登陆，错误提示信息中会出现“status=200”字样,审核不通过,21,2015-12-21 23:53:30
72,首页，在车型列表中选保时捷，然后选boxster，在车型列表中，点“全程比价”，在比价页面点比价城市，选择广东韶关，系统会出现提示信息“你选择的比价城市没有经销商”等，信息中还显示了代码片段“status=200”,首页，在车型列表中选保时捷，然后选boxster，在车型列表中，点“全程比价”，在比价页面点比价城市，选择广东韶关，系统会出现提示信息“你选择的比价城市没有经销商”等，信息中还显示了代码片段“status=200”,审核不通过,18,2015-12-21 23:54:13
73,随便搜索一个车型，进入车型介绍页面，点经销商，在经销商列表中任意点一项，进入经销商地图页面，有的时候地图能正常显示，有时候地图部分是黑屏，看截图,随便搜索一个车型，进入车型介绍页面，点经销商，在经销商列表中任意点一项，进入经销商地图页面，有的时候地图能正常显示，有时候地图部分是黑屏，看截图,审核不通过,20,2015-12-21 23:54:29
74,在测试过程中出现了app停止运行，看截图,在测试过程中出现了app停止运行，看截图,审核通过,26,2015-12-21 23:54:45
75,首页-》试驾，填写各项信息，提交，提交之后，会弹出一个“网址为。。。。的网页显示：。。。”的信息，这个网址代表这个app吗？,首页-》试驾，填写各项信息，提交，提交之后，会弹出一个“网址为。。。。的网页显示：。。。”的信息，这个网址代表这个app吗？,审核不通过,9,2015-12-21 23:55:09
76,首页-》试驾，填写各项信息，提交，提交之后，会弹出一个“网址为。。。。的网页显示：。。。”的信息，点确定，界面仍然停留在试驾信息填写页面，正常的流程填写成功后应该跳出信息填写页面,首页-》试驾，填写各项信息，提交，提交之后，会弹出一个“网址为。。。。的网页显示：。。。”的信息，点确定，界面仍然停留在试驾信息填写页面，正常的流程填写成功后应该跳出信息填写页面,审核不通过,9,2015-12-21 23:56:03
77,首页-》优惠，点优惠列表中任意一项，点下方黑色背景区域，在此页面中点销售顾问中的“与他联系”，会弹出“您使用的设备不能拨打电话。。。。”。我用的是华为荣耀的平板手机，是可以打电话的。,首页-》优惠，点优惠列表中任意一项，点下方黑色背景区域，在此页面中点销售顾问中的“与他联系”，会弹出“您使用的设备不能拨打电话。。。。”。我用的是华为荣耀的平板手机，是可以打电话的。,审核不通过,13,2015-12-21 23:56:59
78,首页，在车型列表中选保时捷，然后选boxster，在全部在售下方列表中任意点一项进入到车型详情页面，车型详情页面上方的价格走势图都是空的,首页，在车型列表中选保时捷，然后选boxster，在全部在售下方列表中任意点一项进入到车型详情页面，车型详情页面上方的价格走势图都是空的,审核通过,24,2015-12-21 23:58:32
79,通过砍价功能进入到出价页面，按正常操作填写价格，确认，在填写其他信息在确认，按照正常流程操作到进入支付页面，选择淘宝支付，并点立即支付，然后就是“正在加载”，然后就变成白屏，然后就没有然后了,通过砍价功能进入到出价页面，按正常操作填写价格，确认，在填写其他信息在确认，按照正常流程操作到进入支付页面，选择淘宝支付，并点立即支付，然后就是“正在加载”，然后就变成白屏，然后就没有然后了,审核不通过,12,2015-12-21 23:59:00
80,打开app，无论是在“买车”还是“讨论”页面，点右上角的搜索，都是搜索车系，应该是买车页面点搜索则搜索车系，讨论页面点搜索则默认搜索讨论,打开app，无论是在“买车”还是“讨论”页面，点右上角的搜索，都是搜索车系，应该是买车页面点搜索则搜索车系，讨论页面点搜索则默认搜索讨论,审核不通过,11,2015-12-22 00:02:52
81,首页，搜索polo，进入polo车介绍页面，点更多评测-》点任意的来源是汽车之家的评测，在评测内容页面都是空的，其他来源的就有内容,首页，搜索polo，进入polo车介绍页面，点更多评测-》点任意的来源是汽车之家的评测，在评测内容页面都是空的，其他来源的就有内容,审核不通过,16,2015-12-22 00:07:07
82,讨论-》热门讨论，热门讨论下方帖子排序不正确。1人参与的帖子会出现在4人或5人参与的帖子前面,讨论-》热门讨论，热门讨论下方帖子排序不正确。1人参与的帖子会出现在4人或5人参与的帖子前面,审核通过,19,2015-12-22 00:07:22
83,首页-》选车，在选车中心页面，右侧26个字母显示太小，根本没法点中,首页-》选车，在选车中心页面，右侧26个字母显示太小，根本没法点中,审核不通过,16,2015-12-22 00:07:35
84,首页，点选车，停顿了将近10秒才进入选车页面，加载需要这么长时间的话，页面中应该显示loading的提示,首页，点选车，停顿了将近10秒才进入选车页面，加载需要这么长时间的话，页面中应该显示loading的提示,审核不通过,16,2015-12-22 00:07:57
85,首页-》讨论-》发起讨论，输入一段非常长非常长的文本，提交。返回到首页-》讨论，在讨论列表中选择刚刚发布的长文本帖子，点看进入详情页面，之前输入的文本被截断了，只是显示了部分内容。,首页-》讨论-》发起讨论，输入一段非常长非常长的文本，提交。返回到首页-》讨论，在讨论列表中选择刚刚发布的长文本帖子，点看进入详情页面，之前输入的文本被截断了，只是显示了部分内容。,审核不通过,19,2015-12-22 00:09:15
86,首页-》讨论-》发起讨论，输入一段非常长的文本，在编辑讨论的页面，这个文本仅仅显示在了屏幕上方一小部分区域，即便是小区域没显示全，也只是在上方小区域范围内可上下滑动,首页-》讨论-》发起讨论，输入一段非常长的文本，在编辑讨论的页面，这个文本仅仅显示在了屏幕上方一小部分区域，即便是小区域没显示全，也只是在上方小区域范围内可上下滑动,审核不通过,19,2015-12-22 00:10:27
87,首页，在车型列表中选保时捷，然后选boxster，全部在售一行中，根据年份分类的tab排序错误，页面显示的是2015款，2013款、2014款，正常应该2014款在2013款左边,首页，在车型列表中选保时捷，然后选boxster，全部在售一行中，根据年份分类的tab排序错误，页面显示的是2015款，2013款、2014款，正常应该2014款在2013款左边,审核通过,24,2015-12-22 00:10:46
