id,bug详情,复现步骤,审核状态,重复情况,提交时间
88,首页，在车型列表中选保时捷，然后选boxster，全部在售下方列表中2013款只有两种车，而切换到2013款tab，下方显示了有3个车。数据不一致，且在2013款下方的列表中，前两个车是一样的,首页，在车型列表中选保时捷，然后选boxster，全部在售下方列表中2013款只有两种车，而切换到2013款tab，下方显示了有3个车。数据不一致，且在2013款下方的列表中，前两个车是一样的,审核通过,24,2015-12-22 00:11:34
89,首页，在车型列表中选保时捷，然后选boxster，在boxster页面点讨论，在boxster相关讨论页面点右下角编辑图标，进入到发起讨论页面，任意输入一些问题，提交。提交后的讨论并没有增加到boxster相关讨论中。也就是从boxster车型的相关讨论页面发起的讨论，没有自动与boxster车型关联起来,首页，在车型列表中选保时捷，然后选boxster，在boxster页面点讨论，在boxster相关讨论页面点右下角编辑图标，进入到发起讨论页面，任意输入一些问题，提交。提交后的讨论并没有增加到boxster相关讨论中。也就是从boxster车型的相关讨论页面发起的讨论，没有自动与boxster车型关联起来,审核不通过,19,2015-12-22 00:13:50
90,"1.手机无法接受验证码
2.用提供的账号和密码无法登陆",进入操作界面，1.无法用手机号注册，2.提供的账号12111111001和密码123456无法登陆,审核不通过,21,2015-12-22 00:17:26
91,我自己发起的讨论不能删除，，建议可以删除，，,"我自己发起的讨论不能，删除，建议可以删除，，
首页---选（我）在选（我的讨论）---在点击讨论进去---没办法删除，自己发起的讨论，",审核通过,19,2015-12-22 00:17:41
92,在软件中用账号12111111085登陆，无法登陆，且显示账号或者密码错误。,在软件中用账号12111111085登陆，无法登陆，且显示账号或者密码错误。,审核不通过,6,2015-12-22 00:18:07
93,在软件中用账号12111111085登陆，无法登陆，且显示账号或者密码错误。,在软件中用账号12111111085登陆，无法登陆，且显示账号或者密码错误。,审核不通过,6,2015-12-22 00:18:29
94,账号登录中忘记密码，无法收取到验证码。,账号登录中忘记密码，无法收取到验证码。账号登录中忘记密码，无法收取到验证码。,审核不通过,6,2015-12-22 00:18:51
95,软件中的快速登录，填写自己手机号后，发送验证码，完全收不到，试了4次，都不行。,软件中的快速登录，填写自己手机号后，发送验证码，完全收不到，试了4次，都不行。,审核不通过,22,2015-12-22 00:19:12
96,输入正确账号密码无法登陆,"环境：红米手机2 miui7.0.11.0  wifi，从百度微任务或桌面打开app,输入正确账号密码无法登陆",审核不通过,6,2015-12-22 00:19:40
97,试用账号12111111001登陆软件，登陆不上，且显示账号或者密码错误。,试用账号12111111001登陆软件，登陆不上，且显示账号或者密码错误。,审核不通过,6,2015-12-22 00:19:48
98,试用账号12111111085登陆软件，登陆不上，且显示账号或者密码错误。,试用账号12111111085登陆软件，登陆不上，且显示账号或者密码错误。,审核不通过,6,2015-12-22 00:20:14
99,软件账号登陆中的账号忘记密码，然后填写手机号，获取验证码，毫无反应。,软件账号登陆中的账号忘记密码，然后填写手机号，获取验证码，毫无反应。,审核通过,21,2015-12-22 00:20:32
100,软件中的快速登录，填写手机号，点击获取验证码，收不到验证码，试了3次都不可以。,软件中的快速登录，填写手机号，点击获取验证码，收不到验证码，试了3次都不可以。,审核不通过,22,2015-12-22 00:20:52
101,软件中点击经销商列表后出现网络异常，出现白屏,软件中点击经销商列表后出现网络异常，出现白屏。软件中点击经销商后出现网络异常，出现白屏,审核不通过,20,2015-12-22 00:21:59
102,输入正确的手机号提示号码不存在,进入登录页面-点击找回密码-输入正确的手机号-点击获取验证码-提示手机号码不存在,审核通过,15,2015-12-22 12:18:23
103,买车页面进入测试图片，点击经销商地图面直接跳转到首页,进入买车页面-点击广告图片测试进入-点击经销商地图直接跳转到首页,审核通过,20,2015-12-22 12:18:31
104,进入车款详情页面，全部在售中，2013款显示为2款，点击2013款tab进入，却显示有3款,买车-保时捷-boxster-查看全部在售下的2013款车型为2款，点击2013tab，查看下面的车款，显示有3款，与实际显示不符,审核通过,24,2015-12-22 12:18:47
105,搜索页面没有取消按钮或退出按钮,进入讨论页面-点击搜索-进入搜索页面时无法取消搜索或退出搜索页面，只能通过手机返回键退出,审核通过,11,2015-12-22 12:19:12
106,发起砍价时，价格一栏输入建议价格，提示出价过低,买车页面-点击砍价-输入信息，在价格一栏输入建议的价格，提示出价过低；期望结果：不会弹出提示，因为是建议的价格所以在正常出价范围内,审核通过,12,2015-12-22 12:19:18
107,讨论详情页面对参与评论用户点赞成功后无法取消点赞,买车-选车中心-选择大众途安-点击讨论-选择一个讨论进入详情-下拉页面，在网友建议下对用户点赞，点赞成功后取消点赞,审核通过,0,2015-12-22 12:19:26
108,讨论详情页面回复评论时输入空格，点击发送没反应,进入讨论页面-选择一个讨论进入-下拉页面，回复评论-在输入框中输入空格，点击发送，没任何提示，没反应,审核通过,19,2015-12-22 12:19:32
109,特价车页面选择地区时筛选伊犁时，查看结果显示内蒙古,进入买车页面-点击特价车-选择地区为伊犁，查看结果，还有显示内蒙古的,审核通过,23,2015-12-22 12:19:39
110,分享到微信朋友圈时点击分享后直接跳转页面没提示,进入买车页面-点击广告图片那些年国为电影爱上的车进入，点击分享-分享到微信好友-分享成功后返回app时没提示，应提示分享成功,审核通过,5,2015-12-22 12:19:49
111,购车城市页面定位失败,买车页面-轮播图片自驾拉萨进入-点击一键比价-点击经销商-点击右上角的城市进入-定位我的位置时失败，不能定位,审核通过,2,2015-12-22 12:19:59
112,查看其他评测内容时，点击内容不能进入，在页面上跳转一下不能进入详情页面,买车页面-轮播图片自驾拉萨进入-选择牧马人点击一键比价-在评测下点击进入查看其他评测-点击其他评测内容时，页面只跳转了一下，没有进入详情页面,审核通过,16,2015-12-22 12:20:08
113,购车领取奖励时上传发票从相册中选择图片上传失败，闪跳出添加奖励页面,买车页面-点击广告图片特惠购车季进入-点击已购车，领取奖励-上传发票-从相册中选择图片-上传失败，跳回广告图片页面,审核通过,7,2015-12-22 12:20:17
114,昵称输入空格后没任何没提示,进入我的页面-进入个人信息页面-输入昵称为空格，点击确定没反应,审核通过,25,2015-12-22 12:20:27
115,个人资料设置页面输入昵称为两个字时提示语后面有代码,登录成功后-进入设置个人资料页面-输入昵称为两个字时点击确定-提示昵称最少需输入3个文字后面有代码,审核通过,25,2015-12-22 12:20:53
116,预约试驾填写信息后，返回我的页面查看我预约的试驾，不显示已预约的详情,买车页面-试驾-填写所有信息后点击提交-提交成功后返回我的页面-点击预约试驾，不显示预约的详情,审核通过,9,2015-12-22 12:21:02
117,将车加入对比后“加入对比”四字没改变成“已加入对比”,买车-选择一款车型进入详情页面-选择一款加入对比，加入成功后“加入对比”四字未切换成“已加入对比”，避免重复操作,审核通过,23,2015-12-22 12:21:08
118,发起砍价页面购车城市显示不全,买车-选择一款奔池进入-查看经销商，显示有北京的公司，返回详情页面点击发起砍价选择购车城市时没有北京,审核通过,24,2015-12-22 12:21:16
119,登陆页面提示文字显示有误，选择账号登陆时，提示显示登录手机号,登陆页面提示文字显示有误，选择账号登陆时，提示显示登录手机号,审核不通过,21,2015-12-22 12:22:05
120,昵称字数限制，建议改成最少两个汉字，两个汉字易于记忆,昵称字数限制，建议改成最少两个汉字，两个汉字易于记忆,审核不通过,25,2015-12-22 12:22:26
121,首页顶部横栏自驾拉萨，点击进入后先显示白屏，图片在数秒后才加载出现,首页顶部横栏自驾拉萨，点击进入后先显示白屏，图片在数秒后才加载出现,审核不通过,17,2015-12-22 12:22:48
122,提供的账号无法登陆！无法接收验证码,提供的账号无法登陆！无法接收验证码，验证码是发到手机号的，测试账号无法接受,审核不通过,21,2015-12-22 12:39:39
123,提供的账号和密码根本上不去,不知道为什么，网页提供的账号和密码根本上不去，手机是华为4c,审核不通过,6,2015-12-22 12:40:41
124,自己用手机号码注册，发不了验证码,用不了网页提供的账号和密码以后，我准备自己注册，问题是根本不给我发验证码，试了两次，都不行。手机是华为4c,审核不通过,22,2015-12-22 12:41:06
125,点击键盘的搜索图标，不工作,"1。打开app。点击右上角的搜索图标。
2。输入“日产370z”，点击键盘里的搜索图标，没有进行搜索操作。",审核不通过,11,2015-12-22 12:41:47
126,“我的比价”界面，提示“暂时没有比价纪录”。“纪录”应为“记录”,1。打开app。登录后点击“我”，然后点击“我的比价“。界面上的提示“暂时没有比价纪录”，“纪录”应为“记录”。,审核不通过,18,2015-12-22 12:42:55
127,消息推送设置勿扰模式功能没有用，,下载安装后打开，点击我，点击设置，点击消息推送在勿扰模式后打勾，开启后应该23点到7点不会给我推送消息，但是我做测试的时候是6点多，咚咚咚，一会儿一个,审核通过,26,2015-12-22 12:44:29
128,成功发表讨论后不能删除自己发表的讨论，设计不合理,进入讨论页面-点击右下角的发表按钮，发表成功后查看我发表的讨论-长按讨论，不能删除,审核通过,19,2015-12-22 12:44:47
129,搜索页面搜索宝马，搜索出结果后删除宝马两字，页面还显示搜索出的结果,进入买车页面-点击搜索按钮-在搜索框中输入宝马-搜索出结果后删除宝马二字，查看结果,审核通过,11,2015-12-22 12:45:01
130,账号12111111085登录不上，显示账号或者密码错误。,账号12111111085登录不上，显示账号或者密码错误。,审核不通过,6,2015-12-22 12:45:15
131,"提供的99组账号密码  账号12111111001  ―  12111111099   密码 123456
使用“12111111001”无法正确登录，显示“账号或密码错误”，并在下方提示框中出现乱码。","提供的99组账号密码  账号12111111001  ―  12111111099   密码 123456
使用“12111111001”无法正确登录，显示“账号或密码错误”，并在下方提示框中出现乱码。",审核不通过,6,2015-12-22 12:45:39
132,用提供的账号登陆时提示statuscode=200错误，还有一次提示支付10元失败,"1、下载并安装软件；
2、打开软件，点击我的登陆；
3、用提供的12111111001账号，密码123456登陆，多次提示账号密码错，statuscode=200错误，还有一次提示支付10元失败，请参见截图，谢谢。",审核通过,21,2015-12-22 12:46:06
133,无法给应用评分。。。,下载安装打开，点击我点击设置，点击给我评分，页面显示网络不给力请稍候刷新，反正我是刷新好久还是那样,审核不通过,13,2015-12-22 12:46:25
134,成功安装应用后，打开应用，未出现任何提示就闪退报错,成功安装应用后，打开应用，未出现任何提示就闪退报错,审核通过,14,2015-12-22 12:46:39
135,账户登陆界面，手机号输入框应限制只能输入数字,"打开app点我，进入快速登陆页面，点右上角账户登陆，
该页面手机号输入框应限制只能输入数字",审核不通过,15,2015-12-22 12:46:52
136,"进入app后一分钟不到就会出现闪退,系统是4.0.4","进入app后一分钟不到就会出现闪退,系统是4.0.4",审核不通过,14,2015-12-22 12:47:09
137,启动app后，一直是定位中，没有定位到所在城市北京。,启动app后，一直是定位中，没有定位到所在城市北京。,审核通过,2,2015-12-22 12:47:32
138,手动选择城市北京后，app崩溃，无法进入app主页测试,手动选择城市北京后，app崩溃，无法进入app主页测试,审核通过,24,2015-12-22 12:47:49
139,台电平板点击下面尾部的400电话会出现闪退，可能是因为平板无法调用通话，但是建议给出提示而不是闪退,台电平板点击下面尾部的400电话会出现闪退，可能是因为平板无法调用通话，但是建议给出提示而不是闪退,审核通过,14,2015-12-22 12:48:09
140,启动程序后进入首页，出现闪退,机型：联想a789 系统：安卓4.04 启动程序后进入首页，出现闪退，反复测试过多次,审核不通过,14,2015-12-22 12:48:36
141,点击打开软件，进入主界面后几秒后闪退，由于闪退时间较短，未能截到图,点击打开软件，进入主界面后几秒后闪退，由于闪退时间较短，未能截到图,审核通过,14,2015-12-22 12:49:00
142,特价车列表点击进入后，内容加载缓慢，大约5s后才加载出内容,特价车列表点击进入后，内容加载缓慢，大约5s后才加载出内容,审核不通过,16,2015-12-22 12:49:08
143,预约试驾内容加载缓慢，大约5s之后才成功加载出内容,预约试驾内容加载缓慢，大约5s之后才成功加载出内容,审核不通过,16,2015-12-22 12:49:29
144,右上角点击搜索，搜索只能根据车系和讨论进行搜索，建议增加品牌，车型,右上角点击搜索，搜索只能根据车系和讨论进行搜索，建议增加品牌，车型,审核不通过,11,2015-12-22 12:49:46
145,特价车只能筛选地区和品牌，不能筛选价格和截止时间,特价车只能筛选地区和品牌，不能筛选价格和截止时间,审核不通过,23,2015-12-22 12:49:57
146,在“买车”里点击预约试驾，提交信息以后，在“我”里查看预约信息，没有显示。,在“买车”里点击预约试驾，提交信息以后，在“我”里查看预约信息，没有显示。,审核通过,9,2015-12-22 14:52:40
147,打开app 不能自动定位,打开app 自动定位失败  需要手动定位,审核通过,2,2015-12-22 22:40:05
148,账号登录中第一个12111111001 登录显示错误,打开app 点击我 账号输入12111111001  密码123456 显示错误,审核不通过,6,2015-12-22 22:41:46
149,app中的优惠  点进去全部优惠很难理解,打开app 点击首页中的优惠    地方偏远  优惠标题含糊不清,审核不通过,26,2015-12-22 22:42:03
150,讨论详情评论完，参与人数加，再删除评论，参与人数未减，然而这和实际看到的参与人数不一致,讨论详情评论完，参与人数加，再删除评论，参与人数未减，然而这和实际看到的参与人数不一致,审核不通过,19,2015-12-22 22:42:39
151,买车页面-点击首个滚动图技术测试-点击车系页-bug提示:，app自动重启,买车页面-点击首个滚动图技术测试-点击车系页-bug提示:，app自动重启. 点击经销商列表，提示网络异常。,审核通过,20,2015-12-22 22:42:48
152,买车页面-点击首个滚动图第二张：特惠购车季，里面的发票无法上传，上传非照片文件后跳转到上一页(原先是会乱跳，不知道是选了哪个车型),买车页面-点击首个滚动图第二张：特惠购车季，点击“已购车，领取奖励”-点击上传发票，选非照片文件跳转到前一页，选照片文件无任何体现。,审核通过,7,2015-12-22 22:43:54
153,预约试驾中，城市，车系，车型无法选择，点击提交无 提示无反应,预约试驾中，城市，车系，车型无法选择，点击提交无 提示无反应,审核通过,9,2015-12-22 22:44:58
154,多个评测内容为空的链接存在，转跳切换内容都是空的，体验不好,多个评测内容为空的链接存在，转跳切换内容都是空的，体验不好,审核通过,16,2015-12-22 22:45:11
155,无法登陆，填写12111111001登陆失败,点击个人中心，账号登入后，填写12111111001，及密码123456，登陆失败,审核不通过,21,2015-12-22 22:45:41
156,进入等速登录页面，输入手机号后，点击获取验证码，无法获取到验证码,进入等速登录页面，输入手机号后，点击获取验证码，无法获取到验证码,审核不通过,15,2015-12-22 22:46:02
157,进入查看车图页面，点击右边的分类后，不会自动左移，查看更多的分类（需要手动滑动，不容易知道还有那么多分类）,进入查看车图页面，点击右边的分类后，不会自动左移，查看更多的分类（需要手动滑动，不容易知道还有那么多分类）,审核通过,17,2015-12-22 22:48:02
158,"进入修改昵称页面，提示语有误,，不应该输出“statuscode=200”这样的信息","进入修改昵称页面，提示语有误,，不应该输出“statuscode=200”这样的信息",审核通过,25,2015-12-22 22:48:10
159,购车计算器--1.6l以下的车辆购置税计算错误,"1.进入大众朗逸1.6l手动舒适的报价明细--落地价预估
2.查看购置税的计算
结果：计算规则为购车款*10%
期望：今年的新规定，1.6l一下车辆购置税减半，请及时修改",审核通过,23,2015-12-22 22:48:29
160,讨论详情中邀请好友投票，分享到微信，在微信中点击无法打开网页，直接提示报错,"机型：魅族mx4 pro
android系统：5.0.1
网络：wifi
操作步骤：
1、打开买车达人app
2、登录账号后，点击讨论tab，进入页面后
3、添加车型及讨论话题提交后
4、在讨论专区选择邀请好友投票，分享到微信
5、好友在微信中点击此链接，该页面无法打开，提示报错",审核通过,5,2015-12-22 22:48:47
161,在账号登陆界面使用提供的账号密码提示“错误”，使用自己手机注册无法收到验证码,在账号登陆界面使用提供的账号密码提示“错误”，使用自己手机注册无法收到验证码,审核不通过,6,2015-12-22 22:49:20
162,点击“技术测试”，选择“车系页”，弹出的也没后，点击确定，程序奔溃。,点击“技术测试”，选择“车系页”，弹出的也没后，点击确定，程序奔溃。,审核通过,20,2015-12-22 22:49:46
163,建议点击调整出价时，定位到修改价格的位置,"1.点击主界面中的“砍价”；<br>
2.填写车辆相关信息，其中出价填写的值小于建议值；<br>
3.将页面滑倒到底端的“常见问题”，查看常见问题；<br>
4.点击“发起砍价”按钮；<br>
5.app弹出“您的出价过低”的提示框,点击提示框中的“调整出价”按钮；<br>

结果：没有自动滑动到上方修改价格的位置；<br>
预期：自动滑动到上方修改价格的位置，便于用户修改价格；",审核通过,12,2015-12-22 22:50:04
164,手机号不存在时，提示信息不友好，出现statuscode=200的字串,"1.进入找回密码界面；<br>
2.输入没有注册过的正确的手机号<br>
3.点击“获取验证码”按钮；<br.
结果：提示信息中包含statuscode=200的字串；<br>
期望：提示信息中不包含statuscode=200的字串，提示信息友好；<br>",审核不通过,4,2015-12-22 22:50:42
165,快速登陆按钮的文字太轻，建议优化快速登陆按钮的文字对比度，修改成白色与橙色的对比,"【前置条件】<br>
用户已进入主界面但尚未登录<br>
1.点击“讨论”；<br>
2.点击右下角“编辑”图标；<br>
结果：快速登录按钮的字体对比度太低<br>
预期：建议将字体修改成白色，与忘记密码界面的按钮字体保持一致",审核通过,8,2015-12-22 22:51:27
166,手机格式错误时提示信息不友好，出现statuscode=200的字串,"1.进入找回密码界面；<br>
2.输入错误格式的手机号,如：155156278;<br>
3.点击“获取验证码”按钮；<br.
结果：提示信息中包含statuscode=200的字串；<br>
期望：提示信息中不包含statuscode=200的字串，提示信息友好；<br>",审核通过,4,2015-12-22 22:51:54
167,昵称设置不规范时提示多余字符,"打开软件
选择登录测试帐号，登陆成功都提示设置昵称
当输入的昵称不符合规范时，下方提示框提示的文字后边会多出一条代码，多出的字符严重影响体验
手机 samsung s4 i9500 安卓4.4.2  wifi",审核通过,25,2015-12-22 22:52:07
168,进入注册页面，输入手机号后点击获取验证码，无法收到验证码,进入注册页面，输入手机号后点击获取验证码，无法收到验证码,审核不通过,15,2015-12-23 00:09:56
169,进入登录页面，输入错误的账号和密码后点击登录，附带不合理提示“statuscode=200””,进入登录页面，输入错误的账号和密码后点击登录，附带不合理提示“statuscode=200””,审核通过,8,2015-12-23 00:10:19
170,点击买车-奥迪，点击图片进入查看车图页面，点击空间座椅不会自动左移，看不清内容,点击买车-奥迪，点击图片进入查看车图页面，点击空间座椅不会自动左移，看不清内容,审核通过,17,2015-12-23 00:11:16
171,进入应用后，点击第一页引导页右上角的跳过按钮，无法跳过引导页,进入应用后，点击第一页引导页右上角的跳过按钮，无法跳过引导页,审核不通过,13,2015-12-23 00:11:47
172,进入应用后，点击第一页引导页右上角的跳过按钮，无法跳过引导页,进入应用后，点击第一页引导页右上角的跳过按钮，无法跳过引导页,审核通过,13,2015-12-23 00:12:00
173,进入登录页面，输入错误的账号和密码后点击登录，附带不合理提示“statuscode=200””,进入登录页面，输入错误的账号和密码后点击登录，附带不合理提示“statuscode=200””,审核不通过,8,2015-12-23 00:12:47
174,进入注册页面，输入手机号后点击获取验证码，无法收到验证码,进入注册页面，输入手机号后点击获取验证码，无法收到验证码,审核不通过,15,2015-12-23 00:13:21
175,点击买车-奥迪，点击图片进入查看车图页面，点击空间座椅不会自动左移，看不清内容,点击买车-奥迪，点击图片进入查看车图页面，点击空间座椅不会自动左移，看不清内容,审核不通过,17,2015-12-23 00:13:44
176,点击北汽制造车型，进入后无显示,"1.进入买车达人app首页
2.登陆帐号后，选择北汽制造
3.打开是白页，无任何显示",审核通过,24,2015-12-23 00:14:02
177,使用系统提供的帐号密码无法登录  帐号12111111001   密码 123456,使用系统提供的帐号密码无法登录  帐号12111111001   密码 123456,审核通过,10,2015-12-23 10:39:11
178,在app主页点击技术测试进入子页面，页面许多模块功能重叠 比如两个分享点进入显示是qq 微信好友 朋友圈 但是页面也还有两份重叠的,在app主页点击技术测试进入子页面，页面许多模块功能重叠 比如两个分享点进入显示是qq 微信好友 朋友圈 但是页面也还有两份重叠的,审核通过,3,2015-12-23 10:40:04
179,打开app 点击快速登录 输入19888369988这个电话号码点击获取验证码 不会提示你号码错误 会显示已发送 但是这个198的号段根本不存在啊,打开app 点击快速登录 输入19888369988这个电话号码点击获取验证码 不会提示你号码错误 会显示已发送 但是这个198的号段根本不存在啊,审核通过,15,2015-12-23 10:40:18
180,在app主页点击技术测试进入子页面 点击经销商列表 弹出一个提示 然后点击确定进入子页面 显示网络异常 检查网络连接,在app主页点击技术测试进入子页面 点击经销商列表 弹出一个提示 然后点击确定进入子页面 显示网络异常 检查网络连接,审核通过,20,2015-12-23 10:40:29
181,在app主页点击技术测试进入子页面 点击banner分享 弹出一个提示框里面包含了微信好友 qq 朋友圈 这三个板块 但是在页面中也有这3个板块 功能重叠,在app主页点击技术测试进入子页面 点击banner分享 弹出一个提示框里面包含了微信好友 qq 朋友圈 这三个板块 但是在页面中也有这3个板块 功能重叠,审核通过,3,2015-12-23 10:40:46
