id,bug详情,复现步骤,审核状态,重复情况,提交时间
100,在重新安装APP后登陆以前账号其中的设置接收通知消息提示和聊天消息提示会自动打开,在账号状态下关闭接收通知消息提示和聊天消息提示卸载APP重新安装后登陆注册的账号在我设置接收通知消息提示和聊天消息提示会自动打开,审核通过,13,2016-03-14 10:47:07
101,在账号注册成功后不会自动登录返回至登录界面,打开APP完成注册后APP返回至首页登录界面注册成功后不能自动登录,审核通过,16,2016-03-14 10:47:07
102,在首次注册成功后登录进入APP界面首页的新闻图片不能够正确显示,在首次注册成功后登录进入APP界面首页的新闻资讯图片要么不显示要么显示为图片被删除,审核通过,8,2016-03-14 10:47:07
103,修改密码密码字符类型未限制,我设置密码修改新密码中输入字符的类型未进行限制可汉字等任意字符,审核通过,20,2016-03-14 10:47:07
104,探索一师一优课搜索点击小学语文标签查询其中的内容含有八年级七年级等非小学课程内容,探索一师一优课搜索点击小学语文标签查询其中的内容含有八年级七年级等非小学课程内容,审核通过,17,2016-03-14 10:47:07
105,商城中的拓展培训课程点击时会闪现获取中的提示框,商城拓展培训点击钢琴课程在弹出课程内容时会出现获取中的提示框,审核通过,19,2016-03-14 10:47:07
106,关闭网络情况下点击APP中的标签时屏幕正下方会出现一个大黑点,关闭网络点击探索我此时屏幕正下方会出现一个大黑点,审核通过,4,2016-03-14 10:47:07
107,网络关闭条件下无法退出登录关闭APP,网络关闭条件下我设置退出登录提示网络未联机此时APP也不会自动关闭,审核通过,4,2016-03-14 10:47:07
108,使用测试账号登录通知公告的未读数量在点击进去后全部消失,使用测试账号登录畅联通知公告的未读数量在点击进去后全部消失,审核通过,10,2016-03-14 10:47:07
109,反馈的语音信息在未提交情况下更换测试账号其仍保存在未发送的草稿中,我设置反馈录音退出APP更换测试账号后登录在反馈中仍然保存有相关录音信息重新安装APP后消失,审核通过,9,2016-03-14 10:47:07
110,点击新闻动态下2016高考全国卷看下的分享按钮无法跳转到待分享界面,点击新闻动态下2016高考全国卷看下的分享按钮无法跳转到待分享界面,审核通过,0,2016-03-14 11:23:09
111,使用本机手机注册登录时在进入主页的缓冲界面时程序异常闪退,使用本机手机注册登录时在进入主页的缓冲界面时程序异常闪退使用本机手机注册登录时在进入主页的缓冲界面时程序异常闪退,审核通过,16,2016-03-14 11:23:09
112,商城下的拓展培训里产品布局图下方留白的地方太多,商城下的拓展培训里产品布局图下方留白的地方太多商城下的拓展培训里产品布局图下方留白的地方太多,审核通过,19,2016-03-14 11:23:09
113,登录页面输入用户名与密码不选择使用协议弹出提示语文字错误将登录写成登陆,登录页面输入用户名与密码不选择使用协议弹出提示语文字错误将登录写成登陆,审核通过,20,2016-03-14 14:18:53
114,进入用户注册页面弹出键盘后点击左上角返回按钮回退到登录页面键盘未隐藏,进入用户注册页面弹出键盘后点击左上角返回按钮回退到登录页面键盘未隐藏,审核通过,16,2016-03-14 14:18:53
115,进入注册页面切回桌面后再进入查看进入页面错误没有进入到注册页面,进入注册页面切回桌面后再进入查看进入页面错误没有进入到注册页面,审核通过,18,2016-03-14 14:18:54
116,发送个人通知选择分组后应该回到个人通知页面,1登录点击畅联我的校园个人通知2发送给谁选择一个分组一个人3点保存实际结果回到选择组页面期望结果回到发布通知页面更好,审核通过,10,2016-03-14 14:48:27
117,个人通知页面点击分享没反应,1登录点击畅联我的校园个人通知2点开查看一条个人通知3右上角点分享按钮实际结果提示用户准备分享中请稍后期望结果弹出分享页面,审核通过,10,2016-03-14 14:48:27
118,整个app点击切换不是很流畅,1登录app2来回点击切换页面实际结果切换不是很流畅期望结果切换显示流畅,审核通过,9,2016-03-14 14:48:28
119,进入注册页面光标默认停留在验证码页面,1打开软件2点击点击注册页面预期结果光标默认停留在姓名页面实际结果光标默认停留在验证码页面,审核通过,18,2016-03-14 16:18:23
120,注册页面中姓名输入表情提交失败提示与服务器通讯异常,1打开软件2点击进入注册页面3姓名中输入表情手机号码雨验证码输入正确4点击提交预期结果提交成功实际结果提交失败提示与服务器通讯异常,审核通过,18,2016-03-14 16:18:23
121,注册页面中输入表情提示注册失败实际已经注册成功,1打开软件2点击进入注册页面3姓名中输入表情手机号码雨验证码输入正确4点击提交提示错误后5等待倒计时结束再次点击获取验证码预期结果能再次获取验证码成功实际结果获取验证码失败提示此号码已存在,审核通过,18,2016-03-14 16:18:23
122,姓名中输入表情保存后显示异常显示为,1打开软件2点击进入我3姓名中输入表情保存后查看预期结果正常显示实际结果显示异常显示为,审核通过,18,2016-03-14 16:18:23
123,无网络进入个人信息提示错误,1打开软件2点击进入我3关闭手机网络点击进入个人信息预期结果提示网络异常实际结果弹出黑框提示,审核通过,11,2016-03-14 16:18:24
124,无网络点击订单导致软件停止运行,1打开软件2点击进入我3关闭手机网络点击订单预期结果提示网络异常实际结果软件停止运行,审核通过,4,2016-03-14 16:18:24
125,无网络打开软件一直重复提示与服务器通讯异常且弹出黑色框,1关闭手机网络2打开软件预期结果只提示一次网络异常实际结果一直重复提示与服务器通讯异常且弹出黑色框,审核通过,11,2016-03-14 16:18:24
126,设置中清除缓存能进行多次清空操作,1打开软件2点击进入我设置3进行多次清空缓存操作预期结果第二次清空时提示当前缓存为空实际结果能进行多次清空操作其他截图上传到了百度云链接为httppanbaiducoms1nuc3DJN,审核通过,18,2016-03-14 16:18:24
127,聊天页面中无录音权限录音仍能发送成功,1打开软件2点击进入畅联3切换到畅聊4点击默认班级进入聊天页面5点击录音弹出权限中禁止录音权限查看预期结果录音发送失败实际结果录音发送成功但是没有声音其他截图上传到了百度云链接为httppanbaiducoms1nuc3DJN,审核通过,9,2016-03-14 16:18:24
128,探索一师一优课中输入表情搜索页面显示空白,1打开软件2点击进入探索3点击进入一师一优课4点击搜索输入表情预期结果提示暂无内容实际结果页面显示空白其他截图上传到了百度云链接为httppanbaiducoms1nuc3DJN,审核通过,18,2016-03-14 16:18:24
129,家校互联中显示页面错误显示的为电脑端页面,1打开软件2点击进入畅联3下滑点击进入家校互联4点击一个班级进入查看预期结果显示的为手机端页面实际结果显示的为电脑端页面其他截图上传到了百度云链接为httppanbaiducoms1nuc3DJN,审核通过,18,2016-03-14 16:18:25
130,我的圈子评论发送按钮文字为空,测试账号13548670464000000手机型号小米MINOTELTEAndroid4441登录成功点击我我的圈子照相机按钮2进入写动态页面添加照片和文字内容点击分享保存成功3点击我的圈子对分享的内容点击评论查看页面显示评论发送按钮文字为空,审核通过,6,2016-03-15 00:45:32
131,建议Bug评论删除按钮太小点击不灵敏建议按钮可点击位置设置大点,测试账号13548670464000000手机型号小米MINOTELTEAndroid4441登录成功点击我我的圈子页面存在评论信息2点击删除测试删除按钮点击灵敏度实际删除按钮太小点击10次4次才可以触发点击事件,审核通过,6,2016-03-15 00:45:32
132,点击我的订单进入订单详情页面时程序闪退重启,测试账号13548670464000000手机型号小米MINOTELTEAndroid4441登录成功点击我订单进入我的订单列表页面2点击列表页面订单如写字本卓玉测试进入订单详情查看页面响应app闪退后重新打开,审核通过,4,2016-03-15 00:45:32
133,反馈页面录音权限提示拒绝后仍然可以录音,测试账号13548670464000000手机型号小米MINOTELTEAndroid4441登录成功点击我的设置反馈2点击按住录音弹出录音开启权限询问点击拒绝3再次点击按住录音可以正常录音,审核通过,9,2016-03-15 00:45:32
134,服务器通讯异常时我的页面tooltips提示为空,测试账号13548670464000000手机型号小米MINOTELTEAndroid4441服务器异常登录成功点击我的2查看服务器异常提示显示页面提示内容为空,审核通过,11,2016-03-15 00:45:32
135,个人信息头像从拍照中退出后提示与服务器通讯异常,测试账号13548670464000000手机型号小米MINOTELTEAndroid4441登录成功服务器正常2点击我个人信息头像拍照3进入照相机后不做操作点击返回4返回个人信息页面查看页面显示页面提示与服务器通讯异常,审核通过,11,2016-03-15 00:45:32
136,学霸家教输入空格进行查询提示与服务器通讯异常,测试账号13548670464000000手机型号小米MINOTELTEAndroid4441点击探索学霸家教搜索按钮2输入屋里点击查询查询结果为空3输入空格点击查询提示与服务器通讯异常,审核通过,11,2016-03-15 00:45:32
137,个人通知页面发布通知内容为空格提示发布异常,测试账号13548670464000000手机型号小米MINOTELTEAndroid4441点击畅联我的校园个人通知2点击添加内容输入空格发送给谁选择完成3点击发送页面提示发布异常应该提示内容不能为空,审核通过,10,2016-03-15 00:45:32
138,通知公告页面发布通知内容为空格发布成功没有做有效性验证,测试账号13548670464000000手机型号小米MINOTELTEAndroid4441点击畅联我的校园通知公告2点击添加内容输入空格发送给谁选择完成3点击发送页面提示成功应该提示内容不能为空4打开发布的公告内容为空备注校内公告也复现该Bug,审核通过,10,2016-03-15 00:45:32
139,个人通知中播放录音进度条上有两个进度点,用提供的帐号登录畅联个人通知进去播放录音进度条上有两个进度点夏新N828安卓421WIFI网络,审核通过,10,2016-03-15 12:58:05
140,登录时输入正确的手机号码和密码后未点击同意协议点击登录系统给出的提示信息中有错别字如截图必须同意使用协议后才能登陆应该是录,登录时输入正确的手机号码和密码后未点击同意协议点击登录系统给出的提示信息中有错别字如截图必须同意使用协议后才能登陆应该是录,审核通过,20,2016-03-15 13:30:29
141,登录后进入我的圈子点击评论评论按钮中无字建议给出,登录后进入我的圈子点击评论评论按钮中无字建议给出,审核通过,6,2016-03-15 13:30:29
142,手机一摇却出现了反馈的界面,手机一摇却出现了反馈的界面,审核通过,9,2016-03-15 14:00:36
143,我点击在线客服欣欣显示出来的却是微光,我点击在线客服欣欣显示出来的却是微光,审核通过,15,2016-03-15 14:00:36
144,探索学霸家教点击历史张森学的古代中国经济的视频播放5秒自动暂停播放到10秒16秒也自动暂停过然后又开始播放,探索学霸家教点击历史张森学的古代中国经济的视频播放5秒自动暂停播放到10秒16秒也自动暂停过然后又开始播放,审核通过,3,2016-03-15 14:00:36
145,登陆软件点击我点设置点密码修改输完密码按确定没反应,登陆软件点击我点设置点密码修改输完密码按确定没反应,审核通过,20,2016-03-15 17:27:44
146,未设置姓名的用户在畅联模块的畅聊功能中聊天内容添加图片后点击返回按钮APP崩溃闪退再次进入APP的畅联模块APP直接崩溃闪退,测试机型oppor7s前提条件登录用户是未设置姓名的用户测试步骤1点击页面下方畅联模块2在畅联模块点击畅聊功能选择默认班级3在打开的默认班级聊天页面添加一张图片4点击聊天页面左上角的返回按钮预期结果可以成功返回到上一页面实际结果APP崩溃闪退且再次进入APP的畅联模块APP直接崩溃闪退,审核通过,16,2016-03-15 21:39:17
147,进入软件后点击动态查询里的新闻动态第一个新闻资讯未进入时下面有点赞等一些按键进入界面后新闻最低端什么都没有,进入软件后点击动态查询里的新闻动态第一个新闻资讯未进入时下面有点赞等一些按键进入界面后新闻最低端什么都没有,审核通过,0,2016-03-15 21:44:38
148,进入软件后点击动态查询里的新闻动态里新闻资讯进入新闻资讯后点击右上角的分享按键没有提示分享到什么平台且分享后也没有提示是否分享成功的提示信息,进入软件后点击动态查询里的新闻动态里新闻资讯进入新闻资讯后点击右上角的分享按键没有提示分享到什么平台且分享后也没有提示是否分享成功的提示信息,审核通过,0,2016-03-15 21:44:38
149,在软件畅聊的界面中的我的校园的家庭作业中点击后出现软件需要重新登录的退回到初始的登录的界面,在软件畅聊的界面中的我的校园的家庭作业中点击后出现软件需要重新登录的退回到初始的登录的界面,审核通过,12,2016-03-15 21:44:38
150,在软件畅聊的界面中的我的校园的问卷调查中点击后无任何反应,在软件畅聊的界面中的我的校园的问卷调查中点击后无任何反应在软件畅聊的界面中的我的校园的问卷调查中点击后无任何反应,审核通过,12,2016-03-15 21:44:38
151,登陆界面输入账号密码后输入法没有及时退出,登陆界面输入账号密码后输入法没有及时退出还在界面上很不美观,审核通过,20,2016-03-16 09:03:56
152,各种通知界面发布照片照片不能加载,各种通知界面发布照片选择拍照但照片不能加载测试手机红米1S,审核通过,10,2016-03-16 09:03:56
