id,bug详情,复现步骤,审核状态,重复情况,提交时间
1,点击对某一个人进行评论评论成功却没有看到评论的内容,点击对某一个人进行评论评论成功却没有看到评论的内容,审核通过,2,2015-12-16 17:11:03
2,如图功能性BUG当我们输入的手机号为假时发送消息的那个按钮也被激活了并且可以按下并且还提示我图中输入的手机号已经使用一个符号的手机号这是程序设计的一个BUG应该改成输入框中输入手机号为真时或更明细一些的判断如输入的手机号位数为11位且号码的前三位为131或133或135139这样才为一个合格的程序,如图功能性BUG当我们输入的手机号为假时发送消息的那个按钮也被激活了并且可以按下并且还提示我图中输入的手机号已经使用一个符号的手机号这是程序设计的一个BUG应该改成输入框中输入手机号为真时或更明细一些的判断如输入的手机号位数为11位且号码的前三位为131或133或135139这样才为一个合格的程序,审核通过,21,2015-12-16 17:53:56
3,点击跟读练习后显示网络检查,点击跟读练习后显示网络检查无法连接读取音频文件无法播放和跟读无法评分手机荣耀3c网络wifi,审核通过,17,2015-12-16 17:57:09
4,手机注册成功显示注册失败,注册成功进入选择身份即小学生等的页面但页面底部显示注册失败软件卡死需要重新开,审核通过,20,2015-12-16 18:00:42
5,无法正常播放题目录音,点击播放录音显示检查网络一直进行加载状态无法播放红米notemiui7,审核通过,11,2015-12-16 18:00:42
6,点击跟读练习后一直加载跟读练习失败,点击跟读练习后一直加载最后提示请检查网络经查网络并无问题手机型号VIVOX5V宽带电信50M宽带,审核通过,17,2015-12-16 18:22:31
7,我设置关于我们最下方公司版权时间为20132014该更新了,我设置关于我们最下方公司版权时间为20132014该更新了,审核通过,24,2015-12-16 18:36:58
8,进入app首页点击我学习数据报告进入数据报告页面右上角有分享但是点击分享没有任何反应分享功能不能使用,进入app首页点击我学习数据报告进入数据报告页面右上角有分享但是点击分享没有任何反应分享功能不能使用,审核通过,6,2015-12-16 18:43:42
9,第三方登录时手机上没有登录qq但是自动获取了用户的qq安全性差,1打开app点击下方的qq2观察界面实际结果自动关联了用户qq此时用户在手机上未登录qq期望结果用户未登录不该调取用户qq,审核通过,23,2015-12-16 18:48:54
10,点击跟读练习时无法连接网络,打开软件注册登录点击首页三个圆圈中真题预测和真题库点击一个类别点击题目点击跟读练习点击播放显示无网络手机型号华为G716L070系统安卓422网络环境wifi,审核通过,17,2015-12-16 19:31:58
11,进入跟读页面显示检查网络无法跟读,按照步骤进入跟读页面页面显示检查网络但网络没问题点击播放和录音一直加载无法跟读,审核通过,17,2015-12-16 19:59:30
12,点击录音后一直加载无法录音无法打分,按照步骤进入跟读页面点击打分显示还没有录音但录音一直加载无法进行更无法打分,审核通过,12,2015-12-16 19:59:30
13,手机注册完之后app会bug弹出窗口说stop了,手机注册完之后app会bug弹出窗口说stop了安卓442手机注册点注册弹出stop窗口没有跳转到注册成功的页面停留在注册页面之后点登陆可以进入app,审核通过,20,2015-12-16 20:37:46
14,登录界面登录按钮的文字显示不全,登录界面登录按钮的文字显示不全,审核通过,23,2015-12-16 20:53:58
15,登录界面选择其他方式登录中的微信无反应未安装微信情况下,登录界面选择其他方式登录中的微信无反应未安装微信情况下,审核通过,14,2015-12-16 20:53:58
16,注册界面获取验证码按钮文字显示不全,注册界面获取验证码按钮文字显示不全,审核通过,20,2015-12-16 20:53:58
17,在我的界面里个人名字后的性别图标和一个什么小花与帖子的文字覆盖,在我的界面里个人名字后的性别图标和一个什么小花与帖子的文字覆盖,审核通过,18,2015-12-16 20:53:58
18,在学习数据报告里学习建议怎么不向上些很不容易发现且中间有一大片空白,在学习数据报告里学习建议怎么不向上些很不容易发现且中间有一大片空白,审核通过,6,2015-12-16 20:53:58
19,在学习数据报告里点击分享无反应,在学习数据报告里点击分享按钮无反应,审核通过,6,2015-12-16 20:53:58
20,点击跟读练习点击开始提示检查网络但手机有wifi连接,点击跟读练习点击开始提示检查网络但手机有wifi连接,审核通过,17,2015-12-16 20:53:58
21,点击跟读练习点击录音一直缓冲无录音提示,点击跟读练习点击录音一直缓冲无录音提示,审核通过,12,2015-12-16 20:53:58
22,首页点击真题库点击分享无任何反应,首页点击真题库然后点击右上角分享无任何反应,审核通过,19,2015-12-16 20:53:58
23,写分享点击一次录音或相机则输入内容时内容输入框被覆盖无法显示,写分享点击一次录音或相机则输入内容时内容输入框被覆盖无法显示,审核通过,22,2015-12-16 20:53:58
24,写分享完成后点击发布显示失败,写分享完成后点击发布显示失败,审核通过,3,2015-12-16 20:53:58
25,在找考友里点击我关注的显示网络异常手机连接wifi最新和最热信息无问题,在找考友里点击我关注的显示网络异常手机连接wifi最新和最热信息无问题,审核通过,16,2015-12-16 20:53:58
26,在圈子里点击我关注的显示网络不够稳定手机连接wifi最新和最热信息无问题,在圈子里点击我关注的显示网络不够稳定手机连接wifi最新和最热信息无问题,审核通过,16,2015-12-16 20:53:58
27,安装成功后打开APP点击注册输入手机号验证码密码点击注册应用停止运行我的手机是酷派大神F2全网通系统安卓442网络联通4GPS注册成功了,安装成功后打开APP点击注册输入手机号验证码密码点击注册应用停止运行我的手机是酷派大神F2全网通系统安卓442网络联通4GPS注册成功了,审核通过,7,2015-12-16 21:08:20
28,注册成功登陆APP点击我点击头像不要点击用户名在个人信息页面点击更换头像选择从相册获取选择好图片点击保存页面自动跳转到选择从相册获取或拍照获取界面点击取消发现头像没有更换多次尝试无法更换头像,安装成功后打开APP点击注册输入手机号验证码密码点击注册应用停止运行我的手机是酷派大神F2全网通系统安卓442网络联通4GPS注册成功了,审核通过,7,2015-12-16 21:08:20
29,登陆APP点击下方的回答点击推荐中的任意一项内容例如电影点击给他点评选好星级在文本框中输入文字点击发送提示点评失败,登陆APP点击下方的回答点击推荐中的任意一项内容例如电影点击给他点评选好星级在文本框中输入文字点击发送提示点评失败,审核通过,13,2015-12-16 21:08:20
30,登陆APP点击下方的回答点击推荐中的任意一项内容例如电影点击去练习点击跟读练习点击左侧的播放按钮会提示检查网络而此时我的网络没有问题,登陆APP点击下方的回答点击推荐中的任意一项内容例如电影点击去练习点击跟读练习点击左侧的播放按钮会提示检查网络而此时我的网络没有问题,审核通过,17,2015-12-16 21:08:20
31,登陆APP点击下方的回答点击推荐中的任意一项内容例如电影点击去练习点击下方我要答题点击开始答题录音25秒后点击下方的紫色按钮提示录音失败,登陆APP点击下方的回答点击推荐中的任意一项内容例如电影点击去练习点击下方我要答题点击开始答题录音25秒后点击下方的紫色按钮提示录音失败,审核通过,12,2015-12-16 21:08:20
32,登陆APP用户名点击下方的圈子点击TAO友帖字中最新或者最热都可正常刷新帖子列表但是点击我关注的就一直显示网络不够稳定,登陆APP用户名点击下方的圈子点击TAO友帖字中最新或者最热都可正常刷新帖子列表但是点击我关注的就一直显示网络不够稳定,审核通过,16,2015-12-16 21:08:20
33,真题预测的第一个外面显示的时间和里面的不一致,真题预测的第一个外面显示的时间和里面的不一致外面显示的真题预测时间是2015年12月12日里面的标题显示的时间是2012年12月12日其他机经预测都正确,审核通过,10,2015-12-16 21:14:36
34,答题过程中出现bug提示,点击某一个题目点击下方的我要答题照显示的读完后点击结束答题显示录音失败等时间结束再点击还是显示录音失败,审核通过,1,2015-12-16 21:14:36
35,头像可以操作上传但没成功,在我页面点击个人信息点击更换头像从相册获取选择一张照片提交后头像没有任何变化,审核通过,18,2015-12-16 21:14:36
36,对用户的语言交流无法发送语音,对任一用户进行交流可以发送文字但发送语音失败,审核通过,13,2015-12-16 21:14:36
37,写分享点击发布提示失败,圈子用户反馈发帖填写完内容上传好照片后点击发布提示失败发布不成功,审核通过,4,2015-12-16 21:14:36
38,用户反馈界面的阅读数无增加,在用户反馈的界面对某一个用户反馈进行了评论评论数是正确增加了此用户反馈的阅读数没有改变,审核通过,23,2015-12-16 21:14:36
39,点击打开软件白屏闪退系统闪退,1下载安装软件2点击打开软件3白屏闪退系统崩溃停止运行,审核通过,9,2015-12-16 21:25:28
40,圈子点击用户反馈发帖时添加照片点击拍照添加照片闪退,1打开软件2打开圈子3打开用户反馈4点击发帖添加照片拍照添加闪退,审核通过,4,2015-12-16 21:25:29
41,课程模块打开手机直播课点击查看qq群交流页面显示qq群有两个头像,1打开软件2打开课程3打开手机直播课4查看qq交流群显示有两个头像,审核通过,24,2015-12-16 21:25:29
42,网络状态良好情况下首页打开真题库打开某一专题点击跟读练习点击播放按键无法播放,1打开软件2进入首页3打开真题库4打开某一专题5点击跟读练习点击播放播放失败,审核通过,11,2015-12-16 21:25:29
43,首页打开真题库打开某一专题点击分享点击无效无法分享,1点击打开软件2进入首页3打开真题库4进入某一专题5点击分享点击无效无法分享,审核通过,19,2015-12-16 21:25:29
44,首页打开真题预测点击答题录音点击提交提交失败,1打开软件2进入首页3点击真题预测4点击答题录音点击提交提交失败,审核通过,1,2015-12-16 21:25:29
45,圈子干货集锦页面点击发帖添加录音点击发布发布失败,1打开软件2啊点击圈子3点击干货集锦4点击发帖添加录音点击发布发布失败,审核通过,4,2015-12-16 21:25:29
46,干货集锦页面点击发帖添加照片系统崩溃,1打开软件2打开圈子3打开干货集锦4点击发帖点击添加照片系统崩溃,审核通过,4,2015-12-16 21:25:29
47,回答模块点击播放回答无法播放无任何声音,1打开软件2打开回答模块3点击播放回答4无任何声音播放失败,审核通过,11,2015-12-16 21:25:29
48,回答模块打开某一播放给他点评点评失败,1打卡软件2打开回答模块3打开某一播放4点击给她点评5编辑点评点击点评点评失败,审核通过,11,2015-12-16 21:25:29
49,注册过程中系统提示APP停止运行,1首次打开APP在登录页面选注册2填写手机号码验证码和密码点注册3系统提示APP已停止运行见截图4重启APP后发现注册已经成功可以使用之前注册的帐号登录测试手机就只有一部无法再次测试只能提供系统日志截图一份无法确定是否会复现及怎样的操作会再次触发错误发生手机环境小米2S联通非定制机MIUIv7开发版Androidv5022G运行内存测试时至少还有40内存可用3GWIFI10M或100M光纤接入未安装任何第三方安全类A,审核通过,7,2015-12-16 22:07:24
50,圈子里发表评论时使用语音评论功能失效,1打开APP登录2屏幕下方点圈子进入栏目页面3屏幕下滚到一条条的用户发布的内容处任意点一条进入内容页4点屏幕左下角的麦克风图标切换到语音评论状态5按住长按录音按钮进行录音几秒后公开显示回放和重录按钮点回放按钮无法回放我录了4秒就一直卡在4秒那里点发送则显示发送失败6其它内容进行相同操作确认语音评论功能失效提供录音后回放卡在4秒截图一张手机环境小米2S联通非定制机MIUIv7开发版Androidv5022G运行内存,审核通过,2,2015-12-16 22:07:24
51,更改头像功能失效无法实现头像更换,1打开APP登录2点屏幕右下角我图标进入我模块3点头像进入个人信息页面4点更换头像在弹出菜单中选择从相朋获取之后选择一张照片并调整好截取大小和位置点应用5APP转回个人信息页面等待超过1分钟无提示头像上传成功或失败从相朋获取拍照获取取消菜单一直就是展开状态没有自动关闭6点取消页面头像没有更新返回上一页重新进入头像没有更新换用拍照获取方式再次尝试与相册传图一样情形卡在最后那里没响应无法上传7多次尝试情况,审核通过,18,2015-12-16 22:07:25
52,目标分数设置为0时提示分数必须0120范围内,1打开APP登录2点屏幕右下角我图标进入我模块3点头像进入个人信息页面4点目标分数进入目标分数修改页填个0进去点保存得到提示分数必须0120范围内问题是我填的就是0是在这个范围之内的确定此处BUG提供填0保存时提示分数必须0120范围内截图一张手机环境小米2S联通非定制机MIUIv7开发版Androidv5022G运行内存测试时至少还有40内存可用3GWIFI10M或100M光纤接入未,审核通过,0,2015-12-16 22:07:25
53,数据报告的分享功能无效,1打开APP登录2点屏幕右下角我图标进入我模块3点学习数据报告进入数据报告页面4点右上角分享无响应无动作无刷新提供数据报告页截图一张手机环境小米2S联通非定制机MIUIv7开发版Androidv5022G运行内存测试时至少还有40内存可用3GWIFI10M或100M光纤接入未安装任何第三方安全类APP未启用Root鄙视以设计如此搪塞用户的无耻众测小编,审核通过,6,2015-12-16 22:07:25
54,我的消息,1打开APP登录2点屏幕右下角我图标进入我模块3点我的消息进入我的消息页面4点赞进入赞页面界面长时间显示一个加载动画蓝色小鸟超过1分钟无变化不停歇无提示5退出重新进入多次现象依旧无法加载赞列表也不会显示还没有赞过等提示性文字另外在我页面点我的Tao券也是同样的状态长时间显示加载动画就是停不下来提供赞页面蓝色小鸟一直显示为加载状态的截图一张手机环境小米2S联通非定制机MIUIv7开发版Androidv5,审核通过,15,2015-12-16 22:07:25
55,真题预测第一题显示2015年12月12日点进去却是显示2012年12月12日,首页真题预测选第一个2015年12月12日点进去却是显示2012年12月12日,审核通过,10,2015-12-16 22:15:13
56,进入首页中间无法显示内容只有几个按钮可以显示,进入首页中间无法显示内容只有几个按钮可以显示,审核通过,22,2015-12-16 22:49:45
57,点击真题库进入页面后点击右上角的分享按钮无法调起分享页面,点击真题库进入页面后点击右上角的分享按钮无法调起分享页面,审核通过,19,2015-12-16 22:49:45
58,点击首页的已下载向下滑动加载后应用停止运行,点击首页的已下载向下滑动加载后应用停止运行,审核通过,9,2015-12-16 22:49:45
59,进入个人信息页面更换头像后无法显示头像,进入个人信息页面更换头像后无法显示头像,审核通过,18,2015-12-16 22:49:45
60,进入首页除了下方的三个圆圈上面全部空白是什么鬼,进入首页除了下方的三个圆圈上面全部空白是什么鬼,审核通过,12,2015-12-16 22:57:46
61,点击我查看学习数据报告大面积的空白区域界面不合理,点击我查看学习数据报告大面积的空白区域界面不合理,审核通过,6,2015-12-16 22:57:46
62,输入判断性BUG如图的地方应该只可以输入数字不应该可以输入字符,输入判断性BUG如图的地方应该只可以输入数字不应该可以输入字符,审核通过,21,2015-12-16 23:16:14
63,更换头像时选好照片后无法修改头像,1成功登录APP2点击我点击头像进入个人信息3点击更换头像从相册获取相片4弹出从相册获取页面无法更改头像,审核通过,18,2015-12-17 01:05:03
64,选择考区考场后字数过长文字显示重叠,1成功登录APP2点击我点击头像进入个人信息3点击考区点击完成4文字显示重叠,审核通过,18,2015-12-17 01:05:03
65,QQ未登录时使用QQ登录直接获取账号信息,1进入注册登录2使用QQ登录未登录QQ时直接获取账号信息,审核通过,23,2015-12-17 01:05:03
66,意见反馈输入全空格键提交成功,1成功登录APP2点击我3点击右上角设置意见反馈4输入全空格键邮箱5点击发送提交成功,审核通过,21,2015-12-17 01:05:03
67,学习数据报告里的分享点击无响应,1成功登录APP2点击我学习数据报告3点击分享无响应,审核通过,6,2015-12-17 01:05:03
68,我的消息里进入赞的页面一直显示加载中,1成功登录APP2点击我我的消息3点击赞进入页面一直显示加载中,审核通过,15,2015-12-17 01:05:03
69,进入对话页面空白无内容,1成功登录APP2点击我我的消息3点击对话进入页面4会话页面空白无内容,审核通过,22,2015-12-17 01:05:03
70,点击我关注的提示网络不够稳定,1成功登录APP2点击圈子我关注的3提示网络不够稳定,审核通过,16,2015-12-17 01:05:03
71,分享微信提示分享失败,1成功登录APP2点击圈子机经专区3任意点击一个最新机经预测进入页面4点击分享微信5提示分享失败,审核通过,3,2015-12-17 01:05:03
72,分享朋友圈提示分享失败,1成功登录APP2点击圈子机经专区3任意点击一个最新机经预测进入页面4点击分享朋友圈5提示分享失败,审核通过,3,2015-12-17 01:05:03
73,用户评论输入全空格键发送成功,1成功登录APP2点击圈子机经专区3任意点击一个最新机经预测进入页面4输入全空格键5点击发送提示发送成功,审核通过,13,2015-12-17 01:05:03
74,答题时间录音提示录音失败,1成功登录APP2点击回答任意点击推荐如电影3点击去练习跟读练习4点击录音提示录音失败,审核通过,12,2015-12-17 01:05:03
75,给他点评可以看到点评但提交失败,1成功登录APP2点击回答任意点击推荐如电影3点击给他点评点满星星输入文字4点击发送提交失败,审核通过,13,2015-12-17 01:05:03
76,真题预测第一张图片时间2015年12月12日跟进入页面的时间2012年12月12日不一样,1成功登录APP2点击首页真题预测3点击真题预测首页第一张图进入页面4第一张图片时间2015年12月12日跟进入页面的时间2012年12月12日不一样,审核通过,5,2015-12-17 01:05:03
77,首页上部分显示空白没有内容,1成功登录APP2点击首页页面上部分显示空白没有内容,审核通过,22,2015-12-17 01:05:03
78,目标分数修改时输入0提示分数必须0120范围内提示有误,1成功登录APP2点击我点击头像目标分数3输入0点击保存提示分数必须0120范围内4提示有误,审核通过,0,2015-12-17 01:05:03
79,打开软件点击注册随便输入一个手机号码0开头并且是16位数以上点击获取验证码会提示你该手机已经使用这明显是个错误哪里有16位数的手机号码,打开软件点击注册随便输入一个手机号码0开头并且是16位数以上点击获取验证码会提示你该手机已经使用这明显是个错误哪里有16位数的手机号码,审核通过,20,2015-12-17 01:12:47
80,打开软件点击设置点击关于我们下面显示是2003到2014马上都快2016了明显错误,打开软件点击设置点击关于我们下面显示是2003到2014马上都快2016了明显错误,审核通过,8,2015-12-17 01:12:47
81,打开软件点击设置点击关于我们有个反馈写点反馈语言留下自己的邮箱点击发送一直发送2分钟都没有发送出去已经检查排除网络的问题应该是软件接口的问题,打开软件点击设置点击关于我们有个反馈写点反馈语言留下自己的邮箱点击发送一直发送2分钟都没有发送出去已经检查排除网络的问题应该是软件接口的问题,审核通过,13,2015-12-17 01:12:47
82,打开软件点击真题预测点击一个语句进入最下面显示我要答题点击我要答题开始答题出现一个句子开始答题显示录音中读句子我已经读完了再次点击录音中却显示录音时长需要超过25秒无法结束非要等25秒以后要才可以,打开软件点击真题预测点击一个语句进入最下面显示我要答题点击我要答题开始答题出现一个句子开始答题显示录音中读句子我已经读完了再次点击录音中却显示录音时长需要超过25秒无法结束非要等25秒以后要才可以,审核通过,1,2015-12-17 01:12:47
83,打开软件点击真题库点击进入点击右上角分享点击以后没有任何反应导致无法分享,打开软件点击真题库点击进入点击右上角分享点击以后没有任何反应导致无法分享,审核通过,19,2015-12-17 01:12:47
84,打开软件点击我点击我的TAO券进入一直都在加载中无法显示出来内容2分钟以后都还是这个样子已经排除网络问题WIFI4G都一样,打开软件点击我点击我的TAO券进入一直都在加载中无法显示出来内容2分钟以后都还是这个样子已经排除网络问题WIFI4G都一样,审核通过,8,2015-12-17 01:12:47
85,退出时候会提示程序异常然后就是白屏卡住,退出时候会提示程序异常然后就是白屏卡住,审核通过,21,2015-12-17 09:09:16
86,跟读练习无法成功完成,首页点击真题库点击人际交往点击第四行点击跟读练习点击播放按钮出现提示检查网络点击录音则出现菊花卡住不动,审核通过,17,2015-12-17 09:22:53
87,注册登陆后直接应用出错提示滔滔托福口语已停止,注册登陆后直接应用出错提示滔滔托福口语已停止,审核通过,7,2015-12-17 10:16:12
88,登陆后提示积分20等级lv1积分20的框框无法自动消失要手动后台关闭应用后再重启应该方可消失,登陆后提示积分20等级lv1积分20的框框无法自动消失要手动后台关闭应用后再重启应该方可消失,审核通过,14,2015-12-17 10:16:12
89,点击首页的真题库进入页面后点击右上角的分享按钮点击无反应,点击首页的真题库进入页面后点击右上角的分享按钮点击无反应,审核通过,19,2015-12-17 10:21:37
90,点击首页的已下载进入该页面后下拉列表进行刷新应用直接停止运行了,点击首页的已下载进入该页面后下拉列表进行刷新应用直接停止运行了,审核通过,9,2015-12-17 10:21:37
91,进入首页随机出现没有内容的情况只有3个圆形图标,进入首页随机出现没有内容的情况只有3个圆形图标,审核通过,22,2015-12-17 12:38:50
92,点击真题库点击右上角的分享按钮没有弹出可以分享的应用,点击真题库点击右上角的分享按钮没有弹出可以分享的应用,审核通过,19,2015-12-17 12:38:50
93,注册界面手机号输入框应限制只能输入11位数字,打开app点击体验后进入登陆界面点击注册按钮并选择手机号注册界面手机号输入框应限制只能输入11位数字现在可输入非数字字符,审核通过,21,2015-12-17 13:14:41
94,点开软件注册用手机号注册失败,按任务要求点开软件点击注册选择手机注册输入手机号获取验证码输入验证码输入密码点击注册显示注册失败,审核通过,20,2015-12-17 13:38:34
95,真题库里的分享点击无反应,1点击首页真题库进入页面2点击分享无响应,审核通过,19,2015-12-17 13:51:53
96,修改目标分数输入0时提示分数必须0120范围内提示出错,1点击我点击头像目标分数输入02点击保存提示分数必须0120范围内提示出错,审核通过,0,2015-12-17 13:51:53
97,发贴时添加相片提示失败,1点击圈子机经专区2点击发贴输入标题内容添加相片3点击发布提示失败,审核通过,4,2015-12-17 13:51:53
98,首页里的真题预测的第一张图片日期跟进入页面的日期不一致,1点击首页真题预测2点击真题预测首页第一张图进入页面3第一张图片时间2015年12月12日跟进入页面的时间2012年12月12日不一致,审核通过,5,2015-12-17 13:51:53
99,断网后分享微信提示分享失败提示有误应该提示无网络,1点击课程手机直播2任意点击一个直播课进入页面断开网络3点击分享点击微信提示分享失败应该提示无网络,审核通过,3,2015-12-17 13:51:53
100,断网后分享朋友圈提示分享失败提示有误应该提示无网络,1点击课程手机直播2任意点击一个直播课进入页面断开网络3点击分享点击朋友圈提示分享失败应该提示无网络,审核通过,3,2015-12-17 13:51:53
101,进入赞的页面一直在加载中,1点击我我的消息赞2进入赞页面一直显示加载,审核通过,15,2015-12-17 13:51:53
