id,bug详情,复现步骤,审核状态,重复情况,提交时间
102,会话页面空白无内容应该显示会话页面,1点击我我的消息对话2会话页面空白无内容应该显示会话页面,审核通过,22,2015-12-17 13:51:53
103,圈子里的今日推荐进入发表内容输入全空格键发送点击没反应无提示,1点击圈子2任意点击今日推荐的一个推荐3输入全空格键点击发送没反应无提示,审核通过,13,2015-12-17 13:51:53
104,进入个人信息页面没有头像显示,1点击我头像进入个人页面2进入个人信息页面没有头像显示,审核通过,18,2015-12-17 13:51:53
105,进入找考友页面点击我关注的一直显示加载,1点击圈子找考友2点击我关注的一直显示加载,审核通过,16,2015-12-17 13:51:53
106,关于我们滔滔英语版本年份显示有误,1点击我右上角设置关于我们2版本年份显示有误如20132014现在是2015,审核通过,24,2015-12-17 13:51:53
107,注册手机号输入12位数字点击获取验证码时提示该手机已使用,1进入注册登录页面2点击注册任意输入12位数字输入密码点击获取验证码3提示该手机已使用,审核通过,20,2015-12-17 13:51:53
108,给他点评点击发送提示发送失败,1点击回答任意点击推荐如家乡2点击给他点评输入问字3点击发送提示发送失败,审核通过,13,2015-12-17 13:51:53
109,真题预测中第一题外面标题跟里面不一致外面是2015年里面是2012年,首页真题预测第一题2015年12月12日外面是2015年里面是2012年,审核通过,10,2015-12-17 13:59:05
110,无法进行跟读联系显示检查网络,根据要求选择跟读联系点击播放按钮跳出检查网络在继续点击也无反应测试多个跟读联系题目都是一样手机华为荣耀4C安卓442网络正常,审核通过,17,2015-12-17 15:11:05
111,新浪微博登录失败点击确定加载后没反应,1进入登录页面点击使用新浪微博登录2进入登录页面点击确定加载后没反应,审核通过,23,2015-12-17 15:48:25
112,消息通知页面点击消息无法进入消息详情页面,1进入我的页面点击我的消息2进入我的消息页面点击一个消息进入详情情页面不能进入,审核通过,15,2015-12-17 15:48:25
113,输入错误的手机号注册时提示语错误提示注册失败应提示请输入正确的手机号,1进入登录页面点击注册2输入错误的手机号如11个4点击获取验证码提示手机注册失败,审核通过,20,2015-12-17 15:48:25
114,邮箱注册时选择拍照上传头像系统停止运行,1进入登录页面点击注册2点击邮箱点击头像上传照片系统停止运行,审核通过,9,2015-12-17 15:48:25
115,邮箱注册时随便输入一个邮箱注册成功未对邮箱做验证,1进入登录页面点击注册2在邮箱一栏随便输入一个邮箱格式的邮箱点击注册直接注册成功没有做校验或去邮箱接收验证码,审核通过,20,2015-12-17 15:48:25
116,进入优惠券页面页面一直加载中,1打开软件点击我进入2点击我的Tao券进入页面一直加载中期望结果有优惠券则显示没优惠券则页面显示你还没有优惠券,审核通过,15,2015-12-17 15:48:25
117,雅思口语学习群页面上方显示重复的LOGO,1进入我的页面点击雅思口语学习群进入2查看页面上方的LOGO显示重复的两个图标,审核通过,24,2015-12-17 15:48:25
118,数据报告页面点击分享没反应,1进入我的页面2点击学习数据报告进入3点击右上角的分享按钮点击没反应不能分享,审核通过,6,2015-12-17 15:48:25
119,个人信息页面上传头像失败点击从相册中选择图片上传后返回选择上传选项界面,1进入我的页面点击头像进入个人信息页面2点击头像选择从相册中选择图片上传图片后跳回个人信息页面不显示头像上传失败,审核通过,18,2015-12-17 15:48:25
120,个人信息页面选择当前身份时点击身份按钮文字消失,1进入我的页面点击头像进入个人信息页面2点击当前身份进入选择已工作被选择按钮的文字消失,审核通过,18,2015-12-17 15:48:25
121,目标分数修改时在输入框中输入0分提示分数必须输入0120分以内输入的0分在提示范围内但不可保存,1进入我的页面点击头像进入个人信息页面2点击目标分数进入在输入框中输入0分提示分数必须输入0120分以内输入的数字在提示范围内但不可保存,审核通过,0,2015-12-17 15:48:25
122,我的页面当前积分显示为45进入用户详情页面积分却为0,1进入我的页面查看当前积分为452点击账号进入个人中心查看积分为0分与我的页面显示的积分不符,审核通过,24,2015-12-17 15:48:25
123,网络正常情况下进入跟读页面点击麦克风时页面一直加载中提示检查网络,1网络正常2点击首页点击真题预测3选择一个进入预测页面进入详情页面4点击跟读练习点击录音按钮一直显示加载中提示检查网络,审核通过,17,2015-12-17 15:48:25
124,录音结束后点击结束答题提示录音失败,1网络正常2点击首页点击真题预测3选择一个进入预测页面进入详情页面点击我要答题4录音结束后点击结束答题提示录音失败,审核通过,1,2015-12-17 15:48:25
125,已缓存情况下断网后点击跟读时提示网络异常,1网络正常2点击首页点击真题预测3选择一个进入预测页面进入详情页面点击缓存缓存成功后断开网络4点击跟读练习页面显示网络异常,审核通过,17,2015-12-17 15:48:25
126,写分享时录音后输入标题点击发布提示失败,1打开软件进入圈子2点击机经专区点击发贴录音后输入标题点击发布提示失败,审核通过,4,2015-12-17 15:48:25
127,写分享页面上传图片成功后再次点击拍照返回后查看图片不显示,1打开软件进入圈子2点击机经专区点击发贴点击拍照按钮成功上传图片3再次点击拍照按钮点击手机返回键后图片不显示并且无法删除,审核通过,5,2015-12-17 15:48:25
128,机经专区查看帖子后返回列表阅读数量未增加没及时更新,1打开软件进入圈子2点击机经专区点击最热选择一个帖子进入查看再返回列表查看阅读数量未及时更新,审核通过,24,2015-12-17 15:48:25
129,发表评论时不输入内容直接点击发送提示发送成功,1打开软件进入圈子2点击机经专区点击最热在一个帖子下点击评论直接点击发送按钮,审核通过,13,2015-12-17 15:48:25
130,在评论页面点击用户头像进入个人中心时没上传头像的不显示默认头像,1点击课程2选择一个推荐课程进入点击评论点击一个评论用户头像进入个人详情页面上传头你的显示头像如没上传头像的什么都不显示默认圆圈都没有,审核通过,18,2015-12-17 15:48:25
131,课程报名时点击去支付提示支付失败,1点击课程点击推荐课程进入2点击我要报名进入支付页面点击我要支付提示支付失败后再进入支付宝支付页面返回后再次点击支付直接提示支付失败,审核通过,24,2015-12-17 15:48:25
132,本机没有安装微信选择微信登陆时页面没有任何反应至少可以提示您还没有安装微信请安装后再试,本机没有安装微信选择微信登陆时页面没有任何反应至少可以提示您还没有安装微信请安装后再试,审核通过,14,2015-12-17 16:04:50
133,注册页面问题1手机号注册当文本框为空时注册弹出的必填提示不是藏上到下提示而是从下到上先密码验证码手机号提示不符合常规逻辑2邮箱注册什么都不填写时提示输入不能为空没有定位到具体的某一项3手机号注册手机号输入错误的手机号获取验证码时提示该手机已被注册,注册页面问题1手机号注册当文本框为空时注册弹出的必填提示不是藏上到下提示而是从下到上先密码验证码手机号提示不符合常规逻辑2邮箱注册什么都不填写时提示输入不能为空没有定位到具体的某一项3手机号注册手机号输入错误的手机号获取验证码时提示该手机已被注册,审核通过,20,2015-12-17 16:04:50
134,登录成功后个人信息修改页问题1出国阶段选择时间时由于颜色问题导致所选择的日期不可见国家选项也存在这个问题问题2目标分数当输入02保存成功时并没有将前面的0去掉问题3输入签名如1回车2回车3回车4回车5回车保存失败,登录成功后个人信息修改页问题1出国阶段选择时间时由于颜色问题导致所选择的日期不可见国家选项也存在这个问题问题2目标分数当输入02保存成功时并没有将前面的0去掉问题3输入签名如1回车2回车3回车4回车5回车保存失败可能程序对回车处理有问题,审核通过,0,2015-12-17 16:04:50
135,自我介绍跟读训练点击某个人的跟读给他点评打分全是2星和输入评论文字后发送时提示评论失败但实际返回页面后可以看到刚才的评论,自我介绍跟读训练点击某个人的跟读给他点评打分全是2星和输入评论文字后发送时提示点评失败但实际返回页面后可以看到刚才的评论,审核通过,2,2015-12-17 16:04:50
136,任意雅思内容的答案列表页选择某人的答案后进行播放或点评播放或点评后返回答案列表播放次数和点评数没有更新最严重的的是播放次数通过左上角的返回后再重新进入答案列表点评数可以更新但播放时不增加,任意雅思内容的答案列表页选择某人的答案后进行播放或点评播放或点评后返回答案列表播放次数和点评数没有更新最严重的的是播放次数通过左上角的返回后再重新进入答案列表点评数可以更新但播放时不增加,审核通过,11,2015-12-17 16:04:50
137,圈子名师指路最热页签比如第一条显示有7条评论但是点击评论处的7跳转到的评论页面却没有任何评论内容,圈子名师指路最热页签比如第一条显示有7条评论但是点击评论处的7跳转到的评论页面却没有任何评论内容,审核通过,2,2015-12-17 16:04:50
138,圈子名师指路默认位于最新页签切换到我关注的页签显示显示了2条空内容紧接着是显示了最热页签的内容但是并没有切换页签应该是内容显示错误,圈子名师指路默认位于最新页签切换到我关注的页签显示显示了2条空内容紧接着是显示了最热页签的内容但是并没有切换页签应该是内容显示错误,审核通过,16,2015-12-17 16:04:50
139,如图当我们错误的输入手机号的时候会提示手机号已占用的字样这样是有问题的,如图当我们错误的输入手机号的时候会提示手机号已占用的字样这样是有问题的,审核通过,21,2015-12-17 17:00:56
140,还有一个BUG就是但如果快速点击就会使这样的字样一直出现在屏上即便转到别的窗口下就不会消失个人对APP的建议加入按钮的CD时间防止连点带来的问题至少CD时间要大于提示消息时间这样做才能保持友好的用户体验,还有一个BUG就是但如果快速点击就会使这样的字样一直出现在屏上即便转到别的窗口下就不会消失个人对APP的建议加入按钮的CD时间防止连点带来的问题至少CD时间要大于提示消息时间这样做才能保持友好的用户体验,审核通过,15,2015-12-17 17:00:56
141,首次启动app注册登录后选择当前身份等选项选择后填充色盖住了文字,1首次启动app2注册并登录3选择选择当前身份等任意选项,审核通过,23,2015-12-17 19:54:33
142,真题库中分享按钮失效,1打开应用2使用微信登陆3点击真题库4点击分享按钮问题描述分享按钮无响应未唤起分享功能机型mx4,审核通过,19,2015-12-17 21:35:40
143,在个人信息页中点个人头像选择相册中的图片后会显示错误提示,在个人信息页中点个人头像选择相册中的图片后会显示错误提示,审核通过,18,2015-12-17 23:29:06
144,点击跟读练习无法正常完成录音和打分,根据操作说明点击了跟读练习点击录音按钮后就会显示无网络连接经检查网络并没有问题我的手机是小米4C移动卡用的是WIFI网络,审核通过,17,2015-12-18 12:54:07
145,跟读练习无法播放无法录音然后闪退,手机小米2S网络WIFI系统安卓411重现步骤1打开APP注册后登陆2点击真题库点击科技进步点击飞机的优缺点点击跟读练习点击播放后一直不能播放点击录音也不能录音等两分钟后直接闪退,审核通过,11,2015-12-18 16:27:04
146,登录界面第三方登陆的的陆字错误应该是这个录,登录界面第三方登陆的的陆字错误应该是这个录,审核通过,14,2015-12-18 16:34:46
147,真题预测界面图片失真拉伸现象严重,进入真题预测界面查看图片显示情况发现图片失真拉伸现象严重,审核通过,5,2015-12-18 16:34:46
148,真题预测界面有大片的空白,在真题预测界面滑动滚动条到最底端界面有在片的空白,审核通过,10,2015-12-18 16:34:46
149,首次进入我的界面点击学习数据报告进入相应的界面后界面先显示75后再显示00分,首次进入我的界面点击学习数据报告进入相应的界面后界面先显示75后再显示00分,审核通过,6,2015-12-18 16:34:46
150,我的界面选择当前身份在当前身份界面选择已工作则在已工作标签上覆盖上上紫色背景看不清上面的汉字,我的界面选择当前身份在当前身份界面选择已工作则在已工作标签上覆盖上上紫色背景看不清上面的汉字,审核通过,23,2015-12-18 16:34:46
151,进入圈子界面选择任意话题进入后点击分享分享到微信时提示在后台进行然后提示分享失败,进入圈子界面选择任意话题进入后点击分享分享到微信时提示在后台进行然后提示分享失败,审核通过,3,2015-12-18 16:34:46
152,首页真题预测任意主题任意预测选择别人的跟读后进行给他点评点评失败,首页真题预测任意主题任意预测选择别人的跟读后进行给他点评点评失败,审核通过,10,2015-12-18 17:16:13
153,不允许app使用录音权限时点录音按钮录音后评分提示你还没录音,1安装app时取消使用录音设备的授权2选择一个跟读点录音按钮3点右侧按钮评分4提示你还没有录音,审核通过,12,2015-12-18 18:27:20
154,优惠券查看界面一直显示为加载中,进入个人中心点击我的Tao券进入优惠券查看界面跳转到优惠券界面后一直显示为加载中一直是鸭子跑动状态,审核通过,15,2015-12-18 21:45:23
155,首页页面排版按钮有重叠的地方,进入首页下方真题库按钮重叠了大概14在中间部分的词汇按钮上方对于操作非常不方便,审核通过,19,2015-12-18 21:45:23
156,手机无法收到验证码测试两个联通号码均收不到验证码,点击注册选择手机号码我测试两个联通号码13192857736和18675100728获取验证码后显示已经发送但是两个手机号码均未收到有短信,审核通过,20,2015-12-18 22:29:03
157,在登录页点击登录会跳转并缦执砦筇崾,在登录页点击登录会跳转并缦执砦筇崾,审核通过,23,2015-12-18 23:04:12
158,软件运行时会出现死机现象,用手机号码注册后登陆不了出现了死机现象,审核通过,9,2015-12-19 11:46:17
159,答题时结束答题点击不了,答题时间25s后点击结束答题没有反应结束不了,审核通过,1,2015-12-19 11:46:17
160,注册流程走到身份的时候app异常退出,打开app点击注册输入手机号验证码和密码点击注册此时转到你是什么身份的页面还未来得及选择就异常退出提示很抱歉滔滔雅思口语已停止运行请参考截图,审核通过,7,2015-12-19 12:05:14
161,跟读练习中无法正确播放,进入首页点击真题预测选择2015年选择漂亮的人在后续页面中点击跟读练习点击beautifulperson中的播放按钮无论点击哪一个播放按钮都会等待数十秒后提示检查网络而无法播放但当前是使用的电信网络wifi是能够正常上网的,审核通过,11,2015-12-19 12:05:14
162,登录界面里的使用其他方式登陆登陆应为登录,登录界面里的使用其他方式登陆登陆应为登录,审核通过,14,2015-12-19 23:58:24
163,在真题库界面点击右上角的分享没有反应,打开app点击真题库点击右上角的分享没有反应,审核通过,19,2015-12-19 23:58:24
164,在机经专区界面点击我关注的显示网络异常点击重试后列出内容每次点击我关注的都能重现这个问题所以不觉得是真的网络异常,打开app点击圈子点击机经专区点击我关注的显示网络异常点击重试后列出内容每次点击我关注的都能重现这个问题所以不觉得是真的网络异常,审核通过,16,2015-12-19 23:58:24
165,无法跟读网络异常一直报检查网络,无法跟读网络异常一直报检查网络手机型号华为G750T01,审核通过,17,2015-12-20 13:13:00
166,首页页面部分显示空白,打开软件查看首页页面页面顶部显示空白退出重新进入仍然没有显示测试手机SONYXM50h,审核通过,24,2015-12-21 13:14:38
167,个人信息页面更换头像从相册获取失败,1点击页面底部的我2点击头像进入个人信息页面3点击更换头像4点击从相册获取5选择照片并确定测试手机SONYXM50h,审核通过,18,2015-12-21 13:14:38
168,真题库页面分享按钮失效,1点击页面底部真题库2点击右上角分享按钮测试手机SONYXM50h,审核通过,19,2015-12-21 13:14:38
169,在跟读练习页面点击播放无反应,在跟读练习页面点击播放按钮很长时间无反应接着弹出检测网络,审核通过,11,2015-12-21 13:20:26
170,其他方式登陆登陆之后退出会提示登陆失败CODE700,其他方式登陆登陆之后退出会提示登陆失败CODE700,审核通过,14,2015-12-21 16:16:21
171,点击我然后点击学习数据报告看到已练习平均分等数据但是我这个是刚刚注册的账号还没开始练习不应该有数据才对,点击我然后点击学习数据报告看到已练习平均分等数据但是我这个是刚刚注册的账号还没开始练习不应该有数据才对,审核通过,6,2015-12-21 16:16:21
172,首页真题预测真题库显示空白但是点击空白处又能跳转到练习界面,首页真题预测真题库显示空白但是点击空白处又能跳转到练习界面,审核通过,10,2015-12-21 16:16:21
173,圈子选择任意一个版块我关注的页签和最新页签的帖子一样并没有筛选出关注的帖子,圈子选择任意一个版块我关注的页签和最新页签的帖子一样并没有筛选出关注的帖子,审核通过,16,2015-12-21 16:16:21
174,登录进入首页后界面大部分为空白,1登录APP2进入首页3查看界面,审核通过,23,2015-12-21 16:52:35
175,进入主页上面大部分白屏无任何内容,进入主页直接白屏网络网络环境良好设备华为荣耀3,审核通过,8,2015-12-21 20:41:39
176,真题库分享按钮点击无反应,从主页进入真题库然后点击分享无反应网络良好设备华为荣耀3,审核通过,19,2015-12-21 20:41:39
177,进入首页后首页界面空空的明显缺少图片内容,1进入首页br结果首页界面空空的如图所示br预期首页界面美观内容充实,审核通过,5,2015-12-21 22:33:01
178,首页空白无内容显得太空洞,首页只有菜单项其余都是空白无内容看上去显得太空洞,审核通过,22,2015-12-22 08:54:19
179,主界面中我的学习数据报告界面分享按钮不可以点击,1启动客户端在主界面选择我选择学习数据报告右上角的分享按钮不可以点击测试机型号GTN7108DAndroid系统422,审核通过,6,2015-12-22 11:33:12
180,手机注册时失败提示滔滔雅思口语已停止,三星i959铁通光钎10M手机注册该软件时收到验证后输入密码确认后提示滔滔雅思口语已停止退出再重新注册后仍显示手机注册失败希望我的测试能给你们提供帮助,审核通过,7,2015-12-22 13:13:54
