id,bug详情,复现步骤,审核状态,重复情况,提交时间
129,安上述步骤操作到第五i出现闪退现象,1打开APP2点击录像按钮默认在存储卡test2bibo目录下生成h264码流文件3实体键选项或者双击屏幕弹出菜单键4点击设置依次勾选封装媒体编码音频5点击录像出现闪退现象很抱歉孬播已停止运行我的手机是华为畅玩,审核通过,13,2015-12-16 09:06:07
130,无法播放点击录好的内容播放程序直接无响应,无法播放点击录好的内容播放程序直接无响应而关闭,审核通过,14,2015-12-16 09:07:27
131,点击设置依次勾选封装媒体编码音频步骤不能完成,点击设置依次勾选封装媒体编码音频在点击录像会自动跳出软件显示停止运行,审核通过,17,2015-12-16 12:26:26
132,在软解的界面下播放录制的视频程序直接闪退,在软解界面播放视频程序直接闪退首届界面会先黑屏一下然后直接自动退出并谈出对话框很抱歉孬播停止运行,审核通过,14,2015-12-16 12:56:11
133,勾选封装媒体编码音频之后点击录像孬播自动停止,勾选封装媒体编码音频之后点击录像孬播自动停止,审核通过,17,2015-12-16 14:14:51
134,在可以录制的分辨率下录制的视频无法播放,打开APP选择分辨率刻录点击浏览出现抱歉已停止运行提示,审核通过,5,2015-12-16 14:22:50
135,在主界面双击屏幕设置选项里选中使用X264编码封装媒体编码音频退出后再点击录制应用停止运行,打开APP双击屏幕设置勾选使用X264编码封装媒体编码音频退出点击录像应用弹出停止运行提示,审核通过,17,2015-12-16 14:22:50
136,主界面双击屏幕设置选项里选使用X264编码然后选择打包输出格式中MP4flvmpegts任何一种退出再进行录像都会弹出停止运行提示,打开APP双击屏幕设置勾选使用X264编码退出双击屏幕设置打包输出格式选择任何一种格式退出录像弹出停止运行提示,审核通过,20,2015-12-16 14:22:51
137,在浏览功能下不能选中查看截图的文件,打开APP浏览录像文件为软解或者硬解点击截图无响应,审核通过,16,2015-12-16 14:22:51
138,在APP界面可以录像的分辨率如640480切换到别的分辨率后点击录像有时会弹出停止运行提示,打开APP点击分辨率选择640480录像正常点击分辨率选中960720等可录制的分辨率有时候弹出停止运行提示,审核通过,5,2015-12-16 14:22:52
139,测试工程中程序崩溃停止运行,测试到第四部时结束录像再点击录像程序停止运行再打开软件点击录像还是停止运行点击已经录制的视频播放时停止运行,审核通过,14,2015-12-16 14:31:39
140,勾选封装媒体编码音频后再点录像软件闪退,手机华为荣耀6安卓版本442按测试步骤4勾选封装媒体编码音频后再按测试步骤5点录像按钮软件闪退报错重复进入点击仍闪退,审核通过,8,2015-12-17 09:12:15
141,点击浏览进入播放页面点击底部的已录制的文件应用崩溃,1点击进入应用2点击录制停止3点击浏览4点击底部的文件名结果应用停止运行,审核通过,0,2015-12-17 12:44:01
142,Android系统手机程序运行一次录像后退出出现软件崩溃现象打开软件点击任何按钮都提示软件已停止,Android系统手机程序运行一次录像后退出出现软件崩溃现象打开软件点击任何按钮都提示软件已停止,审核通过,6,2015-12-17 13:39:06
143,设置功能点击封装媒体设置功能消失需要再次双击界面才能出现设置功能选择其他内容,设置功能点击封装媒体设置功能消失需要再次双击界面才能出现设置功能选择其他内容,审核通过,20,2015-12-17 13:39:06
144,录像中时退出软件后再次进入本软件点击停止按钮没有任何反应,录像中时退出软件后再次进入本软件点击停止按钮没有任何反应,审核通过,18,2015-12-17 13:39:06
145,在设置的时候软件崩溃,1打开APP2点击设置依次勾选封装媒体编码音频3点击录像结果程序崩溃,审核通过,17,2015-12-17 13:51:43
146,打开软件提示软件已停止运行,1下载2安装3打开软件4不做任何操作约5s后软件停止工作,审核通过,2,2015-12-17 14:03:47
147,安装后打开APP直接崩溃应该是兼容性不太好,安装后打开APP直接崩溃应该是兼容性不太好,审核通过,11,2015-12-17 14:13:34
