id,bug详情,复现步骤,审核状态,重复情况,提交时间
105,进入医生认证页面选择职称后点击保存应用停止运行,进入医生认证页面选择职称后点击保存应用停止运行,审核通过,9,2015-12-06 16:55:54
106,点击个人中心设置服务条款页面无法显示提示404错误,点击个人中心设置服务条款页面无法显示提示404错误,审核通过,0,2015-12-06 16:55:54
107,点击个人中心积分商城应用停止运行,1点击个人中心2点击积分商城结果应用停止运行,审核通过,9,2015-12-06 16:55:54
108,进入发布病例页面选择相片输入相关信息后点击发布按钮随机出现停止运行,进入发布病例页面选择相片输入相关信息后点击发布按钮随机出现停止运行,审核通过,6,2015-12-06 16:55:54
109,进入病例广场搜索页面输入关键字后只能自动检索没有结果时都没有提示一开始都不知道怎么搜索,进入病例广场搜索页面输入关键字后只能自动检索没有结果时都没有提示一开始都不知道怎么搜索,审核通过,6,2015-12-06 16:55:54
110,积分商城首页的图片比例不对,打开软件点击右下角的小人图标选择积分商城首页上的图片比例明显失调,审核通过,9,2015-12-06 23:36:07
