id,bug详情,复现步骤,审核状态,重复情况,提交时间
1,注册时软件没发送验证码给手机导致无法进入首页,进入APP后填上手机号注册时软件没有发验证码给手机导致无法进入首页,审核通过,1,2015-12-03 20:55:41
2,短信验证码无法接收到什么情况啊不注册无法浏览,短信验证码无法接收到什么情况啊不注册无法浏览,审核通过,12,2015-12-03 21:00:05
3,注册时输入手机号收不到验证码换,注册时输入手机号收不到验证码换个号还是收不到网络正常手机型号青橙N1Y,审核通过,12,2015-12-03 21:02:05
4,注册时不发送验证码无法完成注册,注册时不发送验证码无法正常登入软件无法正常测试,审核通过,1,2015-12-03 21:05:04
5,注册的时候无法获取验证码,注册的时候无法获取验证码倒计时结束后点击重新获取还是收不到验证码,审核通过,10,2015-12-03 21:10:03
6,注册帐号时系统没有下发验证码,小米2S电信版电信号码wifi网络下注册账号时没有接收到验证码不是手机问题刚测试别的软件可以正常接收,审核通过,12,2015-12-03 21:14:54
7,无法注册哦,注册时获取验证码几次了都没收到,审核通过,7,2015-12-03 21:20:48
8,注册时不能接受验证码,注册时点击获取验证码后不能接受验证码试了好几次然后点击忘记密码里面点击发送验证码仍然收不到手机为华为荣耀6安卓442系统wifi稳定网络可以正常接收短信因为刚刚做了别的app测试手机注册都成功了,审核通过,12,2015-12-03 21:23:42
9,注册过程无法获取手机验证码,打开软件点击注册填写手机号无法获取验证码换了3个手机号两个不同的运营商均无法获取验证码,审核通过,10,2015-12-03 21:33:26
10,注册时输入手机号点获取验证码一分钟后未获取到验证码点重新获取验证码依然没有获取到重复三次均未能获取验证码手机能正常接收短信注册其他软件时也可正常接收验证码手机号确认没有输入错误,注册时输入手机号点获取验证码一分钟后未获取到验证码点重新获取验证码依然没有获取到重复三次均未能获取验证码手机能正常接收短信注册其他软件时也可正常接收验证码手机号确认没有输入错误手机型号红米2操作系统安卓444,审核通过,10,2015-12-03 21:33:59
11,注册界面输入手机号后无法获得验证码,荣耀4x电信版注册页面输入手机号点击获取验证码但未收到验证码短信重复点击获取验证码仍然无验证码短信,审核通过,10,2015-12-03 21:34:19
12,完全无法获取注册验证码,完全无法获取注册验证码尝试多次都无法获取红米NOTE联通3G版MIUI7WIFI,审核通过,10,2015-12-03 21:40:34
13,手机注册收不到验证码,手机测试注册收不到验证码移动信号满格测试手机红米反复重新发送验证码不下十次依然收不到,审核通过,12,2015-12-03 21:42:10
14,下载安装成功后点击注册填写手机无法获取验证码验证失败,下载安装成功后点击注册填写手机无法获取验证码验证失败,审核通过,10,2015-12-03 21:45:39
15,注册的时候输入手机号无法获取验证码,注册无法获取验证码一共获取了45次都不来验证码,审核通过,10,2015-12-03 21:45:49
16,安装茄子医生后打开无法注册,安装茄子医生后打开无法注册崩溃老是自动停止安卓版本502乐视手机1,审核通过,2,2015-12-03 21:47:47
17,进入注册页面点击获取验证码无法收到短信,进入注册页面点击获取验证码无法收到短信,审核通过,7,2015-12-03 21:49:20
18,进入注册页面点击获取验证码应用出现异常无法进行测试,vivox5m502进入注册页面点击获取验证码应用出现异常无法进行测试,审核通过,13,2015-12-03 21:49:21
19,注册时无法打开服务条款显示服务器错误,注册时点击注册服务条款协议时显示服务器错误404找不到文件或目录你要查找的资源可能已被删除已更改名称或者暂时不可用,审核通过,0,2015-12-03 21:51:25
20,点击立即注册后输入手机号点击立即获取程序就立即停止重复三次都是这样手机是酷派大神f2,点击立即注册后输入手机号点击立即获取程序就立即停止,审核通过,10,2015-12-03 21:52:03
21,无法接收到手机验证码无法完成注册,机型联想a789系统安卓404无法接收到手机验证码无法完成注册一直在出现接收验证码引导画面分别在移动和WIfi下测试,审核通过,12,2015-12-03 21:52:51
22,app无法注册获取验证码是闪退,app无法注册获取验证码是闪退在进入App后点击立即注册后输入手机号后点击获取验证码无法获取验证码软件闪退手机红米note3,审核通过,7,2015-12-03 21:58:14
23,注册时直接出现闪退现象,手机小米2S操作系统安卓411网络环境WIFI步骤重现1APP安装成功2打开APP点击马上注册输入手机号后点获取验证码后直接出现闪退现象,审核通过,11,2015-12-03 21:59:32
24,注册时有闪退现象无法登录,打开APP后用手机注册输信电话号码后发现闪退现象无法注册,审核通过,11,2015-12-03 22:02:35
25,注册时输入手机号后点击获取验证码程序崩溃退出,打开app点击注册输入手机号点击获取验证码程序立即退出,审核通过,4,2015-12-03 22:04:57
26,在注册时手机获取验证码出现程序停止运行,在注册时手机获取验证码出现程序停止运行重启程序注册还是会出现bug日志以截图上传,审核通过,13,2015-12-03 22:08:34
27,软件在注册过程中自动关闭和停止该APP目前无法使用测试功能,软件在注册过程中自动关闭和停止该APP目前无法使用测试功能,审核通过,11,2015-12-03 22:13:40
28,注册时候点获取验证码就闪退并且并不发送验证码,注册时候点获取验证码就闪退并且并不发送验证码注册时候点获取验证码就闪退并且并不发送验证码,审核通过,8,2015-12-03 22:19:40
29,点击获取码就自动退出,打开注册输入手机号点击获取验证码软件就自动退出,审核通过,4,2015-12-03 22:25:20
30,无法注册一点击获取验证码程序就自动关闭,无法注册输入正确的手机号一点击获取验证码程序就自动关闭无法完成注册,审核通过,4,2015-12-03 22:25:26
31,点击获取码就自动退出,打开注册输入手机号点击获取验证码软件就自动退出,审核通过,4,2015-12-03 22:25:42
32,无法注册手机注册获取验证码加载过程中闪退,无法注册手机注册获取验证码加载过程中闪退尝试多次均相同测试手机华为荣耀7,审核通过,7,2015-12-03 22:31:08
33,在注册过程中软件出现多次闪退现象,机型已经刷机的小米2S安卓版本511在刚安装完成后进入注册界面在输入手机接收验证码过程中没出现多次闪退,审核通过,11,2015-12-03 22:43:04
34,注册时点获取验证码后退出,注册时点获取验证码后退出程序崩溃不能注册,审核通过,4,2015-12-03 22:46:37
35,不能注册注册时点获取验证码后程序崩溃,注册时点获取验证码后退出程序崩溃不能注册,审核通过,4,2015-12-03 22:49:07
36,软件无法完成注册注册时点获取验证码后程序停止运行,手机型号小米4移动版MIUI751126开发版android版本444ktu84p安装软件进入后点击马上注册输入手机号点击获取验证码程序停止运行显示很抱歉茄子医生已停止运行,审核通过,2,2015-12-03 22:50:45
37,点击获取验证码软件异常退出,本人手机魅蓝note1电信版安卓版本444网络环境50M电信光纤网络畅通打开软件点击马上注册输入手机号输入密码请注意一定是先输入密码然后点击获取验证码等几秒种后软件退出显示很抱歉茄子医生已停止运行如果点击马上注册输入手机号不输入密码直接点击获取验证码就不会退出但是60秒内无法获取验证码无法注册,审核通过,4,2015-12-03 22:58:36
38,点击获取验证码软件异常退出,本人手机魅蓝note1电信版安卓版本444网络环境50M电信光纤网络畅通打开软件点击马上注册输入手机号输入密码请注意一定是先输入密码然后点击获取验证码等几秒种后软件退出显示很抱歉茄子医生已停止运行如果点击马上注册输入手机号不输入密码直接点击获取验证码就不会退出但是60秒内无法获取验证码无法注册,审核通过,4,2015-12-03 22:58:47
39,注册点击发送验证码时闪退出APP程序,注册点击发送验证码时闪退出APP程序红米手机WIFI网络,审核通过,8,2015-12-03 23:04:30
40,无法注册点击获取验证码就闪退,无法注册打开软件后点击马上注册输入手机号码后点击获取验证码就闪退,审核通过,7,2015-12-03 23:08:38
41,打开app导航页面有4个向右滑动滑到最后一个后页面竟然没有进入app或立即体验之类的按钮只有右上方有个不明显的跳过这种用户体验也太差了一不小心还进不去app了,打开app导航页面有4个向右滑动滑到最后一个后页面竟然没有进入app或立即体验之类的按钮只有右上方有个不明显的跳过这种用户体验也太差了一不小心还进不去app了,审核通过,14,2015-12-03 23:47:23
42,注册页面logo和手机号输入框中间的空白太多了导致输入手机号时候上方logo显示不全一个注册页面还要上下滑动才能显示全测试时候用的平板,注册页面logo和手机号输入框中间的空白太多了导致输入手机号时候上方logo显示不全一个注册页面还要上下滑动才能显示全测试时候用的平板,审核通过,8,2015-12-03 23:47:23
43,手机注册过程中发现软件直接闪退,机型小米手机在安装完成后准备注册登录软件的时候发现软件直接闪退而岛主无法登陆注册从而无法接下来的体验,审核通过,11,2015-12-04 00:01:43
44,无法注册获取验证码时闪退提示茄子医生已停止,无法注册获取验证码时闪退系统提示茄子医生已停止,审核通过,2,2015-12-04 00:12:03
45,小米2sAndroid502注册时输入了手机号然后按获取验证码就闪退,小米2sAndroid502注册时输入了手机号然后按获取验证码就闪退,审核通过,7,2015-12-04 00:15:05
46,茄子医生App不能登录,1出现登陆界面输入手机号输入密码点击登录2出现提示很抱歉茄子医生已经停止,审核通过,2,2015-12-04 00:17:12
47,茄子医生App不能注册,1出现登陆界面选择马上注册输入手机号点击发送验证码2出现提示很抱歉茄子医生已经停止,审核通过,2,2015-12-04 00:17:12
48,茄子医生App不能找回密码,1出现登陆界面选择马上注册输入手机号点击获取验证码2出现提示很抱歉茄子医生已经停止,审核通过,2,2015-12-04 00:17:12
49,注册时出现异常停止现象,安装后打开软件进入注册界面输入手机号点击获取验证码然后出现异常停止运行且手机收不到验证码红米note手机测试,审核通过,13,2015-12-04 00:26:44
50,注册手机号码时系统崩溃,注册手机号码操作点击获取验证码按钮系统崩溃提示茄子医生停止工作手机型号VIVOX5V,审核通过,2,2015-12-04 06:08:35
51,APP不能注册一点就退了,点击注册输入手机号点击发送验证码秒退了,审核通过,8,2015-12-04 07:05:36
52,安装后无法注册闪退,按照要求下载安装后点击马上注册输入手机号码后点击获取验证码然后就退出了无法注册试了好几遍后如此手机是魅蓝n2,审核通过,4,2015-12-04 07:35:42
53,在注册页面敲入手机号码点获取验证码时闪退,1下载软件2安装软件3跳过广告页面4在登陆页面选马上注册5在注册页面敲入手机号码点获取验证码软件闪退反复数次都是这样的结果手机信息红米2MIUI7,审核通过,7,2015-12-04 07:38:03
54,进入注册页面APP停止运行直接闪退,下载安装APP进入注册页面输入手机号码获取验证码APP停止运行直接闪退,审核通过,13,2015-12-04 08:15:50
55,下载完毕安装好了以后就不能注册了要注册就停止运行了,下载完毕安装好了以后就不能注册了要注册就停止运行了,审核通过,13,2015-12-04 08:20:59
56,页面跳转时显示为很抱歉茄子医生已停止运行,下载APP后进行注册输入手机号获取验证码页面跳转为很抱歉茄子医生已停止运行,审核通过,2,2015-12-04 08:27:23
57,打开软件后进入注册界面输入手机号码点获取验证码的时候一直无法收到验证码信息故注册失败,打开软件后进入注册界面输入手机号码点获取验证码的时候一直无法收到验证码信息故注册失败,审核通过,10,2015-12-04 08:41:54
58,注册账号时当获取验证码时直接退出,注册账号时当获取验证码时直接退出根本无法完成注册,审核通过,4,2015-12-04 08:46:53
59,服务条款页面报404错误,1进入注册页面点击服务条款2进入服务条款页面预期结果服务条款页面显示正常实际结果服务条款页面报404错误,审核通过,0,2015-12-04 08:56:25
60,注册获取验证码导致APP崩溃,注册输入手机号点击获取验证码APP崩溃,审核通过,7,2015-12-04 09:03:23
61,病历详情无法评论并跳错,进入病历广场点击病历详情在病历详情进行评论跳出API内部错误无法评论,审核通过,5,2015-12-04 09:38:11
62,注册成功后登陆APP点击下方第三个栏目打开病历广场点击右下角新建病历图标编辑好病历后点击发布会提示API内部错误但是在病历广场上可以看到这个是发布成功的,注册成功后登陆APP点击下方第三个栏目打开病历广场点击右下角新建病历图标编辑好病历后点击发布会提示API内部错误但是在病历广场上可以看到这个是发布成功的,审核通过,5,2015-12-04 09:47:38
63,发布病历出现错误无法发布,病历广场点击右下方的新建发布进入发布病历页面输入内容后点击发布提示内部API错误返回退出app再次进入病历广场病历已经发布了,审核通过,5,2015-12-04 10:16:49
64,1在提交病例页面填写完成后提交的时候不能完成会显示API内部错误我2但在我的页面能看到病例已经提交,手机魅族mx3版本flyme475a1在提交病例页面填写完成后提交的时候不能完成会显示API内部错误我2但在我的页面能看到病例已经提交,审核通过,6,2015-12-04 10:16:51
65,个人资料设置页成功更换完头像后会导致保存按钮失效,1打开APP在屏幕下方点最后一个人型图标进入个人资料界面2点击右上角齿轮图标进入设置界面3点击个人资料进入个人资料修改页面4点击头像弹出拍照从手机相册中选择菜单任意选择一项并完成头像更换动作5在头像更换成功后会回到个人资料修改页面并提示修改头像成功如截图6此时修改姓名年龄等项内容后点界面右上角保存无响应已确认在不修改头像时此保存功能有效手机环境小米2S联通非定制机MIUIv7开发版And,审核通过,3,2015-12-04 11:02:23
66,服务条款界面显示HTTP404错误,1打开APP在屏幕下方点最后一个人型图标进入个人资料界面2点击右上角齿轮图标进入设置界面3点服务条款打开服务条款页面见到图截图所示的404错误页,审核通过,0,2015-12-04 11:02:23
67,在个人资料页点击头像下方的病历链接APP崩溃,1打开APP在屏幕下方点最后一个人型图标进入个人资料界面2点击头像下方的病历链接APP崩溃重试可复现测试时显示病历数为0必要条件为当时未显示出昵称性别和年龄等信息如截图所示提供最终操作界面截图崩溃后系统提示截图和系统提供的错误报告截图各一张手机环境小米2S联通非定制机MIUIv7开发版Androidv5022G运行内存测试时至少还有40内存可用3GWIFI10M或100M光纤接入未安装任何第三方安全类APP未启用Root,审核通过,3,2015-12-04 11:02:23
68,个人资料页头像下方的收藏链接不响应点击,1打开APP在屏幕下方点最后一个人型图标进入个人资料界面2点击头像下方的收藏链接APP没有响应点击事件界面无提示无刷新无变化附最终操作界面截图一张与前诉BUG同一张图手机环境小米2S联通非定制机MIUIv7开发版Androidv5022G运行内存测试时至少还有40内存可用3GWIFI10M或100M光纤接入未安装任何第三方安全类APP未启用Root,审核通过,3,2015-12-04 11:02:23
69,个人资料页的积分商城导致APP崩溃,1打开APP在屏幕下方点最后一个人型图标进入个人资料界面2点击积分商城链接APP崩溃重试可复现提供最终操作界面截图与前诉BUG同一张图崩溃后系统提示截图和系统提供的错误报告截图各一张手机环境小米2S联通非定制机MIUIv7开发版Androidv5022G运行内存测试时至少还有40内存可用3GWIFI10M或100M光纤接入未安装任何第三方安全类APP未启用Root,审核通过,3,2015-12-04 11:02:23
70,今日任务中通过邀请手机好友功能产生的短信内容为1111,1打开APP在屏幕下方点最后一个人型图标进入个人资料界面2点今日任务链接打开我的任务页面3滚动屏幕致最底端点邀请好友转到邀请好友界面4确保上方文本框是默认的网址这很重要点邀请手机好友按钮转到手机短信界面5在短信内容文本框中被默认设置的内容是1111跟本不是上一界面文本框中的网址提供最终操作界面截图邀请好友界面和手机短信界面截图一张手机环境小米2S联通非定制机MIUIv7开发版Androidv5022G运行,审核通过,3,2015-12-04 11:02:23
71,点程序右下角我进入我的页面点头像下面的病历项会闪退并提示错误,点程序右下角我进入我的页面点头像下面的病历项会闪退并提示错误,审核通过,5,2015-12-04 11:30:43
72,点程序右下角我进入我的页面点头像下面的病历项会闪退并提示错误,点程序右下角我进入我的页面点头像下面的病历项会闪退并提示错误,审核通过,5,2015-12-04 11:30:43
73,进入首页后页面下方四个选项卡下面的文字无法显示,进入首页后页面下方四个选项卡下面的文字无法显示手机型号为酷派9960主屏47寸分辨率1280x720手机系统安卓411当前设置字号为最大,审核通过,14,2015-12-04 11:54:16
74,打开测试APP点击注册使用手机号码注册然后进行下一步输入登录名字提示2到20位但是我只是输入了8位也不能通过,打开测试APP点击注册使用手机号码注册然后进行下一步输入登录名字提示2到20位但是我只是输入了8位也不能通过,审核通过,11,2015-12-04 12:26:04
75,当我们错误的输入手机号的时候会出一手机号有误的字样这样并没有问题但如果快速点击验证码就会使这样的字样一直出现在屏上如果你点了100次那么这个验证码提示手机号有误就会出来100次无论转到哪个窗口下就不会消失APP建议加入按钮的CD时间防止连点带来的问题至少CD时间要大于提示消息时间这样做才能保持友好的用户体验,当我们错误的输入手机号的时候会出一手机号有误的字样这样并没有问题但如果快速点击验证码就会使这样的字样一直出现在屏上如果你点了100次那么这个验证码提示手机号有误就会出来100次无论转到哪个窗口下就不会消失APP建议加入按钮的CD时间防止连点带来的问题至少CD时间要大于提示消息时间这样做才能保持友好的用户体验,审核通过,14,2015-12-04 14:21:07
76,无法获取手机验证码继而无法注册,无法获取手机验证码继而无法注册机型HTCONEM7801安卓502,审核通过,10,2015-12-04 17:21:41
77,测试该软件时中间卡顿然后闪退停止运行,三星I959铁通光钎10M打开该软件测试时添加患者时出现卡顿然后停止运行经反复测试多次出现该问题希望我的测试能对您有所帮助,审核通过,13,2015-12-04 20:59:19
78,手机注册收不到验证码,安装打开APP软件输入手机号获取密码重复两次都没有收到验证密码SP短信端口有问题,审核通过,10,2015-12-04 23:38:47
79,注册帐号时输入规定字数内的昵称却提示字数范围错误,1打开软件2打开注册页面输入10位数昵称点击注册,审核通过,1,2015-12-05 08:29:56
80,无法注册验证码收不到服务条款页面错误404,无法注册验证码收不到服务条款页面错误404小米红米1WiFi网络,审核通过,0,2015-12-05 12:40:55
81,注册不了账号手机接收不到验证码,打开软件单击注册输入手机号后试过多次获取不到验证码无法登陆,审核通过,12,2015-12-05 14:10:57
82,出现闪退出现闪退,点积分商城会闪退点积分商城会闪退,审核通过,13,2015-12-05 15:06:30
83,注册服务条款界面显示错误,点击注册下方有个服务条款按钮点击进入后显示404页面错误,审核通过,0,2015-12-05 16:26:13
84,注册页面最下方服务条款404错误,注册页面最下方服务条款404错误找不到文件或目录具体看截图,审核通过,0,2015-12-05 16:36:35
85,小米2点击进入注册账号页面整体按钮显示有误有棱有角,小米2点击进入注册账号页面整体按钮显示有误有棱有角,审核通过,14,2015-12-05 17:25:05
86,注册功能输入手机号后无法获得验证码,注册功能输入手机号后无法获得验证码重新发送后依然无法收到测试手机小米4安卓444,审核通过,10,2015-12-05 17:50:30
87,点击我的积分商城程序停止运行,小米44441点击底部我的底部第四个图标2点击积分商城结果应用停止,审核通过,9,2015-12-05 21:43:16
88,进入病例广场发布病例从相册中选择图片后点击确定应用停止运行,小米4444进入病例广场发布病例从相册中选择图片后点击确定应用停止运行,审核通过,6,2015-12-05 21:43:16
89,进入病例广场发布病例点击病例列表时出现一次停止运行,进入病例广场发布病例点击病例列表时出现一次停止运行,审核通过,6,2015-12-05 21:43:16
90,进入个人资料页面点击未认证按钮从相册中选择图片后整个页面变黑无法进入下一步,小米44441点击底部我的底部第四个图标2右上角的设置图标3点击个人资料未认证4点击相机图标从相册中选择点击一张照片结果整个页面变黑点击也无效了,审核通过,9,2015-12-05 21:43:16
91,点击个人资料进入医生认证页面输入信息后点击保存应用停止运行,小米4444点击个人资料进入医生认证页面输入信息后点击保存应用停止运行,审核通过,9,2015-12-05 21:43:16
92,进入设置页面点击服务条款提示服务器错误,进入设置页面点击服务条款提示服务器错误,审核通过,0,2015-12-05 21:43:16
93,注册时不输入手机号点击获取验证码提示语错误,1进入登录页面2点击注册不输入手机号码直接点击获取验证码,审核通过,7,2015-12-06 00:11:48
94,注册页面点击服务条款显示404找不到文件或目录,1打开应用2进入登录页面3点击注册点击服务条款进入页面查看,审核通过,0,2015-12-06 00:11:48
95,人相册中上传背景图片失败不显示图片,1进入个人中心页面2点击背景图片上的蓝色按钮3点击从相册中选择图片上传,审核通过,14,2015-12-06 00:11:48
96,背景图片上的蓝色按钮不显示文字提示信息,1成功打开APP登录成功2进入个人中心页面查看背景图片上的蓝色按钮,审核通过,14,2015-12-06 00:11:48
97,医生认证页面上传照片与输入内容后点击右上角的保存无响应但提示会在24小时内处理认证申请,1登录成功进入我的页面2点击小字体认证后才能兑换商品马上去认证吧进入3上传认证照片与输入其他内容点击右上角的保存按钮,审核通过,9,2015-12-06 00:11:48
98,头像上传成功后进入设置页面查看服务条款后返回个人中心时头像不显示,1进入个人中心点击右上角的设置2点击服务条款查看返回到个人中心页面查看头像,审核通过,0,2015-12-06 00:11:48
99,病历广场页面进入帖子评论后显示重复的两条评论,1登录成功2点击病历广场进入3选择一个帖子进入评论查看评论,审核通过,5,2015-12-06 00:11:48
100,病历广场页面多次点击心形图标提示该收藏不存在,1登录成功2点击病历广场进入3在一篇帖子下多次点击心形图标,审核通过,5,2015-12-06 00:11:48
101,病历广场页面点击用户头像不能进入查看个人资料页面,1打开APP登录成功2点击病历广场点击发表帖子的用户头像,审核通过,5,2015-12-06 00:11:48
102,主页的日历可能会使下方的默认图片显示不全,进入app在主页中点击日历上方的年月比如2015年12月此时会下拉出详细的当月天数对有些月份来说会让下方的默认图片即无内容显示的情况时只显示部分而且特别小也看不出是什么文字,审核通过,14,2015-12-06 09:56:18
103,整个App的真正目的不清晰博知道是用来干嘛的数据很多半天都出不来点哪儿哪都是空白的连个提示都没有,整个App的真正目的不清晰博知道是用来干嘛的数据很多半天都出不来点哪儿哪都是空白的连个提示都没有,审核通过,6,2015-12-06 14:35:31
104,进入医生认证页面点击相册选择照片后页面一直黑屏点击任何按钮都无效最后等来的是无响应的提示,进入医生认证页面点击相册选择照片后页面一直黑屏点击任何按钮都无效最后等来的是无响应的提示,审核通过,9,2015-12-06 16:55:54
