id,bug详情,复现步骤,审核状态,重复情况,提交时间
1,加入购物车后去购物车查看没有商品,点击加入购物车选择了药品的规格加入成功后再去购物车查看购物车并没有刚才加入的商品,审核不通过,13,2015-05-01 09:43:00
2,药直达首页自动定位错误,药直达首页自动定位错误我在安徽亳州自动定位到北京市,审核不通过,26,2015-05-01 10:05:00
3,无法将药品添加至购物车,无法将药品添加至购物车点击添加按钮显示添加成功购物车里仍然是空的,审核通过,14,2015-05-01 10:05:00
4,定位功能无法使用并且手动切换无法使用,手机的gps已开启其他软件均可成功定位进入首页的时候天气预报是可以正确显示位置的但是到了药直达里无法定位人在沈阳自动默认在北京而且在手动选择城市里无法切换,审核不通过,10,2015-05-01 10:14:00
5,搜索到的药品名称不显示具体信息,按照操作步骤输入关键字九芝堂后搜索出的药品名称无具体信息只显示九芝堂字样,审核不通过,24,2015-05-01 10:14:00
6,购物车不好用已填加但是无显示,选择药品数量规格后点击添加到购物车并且已显示添加成功但是点击购物车进入查看时提示您的购物车还是空的赶紧行动吧,审核通过,13,2015-05-01 10:14:00
7,乡村无法定位到药店任务无法完成,找不到药店无法完成搜索药店搜索感冒价格筛选任务,审核通过,15,2015-05-01 10:32:00
8,无法定位到药店找不到商品进行测试,在村里定位不精确在无线环境下也定位不到无法完成任务,审核通过,15,2015-05-01 10:32:00
9,找不到药品信息无法完成,wifi环境下定位不成功不是山村定位不是很好用改进下定位吧,审核通过,26,2015-05-01 10:32:00
10,无法进行任务找不到药店,无法进行任务找不到药店和药品信息无法到达这一步,审核通过,15,2015-05-01 10:32:00
11,开了GPS但是定位仍然不准确,搜索药直达test页面显示在定位可是定位之后显示的是嘉事堂药店按操作要求继续选择其他的分店可都是在北京的而我是武汉的,审核不通过,25,2015-05-01 10:33:00
12,添加购物车成功了但是点开购物车里面什么都没有,将商品添加至购物车显示添加成功可是再点开我自己的购物车时里面是空的,审核通过,14,2015-05-01 10:33:00
13,地址只能填北京市未付款退出付款之后找不到订单,填写收货地址时表示只能在本市内配送我只好把地址改为北京市之后提交订单未付款退出之后和就找不到订单了,审核不通过,12,2015-05-01 10:33:00
14,城市药房定位不准确显示错误,按步骤一要求搜索药直达test进入后显示的是北京的某药店而我所在的地方在广州更改城市功能没法更改,审核通过,17,2015-05-01 10:36:00
15,按商品添加到购物车点击购物车里面是空的,点击小儿肺热咳喘口服液选择10ml6OTC购买数量1点击加入购物车返回点击屏幕下方购物车按钮里面是空的并没有显示所选的药物,审核通过,14,2015-05-01 10:36:00
16,搜索药直达test进入后定位到离你当前最近的药店只有北京的,搜索药直达test进入后定位到离你当前最近的药店只有北京的定位周边药店不准确,审核不通过,8,2015-05-01 10:57:00
17,搜索药直达test进入后定位到离你当前最近的药店只有北京的选择城市为空即无法选择城市,搜索药直达test进入后定位到离你当前最近的药店只有北京的选择城市为空即无法选择城市,审核不通过,17,2015-05-01 10:57:00
18,点击或者底部咨询按钮无法与药剂师进行沟通仅仅是留言,点击或者底部咨询按钮无法与药剂师进行实时沟通仅仅是留言,审核不通过,18,2015-05-01 10:57:00
19,选择药品规格和数量点击加入购物车后提示商品添加成功在购物车中无任何信息记录,搜索药品后点击任一条药品记录打开药品详情页选择药品规格和数量并点击加入购物车提示商品添加成功再进入购物车中查看无任何信息记录,审核通过,13,2015-05-01 10:57:00
20,添加药品到购物车后提示商品添加成功但点击底部购物车按钮打开购物车时无任何商品药品信息记录无法进行后续操作,搜索药品添加药品到购物车后提示商品添加成功但点击底部购物车按钮打开购物车时无任何商品药品信息记录,审核通过,14,2015-05-01 10:57:00
21,未见首页底部有订单按钮,打开手机百度输入药直达test进入首页搜索药品并操作添加药品到购物车提示添加成功返回首页未见首页底部有订单按钮,审核不通过,18,2015-05-01 10:57:00
22,配送地址可以选择全国地址但提交订单时却无法提交订单配送地址处却提示目前仅支持本市内配送,打开手机百度输入药直达test进入首页搜索药品选择药品并操作马上购买选择支付与配送并设置配送地址可以选择全国地址但提交订单时却无法提交订单配送地址处却提示目前仅支持本市内配送,审核不通过,12,2015-05-01 10:57:00
23,无法查看订单未能进入订单查看页面无法操作进行订单取消,打开手机百度输入药直达test进入首页搜索药品选择药品并操作马上购买选择支付与配送并设置配送地址北京市区内后提交订单后提示订单提交成功但无法查看订单退回到首页未见首页底部有订单按钮,审核不通过,18,2015-05-01 10:57:00
24,找不到首页底部的订单按钮,找不到首页底部的订单按钮查看不了我的订单,审核不通过,18,2015-05-01 11:02:00
25,一直显示定位中无法操作,卸载了65安装64版本根据要求输入药直达test然后一直显示定位中无法操作,审核通过,25,2015-05-01 11:16:00
26,商品加入购物车后购物车中无商品信息,在商品详情页选择添加商品至购物车商品加入购物车后购物车中无商品信息,审核通过,13,2015-05-01 11:35:00
27,购物车不显示已选药品,添加到购物车显示添加成功但是到购物车选项中找不到添加的药品所以后面结算提交之类的无法完成,审核通过,14,2015-05-01 11:50:00
28,搜索感冒点击具体商品无法显示商品详情只显示空白页面有的商品则是显示商品不存在,搜索感冒点击具体商品无法显示商品详情只显示空白页面有的商品则是显示商品不存在,审核通过,20,2015-05-01 11:55:00
29,显示成功添加到购物车但是购物车里并没有刷新之后也没有,搜索药品九芝堂综合排序选择规格数量添加到购物车然后去购物车看,审核通过,14,2015-05-01 12:08:00
30,有的商品显示出来但是点进去显示商品并不存在,综合排序搜索盘点击第一个叫修正修正的药进去后发现并不存在,审核通过,19,2015-05-01 12:08:00
31,商品规格和数量选择后添加到购物车但返回点击购物车进入显示购物车为空,1点选择包装规格和数量2选择包装规格并确定购买数量点击加入购物车3点击购物车进入显示您的购物车还是空的赶紧行动吧,审核通过,13,2015-05-01 12:26:00
32,按上述步骤打开没有显示详情页内容,按上述步骤打开没有显示详情页内容网络没有问题,审核通过,1,2015-05-01 12:34:00
33,没有显示详情页内容无法下单,上一个步骤没有显示详情页内容无法下单,审核不通过,1,2015-05-01 12:34:00
34,没有显示详情页内容无法下单,没有显示详情页内容无法下单网络没问题,审核不通过,1,2015-05-01 12:34:00
35,搜索药直达test页面出现乱码,1打开手机百度搜索药直达ｔｅｓｔ页面出现乱码2关闭也网页重新搜索药直达ｔｅｓｔ进入页面,审核通过,8,2015-05-01 13:08:00
36,无法选择其它分店选择分店后页面空白,1搜索药直达test进入页面2切换药店选择其它分店页面空白,审核不通过,10,2015-05-01 13:08:00
37,药品加入购物车成功后购物车里是空的,进入有药品情页选择数量和规格加入购物车后购物车显示没有商品,审核不通过,13,2015-05-01 13:08:00
38,定位错误武汉定位到北京的药店,打开药直达后软件自动定位到北京而应该是在武汉,审核通过,26,2015-05-01 13:10:00
39,药品加入购物车后点击购物车里无该药品,在药品页将药加入购物车后再点击购物车按钮购物车里无药品,审核通过,13,2015-05-01 13:10:00
40,订单提交后无法查看订单,两次订单提交后点击查看订单无响应且找不到其他入口查看订单更不论取消订单,审核通过,18,2015-05-01 13:10:00
41,经常提示系统错误请稍后再试,在加入购物车的时候经常出现系统错误请稍后再试无法进入下一个流程购物体验不好,审核通过,6,2015-05-01 13:28:00
42,加入购物车提示系统错误不能加入购物车,选择一个药物选择规格和数量加入购物车提示系统错误,审核通过,6,2015-05-01 13:49:00
43,输入药直达test后定位不准确,输入药直达test后定位不准确我在太原定位却是北京,审核不通过,25,2015-05-01 13:52:00
44,在药直达test搜索框中搜感冒结果推荐药品中有王老吉,在药直达test搜索框中搜感冒结果推荐药品中有王老吉,审核不通过,24,2015-05-01 13:52:00
45,在药直达test中搜索京都念慈C有两条结果点击第二条外面的名字和里面的名字不一样而且无法加入购物车,在药直达test中搜索京都念慈C有两条结果点击第二条念慈C瑞典LELO进入详情页里面的名字显示为京都念慈C蜜炼川贝枇杷膏而且无法加入购物车,审核通过,6,2015-05-01 13:52:00
46,无法加入购物车显示系统错误请稍后再试,无法加入购物车显示系统错误请稍后再试,审核通过,6,2015-05-01 13:52:00
47,一直显示定位中gps已经打开无效,一直显示定位中gps已经打开无效始终在定位过程中,审核不通过,26,2015-05-01 13:57:00
48,选择商品后提交时显示系统错误无法提交订单,点击商品详情后选择商品及数量后点确认加入购物车显示系统错误无法提交订单,审核不通过,12,2015-05-01 14:19:00
49,GPS已开启但一直显示定位中,GPS已开启但一直显示定位中系统安卓409,审核不通过,26,2015-05-01 15:12:00
50,网络已开启但无法看到内容,网络已开启但无法看到内容系统安卓403,审核不通过,23,2015-05-01 15:12:00
51,看不到内容无法进行下单操作,看不到内容无法进行下单操作系统安卓403,审核不通过,5,2015-05-01 15:12:00
52,看不到内容无法进行下单操作,看不到内容无法进行下单操作系统安卓403,审核不通过,5,2015-05-01 15:12:00
53,添加购物车就失败显示系统错误,按步骤进行加入购物车时显示系统错误无法进入下一个界面,审核通过,6,2015-05-01 15:22:00
54,深圳被定位到北京了,药直达test后默认定位在北京而我却是在深圳默认应该是点名而非测试项目名,审核通过,11,2015-05-01 15:46:00
55,点击加入购物车确定以后发生错误,点击加入购物车确定以后发生错误提示系统错误请稍后再试,审核通过,6,2015-05-01 16:07:00
56,打开软件之后不能定位,打开软件后显示定位中等待一段时间后任然是定位中期间手机GPS和网络正常开启,审核通过,26,2015-05-01 16:55:00
57,聊天内容按发送键发布出去并不是网络问题,像药店医师发送咨询但是案件是灰色的根本发布出去网络已检查是私人无线网没问题手机聊天也没问题但就是这个在线咨询出了问题就是无法发送出消息,审核通过,23,2015-05-01 17:09:00
58,我在无锡定位到北京而且不能切换城市,输入药直达test后点击切换其他分店发现定位到了错误地点想切换城市可是就卡住了不能切换,审核不通过,10,2015-05-01 17:23:00
59,按返回界面死机无法退出,输入感冒搜索再次输入感冒搜索按返回或者关闭界面卡住了过了一会再按关闭才能返回手机百度界面,审核不通过,22,2015-05-01 17:23:00
60,当药品规格只有1种时还要选择多此一举,选择九芝堂驴胶补血颗粒点击马上购买一看只有一种规格就直接电机确定可是弹出请选择规格选择规格后才能加入购物车这种情况显然没必要选择啊,审核不通过,13,2015-05-01 17:23:00
61,输入地址时省份输完直接进入市而想返回还得按上一步,输入订单地址时由于省份之间间隔小容易误操作且没有拼音筛选功能出错后进入市一级按省不能折叠起来重新选择必须按返回才能再滚动着选一遍操作难度很大,审核不通过,12,2015-05-01 17:23:00
62,首页底部无订单字样,正常进行任务操作后首页底部无订单字样,审核通过,18,2015-05-01 18:02:00
63,定位不准备城市不能选择,1定位显示的药方城市是北京而我在2城市选择里只要北京没有其他城市,审核不通过,17,2015-05-01 18:17:00
64,提示没有与搜索相匹配的内容,输入九芝堂进行搜索提示提示没有与搜索相匹配的内容可以咨询药师,审核通过,5,2015-05-01 18:51:00
65,按照第二步切换其他分店时显示定位失败,按照第二步切换其他分店时显示定位失败无当前位置选择,审核通过,10,2015-05-01 21:33:00
66,打开手机百度搜索药直达test进入后一直在定位中,打开手机百度搜索药直达test进入后一直在定位中几分钟之后依然没有定位成功,审核通过,8,2015-05-01 22:14:00
67,定位不准确我的位置不在北京软件默认是北京,第一次进入当前最近的药店后默认的城市是北京然后点退出在进入当前最近的药店就重新定位当前城市了显示附近没有药店,审核不通过,15,2015-05-01 23:02:00
68,搜索出来的药品有问题,搜索感冒筛选选择中药然后按价格排序居然出现风油精这个药也不是治疗感冒的啊,审核不通过,22,2015-05-01 23:02:00
69,我在江苏默认定位到北京了,我在江苏默认定位到北京了我开了定位功能也同意了权限但是定位不对,审核通过,11,2015-05-02 09:39:00
70,定位不准本来太原却定位北京,1打开手机百度搜索药直达test进入后不能定位到离我当前最近的药店,审核不通过,8,2015-05-02 10:32:00
71,定位不准确本人在河南定位却在北京,打开手机百度搜索药直达test进入后定位到北京,审核不通过,8,2015-05-02 11:16:00
72,已开启gps以及百度的定位权限但依然持续定位中无法正常进行测试,已开启gps以及百度的定位权限但依然持续定位中无法正常进行测试,审核通过,11,2015-05-02 11:19:00
73,随便选择一种药物点击进入都无法进入药品详情页,随便选择一种药物点击进入都无法进入药品详情页全是空白内容刷新后依然如此,审核不通过,21,2015-05-02 12:31:00
74,周边药店定位不准确只能定位到北京,周边药店定位不准确只能定位到北京自己选择地区也只有北京,审核不通过,8,2015-05-02 13:25:00
75,大写的药字下面的标题每次点返回都要重新定位一遍,大写的药字下面的标题每次点返回都要重新定位一遍,审核不通过,25,2015-05-02 14:21:00
76,软件无法操作无法启动,第二项测试的时候软件退出无法启动没法进行测试难道机型不匹配,审核不通过,11,2015-05-02 15:25:00
77,点击药品详情后空白,进店后随便选择一个药品点击查看详情显示空白,审核通过,21,2015-05-02 16:09:00
78,定位不精确,定位不精确怎么直达啊几百公里呢,审核不通过,26,2015-05-02 17:37:00
79,咨询功能问题,咨询功能问题咨询发送后没有回信啊,审核不通过,23,2015-05-02 17:37:00
80,进入搜索界面详情后在输入别的搜索竟然没有搜索按钮而是一个删除按钮,进入搜索界面详情后在输入别的搜索竟然没有搜索按钮而是一个删除按钮,审核通过,22,2015-05-02 17:37:00
81,定位不准确只有北京佛山两个城市选择不能定位到本人所在所在的青岛市,1进入首页自动定位在北京某分店2点击药店名旁的下箭头进入城市选择发现只有北京佛山两个城市可供选择,审核通过,17,2015-05-02 20:45:00
82,打开页面变成空白页无法选择提交订单没办法选择,打开页面变成空白页无法选择提交订单没办法选择,审核不通过,3,2015-05-02 22:24:00
83,打开页面变成空白页无法选择提交订单没办法选择,打开页面变成空白页无法选择提交订单没办法选择,审核不通过,3,2015-05-02 22:24:00
84,搜索药品正常点击药品购买页面变成空白页无法选择提交订单没办法选择,搜索药品正常点击药品购买页面变成空白页无法选择提交订单没办法选择,审核通过,3,2015-05-02 22:35:00
85,搜索药品正常点击药品购买页面变成空白页无法选择提交订单没办法选择,搜索药品正常点击药品购买页面变成空白页无法选择提交订单没办法选择,审核不通过,3,2015-05-02 22:35:00
86,搜索药品正常点击药品购买页面变成空白页无法选择提交订单没办法选择,搜索药品正常点击药品购买页面变成空白页无法选择提交订单没办法选择,审核不通过,3,2015-05-02 22:35:00
87,药直达test打开长时间一直处于加载状态,1等了好几分钟都没有打开后面干脆做了下记录发现它居然要8分钟的时间才能打开我的网速是电信4M的速度不低了2定位功能不准确我在广州天河区但是定位信息上面显示我在佛山百度之前的app也是显示我是在广州证明这个定位有问题,审核不通过,26,2015-05-03 00:27:00
88,搜索框里的搜索按钮有问题,如果点击搜索框里的删除按钮删除搜索完成的标题后再输入标题搜索无论如何都不能再搜索第二次只能退出此程序再重新打开才能再次搜索,审核通过,22,2015-05-03 00:27:00
89,价格排序在筛选完成后变乱,价格按升序排序后再筛选为内容为处方药但是出来的结果是价格并未按照先前设定的顺序来排序,审核通过,9,2015-05-03 00:27:00
90,商品详情基本上全都看不到,点开了很多的商品详情基本上全是空白的无任何提示信息,审核通过,7,2015-05-03 00:27:00
91,商品在商品清单里面有打开详情却提示商品不存在,选择感冒来搜索接着以价格来升序排序再按处方来来筛选选中图片上从上往下的第四个药品芬必得酚咖片但是点开详情时却提示商品不存在,审核通过,19,2015-05-03 00:27:00
92,商品列表里有药品但是点击打开详情时看不到任何东西,商品列表里有药品但是点击打开详情时看不到任何东西导致买不了药品体验不了这一步的购物功能,审核通过,7,2015-05-03 00:27:00
93,点击商品详情无任何反应,本来我以为是网络的事把WiFi关闭连接自己的4g网络依然是不好使空白没有反应,审核不通过,16,2015-05-03 10:06:00
94,上面那栏选不了是空白的这个也填写不了,之前的页面就无法操作了我确定不是我自己网络的事情我换了WiFi的网还有自己手机移动4g都网络都显示没有反应,审核不通过,16,2015-05-03 10:06:00
95,点击某一条药品记录打开药品详情页时不显示详情,搜索完后随机点入药品详情时不显示商品详情只显示顶部档加空白页随机点击天价药则显示商品不存在,审核通过,21,2015-05-03 10:13:00
96,由于上一环节不能显示商品所以无法进入购物环节,由于上一环节不能显示商品所以无法进入购物环节,审核不通过,20,2015-05-03 10:13:00
97,由于上一环节无法显示商品所以不能进入到此测试,由于上一环节无法显示商品所以不能进入到此测试,审核不通过,20,2015-05-03 10:13:00
98,定位不准周围药店显示是北京,定位不准周围药店显示是北京周围一公里内有五六家要点没有显示,审核通过,15,2015-05-03 11:29:00
99,搜索九芝堂只显示一种药品,搜索九芝堂只显示一种药品九芝堂足光散其余没有显示,审核通过,24,2015-05-03 11:29:00
100,在顶部搜索框搜索感冒不显示药品详情页,在顶部搜索框搜索感冒随机点击某条药品名称无法显示药品详情页,审核不通过,22,2015-05-03 16:33:00
101,无法准确定位在搜索药直达test进入时有定位当前位置的手机权限提示已经允许定位但定位失败,无法准确定位在搜索药直达test进入时有定位当前位置的手机权限提示已经允许定位但定位失败目前位置是山东省东营市手机华为Y330C00,审核不通过,8,2015-05-03 17:06:00
102,商品详情页全部打开都是空白的,商品详情列表打开都是空白的然后后续的购买和支付也无法进行,审核通过,1,2015-05-03 18:23:00
103,定位不准明明是在广州竟然定位到了佛山乱定位还不能选择自己的城市,1打开手机百度搜索药直达test进入后能定位到离你当前最近的药店,审核不通过,8,2015-05-03 18:29:00
104,许多药品详情显示不出而且价格几百上千万有的甚至点进去后说没有该药品,1点击某一条药品记录打开药品详情页1点击某一条药品记录打开药品详情页,审核通过,21,2015-05-03 18:29:00
105,价格排序之后选筛选价格就不按排序先后排序,价格排序之后选筛选价格就不按排序先后排序,审核不通过,9,2015-05-03 21:12:00
106,搜索九芝堂得到的前四种打开白屏后四种商品不存在,搜索九芝堂得到的前四种打开白屏后四种商品不存在另外在开始第一项开始搜索九芝堂时是白屏刷新和重新搜索才正常这个没截图,审核通过,2,2015-05-03 21:12:00
107,所有药品详情不是白屏就是商品不存在没能再操作,所有药品详情不是白屏就是商品不存在没能再操作,审核通过,21,2015-05-03 21:12:00
108,定位不出地址来实际临沂定位也开,定位不出地址来实际临沂定位也开城市选择只有两个定位不能使用,审核通过,17,2015-05-03 23:24:00
109,进入到商品列表后搜索功能就不能使用了,在首页对九芝堂搜索跳转至商品页修改搜索内容显示搜索点击后变为x号,审核通过,22,2015-05-03 23:24:00
110,我在深圳给我定位在佛山,切换其他分店时给我定位在佛山要实际我在深圳市,审核通过,10,2015-05-03 23:24:00
111,点击顶部搜索输入感冒进行搜索然后再点商品却是白屏,点击顶部搜索输入感冒进行搜索然后再点商品却是白屏,审核不通过,22,2015-05-03 23:24:00
112,在深圳市却被定位至佛山市,地理位置定位非常不准相隔了几个城市之多,审核不通过,17,2015-05-03 23:57:00
113,不少药品价格显示错误,搜索感冒按价格从高到低排序会列出非常多的价格为￥2147483647的药品明显不符合实际价格,审核通过,9,2015-05-03 23:57:00
114,点击任意的天价药里面均显示商品不存在,上面一步测试中已经发现了很多价格离奇高的药品随意点击任意一个天价药品里面均显示商品不存在,审核通过,19,2015-05-03 23:57:00
115,没有找到任何药店显示的是药直达,就按照众测要求步骤操作打开后搜索药直达test结果如截图所示,审核不通过,25,2015-05-04 07:21:00
116,搜索九芝堂结果明显不全才找到两个药,就在药直达首页直接搜索九芝堂结果只是找到两个药品明显有问题,审核不通过,24,2015-05-04 07:21:00
117,缺少订单详情确认页直接就是支付,选择药品加购物车之后点击购物车进去能看到结算按钮点击结算直接就到了支付页面,审核不通过,3,2015-05-04 07:21:00
118,基本上都有价格为2147483647的商品不能点击,点击价格为2147483647的商品药然后出示的是商品不存在,审核不通过,9,2015-05-04 08:40:00
119,价格正常的药品出不来商品信息,点进一个贵州益佰感冒止咳糖浆但是商品信息根本不出来,审核通过,19,2015-05-04 08:40:00
120,根本就进不去就根据之前的BUG,点进药品但是这个信息完全是白板基本连购物车都看不到,审核不通过,7,2015-05-04 08:40:00
121,无法准确定位显示周边的药店,打开手机百度搜索药直达test只显示test的药店点击药店名称切换其他分店定位到了佛山市其实我在深圳,审核通过,8,2015-05-04 09:01:00
122,药品详情页内容空白包括下面的购买功能区域,搜索感冒点击某一条药品记录打开药品详情页页面内容为空白,审核通过,21,2015-05-04 09:01:00
123,价格字段值显示不正确且点击对应的药时提示内容不存在,价格字段值显示不正确且点击对应的药时提示内容不存在,审核通过,19,2015-05-04 09:32:00
124,价格显示错误为2147483547,输入九芝堂进行搜索筛选选择西药显示的药品全部价格错误为2147483547,审核通过,9,2015-05-04 09:41:00
125,点击商品详情显示山品信息不存在,如图所示所有价格错误的药品进入都是商品信息不存在,审核通过,19,2015-05-04 09:41:00
126,关爱家人部分UI显示有问题黑色粗体部分与浅黑色部分文字有重合请参考截图,1打开手机百度在搜索框内输入药直达test2进去直达号上下滑动界面查看关爱家人部分的UI,审核通过,23,2015-05-04 10:28:00
127,进入商品详细页页面为空,1进去药直达test后在搜索框内输入九芝堂进去商品列表页面2选择第一个产品进去无内容显示3依次选择前5个产品都无内容显示,审核通过,20,2015-05-04 10:28:00
