id,bug详情,复现步骤,审核状态,重复情况,提交时间
128,搜索框输入感冒后右侧是删除不是搜索需要自己按回车才能搜索,搜索框输入感冒后右侧是删除不是搜索需要自己按回车才能搜索,审核通过,22,2015-05-04 10:36:00
129,点击药品打开都是空白或者商品不存在无法进行后续操作,点击药品打开都是空白或者商品不存在无法进行后续操作,审核通过,21,2015-05-04 10:36:00
130,商品价格不对啊都是错标好高,商品价格不对啊都是错标好高估计是测试所以瞎写的吧,审核通过,9,2015-05-04 10:36:00
131,点击九芝堂健胃愈疡片显示商品不存在而且价格也错标为2147483647元,在药直达号首页搜索九芝堂进入商品列表点击列表中的商品九芝堂健胃愈疡片后显示商品不存在,审核通过,20,2015-05-04 11:22:00
132,点击列表的商品后商品信息不法显示,在药直达号首页搜索九芝堂后能正常显示商品列表浏览商品列表中的九芝堂六味地黄丸售价为127元点击商品没有任何显示信息,审核通过,20,2015-05-04 11:22:00
133,无法定位自己所在的位置,不能定位准确自己的位置而且只有北京和佛山两个地区可选,审核不通过,17,2015-05-04 11:56:00
134,搜索药直达test进入后不能定位到离当前最近的药店点击屏幕任何链接都没有反应,搜索药直达test进入后不能定位到离当前最近的药店点击屏幕任何链接都没有反应,审核通过,8,2015-05-04 14:12:00
135,点击顶部搜索输入感冒进行搜索点击搜索功能没有反应,点击顶部搜索输入感冒进行搜索点击搜索功能没有反应,审核不通过,22,2015-05-04 14:12:00
136,点击任何链接都没有反应刷新一直显示正在加载,点击任何链接都没有反应刷新一直显示正在加载,审核通过,16,2015-05-04 14:12:00
137,能上下拉动页面但点击任何链接都没有反应,能上下拉动页面但点击任何链接都没有反应,审核通过,16,2015-05-04 14:12:00
138,点击任何链接都没有反应,点击任何链接都没有反应所有功能都不能使用wifi链接状态良好,审核通过,16,2015-05-04 14:12:00
139,搜索药直达test进入后不能定位到离当前最近的药店,搜索药直达test进入后不能定位到离当前最近的药店,审核通过,8,2015-05-04 14:57:00
140,点击顶部搜索输入九芝堂进行搜索没有响应,点击顶部搜索输入九芝堂进行搜索没有响应,审核不通过,22,2015-05-04 14:57:00
141,点击任何链接都没有响应,可以上下拉动页面但点击任何链接都没有响应,审核不通过,16,2015-05-04 14:57:00
142,点击任何链接都没有响应刷新后也一样,点击任何链接都没有响应刷新后也一样百度首页,审核不通过,16,2015-05-04 14:57:00
143,所有功能都不可用点击任何链接都没有响应wifi连接良好,所有功能都不可用点击任何链接都没有响应wifi连接良好,审核通过,16,2015-05-04 14:57:00
144,搜索九芝堂和感冒均出现没有与您搜索想匹配的内容,搜索九芝堂和感冒均出现没有与您搜索想匹配的内容没有搜索出内容,审核通过,2,2015-05-04 15:02:00
145,搜索九芝堂和感冒均出现没有与您搜索想匹配的内容,搜索九芝堂和感冒均出现没有与您搜索想匹配的内容没有搜索出结果,审核通过,2,2015-05-04 15:02:00
146,搜索九芝堂和感冒均出现没有与您搜索想匹配的内容,搜索九芝堂和感冒均出现没有与您搜索想匹配的内容,审核通过,2,2015-05-04 15:02:00
147,选择一次商品以后进入商品列表为什么不能再次搜索呢却要返回上页重新回到顶部搜索,选择一次商品以后进入商品列表为什么不能再次搜索呢却要返回上页重新回到顶部搜索,审核通过,20,2015-05-04 16:20:00
148,定位不准确我在四川绵阳定位在佛山,进入药直达test点分店2下拉菜单进入分店选择城市是佛山,审核不通过,10,2015-05-04 17:01:00
149,不能定位到我附近的药店,不能定位到我附近的药店不能自动打开GPS不能开启定位功能,审核通过,15,2015-05-04 17:26:00
150,手机定位不准确定位过程太慢,1打开百度app2输入药直达test3进行搜索等待很长时间才进行定位4定位位置不准确,审核不通过,26,2015-05-04 21:20:00
151,每个商品详情页面为空无法进行下一步操作,1搜索感冒关键词2点击某一条药品记录打开药品详情页,审核不通过,21,2015-05-04 21:20:00
152,商品详情无法打开无法添加到购物车,1打开购物车2点击去购物3点击商品,审核不通过,14,2015-05-04 21:20:00
153,无法添加商品创建订单,1搜索商品2进入详情3发现详情界面为空4无法添加到订单,审核不通过,18,2015-05-04 21:20:00
154,在江苏苏州却只能定位到北京并且城市选择里只有北京和佛山两个地方可选,手机华为荣耀4X电信版在江苏苏州却只能定位到北京并且城市选择里只有北京和佛山两个地方可选,审核不通过,17,2015-05-04 23:04:00
155,搜索九芝堂只显示两个项目显示不全,手机华为荣耀4X电信版搜索九芝堂只显示两个项目显示不全而搜索感冒则显示正常出现很多的搜索内容,审核不通过,24,2015-05-04 23:04:00
156,佛山高明区所以药品都搜索不了,HTCG12手机佛山高明区所在区域打开页面后搜寻药品所以药品都搜索不了无任何药品信息,审核通过,21,2015-05-04 23:34:00
157,页面完全搜不了药品信息,打开页面各样药品搜寻不了没有任务药品信息,审核通过,21,2015-05-04 23:34:00
158,定位不准确定位到最近医院为药直达test不是医院,定位不准确定位到最近医院为药直达test不是医院有问题,审核通过,25,2015-05-05 10:29:00
159,查看不到药品提示没有与您搜索相匹配的内容,查看不到药品提示没有与您搜索相匹配的内容,审核通过,5,2015-05-05 10:29:00
160,无法查看药品提示没有与您搜索相匹配的内容,无法查看药品提示没有与您搜索相匹配的内容,审核通过,5,2015-05-05 10:29:00
161,定位失败选择城市中无深圳只有北京和佛山,定位失败选择城市中无深圳只有北京和佛山,审核不通过,17,2015-05-05 12:01:00
162,没有找到相匹配的内容无法打开,没有定位好没有找到相匹配的内容无法打开,审核通过,25,2015-05-05 12:01:00
163,没有定位好没有显示药品查找失败,没有定位好没有显示药品查找失败望改进谢谢,审核通过,0,2015-05-05 12:01:00
164,没有定位好没有显示药品查找失败下不了订单,没有定位好没有显示药品查找失败下不了订单望改进谢谢,审核不通过,0,2015-05-05 12:01:00
165,没有定位好无法显示下不了订单没有订单产生,没有定位好无法显示下不了订单没有订单产生,审核不通过,18,2015-05-05 12:01:00
166,我在淄博市区均没有搜出相关的内容应该不会是商家少的问题吧,我在淄博市区均没有搜出相关的内容应该不会是商家少的问题吧,审核不通过,23,2015-05-05 15:22:00
167,打开手机百度搜索药直达test进入后不能定位到离我当前最近的药店,打开手机百度搜索药直达test进入后不能定位到离我当前最近的药店出现的是药直达test分店1具体情况有截图,审核不通过,8,2015-05-05 20:39:00
168,药品展示内容不全九芝堂只出现了两种药品,点击顶部搜索输入九芝堂进行搜索发现药品展示内容不全九芝堂只出现了两种药品已经截图,审核不通过,2,2015-05-05 20:39:00
169,在第3步选择送货上门之后下面确定始终是灰色不能提交,在第3步选择送货上门之后下面确定按钮始终是灰色不能提交我以为是日期的原因从5月5日尝试到5月9日都不能确定提交,审核通过,3,2015-05-05 20:39:00
170,在商品列表页面返回按钮失效会闪一下上一面后再跳转回当前页面,1点击下方购药进入了商品列表页2尝试点击了页面左上角的返回或手机自带的返回键3点击后均是闪一下上一页面后又跳转回了商品列表页等于返回功能失效使用手机是三星手机,审核通过,20,2015-05-05 20:47:00
171,点击结算跳转到了短信快捷登陆页面,1点击底部购物车按钮打开购物车2点击结算跳转到了短信快捷登陆页面无法继续,审核不通过,14,2015-05-05 20:47:00
172,购物车反复添加同一商品时数量计数不对,1在购物车中增加了产品云南白药膏4盒2返回产品界面再增加了同一产品1盒3重新进入购物车发现数量是4盒,审核通过,13,2015-05-05 20:47:00
173,定位是佛山药店而我在成都定位有问题,打开浏览器输了药直达test但是出现定功能定位成功不在本市定位有问题其实他没有问题,审核不通过,25,2015-05-06 08:05:00
174,定位城市只有两个也许是test的原因吧,点击切换其他分店出现的定位失败出现两个城市没有可以选择别的城市,审核不通过,17,2015-05-06 08:30:00
175,前一部就提交不了因为超过配送范围了,前一部就提交不了因为超过配送范围了前一部就提交不了因为超过配送范围了,审核不通过,12,2015-05-06 08:30:00
176,搜索无结果输入九芝堂和感冒进行搜索都没有结果,按要求输入搜索无结果输入九芝堂和感冒进行搜索都没有结果34步骤没有办法做,审核不通过,24,2015-05-06 09:52:00
177,按要求操作没有看到商品,搜索不到药品点击分类也一样没有结果所以无法进行下一步操作,审核不通过,24,2015-05-06 09:52:00
178,定位不准只能定位到北京和佛山,定位不准只能定位北京和佛山其他地方不显示,审核通过,26,2015-05-06 10:06:00
179,订单无法提交总是显示超出配送范围,在提交订单时显示超出配送范围无法提交订单,审核不通过,12,2015-05-06 10:06:00
180,订单无法提交显示超出配送范围,提交订单时显示超出配送范围无法正常提交订单,审核不通过,12,2015-05-06 13:36:00
181,点击肠胃疾病显示参数错误,点击促销产品栏如肠胃疾病在商品列表不显示药品显示参数错误多次点击都是如此我的手机是华为C8815,审核通过,4,2015-05-06 16:50:00
182,点击关爱家人下的图标均显示参数错误,点击关爱家人下的图标如儿科用药等均显示参数错误,审核通过,4,2015-05-06 16:50:00
183,不能定位显示定位失败,不能定位显示定位失败定位城市只有佛山市北京市两个城市,审核不通过,17,2015-05-06 16:50:00
184,在顶部输入九芝堂显示参数错误,按要求在顶部输入九芝堂显示参数错误在商品列表处显示参数错误,审核通过,4,2015-05-06 16:50:00
185,搜索关键字没有任何信息具体原因不知道然后就剩下咨询药师这个选项不知道为什么,搜索关键字没有任何信息具体原因不知道然后就剩下咨询药师这个选项不知道为什么,审核不通过,23,2015-05-06 18:02:00
186,定位不准确本人在深圳定位到的城市却在佛山,定位不准确本人在深圳定位到的城市却在佛山,审核不通过,17,2015-05-06 18:24:00
187,城市定位错误把我的位置从宜宾市定位到了佛山市,城市定位错误把我的位置从宜宾市定位到了佛山市,审核通过,17,2015-05-06 21:34:00
188,搜索不到任何药品,搜索不到任何药品搜索不到任何药品,审核不通过,24,2015-05-06 21:34:00
189,搜索感冒和九芝堂无法搜索到相关内容,在WiFi和数据流量分别测试下均无法搜索到九芝堂和感冒关键词,审核不通过,22,2015-05-07 10:03:00
