id,bug详情,复现步骤,审核状态,重复情况,提交时间
139,无法登陆界面出现黑屏且一直不能打开,无法登陆界面出现黑屏且一直不能打开没有发应,审核通过,15,2015-12-15 16:06:24
140,下载安装软件成功后点击打开软件系统崩溃,1下载软件2安装软件3点击打开软件系统崩溃停止运行,审核通过,16,2015-12-15 16:10:48
141,点击打开欢迎页面系统崩溃,1安装软件成功后2点击打开软件3进入欢迎页面点击欢迎页面系统崩溃,审核通过,19,2015-12-15 16:10:48
142,闪退不能打开软件安装过程无异常,荣耀4X电信版安装完成后点击打开自动跳转到移动测试页面,审核通过,17,2015-12-15 16:34:46
143,小米note手机打开软件出现闪退现象,小米note手机安卓44打开软件出现闪退现象直接跳回测试初始页面,审核通过,15,2015-12-15 16:37:24
144,闪退打不开试过多次都不行,在微任务中打开APP结果退回上一界面使用安卓系统做过多次都闪退,审核通过,12,2015-12-15 16:38:08
145,像上传图中的这样打开就这样等了多长时间也没反应应该是APP出问题了也连网了手机也没问题,像上传图中的这样打开就这样等了多长时间也没反应应该是APP出问题了也连网了手机也没问题,审核通过,21,2015-12-15 16:49:18
146,无法打开打开黑屏后闪退,安装成功后点击打开然后黑屏然后闪退,审核通过,19,2015-12-15 16:52:32
147,软件根本无法打开软件打开就提示已停止运行,软件根本无法打开软件打开就提示已停止运行无法进行测试,审核通过,2,2015-12-15 16:58:57
148,下载安装完成后无法进入该APP,下载安装完成点击打开无法进入闪退到下载界面,审核通过,5,2015-12-15 17:05:14
149,你这真是测试闪退的问题确实是闪退啊还挺严重的人家闪退是打开后点一点才退你这闪退是根本就打不开改改吧,你这真是测试闪退的问题确实是闪退啊还挺严重的人家闪退是打开后点一点才退你这闪退是根本就打不开改改吧,审核通过,12,2015-12-15 17:22:41
150,软件无法运行软件运行后无法进入闪退,软件无法运行软件运行后无法进入闪退,审核通过,2,2015-12-15 17:24:14
151,下载安装该软件后无法打开提示雅思君已停止,三星I959铁通光钎10M下载安装该软件后无法打开提示雅思君已停止经多次安装打开测试仍是如此无法继续测试希望我的测试能给你提供帮助,审核通过,9,2015-12-15 17:37:30
152,发现闪退BUG图已经上传了现象是打开后黑屏然后又退到这个界面中APP根本就进不去,发现闪退BUG图已经上传了现象是打开后黑屏然后又退到这个界面中APP根本就进不去,审核通过,21,2015-12-15 17:46:51
153,这个软件太差了直接闪退根本不兼容,这个软件太差了直接闪退根本不兼容我估计很多测试者都是一样的情况建议直接关闭这个任务,审核通过,6,2015-12-15 18:30:10
154,安装后点击打开没有任何提示闪退,安装后点击打开没有任何提示闪退安装后点击打开没有任何提示闪退,审核通过,3,2015-12-15 18:33:30
155,点击打开黑屏然后退出无任何提示和显示,点击打开黑屏然后退出无任何提示和显示,审核通过,13,2015-12-15 18:33:52
156,安装完成点击进入软件然后闪退回桌面,安装完成点击进入软件然后闪退回桌面多次尝试进入软件任然回到桌面无法进入软件,审核通过,18,2015-12-15 19:01:29
