id,bug详情,复现步骤,审核状态,重复情况,提交时间
1,点击相机图标进入橱窗模块上传图片,按提示所给账号密码可正常登陆到工作台然后点击相机图标准备进入橱窗模块上传图片此时会出现密码错误或账号不存在用的是小米手机3,审核通过,16,2015-11-10 20:50:06
2,管理员未登录或登陆状态已失效,测试时刚点击申请换书时又出现管理员未登录或登陆状态已失效,审核通过,10,2015-11-10 20:50:06
3,经常性的自动退出测试无法继续进行,测试期间经常莫名其妙的退出尝试数次根本无法进行测试是不是同一个账号很多人在登录,审核通过,20,2015-11-10 20:51:07
4,无法完成上传活动内容提示密钥过期,无法完成上传活动内容提示密钥过期酷派9150安卓41,审核通过,15,2015-11-10 20:55:30
5,测试过程中频繁退出至登录界面,本人手机魅蓝note1电信版安卓版本444网络环境50M电信光纤网络畅通测试过程中频繁退出至登录界面整个测试过程至少有6次以上正在按要求一步一步的测试项目拍照的图片还没有上传还没有保存突然退至登录界面显示管理员未登录或登录状态实效那个状态失效的失效俩字还弄成白字写成实效低级错误啊这是,审核通过,20,2015-11-10 21:08:51
6,点击上传活动频繁出现管理员未登录或登陆态失效,点击上传活动频繁出现管理员未登录或登陆态失效,审核通过,5,2015-11-10 21:11:33
7,登陆上去频繁出现管理员未登录或登陆态失效,登陆上去频繁出现管理员未登录或登陆态失效,审核通过,5,2015-11-10 21:11:33
8,登入不成功显示管理员未陆入或登陆态实效,登入不成功显示管理员未陆入或登陆态实效,审核通过,0,2015-11-10 21:17:37
9,登入不成功显示管理员未陆入或登陆态实效,登入不成功显示管理员未陆入或登陆态实效,审核通过,0,2015-11-10 21:17:37
10,出现青番茄管理端已停止运行的字样出现闪退程序异常退出,出现青番茄管理端已停止运行的字样出现闪退程序异常退出,审核通过,2,2015-11-10 21:20:37
11,每次输完活动都显示密钥已过期请重新输入重试了好多次还是没办法成功上传活动,点击上传活动把详细信息输进去但是每次输完活动都显示密钥已过期请重新输入重试了好多次还是没办法成功上传活动,审核通过,19,2015-11-10 21:20:37
12,点击申请换书把信息输入点击确认后跳出来说管理员未登陆或登陆态实效无法正常申请重复尝试多次都是这样无法正常申请换书,点击申请换书把信息输入点击确认后跳出来说管理员未登陆或登陆态实效无法正常申请重复尝试多次都是这样无法正常申请换书,审核通过,8,2015-11-10 21:20:37
13,上传活动自动返回登陆界面,点击工作台点击活动点击上传活动自动返回登陆界面提示密钥错误或者过期请重新登陆,审核通过,17,2015-11-10 21:21:21
14,第一次点击相机提示密码过期直接退出在登录页面,1点击工作台2点击相机图标无法进入橱窗模块上传图片直接闪退到登录页面提示密码错误或者密码过期请重新登录,审核通过,11,2015-11-10 21:30:59
15,点击添加图片信息无法保存编辑的信息,1进入INLIBRARY橱窗页面2点击右上角的相机3从相册选择选择一个照片后点击添加图片信息4点击编辑输入问题后无法保存编辑信息,审核通过,1,2015-11-10 21:30:59
16,选择图片后点击保存直接退出提示密码错误或者密码过期请重新登录,1进入INLIBRARY橱窗页面2点击右上角的相机3从相册选择选择一个照片后点击保存,审核通过,11,2015-11-10 21:30:59
17,上传活动页面点击提交后退出到登录页面提示密码错误或者无效请重新输入,1点击工作台2点击活动3点击上传活动输入正确信息后点击提交,审核通过,19,2015-11-10 21:30:59
18,点击申请换书直接退出到登录页面提示管理员未登录或者登录无效,1点击工作台2点击申请换书直接退出到登录页面提示管理员未登录或者登录无效,审核通过,13,2015-11-10 21:30:59
19,点击相机图标进入之后选择照片就跳转到登陆页面提示管理员未登陆或者登陆态实效,点击相机图标进入之后选择照片就跳转到登陆页面提示管理员未登陆或者登陆态实效,审核通过,12,2015-11-10 21:37:26
20,输入活动信息点击提交之后跳转到登陆页面提示密钥错误或者过期需要重新登陆,输入活动信息点击提交之后跳转到登陆页面提示密钥错误或者过期需要重新登陆,审核通过,14,2015-11-10 21:37:26
21,填好换书内容后提交跳转到登陆页面提示实效,填好换书内容后提交跳转到登陆页面提示实效,审核通过,12,2015-11-10 21:37:26
22,我用的红米1S电信版按照要求选好图片上传时直接推出上传网页跳转到登陆界面提示错误,我用的红米1S电信版按照要求选好图片上传时直接推出上传网页跳转到登陆界面提示错误,审核通过,9,2015-11-10 21:38:37
23,我用的红米1S电信版按照要求输入内容在选好图片上传时系统提示出错APP停止运行,我用的红米1S电信版按照要求输入内容在选好图片上传时系统提示出错APP停止运行,审核通过,9,2015-11-10 21:38:37
24,我用的红米1S电信版按照要求的账号登陆后输入内容上传时提示管理员未登陆或者登陆时效,我用的红米1S电信版按照要求的账号登陆后输入内容上传时提示管理员未登陆或者登陆时效,审核通过,9,2015-11-10 21:38:37
25,从手机选择图片时程序崩溃,上传活动时选择照片或海报时本地文件选择打开后程序崩溃重启,审核通过,18,2015-11-10 21:39:34
26,上传过程中登出系统提示密码错误或者过期需要重新登录,登录进入app点击工作台点击相机图标进入橱窗模块选择拍照或者相册图片上传点击保存显示上传但立马登出系统提示密码错误或者过期需要重新登录,审核通过,11,2015-11-10 21:40:45
27,提交失败无法上传活动提示密码错误或者过期需要重新登录,点击工作台点击活动点击上传活动编写活动内容点击上传活动app登出系统提示密码错误或者过期需要重新登录,审核通过,19,2015-11-10 21:40:45
28,提交申请失败提示管理员未登陆或登陆态实效,打开app点击工作台点击申请换书填写内容点击提交登出系统提示管理员未登陆或登陆态实效再次进入appapp不稳定未操作过了几秒自动登出系统提示管理员未登陆或登陆态实效,审核通过,8,2015-11-10 21:40:45
29,经常自动退出登陆,每次上传提交任务照片等操作时自动退出登陆不知是否因多人同时做任务,审核通过,7,2015-11-10 21:52:41
30,登陆状态失效无法完成活动发布,登陆状态失效无法完成活动发布华为P6安卓44wifi,审核通过,10,2015-11-10 21:54:54
31,没法做啊老被挤掉怎么往下进行希望多几个账号或可多处登录,没法做啊老被挤掉怎么往下进行希望多几个账号或可多处登录,审核通过,7,2015-11-10 21:58:46
32,在橱窗页面添加图片后点击编辑图片信息没办法保存编辑的信息,点击工作台点击相机图标进入橱窗模块上传图片添加图片后点击编辑图片信息没办法保存编辑的信息,审核通过,1,2015-11-10 22:11:45
33,上传活动失败提示要重新登录,小米4电信版上传活动时报错提示秘钥错误或过期需要重新登录直接重新登录不成功退出app后可再次登录但上传活动依然如此报错重复3次依然如此,审核通过,19,2015-11-10 22:25:32
34,在申请换书页面提交时跳转入登陆界面,在申请换书界面提交申请时出现跳转到登陆界面显示为登录状态失效重复测试显示同样的界面,审核通过,8,2015-11-10 22:31:40
35,密匙已过期闪退密匙已过期闪退密匙已过期闪退,密匙已过期闪退密匙已过期闪退密匙已过期闪退,审核通过,6,2015-11-10 23:03:54
36,管理员未登陆或登陆实效管理员未登陆或登陆实效,管理员未登陆或登陆实效管理员未登陆或登陆实效管理员未登陆或登陆实效,审核通过,12,2015-11-10 23:03:54
37,上传活动失败一直显示没有填写详细,上传活动失败一直显示没有填写详细但是我该填都填了,审核通过,19,2015-11-10 23:06:20
38,经常闪退无法正常使用,经常闪退无法正常使用用着用着就跳了出去无法正常使用,审核通过,9,2015-11-10 23:06:20
39,进入橱窗模块上传图片选择相册上传到最后保存时会出现错误跳转到启动页提示,进入橱窗模块上传图片选择相册上传到最后保存时会出现错误跳转到启动页提示,审核通过,16,2015-11-10 23:35:38
40,上传活动时选择照片后停止运行,上传活动时选择了照片还未确认提示停止运行,审核通过,2,2015-11-11 00:05:14
41,第一次上传活动图片时程序停止运行,第一次上传活动图片时程序停止运行第二次成功上传停止运行bug日志已截图上传,审核通过,2,2015-11-11 03:12:32
42,在更改地址栏更改地址没有更改地址前无法保存,在更改地址栏更改地址只是更改了省份市县区没有更改详细地址前无法保存,审核通过,18,2015-11-11 04:50:29
43,测试账号登入后有时刷新后账号自动退出有时不退出,测试账号登入后有时刷新后账号自动退出有时不退出,审核通过,20,2015-11-11 08:21:08
44,程序在第一次启动时一定要在第一次启动操作才会出现错误退出重启不行除非从内存清除缓存否则第二次启动不会出现错误提示在上述步骤最后上传图片时会缦执砦筇转,程序在第一次启动时一定要在第一次启动操作才会出现错误退出重启不行除非从内存清除缓存否则第二次启动不会出现错误提示在上述步骤最后上传图片时会缦执砦筇转,审核通过,18,2015-11-11 08:24:19
45,点击工作台点击申请换书提示问题,点击工作台点击申请换书提示管理员未登入或登陆态实效,审核通过,8,2015-11-11 09:30:31
46,按要求上传图片时提示密匙过期,点击工作台按要求点击相机图标进入橱窗模块选择图片后上传上传时程序跳转到开屏首页并提示密匙错误或过期需要重新登录,审核通过,16,2015-11-11 09:38:56
47,上门换书时间段设置开始可晚于结束,跳转至换书内容填写界面换书数量大于80本小于80可提示联系手机手机位数不对可提示上门换书时间段若开始时间晚于结束时间没有提示可以直接提交显然违背实际情况,审核通过,4,2015-11-11 09:38:56
48,在测试的时候经常出现管理员未登录或登录态实效,在测试的时候经常出现管理员未登录或登录态实效需要重新输入密码才能进去这个问题出现好几次,审核通过,13,2015-11-11 10:06:47
49,点击申请换书的时候自动退出提示管理员未登录或登录态实效,点击申请换书的时候自动退出提示管理员未登录或登录态实效重复测试3次均出现这个问题第四次才成功,审核通过,13,2015-11-11 10:06:47
50,点击上传会跳到登录页面提示管理员未登陆或登陆态实效,点击活动上传会跳到登录页面提示管理员未登陆或登陆态实效,审核通过,12,2015-11-11 10:07:50
51,没有点退出但软件会自动退出然后又要重新登录,没有点退出但软件会自动退出然后又要重新登录,审核通过,20,2015-11-11 10:10:24
52,登陆后打开相机退出登陆提示密钥过期或者错误要重新登陆,登陆后打开相机退出登陆提示密钥过期或者错误要重新登陆,审核通过,14,2015-11-11 10:11:02
53,点击活动时退出登陆提示密钥过期或者错误要重新登陆,点击活动时退出登陆提示密钥过期或者错误要重新登陆再次重新登陆有时可以打开发布提交时又出现同样的错误,审核通过,14,2015-11-11 10:11:02
54,点击申请换书时退出登陆提示管理员未登录或登陆态实效要重新登陆,点击申请换书时退出登陆提示管理员未登录或登陆态实效要重新登陆再次可以进入提交时又出现同样问题,审核通过,8,2015-11-11 10:11:02
55,登录管理员账户后点击工作台点击活动点击右上角上传活动标题写百度MALL双十一吃饺子活动内容写双十一吃饺子了类型为分享会时间设置为201511111032到201512111430活动海报上传了相册中的一张截图点击提交时报错提示密钥错误或者过期需要重新登录多次尝试依然如此,登录管理员账户后点击工作台点击活动点击右上角上传活动标题写百度MALL双十一吃饺子活动内容写双十一吃饺子了类型为分享会时间设置为201511111032到201512111430活动海报上传了相册中的一张截图点击提交时报错提示密钥错误或者过期需要重新登录多次尝试依然如此,审核通过,15,2015-11-11 10:40:03
56,不能多人同时登录管理员账户否则在进行修改操作时会提示密钥错误或者过期需要重新登录,不能多人同时登录管理员账户否则在进行修改操作时会提示密钥错误或者过期需要重新登录,审核通过,14,2015-11-11 10:40:03
57,初次启动点击相机图标进入橱窗模块上传图片最后完成时会出现错误跳转提示回到初始页第二次启动不会出现,初次启动点击相机图标进入橱窗模块上传图片最后完成时会出现错误跳转提示回到初始页第二次启动不会出现,审核通过,16,2015-11-11 10:43:58
58,第一次点击活动后自动退回到登陆页,第一次点击工作台中的活动后自动退回到登陆页提示管理员未登陆或登陆状态失效,审核通过,10,2015-11-11 11:04:03
59,点击之后就返回登录界面提示已经过期什么的怎么回事啊,点击之后就返回登录界面提示已经过期什么的怎么回事啊,审核通过,17,2015-11-11 11:09:29
60,点击之后就返回登录界面提示已经过期什么的怎么回事啊不能进行这一步,点击之后就返回登录界面提示已经过期什么的怎么回事啊不能进行这一步,审核通过,17,2015-11-11 11:09:29
61,点击换书之后再填写表格之后再点击之后就返回到了登录状态是不是应该这样的,点击换书之后再填写表格之后再点击之后就返回到了登录状态是不是应该这样的,审核通过,10,2015-11-11 11:09:29
62,点击相机图标进入橱窗模块上传图片上传失败,点击相机图标进入橱窗模块上传图片上传失败提示密码错误或过期重新登入反复尝试无果,审核通过,16,2015-11-11 11:16:32
63,点击相机图标上传照片后直接退出到登录页面并提示密码错误或密码过期需重新登录,点击工作台点击相机图标进入橱窗模块上传图片选择照片后点击保存出现错误提示密码错误或密码过期需重新登录,审核通过,11,2015-11-11 16:02:50
64,点击添加图片信息无法保存编辑的内容,1点击工作台点击相机图标进入橱窗模块点击右上角的相机按钮2从相册中选择图片后点击添加图片信息,审核通过,1,2015-11-11 16:02:50
65,进入橱窗页面点击设为封面提示管理员未登录或者登录无效,进入橱窗页面点击设为封面提示管理员未登录或者登录无效,审核通过,13,2015-11-11 16:02:50
66,点击申请换书失败退回到登录页面提示管理员未登录或者登录无效,1点击工作台申请换书直接退出到登录页面提示管理员未登录或者登录无效,审核通过,13,2015-11-11 16:02:50
67,申请换书点击提交后出现错误,进入申请换书界面输入内容点击提交提示管理员未登陆或登陆态失效重新登录在测试还是这样的错误,审核通过,8,2015-11-11 18:32:12
68,无法上传并保存图片自动退出登陆,无法上传并保存图片一点上传或保存就自动退出登陆提示密钥错误或过期需要重新登录重新登陆了还是这样,审核通过,11,2015-11-11 19:32:58
69,提交活动后自动退出登陆,设置完活动后点击提交自动退出登陆提示密钥错误或者过期需要重新登陆重新登陆后再次尝试创建活动创建成功,审核通过,14,2015-11-11 19:32:58
70,一段时间不操作后自动退出登陆,一段时间不操作自动退出登陆大约一分钟未操作提示管理员未登陆或登陆态失效,审核通过,5,2015-11-11 19:32:58
71,保存活动时系统自动重新回到登录界面,登录后在新建了一个活动保存时应用直接退出到登录界面重新登录登录后还是同样的问题,审核通过,17,2015-11-11 19:46:01
72,第一次按照操作界面进入橱窗页后会有提示登录账号过期请重新登录刚登陆完点击的操作怎么会马上过期呢再一次登录后没有这个问题了直接进入橱窗页面,打开app登录点击工作台点击相机在进入橱窗的过程中有提示登录账号过期请重新登录没有进入橱窗页直接返回到登录页面再一次登录后不在有提示直接进入橱窗页面,审核通过,3,2015-11-11 19:53:22
73,和上个bug类似第一次操作没有进入相应的页面有提示并返回登录页面再一次登录,打开app点击工作台点击活动点击上传活动上传活动有提示并返回登录页面再一次登录后可以正常进入长传活动页面,审核通过,17,2015-11-11 19:53:22
74,操作未完成即提示登陆已过期需要重新登录,1登陆进入工作台2单击相机图标3进入橱窗上传图片4从相册选择图片wifi上传5多次提示登陆过期需要重新登录字样并进入登录页面只抓到一次屏,审核通过,3,2015-11-11 20:46:22
75,操作未完成即提示登陆已过期需要重新登录,1登陆进入工作台2单击相机图标3进入橱窗上传图片4从相册选择图片wifi上传5多次提示登陆过期需要重新登录字样并进入登录页面只抓到一次屏,审核通过,3,2015-11-11 20:46:38
76,点击工作台相机选择照片后点击保存提示密码过期需要重新登陆,点击工作台相机选择照片后点击保存提示密码过期需要重新登陆,审核通过,11,2015-11-11 22:16:36
77,进入橱窗页面选择图片后点击添加图片信息无法保存编辑的内容,进入橱窗页面选择图片后点击添加图片信息无法保存编辑的内容,审核通过,1,2015-11-11 22:16:37
78,点击工作台活动随机出现崩溃退出到登录页面提示管理员未登陆或登陆态失效,点击工作台活动随机出现崩溃退出到登录页面提示管理员未登陆或登陆态失效,审核通过,5,2015-11-11 22:16:37
79,点击工作台申请换书随机出现崩溃退出到登录页面提示管理员未登陆或登陆态失效,点击工作台申请换书随机出现崩溃退出到登录页面提示管理员未登陆或登陆态失效,审核通过,5,2015-11-11 22:16:37
80,跳转至填写活动内容界面输入内容后点击提交无反应,跳转至填写活动内容界面输入内容后点击提交无反应,审核通过,15,2015-11-11 22:39:24
81,跳转至换书内容填写界面输入内容点击无反应,跳转至换书内容填写界面输入内容点击无反应,审核通过,4,2015-11-11 22:39:28
82,活动界面第一个活动海报图片不能看全被即将开始进行中已结束遮住一小部分,安装打开app工作台界面活动进入活动界面活动界面第一个活动海报图片不能看全被即将开始进行中已结束遮住一小部分,审核通过,17,2015-11-12 10:24:05
83,图片保存后跳转不成功,图片保存后跳转不成功点击保存后跳转会初始登录界面第二次上传2张图片保存后跳转成功,审核通过,6,2015-11-12 11:52:56
84,频繁跳到登陆页面老是这样,在做测试任务的时候老是出现登陆失败或失效等情况,审核通过,7,2015-11-12 12:55:16
85,登陆后老是自动退出可能是有别人在登录但也可能是其它问题,登陆随意操作一会后自动退出再重新登录,审核通过,20,2015-11-12 13:00:43
86,活动内容框内无法填写内容,点击工作台点击活动点击上传活动上传活动,审核通过,15,2015-11-12 13:46:17
87,点击工作台点击相机图标进入橱窗模块上传图片在上传图片的时候出现密钥错误或者过期需要重新登陆,点击工作台点击相机图标进入橱窗模块上传图片在上传图片的时候出现密钥错误或者过期需要重新登陆,审核通过,16,2015-11-12 19:32:22
