id,bug详情,复现步骤,审核状态,重复情况,提交时间
265,登陆app，打开练习记录，随便选一个记录点击击入，只显示上方时间跳动，下面无题目出现,登陆app，打开练习记录，随便选一个记录点击击入，只显示上方时间跳动，下面无题目出现,审核通过,8,2016-01-12 15:02:05
266,点击左铡导航，点我的收藏，不能单一选择删除，只有删除所有收藏题目,点击左铡导航，点我的收藏，不能单一选择删除，只有删除所有收藏题目,审核不通过,4,2016-01-12 15:02:20
267,屏开左边人菜单，点设置，第一个显示设置，怎么是调用手机的显示的设置，而不是本app的,屏开左边人菜单，点设置，第一个显示设置，怎么是调用手机的显示的设置，而不是本app的,审核不通过,23,2016-01-12 15:02:55
268,选择一个练习完成后，怎么不提示结束练习结束,选择一个练习完成后，怎么不提示结束练习结束,审核通过,18,2016-01-12 15:03:15
269,点击左铡导航，点我的收藏，不能单一选择删除，只有删除所有收藏题目,点击左铡导航，点我的收藏，不能单一选择删除，只有删除所有收藏题目,审核不通过,4,2016-01-12 15:03:27
270,进入软件，点击设置，点击下载路径无反应，无法更改下载路径，一般的软件都可以更改，这点不是很合理。,进入软件，点击设置，点击下载路径无反应，无法更改下载路径，一般的软件都可以更改，这点不是很合理。,审核不通过,3,2016-01-12 15:03:52
271,下载安装app后，点击其中一个题库下载后，一直正在加载中，按返回键无法退出加载,下载安装app后，点击其中一个题库下载后，一直正在加载中，按返回键无法退出加载,审核不通过,11,2016-01-12 15:04:09
272,下载安装app后，点击左上角按钮，进入后点最下面的关闭怎么是跳出请选择你的专业考试，而不是关闭左侧导航,下载安装app后，点击左上角按钮，进入后点最下面的关闭怎么是跳出请选择你的专业考试，而不是关闭左侧导航,审核不通过,1,2016-01-12 15:04:22
273,下载安装app点忘记密码，无法转跳到找回页面。,下载安装app点忘记密码，无法转跳到找回页面。下载安装app点忘记密码，无法转跳到找回页面。,审核不通过,10,2016-01-12 15:04:47
274,下载安装app屏开左侧菜单，点收藏再点右上角的删除按键。怎么只能删除所有收藏，而不能删除其中某一个,下载安装app屏开左侧菜单，点收藏再点右上角的删除按键。怎么只能删除所有收藏，而不能删除其中某一个,审核不通过,4,2016-01-12 15:04:59
275,下载安装app屏开左侧菜单，点错题再点右上角的删除按键。怎么只能删除所有错题，而不能删除其中某一个,下载安装app屏开左侧菜单，点错题再点右上角的删除按键。怎么只能删除所有错题，而不能删除其中某一个,审核通过,4,2016-01-12 15:05:14
276,美图手机，点击进入左上角菜单栏，点击专业，加载缓慢，平均至少需要三秒以上才能加载成功,美图手机，点击进入左上角菜单栏，点击专业，加载缓慢，平均至少需要三秒以上才能加载成功,审核不通过,6,2016-01-12 15:05:27
277,未登陆状态下可以下载专业题库，但是不能打开，建议统一一下，统一登陆后下载和查看,未登陆状态下可以下载专业题库，但是不能打开，建议统一一下，统一登陆后下载和查看,审核通过,34,2016-01-12 15:05:36
278,试题无法下载，一直在加载中,试题无法下载，一直在加载中。安卓5.1，华为4x,审核通过,25,2016-01-12 15:05:46
279,用户名为3个字符也可以注册（提示4个以上）,用户名为3个字符也可以注册（提示4个以上）。安卓5.1，华为4x,审核通过,7,2016-01-12 15:06:10
280,密码3个字符也可以注册（提示6个以上）,密码3个字符也可以注册（提示6个以上）。安卓5.1，华为4x,审核不通过,7,2016-01-12 15:06:25
281,注册时用户名有中文时可以注册，但登录不了,注册时用户名有中文时可以注册，但登录不了。提示连接超时。安卓5.1，华为4x,审核通过,27,2016-01-12 15:06:33
282,没有办法更改存储路径,登录软件－设置－缓存路径，点击无反应。安卓5.1，华为4x,审核不通过,3,2016-01-12 15:06:45
283,用百度微任务app打开闪退,点击左侧的添加题库，然后一直加载，点击取消的那个图标，手机闪退，我的是华为荣耀7，然后通过百度微任务打开，也是闪退，直接打开也是闪退,审核通过,33,2016-01-12 15:06:53
284,进度统计需要重启才能显示,"1.做题
2.返回主页面，“题目类型统计”显示有变化，根据做的题目统计
3.“进度统计”还是空的，没有变化
4.退出应用，重新进入，“进度统计”刷新，有变化",审核通过,17,2016-01-12 15:06:59
