id,bug详情,复现步骤,审核状态,重复情况,提交时间
92,点击界面上忘记密码按键无反应,点击“登录”界面，然后点击“忘记密码”按键无反应，没有对话框弹出,审核通过,5,2016-01-11 17:24:01
93,读取速度慢，甚至获取失败，有时候会有卡顿。,读取速度慢一直在加载重启应用才好使，，有时候获取失败，有时候会有卡顿。,审核通过,16,2016-01-11 17:24:10
94,注册时，输入用户名弹出的键盘可以输入汉字，但是登陆的弹出的键盘不能直接输入汉字。,注册时，输入用户名弹出的键盘可以输入汉字，但是登陆的弹出的键盘不能直接输入汉字，,审核通过,29,2016-01-11 17:24:19
95,登录界面，点击”忘记密码“按钮没有反应。,登录界面，点击”忘记密码“按钮没有反应，没有跳转到相应的页面。,审核通过,10,2016-01-11 17:24:26
96,用户设置-点击”下载路径“，没有动作。,用户设置-点击”下载路径“，不能弹出设置窗口，没有动作。,审核通过,3,2016-01-11 17:24:36
97,用户设置-题库激活，弹出窗口后，不能用手机自带返回键返回上一层。,用户设置-题库激活，弹出窗口后，不能用手机自带返回键返回上一层，不符合用户习惯。,审核通过,30,2016-01-11 17:24:47
98,注册中文户名成功后，不能登录。,注册中文户名成功后，不能登录。提示：连接超时请重新登录。,审核通过,27,2016-01-11 17:24:56
99,下载专业试题退出后出现屏闪,进去杏林题库后按照要求找到‘‘专业’’后点击‘‘临床’’项目第一项确定安装后一直加载不进去就用手机其他功能，再次进入杏林题库的时候就总是闪屏进不去了,审核通过,25,2016-01-11 17:25:01
100,无法下载专业试题，显示正在加载中,"打开app,点击左上角菜单键，选择专业，任意选择一专业试题进行下载",审核通过,25,2016-01-11 17:25:06
101,"无法下载专业试题的情况下，点击手机home键回手机主页或者从关闭app，重新打开app,闪退，无法打开app","打开app,点击左上角菜单键，选择专业，任意选择一专业试题进行下载,点击手机home键回手机主页，重新打开app",审核通过,25,2016-01-11 17:25:12
102,无法下载专业试题，显示正在加载中,"打开app,点击左上角菜单键，选择专业，任意选择一专业试题进行下载",审核通过,25,2016-01-11 17:25:30
103,"无法下载专业试题的情况下，点击手机home键回手机主页或者从关闭app，重新打开app,闪退，无法打开app","打开app,点击左上角菜单键，选择专业，任意选择一专业试题进行下载,点击手机home键回手机主页，重新打开app",审核通过,25,2016-01-11 17:25:42
104,在进行测试各个专业下载的时候app闪退了,在进行测试各个专业下载的时候app闪退了。小米手机3。,审核通过,34,2016-01-11 17:25:51
105,打开app 点击左上角符号进入 点击登录 点击下面忘记密码 无任何反应 无法正常使用找回密码功能,打开app 点击左上角符号进入 点击登录 点击下面忘记密码 无任何反应 无法正常使用找回密码功能,审核通过,10,2016-01-11 17:25:59
106,打开app 点击左上角符号进入  点击练习 提示一直在加载中 无法实际进入,打开app 点击左上角符号进入  点击练习 提示一直在加载中 无法实际进入,审核通过,15,2016-01-11 17:26:06
107,打开app 在使用途中 点击练习无法加载以后 退出软件 结束后台进程以后 再次点击app 进入 闪退 闪退,打开app 在使用途中 点击练习无法加载以后 退出软件 结束后台进程以后 再次点击app 进入 闪退 闪退,审核通过,33,2016-01-11 17:26:12
108,选择好专业并下载后，点击一套题目做题，上面的计时是正常进行的，点击右上角的答题卡后，计时停止，继续做题也不会继续计时。,选择好专业并下载后，点击一套题目做题，上面的计时是正常进行的，点击右上角的答题卡后，计时停止，继续做题也不会继续计时。,审核通过,31,2016-01-11 17:26:18
109,点击右边的收藏进入我的收藏，这里的标签体现和主界面不一样，用户不习惯。点击哪个标签就哪个标签有颜色 和主界面一样是最好的,点击右边的收藏进入我的收藏，这里的标签体现和主界面不一样，用户不习惯。点击哪个标签就哪个标签有颜色 和主界面一样是最好的,审核不通过,13,2016-01-11 17:26:27
110,我的收藏页面点击任一题目的问号，能显示正确答案，但下面还有个null，是不是要放一下解答。,我的收藏页面点击任一题目的问号，能显示正确答案，但下面还有个null，是不是要放一下解答。,审核通过,13,2016-01-11 17:26:34
111,点击某个题目下面的我的笔记，点击 圆圈加号，无效，点击后面的灰色区域能弹出。这里点击圆圈加号也应该可以弹出，不然还以为没什么。,点击某个题目下面的我的笔记，点击 圆圈加号，无效，点击后面的灰色区域能弹出。这里点击圆圈加号也应该可以弹出，不然还以为没什么。,审核通过,21,2016-01-11 17:26:41
112,点击我的收藏的删除按钮点击确认，跳出bug提示停止运行。另外这里应该允许选择删除而不是全部删除。,点击我的收藏的删除按钮点击确认，跳出bug提示停止运行。另外这里应该允许选择删除而不是全部删除。,审核通过,4,2016-01-11 17:26:48
113,在某道题目下做笔记，保存然后删除，界面显示内容以及情况，再次点击编辑的时候原内容原封不出出现在内容框。那删除也没什么，在编辑里修改即可了。,在某道题目下做笔记，保存然后删除，界面显示内容以及情况，再次点击编辑的时候原内容原封不出出现在内容框。那删除也没什么，在编辑里修改即可了。,审核通过,26,2016-01-11 17:26:53
114,注销后提示登录，但是左上角还是有返回按钮，并且可以进入练习记录里继续做题。,注销后提示登录，但是左上角还是有返回按钮，并且可以进入练习记录里继续做题。,审核通过,31,2016-01-11 17:27:05
115,错题删除时软件报停。,"1.安装并打开软件，注册登录
2.选择专业，下载任意一题库
3.选择练习，开始练习题目，当出现错题后，打开“错题”
点击右上角“删除”按钮，选确认清除所有题目
此时软件提示“杏林题库 已停止”后自动回到软件首页

samsung s4 i9500  安卓4.4.2   wifi",审核通过,4,2016-01-11 17:27:11
116,用户登录界面的忘记密码按钮无效，点击没有反应,用户登录界面的忘记密码按钮无效，点击没有反应,审核通过,10,2016-01-11 17:27:18
117,综合排名界面的表格里，点击表格任一位置，左边的top逐一消失，直至全无，这个设置不是很懂,综合排名界面的表格里，点击表格任一位置，左边的top逐一消失，直至全无，这个设置不是很懂,审核通过,23,2016-01-11 17:27:24
118,无法删除历史错题里的错题点击删除无法删除,无法删除历史错题的错题点击删除无法删除，无法删除历史错题的错题点击删除无法删除,审核通过,4,2016-01-11 17:27:30
119,无法下载题库，手机会卡死了,无法下载题库，app无反应，点击强制关闭后，app无法再次打开。乐视1sx500最新版本,审核不通过,32,2016-01-11 17:27:41
120,正常下载和安装好app后，打开app后直接闪退,正常下载和安装好app后，打开app后显示跳转页面后直接闪退,审核通过,33,2016-01-11 17:27:49
121,日期排列不符合正常人习惯,"进入app,图表横轴下方日期从左至右分别为8号，6号，4号，而一般人习惯是4,6,8这样的排序。",审核不通过,19,2016-01-11 17:27:56
122,在登录页面--点击忘记密码--没有任何提示，要是忘记密码就别想登录了。,在登录页面--点击忘记密码--没有任何提示，要是忘记密码就别想登录了。,审核通过,10,2016-01-11 17:28:01
123,"随意下载一个专业后，点击练习，里面的练习都点第一个，到了答题界面，选择答案的时候选择a会把b也选择上而且取消不了b,","随意下载一个专业后，点击练习，里面的练习都点第一个，到了答题界面，选择答案的时候选择a会把b也选择上而且取消不了b,",审核通过,18,2016-01-11 17:28:07
124,在答题界面，点击右上角，答题卡，完全没必要弄这个弹出的动画，四核2g的手机弹出都感觉略慢。,在答题界面，点击右上角，答题卡，完全没必要弄这个弹出的动画，四核2g的手机弹出都感觉略慢。,审核通过,26,2016-01-11 17:28:15
125,在答题界面，下方有我的笔记，编辑笔记保存后，在我的笔记看不到有保存的笔记。,在答题界面，下方有我的笔记，编辑笔记保存后，在我的笔记看不到有保存的笔记。,审核通过,21,2016-01-11 17:28:22
126,在答题界面，收藏几个题目后，点左上角的点击弹出的收藏，在收藏界面，点击右上角的垃圾桶图标，提示清空收藏的题目，确认后无法删除所有收藏，返回在进入也还在。,在答题界面，收藏几个题目后，点左上角的点击弹出的收藏，在收藏界面，点击右上角的垃圾桶图标，提示清空收藏的题目，确认后无法删除所有收藏，返回在进入也还在。,审核通过,13,2016-01-11 17:28:27
127,在进入试题的时候，多做了些题，弹出输入注册码的提示，但此软件没有地方提示去哪里获取注册码。,在进入试题的时候，多做了些题，弹出输入注册码的提示，但此软件没有地方提示去哪里获取注册码。,审核通过,16,2016-01-11 17:28:33
128,在进入试题的时候，多做了些题，弹出输入注册码的提示，点击取消激活，要点击2至3次才会退出这个弹窗。,在进入试题的时候，多做了些题，弹出输入注册码的提示，点击取消激活，要点击2至3次才会退出这个弹窗。,审核通过,16,2016-01-11 17:28:40
129,选择专业，下载出错，请重试,"1.点击专业
2.点击“临床执业”
3.显示下载出错",审核通过,34,2016-01-11 17:28:52
130,"同一设备,不同的用户登陆,显示的都是第一次登陆的用户数据","打开app,用不同的用户登陆后,显示的都是第一次登陆的用户数据",审核通过,29,2016-01-11 17:28:59
131,未登陆也会显示学习跟踪和练习记录数据,"进入app,登陆,练习答题后退出,再次进入app,未登陆也能显示学习跟踪和练习记录数据,系统设计有问题,这些数据不是从服务器取回,而是直接从设备取",审核通过,22,2016-01-11 17:29:05
132,综合排名页面无排名数据,"进入app,进入综合排名页,无任何数据,按理说既使整个系统只有我一个人使用,至少应该有我自己一个人的数据",审核通过,22,2016-01-11 17:29:10
133,"清空数据功能无效,清空后所有数据仍在","进入app,进入设置,点击清除缓存,提示""确定要清空所有数据"",选确定,提理清理成功,但实际所有的数据仍在,并未清除",审核通过,22,2016-01-11 17:29:17
134,启动时提示“杏林题库 已停止。”，无法进一步测试,启动时提示“杏林题库 已停止。”，无法进一步测试,审核通过,28,2016-01-11 17:29:29
135,注册账号登陆后，点击左上角菜单，再点击练习，选择一个专业进行下载，下载完成后，又回到了首页页面，并没有进入练习页面。,注册账号登陆后，点击左上角菜单，再点击练习，选择一个专业进行下载，下载完成后，又回到了首页页面，并没有进入练习页面。,审核通过,34,2016-01-11 17:29:36
136,注册账号登陆后，点击左上角菜单，接着点击设置，再点击题库激活，并没有输入验证码，就点击“确认激活”按钮，提示“注册失败”，应该是提示“请输入验证码”。,注册账号登陆后，点击左上角菜单，接着点击设置，再点击题库激活，并没有输入验证码，就点击“确认激活”按钮，提示“注册失败”，应该是提示“请输入验证码”。,审核通过,14,2016-01-11 17:29:41
137,注册账号登陆后，点击左上角菜单，接着点击练习，点击章节练习，点击第一章，点击第一项，进入答题页面，点击我的笔记，点击输入框不能输入。,注册账号登陆后，点击左上角菜单，接着点击练习，点击章节练习，点击第一章，点击第一项，进入答题页面，点击我的笔记，点击输入框不能输入。,审核通过,26,2016-01-11 17:29:52
138,登陆界面点击忘记密码无反应,"打开app,点击左上角图标,调出左侧菜单,选择登陆,进入登陆界面,点击右下角的""忘记密码"",无任何反应",审核通过,5,2016-01-11 17:29:58
139,注册页面表单验证，姓名长度和字符类型没有验证，姓名可以是7位汉字,注册页面表单验证，姓名长度和字符类型没有验证，姓名可以是7位汉字,审核通过,29,2016-01-11 17:30:07
140,"注册时,姓名填写少于3个字符时提示连接超时","打开app,点击左上角图标,调出左侧菜单,选择登陆,进入登陆界面,点击注册,进入注册界面,如果姓名输入框输入少于3个字符时,注册提示""连接超时"",而不是姓名长度不够",审核通过,29,2016-01-11 17:30:14
141,注册账号登陆后，点击左上角菜单，接着点击练习，点击章节练习，点击第一章，点击第一项，进入答题页面，点击我的笔记，点击编辑图标，然后进行文字输入，点击保存，提示保存成功，再点击删除，提示删除成功，再点击编辑，刚才写过的文字又出来了。,注册账号登陆后，点击左上角菜单，接着点击练习，点击章节练习，点击第一章，点击第一项，进入答题页面，点击我的笔记，点击编辑图标，然后进行文字输入，点击保存，提示保存成功，再点击删除，提示删除成功，再点击编辑，刚才写过的文字又出来了。,审核通过,26,2016-01-11 17:30:23
142,点击试题选择了药师题目，弹出弹窗确认安装前两次进不去没有安装，第三次才开始安装。,点击试题选择了药师题目，弹出弹窗确认安装前两次进不去没有安装，第三次才开始安装，并且安装的时候还老是卡住，点击两三之后才成功安装。,审核不通过,11,2016-01-12 09:01:44
143,试题安装好进不去，再点击试题的时候提示，需要登录才可以进入试题，除了专业和设置两个可以进去其他的都进不去。,"试题安装好进不去，再点击试题的时候提示，需要登录才可以进入试题，明
明之前没有登录就点进去了，除了专业和设置两个可以进去其他的都进不去。",审核不通过,25,2016-01-12 09:01:58
144,首次启动程序，点击用户设置里面的其他设置项，会出现闪退，错误提示。,首次启动程序，点击用户设置里面的其他设置项，会出现闪退，错误提示。,审核通过,23,2016-01-12 09:02:05
145,"注册时,用户名和密码栏显示有字符数限制,实际可以输入任意长度字符","打开app,点击左上角图标,调出左侧菜单,选择登陆,进入登陆界面,点击注册,进入注册界面,用户名栏显示""请输入4-20位字符"",密码栏显示""请输入6-15位字符"",但实际可以输入任意长度字符,也能注册成功",审核通过,7,2016-01-12 09:02:15
146,"用户反馈界面,只输入二个字符提示网络连接超时,输入三个以上字符提示提交成功","打开app,用注册的用户密码登陆后,打开左侧菜单,进入设置,再进入用户反馈,反馈框内只提示200字以内,但在反馈框里输入1个字符时,点击发送后,提示""网络连接超时"",输入3个以上字符时可以正常提交",审核通过,29,2016-01-12 09:02:22
147,设置界面下载路径无法更改,"打开app,用注册的用户密码登陆后,打开左侧菜单,进入设置界面,系统设置下的显示和清除缓存都可以调出相应界面,但点击下载路径无任何反应,无法修改下载路径",审核通过,3,2016-01-12 09:02:28
148,"练习界面,点击最下栏我的笔记旁的""+""号时""+""号变成""-""号,但没出现笔记输入框","打开app,登陆并下载专业题库后,进入练习题,点击最下边我的笔记旁的""+""号时""+""号变成""-""号,却没出现笔记输入框,只有点了""+""旁的空白处才能出现笔记输入框",审核通过,21,2016-01-12 09:02:34
149,"做练习题时,输入笔记保存,再删除,再次输入时仍会出现删除的内容","打开app,登陆进入练习题,输入笔记保存,再删除,再次点击铅笔图标输入时仍会出现刚才删除的内容,只有完全退出练习界面再进入时才不能出现删除的内容",审核通过,26,2016-01-12 09:02:40
150,"进入练习或试题界面,点击右上角的?标志,显示""详解"",但再次点击?标志时,详解不能隐藏","打开app,登陆进入练习题界面,点击右上角的?标志,显示""详解"",但再次点击?标志时,详解不能隐藏",审核通过,24,2016-01-12 09:02:49
151,"练习界面答题时,点击右上角的答题卡标志,弹出答题卡,关闭答题卡后,练习界面上端的练习时间就不会再继续变化","打开app,登陆进入练习题答题时,点击右上角的答题卡标志,弹出答题卡,关闭答题卡后,练习界面上端的练习时间就不会再继续变化",审核通过,2,2016-01-12 09:02:58
152,"收藏不能删除,进入收藏界面,点击右上角的删除图标,提示""确定要清空所有收藏的题"",点确定后仍面回到收藏界面,原来的收藏也未删除","打开app,登陆进入练习界面收藏某一题,再进入收藏界面,出现收藏的题目,点击右上角的删除图标,提示""确定要清空所有收藏的题"",点确定后仍面回到收藏界面,原来的收藏并未删除",审核通过,13,2016-01-12 09:03:06
153,"错题不能删除,进入错题界面,点击右上角的删除图标,提示""确定要清空所有错误的题目"",点确定后跳到收藏界面,再次进入错题界面,发现仍未删除","打开app,登陆进入练习界面答错某一题,再进入错题界面,出现答错的题目,点击右上角的删除图标,提示""确定要清空所有错误的题目"",点确定后跳到收藏界面,再次进入错题界面,发现仍未删除",审核通过,4,2016-01-12 09:03:12
154,打开软件左侧登录，登录页面，点击注册，账号规定只能输入20字符，实际可以输入更多个字符,打开软件左侧登录，登录页面，点击注册，账号规定只能输入20字符，实际可以输入更多个字符,审核通过,14,2016-01-12 09:03:20
155,打开软件左侧登录，登录页面，点击注册，输入信息后点击注册，提示连接超时，无法完成注册,打开软件左侧登录，登录页面，点击注册，输入信息后点击注册，提示连接超时，无法完成注册,审核通过,27,2016-01-12 09:03:30
156,打开软件左侧登录，登录页面，点击忘记密码，没有任何提示。,打开软件左侧登录，登录页面，点击忘记密码，没有任何提示。,审核通过,10,2016-01-12 09:03:41
157,打开软件，要求下载题库，按照要求选择题库下载，练习，必须要登录可用,打开软件，要求下载题库，按照要求选择题库下载，练习，必须要登录可用,审核不通过,32,2016-01-12 09:03:55
158,按照要求注册，显示注册成功，直接跳转登录界面，输入注册内容，显示链接超时，无法登录,按照要求注册，显示注册成功，直接跳转登录界面，输入注册内容，显示链接超时，无法登录,审核通过,27,2016-01-12 09:04:01
159,打开软件，用户登录，点击忘记密码，没有反应，该功能无法使用,打开软件，用户登录，点击忘记密码，没有反应，该功能无法使用,审核通过,10,2016-01-12 09:04:08
160,打开软件，点击设置，其他设置，用户反馈，输入意见，必须要登录,打开软件，点击设置，其他设置，用户反馈，输入意见，必须要登录,审核不通过,23,2016-01-12 09:04:15
161,点击用户注册，密码和确认密码，输入字符超过15个，能输入26个,"点击用户注册，然后输入密码，密码可以输入最少25个字符，和系统6到15个字符不符合。
手机：小米3.
系统版本：安卓 4.4.4
网络：电信wifi。",审核通过,7,2016-01-12 09:04:20
162,点击用户注册，密码和确认密码，可以输入全部的空格,"点击用户注册，然后输入密码，密码可以输入最少20个空格，
手机：小米3.
系统版本：安卓 4.4.4
网络：电信wifi。",审核通过,7,2016-01-12 09:04:30
163,点击用户注册，输入用户名，可以无限的输入字符，并且可以输入特殊符号，点击注册，没有任何提示，并且注册成功,"点击用户注册，输入用户名，可以无限的输入字符，并且可以输入特殊符号，点击注册，没有任何提示，并且注册成功
手机：小米3.
系统版本：安卓 4.4.4
网络：电信wifi。",审核通过,7,2016-01-12 09:04:39
164,点击用户登录，点击忘记密码，没有任何反映,点击用户登录，点击忘记密码，没有任何反映,审核通过,10,2016-01-12 09:04:50
165,下载路径可以自动更改下载路径可以自动更改,下载路径可以自动更改下载路径可以自动更改下载路径可以自动更改下载路径可以自动更改 华为 4x wifi,审核通过,3,2016-01-12 09:04:57
166,可否用微信或者qq登录 然后还可以互相交流 形成一个论坛,可否用微信或者qq登录 然后还可以互相交流 形成一个论坛 华为 4x wifi,审核不通过,9,2016-01-12 09:05:04
167,网络连接正常情况下，在“练习”习题集“中，“中药学”“方剂学”“中医妇科学”“中医儿科学”“诊断医学基础“内第5行习题无法显示。,进入应用后，打开”练习“，分别查看”中药学”“方剂学”“中医妇科学”“中医儿科学”“诊断医学基础“内第5行习题。,审核通过,24,2016-01-12 09:05:11
168,在选择了一个题目做的时候，大概会在结尾的几道题会一直提示输入注册码激活，不输入的话将无法进行下一题,在选择了一个题目做的时候，大概会在结尾的几道题会一直提示输入注册码激活，不输入的话将无法进行下一题,审核通过,16,2016-01-12 09:05:18
169,在收藏一个题目之后，进入我的收藏，点击右上方的清空收藏的题目，确认之后，收藏的题目还在，所以清空收藏题目按钮无效,在收藏一个题目之后，进入我的收藏，点击右上方的清空收藏的题目，确认之后，收藏的题目还在，所以清空收藏题目按钮无效,审核通过,13,2016-01-12 09:05:23
170,类型为0% b1和4.0% a1/a2 时在比例图上重叠在一起了,当做题类型0% b1和4.0% a1/a2时，b1和4.0%显示重叠在一起了，如图1.png,审核通过,19,2016-01-12 09:05:30
171,专业考试试题无法安装，一直显示正在加载中，手机网络无问题。,"专业考试试题无法安装，一直显示正在加载中，手机网络无问题。
bug复现率：100%
手机型号：mx4 系统：安卓5.1",审核通过,6,2016-01-12 09:05:35
172,无法退出，只能通过返回桌面，杀后台，强制退出。,"无法退出，只能通过返回桌面，杀后台，强制退出。
手机型号：mx4 系统：安卓5.1",审核通过,11,2016-01-12 09:05:41
173,再次打开软件，软件闪退，无法进入。,"再次打开软件，软件闪退，无法进入。
bug复现率：100%
手机型号：mx4 系统：安卓5.1",审核通过,33,2016-01-12 09:05:47
174,长时间加载不出来，闪退。手机为魅族flyme系统。,长时间加载不出来，闪退。手机为魅族flyme系统。,审核通过,33,2016-01-12 09:05:53
175,下载考试题库的提示，反复出现,进入软件后，提示下载相应的题库，点击确认后。点击进入登录界面，然后按返回键返回主界面，提示依然出现，按返回键没有反应，必须点击确认后才能接着使用软件，可以把这个提示改为进入软件只提示一次，这样反复出现，用户体验很差,审核通过,32,2016-01-12 09:05:58
176,进入app，点击左侧菜单栏，选择最下面的设置，在用户设置页面无法修改下载路劲,进入app，点击左侧菜单栏，选择最下面的设置，在用户设置页面无法修改下载路劲,审核通过,23,2016-01-12 09:06:03
177,注册页面，忘记密码点击无反应,登入到注册页面，点击忘记密码，无跳转任何页面，完全无反应。,审核通过,5,2016-01-12 09:06:08
178,进入软件，在登录界面点击忘记密码，无反应,进入软件，在登录界面点击忘记密码，软件无法进入找回密码界面，无任何提示。,审核通过,5,2016-01-12 09:06:13
179,无法加载考试题目。。。,点击专业，选择任何一项资质考试，开始加载，会一直在加载中，无法加载,审核通过,20,2016-01-12 09:06:18
180,加载考试题目中无法取消,点击专业，选择任何一项资质考试，开始加载，在加载中点击叉叉无效，无法取消。,审核通过,20,2016-01-12 09:06:23
