id,bug详情,复现步骤,审核状态,重复情况,提交时间
181,强制关闭后，应用崩溃无法打开,在无限加载中，强制关闭应用后，应用崩溃无法打开，卸载后重新下载才能打开,审核通过,32,2016-01-12 09:06:29
182,登录页面，点击“忘记密码”无任何反应,登录页面，点击“忘记密码”无任何反应，无任何提示，或界面弹出,审核通过,5,2016-01-12 09:06:34
183,注册问题。。。。。。。。。。。。,注册时，输入手机号码，注册其他都没问题，但是却显示我的这个移动号码手机号不正确，换了一个电信的就注册进去了,审核通过,12,2016-01-12 09:06:41
184,题目数量显示不对。。。。。。。。。。。。,练习记录显示1月8日做了4道题，1月9日做了5道题；但是在学习跟踪里面的进度统计又显示1月8日做了7道题，1月9日做了6道题,审核通过,17,2016-01-12 09:06:48
185,与华为安卓5.0系统兼容性差。,与华为安卓5.0系统兼容性差，经常卡屏，影响使用。,审核不通过,30,2016-01-12 09:06:54
186,考试专业里边点击护理专业，长时间不能安装。,考试专业里边点击护理专业，长时间不能安装，并且不能返回退出。,审核通过,20,2016-01-12 09:07:00
187,软件有闪退现象，不能正常打开。,软件有闪退现象，闪退以后再点击进入，软件不能正常打开。,审核通过,33,2016-01-12 09:07:05
188,打开app----专业----护理学（师）----下载好题库后----返回，点击试题----高频考点---一片空白，提示敬请期待更新。,打开app----专业----护理学（师）----下载好题库后----返回，点击试题----高频考点---一片空白，提示敬请期待更新。,审核通过,0,2016-01-12 09:07:12
189,打开app----专业----护理学（师）----下载好题库后----返回，点击练习----随便点击一道练习题，软件报错。。。。。,打开app----专业----护理学（师）----下载好题库后----返回，点击练习----随便点击一道练习题，软件报错。。。。。,审核通过,0,2016-01-12 09:07:18
190,打开app----专业----护理学（师）----下载好题库后----返回，点击收藏------软件报错。如截图显示。。。。,打开app----专业----护理学（师）----下载好题库后----返回，点击收藏------软件报错。如截图显示。。。。,审核通过,0,2016-01-12 09:07:24
191,打开app----设置----用户反馈----一开始就提示只能输入200字，好吧，当我们输入到190字的时候，点击发送发聩信息按钮，就提示，当前文本过长。。。。,打开app----设置----用户反馈----一开始就提示只能输入200字，好吧，当我们输入到190字的时候，点击发送发聩信息按钮，就提示，当前文本过长。。。。,审核通过,29,2016-01-12 09:07:30
192,打开app----专业----临床助理-----练习------选择一道练习题---点击底部的我的笔记按钮，没有任何反应。。。。,打开app----专业----临床助理-----练习------选择一道练习题---点击底部的我的笔记按钮，没有任何反应。。。。,审核通过,24,2016-01-12 09:07:35
193,打开app----专业----临床助理-----练习------选择一道练习题---当做到第10道练习题后，会弹窗注册页面，并且还要弹出3次，设计太不合理了。,打开app----专业----临床助理-----练习------选择一道练习题---当做到第10道练习题后，会弹窗注册页面，并且还要弹出3次，设计太不合理了。,审核通过,24,2016-01-12 09:07:40
194,打开app----错题----点击右上角的垃圾桶按钮----只能清空所有题目，不能单独选择。,打开app----错题----点击右上角的垃圾桶按钮----只能清空所有题目，不能单独选择。,审核通过,13,2016-01-12 09:07:48
195,打开app----登陆账号后---注销----返回到了登陆界面----发现忘记密码按钮，点击没有任何反应。,打开app----登陆账号后---注销----返回到了登陆界面----发现忘记密码按钮，点击没有任何反应。,审核通过,10,2016-01-12 09:07:53
196,注册后登陆 ，下载考试题库失败，再次打开软件出现闪退。,"下载软件安装后登陆注册，点击左侧菜单 ，下载相应题库失败，再次登陆出现闪退。
手机华为荣耀4x 型号：che1-cl20  android版本 5.1  4g网络",审核通过,32,2016-01-12 09:07:58
197,电信手机号码181开头手机号不能注册,"电信手机号码181开头手机号不能注册
手机华为荣耀4x 型号：che1-cl20  android版本 5.1  4g网络",审核通过,12,2016-01-12 09:08:10
198,"点击左侧菜单 ，下载相应题库，题库不能下载
手机华为荣耀4x 型号：che1-cl20  android版本 5.1  4g网络","点击左侧菜单 ，下载相应题库，题库不能下载
手机华为荣耀4x 型号：che1-cl20  android版本 5.1  4g网络",审核通过,32,2016-01-12 09:08:14
199,登录app时显示登陆超时,打开app然后进行注册，注册完毕开始登陆显示登陆超时，多事重试无果,审核通过,27,2016-01-12 09:08:19
200,学习跟踪，题目类型统计底色跟蚊子颜色接近，文字看不清楚。,学习跟踪，题目类型统计底色跟蚊子颜色接近，文字看不清楚。链接：http://pan.baidu.com/s/1devwdwx 密码：kxov,审核通过,19,2016-01-12 09:08:27
201,综合排名，准确率排名是top10-top1，常理都是从top1-top10。,综合排名，准确率排名是top10-top1，常理都是从top1-top10。链接：http://pan.baidu.com/s/1devwdwx 密码：kxov,审核通过,22,2016-01-12 09:08:32
202,软件登录页的忘记密码点击无反应,软件登录页的忘记密码点击无反应。安卓5.1，华为4x,审核通过,5,2016-01-12 09:08:45
203,用户登陆，忘记密码点击没有任何反应。,用户登陆，忘记密码点击没有任何反应。链接：http://pan.baidu.com/s/1devwdwx 密码：kxov,审核通过,10,2016-01-12 09:08:52
204,登陆后，我的收藏，点击右上角的删除，弹出提示确定要清空数据，选择确认后，app崩溃。,登陆后，我的收藏，点击右上角的删除，弹出提示确定要清空数据，选择确认后，app崩溃。链接：http://pan.baidu.com/s/1devwdwx 密码：kxov,审核通过,13,2016-01-12 09:08:59
205,下载公卫助理，进入练习，3章节练习，4环境卫生学，1环境卫生学。从右上角的答题卡中选择第11题，提示输入激活码，但仍弹出提示说当前题目11。,下载公卫助理，进入练习，3章节练习，4环境卫生学，1环境卫生学。从右上角的答题卡中选择第11题，提示输入激活码，但仍弹出提示说当前题目11。链接：http://pan.baidu.com/s/1devwdwx 密码：kxov,审核通过,2,2016-01-12 09:09:03
206,"下载公卫助理，进入练习，3章节练习，4环境卫生学，1环境卫生学，只能做前10题，做第11题时，提示输入激活码，激活失败。在公卫助理-练习记录页面，显示的环境卫生学也是

10题。此时点击练习记录的环境卫生学，自动显示了第11题，并且可以选择答案。但当从右上角的答题卡选择第12题时，又提示输入激活码。练习跟练习记录中的激活码处理不一致","下载公卫助理，进入练习，3章节练习，4环境卫生学，1环境卫生学，只能做前10题，做第11题时，提示输入激活码，激活失败。在公卫助理-练习记录页面，显示的环境卫生学也是

10题。此时点击练习记录的环境卫生学，自动显示了第11题，并且可以选择答案。但当从右上角的答题卡选择第12题时，又提示输入激活码。练习跟练习记录中的激活码处理不一致.链接：http://pan.baidu.com/s/1devwdwx 密码：kxov",审核通过,2,2016-01-12 09:09:09
207,下载公卫助理，进入练习，3章节练习，4环境卫生学，1环境卫生学。顶部计时从00：00开始按秒计时。但当选择右上角的答题卡弹出答题卡选项，点击手机的返回键返回答题页面，计时停止了。,下载公卫助理，进入练习，3章节练习，4环境卫生学，1环境卫生学。顶部计时从00：00开始按秒计时。但当选择右上角的答题卡弹出答题卡选项，点击手机的返回键返回答题页面，计时停止了。链接：http://pan.baidu.com/s/1devwdwx 密码：kxov,审核通过,2,2016-01-12 09:09:14
208,"。下载公卫助理-试题-1公卫试题-2公卫试题二-2公卫试题二 第二单元，自动显示第一题，不作答。选择答题卡的第10题并作答成功。返回到练习记录页面，公卫试题二 第二单元显

示已作答1题，点击进入，显示的是第2道题。但实际第1道题并没有作答，之前作答的是第10道题，应该显示第1道题才对。显示的作答题目应当是有权限的未作答的序号最小的题。","。下载公卫助理-试题-1公卫试题-2公卫试题二-2公卫试题二 第二单元，自动显示第一题，不作答。选择答题卡的第10题并作答成功。返回到练习记录页面，公卫试题二 第二单元显

示已作答1题，点击进入，显示的是第2道题。但实际第1道题并没有作答，之前作答的是第10道题，应该显示第1道题才对。显示的作答题目应当是有权限的未作答的序号最小的题。链接：http://pan.baidu.com/s/1devwdwx 密码：kxov",审核通过,31,2016-01-12 09:09:18
209,打开软件，正常注册后不能登录,正常安装软件，成功打开软件，兼容很好，注册账户成功，进入登录界面，输入账号密码显示，连接超时请重新登录,审核通过,27,2016-01-12 09:09:23
210,再登陆页面下面有个找回密码 点击没有反应 反复尝试均不能找回密码 手机型号vivox5l,再登陆页面下面有个找回密码 点击没有反应 反复尝试均不能找回密码 手机型号vivox5l,审核通过,10,2016-01-12 09:09:28
211,进入软件，点击专业，口腔助理，显示正在加载中，等待约6分钟，一直加载，然后手机死机。（我用的是小米4）,进入软件，点击专业，口腔助理，显示正在加载中，等待约6分钟，一直加载，然后手机死机。（我用的是小米4）,审核通过,6,2016-01-12 09:09:33
212,软件卡死后，重启手机，重新进入软件，没等进入操作页面，立刻闪退，尝试很多次都进不去。重装软件后，又可进入。,软件卡死后，重启手机，重新进入软件，没等进入操作页面，立刻闪退，尝试很多次都进不去。重装软件后，又可进入。,审核通过,15,2016-01-12 09:09:37
213,进入软件，点击练习，口腔执业，显示正在加载中，等待约5分钟，一直加载，然后手机死机。（我用的是小米4）重启手机，重新进入软件，没等进入操作页面，立刻闪退，重装软件后，又可进入。,进入软件，点击练习，口腔执业，显示正在加载中，等待约5分钟，一直加载，然后手机死机。（我用的是小米4）重启手机，重新进入软件，没等进入操作页面，立刻闪退，重装软件后，又可进入。,审核通过,15,2016-01-12 09:09:42
214,进入软件，点击试题，公卫助理，显示正在加载中，等待约5分钟，一直加载，然后手机死机。（我用的是小米4）重启手机，重新进入软件，没等进入操作页面，立刻闪退，重装软件后，又可进入。,进入软件，点击试题，公卫助理，显示正在加载中，等待约5分钟，一直加载，然后手机死机。（我用的是小米4）重启手机，重新进入软件，没等进入操作页面，立刻闪退，重装软件后，又可进入。,审核通过,15,2016-01-12 09:09:47
215,进入软件，点击收藏，中西医执业，显示正在加载中，等待约5分钟，一直加载，然后手机死机。（我用的是小米4）重启手机，重新进入软件，没等进入操作页面，立刻闪退，重装软件后，又可进入。,进入软件，点击收藏，中西医执业，显示正在加载中，等待约5分钟，一直加载，然后手机死机。（我用的是小米4）重启手机，重新进入软件，没等进入操作页面，立刻闪退，重装软件后，又可进入。,审核通过,15,2016-01-12 09:09:57
216,进入软件，点击错题，中医执业，显示正在加载中，等待约5分钟，一直加载，然后手机死机。（我用的是小米4）重启手机，重新进入软件，没等进入操作页面，立刻闪退，重装软件后，又可进入。,进入软件，点击错题，中医执业，显示正在加载中，等待约5分钟，一直加载，然后手机死机。（我用的是小米4）重启手机，重新进入软件，没等进入操作页面，立刻闪退，重装软件后，又可进入,审核通过,15,2016-01-12 09:10:04
217,登陆后，选择专业公卫助理进行下载，没有下载到100%时进行关闭。点击其他专业进行下载时，弹出的提示信息仍然是公卫助理，而不是所选择的其他专业名称。,登陆后，选择专业公卫助理进行下载，没有下载到100%时进行关闭。点击其他专业进行下载时，弹出的提示信息仍然是公卫助理，而不是所选择的其他专业名称。链接：http://pan.baidu.com/s/1devwdwx 密码：kxov,审核通过,34,2016-01-12 09:10:26
218,登陆后，选择任一专业进行下载，没有下载到100%时进行关闭。多次重复这个步骤，app崩溃。,登陆后，选择任一专业进行下载，没有下载到100%时进行关闭。多次重复这个步骤，app崩溃。链接：http://pan.baidu.com/s/1devwdwx 密码：kxov,审核通过,34,2016-01-12 09:10:35
219,进入软件，点击设置，点击下载路径无反应，不能改变设置软件的下载路径，不是很合理。,进入软件，点击设置，点击下载路径无反应，不能改变设置软件的下载路径，不是很合理。,审核通过,3,2016-01-12 09:10:40
220,"""忘记密码”功能无法使用","""忘记密码”功能无法激活无法使用，无法找回密码，。",审核通过,10,2016-01-12 09:10:44
221,题库下载前账号无法注册和登录,杏林题库是一款针对医学专业人士的安卓类app，在下载所学专业的题库前，账号注册和登录无法使用，只能操作进行简单的左右滑屏，题库还需要激活才能学习，我提一个小建议，软件方能不能引进商业合作伙伴设置一些免费课程。,审核通过,14,2016-01-12 09:10:51
222,设置中的下载路径实际不可设置,设置中虽然有下载路径一项，但实际只是显示，并不能进行更改。,审核通过,3,2016-01-12 09:10:56
223,下载专业时，退出的按钮无用。,当不小心点错专业后，界面中有中断的按钮叉，但实际不可操作，必须下载完成。,审核通过,34,2016-01-12 09:11:02
224,设置中的下载路径实际不可设置,设置中虽然有下载路径一项，但实际只是显示，并不能进行更改。,审核通过,3,2016-01-12 09:11:06
225,学习跟踪界面，题目类型的绿色和黄色的配色使数字不易看清,学习跟踪界面，题目类型的绿色和黄色的配色使数字不易看清...............,审核通过,19,2016-01-12 09:11:12
226,用户设置里的下载路径不能更改,用户设置里的下载路径不能更改............................,审核通过,3,2016-01-12 09:11:16
227,用户登录界面点击忘记密码，无提示，无任何反应,用户登录界面点击忘记密码，无提示，无任何反应..............,审核通过,5,2016-01-12 09:11:21
228,在专业里，点击任意考试专业，在点击提示信息的确定按钮后开始下载，但提示信息不消失,在专业里，点击任意考试专业，在点击提示信息的确定按钮后开始下载，但提示信息不消失,审核通过,20,2016-01-12 09:11:26
229,用户设置里的显示设置怎么更改的是系统的显示,用户设置里的显示设置怎么更改的是系统的显示.................,审核通过,23,2016-01-12 09:11:32
230,下载专业时，退出的按钮无用。,当不小心点错专业后，界面中有中断的按钮叉，但实际不可操作，必须下载完成。,审核通过,34,2016-01-12 09:11:39
231,下载路径无法更改，默认是手机自带的储存盘，无法选择另行插入的tf卡,打开软件，点击左上角的“三横杠”，然后选择设置，可以看到下载路径为/storage/sdcard0/jsxl，无法更改成其他路径，假设下载的东西比较多跟杂乱的时候，想根据下载内容进行分类存储就无法做到了,审核通过,3,2016-01-12 09:11:44
232,各个栏目切换操作过快时会导致软件退出,打开软件，在各个栏目之间进行快速切换操作，一会之后就退出，提示已停止运行。然后无法再次进入软件。只能重新安装再进入软件,审核通过,15,2016-01-12 09:11:48
233,运行软件后-----选择“用户登录”------选择“忘记密码”，忘记密码无反应！,运行软件后-----选择“用户登录”------选择“忘记密码”，忘记密码无反应！,审核通过,5,2016-01-12 09:11:54
234,运行软件后，下载题库，选择“请选择你的考试专用”选择“临床执业”，一直提示加载中。,"运行软件后，下载题库，选择“请选择你的考试专用”选择“临床执业”，一直提示加载中。

小米2s",审核通过,20,2016-01-12 09:11:58
235,添加专业时一直都添加不到,下载安装app进入菜单，添加专业时一直都添加不到,审核通过,34,2016-01-12 09:12:04
236,注册账号时账号能够输入的特殊字符，在登录账号时账号又不能输入此特殊字符,注册时使用的全角“。。。。”注册的账号，结果登录时界面不让输入全角“。”，只能输入半角“.”导致登录不了,审核通过,14,2016-01-12 09:12:09
237,第一次打开程序转到设置页，点其他设置里面的项会提示错误信息。,第一次打开程序转到设置页，点其他设置里面的项会提示错误信息。,审核通过,23,2016-01-12 09:13:36
238,打开软件，在“用户登录”界面，点“忘记密码”，忘记密码无响应！,打开软件，在“用户登录”界面，点“忘记密码”，忘记密码无响应！,审核通过,5,2016-01-12 09:13:43
239,打开软件，登录后，下载题库，作“练习”，在“错题”，“学习跟踪”和“练习记录”无法对应，“学习跟踪”的“进度统计”统计不准确。,打开软件，登录后，下载题库，作“练习”，在“错题”，“学习跟踪”和“练习记录”无法对应，“学习跟踪”的“进度统计”统计不准确。,审核通过,17,2016-01-12 09:13:50
240,题库里面的题，临床执业，临考押题第一单元第4题，个别题布局不美观，临考押题第一单元第4题有些题似乎不正确。,题库里面的题，临床执业，临考押题第一单元第4题，个别题布局不美观，临考押题第一单元第4题有些题似乎不正确。,审核通过,31,2016-01-12 09:13:59
241,打开软件后，点“注销”，退出登录后，重新打开软件自动进入上次下载的题库，题库统计界面，应该进入登录界面。,打开软件后，点“注销”，退出登录后，重新打开软件自动进入上次下载的题库，题库统计界面，应该进入登录界面。,审核通过,32,2016-01-12 09:14:09
242,用户登录处，点击忘记密码无反应,用户登录处，点击忘记密码无反应、、、、、、、、、、、、、、、、、,审核通过,5,2016-01-12 09:14:15
243,进入软件，选择其中一个考试专业，界面一直显示正在加载中，无法关闭，也无法退出软件。,进入软件，选择其中一个考试专业，界面一直显示正在加载中，无法关闭，也无法退出软件。,审核通过,1,2016-01-12 09:14:21
244,运行软件，多次出现了闪退,出现无法退出软件，清理后台程序退出后，再运行软件，一直出现了闪退，重启手机也不行，只能卸载重装软件,审核通过,33,2016-01-12 09:15:20
245,注册用户后，点忘记密码，按键无反应,进入软件，在用户登陆界面，注册用户后，点忘记密码，按键无反应,审核通过,5,2016-01-12 09:15:26
246,进入软件，选择左上角的按键，点收藏，选择一个专业，界面一直显示正在加载中，无法关闭，也无法退出软件。,进入软件，选择左上角的按键，点收藏，选择一个专业，界面一直显示正在加载中，无法关闭，也无法退出软件。,审核通过,1,2016-01-12 09:16:32
247,加载内容长时间缓冲，无法终止,加载内容长时间缓冲，无法终止，必须强制关闭程序程序打开才能进行其他操作,审核通过,15,2016-01-12 09:16:40
248,点击界面上某些功能按钮无反应,点击登录界面上忘记密码功能按钮无窗口弹出,审核通过,10,2016-01-12 09:16:46
249,在登陆界面，注册用户后，点忘记密码按钮，无反应！,在登陆界面，注册用户后，点忘记密码按钮，无反应！,审核通过,5,2016-01-12 09:16:50
250,进入软件，点击左边专业按钮，选择考试专业，点确定，一直提示正在努力加载中，无法关闭，软件无法退出,进入软件，点击左边专业按钮，选择考试专业，点确定，一直提示正在努力加载中，无法关闭，软件无法退出,审核通过,1,2016-01-12 09:16:56
251,进入软件，点击左边练习按钮，选择考试专业，点确定，一直提示正在努力加载中，无法关闭，软件无法退出,进入软件，点击左边练习按钮，选择考试专业，点确定，一直提示正在努力加载中，无法关闭，软件无法退出,审核通过,1,2016-01-12 09:17:01
252,进入软件，点击左边试题按钮，选择考试专业，点确定，一直提示正在努力加载中，无法关闭，软件无法退出,进入软件，点击左边试题按钮，选择考试专业，点确定，一直提示正在努力加载中，无法关闭，软件无法退出,审核通过,1,2016-01-12 09:17:07
253,进入软件，点击左边收藏按钮，选择考试专业，点确定，一直提示正在努力加载中，无法关闭，软件无法退出,进入软件，点击左边收藏按钮，选择考试专业，点确定，一直提示正在努力加载中，无法关闭，软件无法退出,审核通过,1,2016-01-12 09:17:12
254,进入软件，点击左边收藏按钮，选择考试专业，点确定，一直提示正在努力加载中，无法关闭，软件无法退出,进入软件，点击左边收藏按钮，选择考试专业，点确定，一直提示正在努力加载中，无法关闭，软件无法退出,审核通过,1,2016-01-12 09:21:03
255,出现上述的无法关闭和无法退出软件，清除手机后台程序，关闭软件后，再次打开软件出现闪退，无法正常运行！,出现上述的无法关闭和无法退出软件，清除手机后台程序，关闭软件后，再次打开软件出现闪退，无法正常运行！,审核通过,33,2016-01-12 09:21:09
256,没看到测试题等我们能应用的东西,正常下载安装，打开后按提示找了个“社区护理”专业下载，结果也没看到测试题啊，只有一个界面，界面内容有学习跟踪，联系记录和综合排名，点击后看到对应的的表格，没有试题等内容。,审核通过,8,2016-01-12 09:21:15
257,"安装""临床执业""失败，提示""下载出错，请重试！"";启动app，频繁意外停止。","4g网络下，点击左侧专业，点击""内科学""，提示""下载出错，请重试！""，同时下载其他专业正常下载;频繁点击下载，取消后，出现闪退，之后再次点击，提示意外停止。android4.4.2",审核通过,28,2016-01-12 09:21:20
258,没看到测试题等我们能应用的东西,正常下载安装，打开后按提示找了个“社区护理”专业下载，结果也没看到测试题啊，只有一个界面，界面内容有学习跟踪，联系记录和综合排名，点击后看到对应的的表格，没有试题等内容。,审核通过,8,2016-01-12 09:21:26
259,做题目练习时候有的类型题只读表没有题目内容,打开app登录，选择专业，下载相关专业习题，打开练习，打开易错与避错考题，里面有的题型1正常显示，题型2一片空白,审核通过,31,2016-01-12 09:21:31
260,进入软件，点击左边错题按钮，选择考试专业，点确定，一直提示正在努力加载中，无法关闭，软件无法退出,进入软件，点击左边错题按钮，选择考试专业，点确定，一直提示正在努力加载中，无法关闭，软件无法退出,审核通过,1,2016-01-12 09:21:39
261,界面突然出现停止运行了。,我在安装《公卫执业》的时候，还没安装完毕，就弹出“很抱歉，“吉林题库”已停止运行”。然后就黑屏了。,审核通过,28,2016-01-12 09:39:57
262,屏开左边人菜单，点设置，第一个显示设置，怎么是调用手机的显示的设置，而不是本app的,屏开左边人菜单，点设置，第一个显示设置，怎么是调用手机的显示的设置，而不是本app的,审核通过,23,2016-01-12 09:42:05
263,选择一个练习完成后，怎么不提示结束练习结束,选择一个练习完成后，怎么不提示结束练习结束,审核通过,18,2016-01-12 09:43:57
264,登陆app，打开练习记录，随便选一个记录点击击入，只显示上方时间跳动，下面无题目出现,登陆app，打开练习记录，随便选一个记录点击击入，只显示上方时间跳动，下面无题目出现,审核通过,8,2016-01-12 09:44:04
