id,bug详情,复现步骤,审核状态,重复情况,提交时间
121,易试驾测试:热榜：随便点击一个立即预约进入之后在确定按键下面的试驾协议进入之后是显示错误。一排英文。,易试驾测试:热榜：随便点击一个立即预约进入之后在确定按键下面的试驾协议进入之后是显示错误。一排英文。,审核通过,14,2016-01-17 20:30:05
122,易试驾测试:待试驾点击登录-进入登录界面，在点击隐私协议，也是出现错误。,易试驾测试:待试驾点击登录-进入登录界面，在点击隐私协议，也是出现错误。,审核不通过,23,2016-01-17 20:30:51
123,点击首页的新手引导，进入后页面无法加载成功，显示的是无法找到该页面,点击首页的新手引导，进入后页面无法加载成功，显示的是无法找到该页面,审核通过,39,2016-01-17 20:31:14
124,无法分享到微博。。。。。,首页点击热榜，，点击随意一辆车的图片，，详情页下方点击分享的标志，分享到微信和qq都没问题，就是分享到微博分享不了，出现c400的提示,审核通过,19,2016-01-17 20:31:30
125,登录页面查看隐私协议，页面报错,"1、进入登录页面
2、点击【隐私协议】
实际结果：隐私协议页面报错",审核通过,35,2016-01-17 20:31:44
126,首页，点击新手引导，网页出现错误,我使用的是红米1s电信版，打开app，点击 首页，点击新手引导，网页出现错误,审核通过,26,2016-01-17 20:31:50
127,登陆界面，点击隐私协议后，网页显示错误,我使用的是红米1s电信版，打开app，登陆界面，点击隐私协议后，网页显示错误,审核通过,17,2016-01-17 20:31:57
128,预约试驾，点击试驾协议，网页显示错误,我使用的是红米1s电信版，打开app，首页，点击立即预约，点击试驾协议，网页显示错误,审核通过,17,2016-01-17 20:32:02
129,点击我的，点击设置，点击关于易试驾，网页显示错误,我使用的是红米1s电信版，打开app，点击我的，点击设置，点击关于易试驾，网页显示错误,审核通过,17,2016-01-17 20:32:07
130,我所在的城市为成都，软件定位城市为北京,我使用的是红米1s电信版，打开app，我所在的城市为成都，软件定位城市为北京,审核通过,8,2016-01-17 20:32:12
131,在注册界面，隐私协议出现乱码，,我的手机是奥克斯v928，打开软件，点击我的，点击设置，进入“关于易试驾”，出现乱码，重复多次操作，现象重复出现。,审核通过,15,2016-01-17 20:32:17
132,在预约试驾界面，试驾协议出现错误乱码’,我的手机是奥克斯v928，打开软件，在热榜栏目下，点击立即预约手，点击确定下面的试驾协议，出现错误页面，复多次操作，现象重复出现。,审核通过,33,2016-01-17 20:32:21
133,首页定位城市是北京无法更换，点击北京无反应,我的手机是奥克斯v928，打开软件在首页左上角，定位城市是北京无法更换，点击北京无反应，复多次操作，现象重复出现。,审核通过,8,2016-01-17 20:32:39
134,首页，点击新手引导，之后会出现错误页面,我的手机是小米2a，打开软件，在首页上，点击新手引导，之后会出现错误页面，重复多次做操，现象重现。,审核通过,26,2016-01-17 20:34:26
135,在登录界面，点击“隐私协议‘出现乱码,我的手机是小米2a，打开软件，点击”我的“点击头像进入登录界面，点击“隐私协议‘出现乱码，重复多次做操，现象重现。,审核通过,15,2016-01-17 20:34:30
136,首页定位城市是北京，无法变更定位城市,我的手机是小米2a，打开软件，在首页左上角点击北京无反应，无法变更定位城市，重复多次做操，现象重现。,审核通过,8,2016-01-17 20:34:34
137,打开app后，首页，点击“新手引导”，显示乱码.,打开app后，首页，点击“新手引导”，显示乱码.,审核通过,26,2016-01-17 20:34:42
138,软件无法打开，魅族魅蓝2,软件下载安装后无法打开，魅族魅蓝2，安卓5.1系统,审核通过,26,2016-01-17 20:34:53
139,在预约试驾界面，点击试驾协议，会出现错误页面’,我的手机是小米2a，开软件，在首页上，点击立即预约，点击下面的试驾协议之后会出现错误页面，重复多次做操，现象重现。,审核通过,33,2016-01-17 20:35:01
140,预约试驾，点击页面最下方”试驾协议“，出错。,预约试驾，点击页面最下方”试驾协议“，出错。找不到页面。,审核通过,29,2016-01-17 20:35:07
141,设置-“关于易试驾”页面出错。,设置-“关于易试驾”页面出错。打不开页面，提示，找不到该页面。,审核通过,29,2016-01-17 20:35:17
142,"登录界面，点击隐私协议，无法打开，提示sorry,the page yoou are looking for could not be found","登录界面，点击隐私协议，无法打开，提示sorry,the page yoou are looking for could not be found",审核通过,22,2016-01-17 20:35:23
143,"登录后・设置・关于易试驾，无法打开，提示sorry,the page yoou are looking for could not be found","登录后・设置・关于易试驾，无法打开，提示sorry,the page yoou are looking for could not be found",审核通过,22,2016-01-17 20:35:27
144,首页・左上角定位显示的是北京，本手机定位已开，而且无法点击修改,首页・左上角定位显示的是北京，本手机定位已开，而且无法点击修改,审核通过,28,2016-01-17 20:35:32
145,"首页・中间的新手指引・点击后无法打开，提示sorry,the page yoou are looking for","首页・中间的新手指引・点击后无法打开，提示sorry,the page yoou are looking for",审核通过,22,2016-01-17 20:35:42
146,设置里，进入“关于易试驾”出现乱码,我的手机是中兴努比亚z7max，打开软件，点击我的，点击设置，进入“关于易试驾”出现乱码，重复多次操作，现象重复出现。,审核通过,15,2016-01-17 20:35:47
147,在预约试驾界面，试驾协议出现错误页面’,我的手机是中兴努比亚z7max，打开软件，在首页上，点击立即预约手，点击确定下面的试驾协议，出现错误页面，复多次操作，现象重复出现。,审核通过,33,2016-01-17 20:35:52
148,首页定位城市是北京无法更换，点击北京无反应,我的手机是中兴努比亚z7max，打开软件在首页左上角，定位城市是北京无法更换，点击北京无反应，复多次操作，现象重复出现。,审核通过,8,2016-01-17 20:36:03
149,在登录界面，“隐私协议‘出现乱码,我的手机是中兴努比亚z7max，打开软件，点击我的，点击设头像进入登录界面，进入““隐私协议‘出现乱码，重复多次操作，现象重复出现。,审核通过,15,2016-01-17 20:36:10
150,登陆页-隐私协议页面，出错，打不开页面。,登陆页-隐私协议页面，出错，打不开页面，提示找不到页面。,审核通过,29,2016-01-17 20:36:23
151,"登陆""易试驾"",进入首页,左上角城市点击没反应,无法修改,已经上传图片","登陆""易试驾"",进入首页,左上角城市点击没反应,无法修改,已经上传图片",审核通过,32,2016-01-17 20:36:33
152,"登陆""易试驾"",进入""热榜"",进入某个车型,点分享,选择新浪微博,提示访问出错了,已经上传图片","登陆""易试驾"",进入""热榜"",进入某个车型,点分享,选择新浪微博,提示访问出错了,已经上传图片",审核通过,19,2016-01-17 20:36:38
153,"登陆""易试驾"",进入首页,点击中间的""新手引导"",进入的页面,英文提示页面无法查找到,已经上传图片","登陆""易试驾"",进入首页,点击中间的""新手引导"",进入的页面,英文提示页面无法查找到,已经上传图片",审核通过,39,2016-01-17 20:36:43
154,登录页面的隐私协议，打开查看，显示sorry---看图。。。,登录页面的隐私协议，打开查看，显示sorry---看图。。。,审核通过,13,2016-01-17 20:37:23
155,首页，点击新手引导，显示未能找到页面,首页，点击新手引导，显示未能找到页面.................,审核通过,39,2016-01-17 20:37:28
156,登录界面，点击隐私协议，显示未能找到页面，一堆代码,登录界面，点击隐私协议，显示未能找到页面，一堆代码,审核通过,29,2016-01-17 20:37:33
157,首页顶部的左上角的位置不能选择,进入首页顶部左上角的位置一直显示北京，点击无反应，不能切换到其他城市，,审核通过,16,2016-01-17 20:37:41
158,"新手引导没有信心，提示sorry,the page you are looking for could not be found","打开app,点击首页，点击新手引导，没有信息，提示sorry,the page you are looking for could not be found",审核通过,22,2016-01-17 20:37:47
159,设置里面的“关于易试驾”的连接，点开后，显示“对不起，你查找的网页可能不存在”,进入“我的”，在进入“设置”，点击里面的“关于易试驾”，显示“对不起，你查找的网页可能不存在”的英语语句,审核通过,35,2016-01-17 20:37:52
160,登陆，进到软件【关于】项，出现一堆乱码。,登陆，进到软件【关于】项，出现一堆乱码。看不懂,审核通过,15,2016-01-17 20:37:58
161,新手引导连接，点击后显示“对不起，您查找的网页可能不存在”,进入首页，新手引导连接，点击后显示“对不起，您查找的网页可能不存在”的英文语句,审核通过,39,2016-01-17 20:38:02
162,"在软件“首页”，点击“新手引导”，进入页面后显示“sorry ,the page you are looking could not be found”",looking could not be found”,审核通过,22,2016-01-17 20:38:07
163,测试两次，无法正常进入软件。,测试两次，无法正常进入软件，请查询是哪里的问题。,审核通过,23,2016-01-17 20:38:16
164,"注册登录，打开软件主页，点击主页下面“我的”，再点""设置"",再点“关于易驾驶”，没有关于易驾驶介绍，网页打不开都是英文，出现sorry,the page you are looking for could not be found","注册登录，打开软件主页，点击主页下面“我的”，再点""设置"",再点“关于易驾驶”，没有关于易驾驶介绍，网页打不开都是英文，出现sorry,the page you are looking for could not be found。  手机华为荣耀4x 型号：che1-cl20 android版本 5.1 wifi网络",审核通过,22,2016-01-17 20:38:25
165,"注册登录，打开软件主页，主页点击“新手引导”，打开后没有连接引导,显示sorry,the page you are looking for could not be found。","注册登录，打开软件主页，主页点击“新手引导”，打开后没有连接引导，显示sorry,the page you are looking for could not be found。   手机华为荣耀4x 型号：che1-cl20 android版本 5.1 wifi网络",审核通过,22,2016-01-17 20:38:31
166,安装好后，打开软件，直接闪退,我使用的是小米note顶配版，打开软件，直接闪退,审核通过,31,2016-01-17 20:38:45
167,每次只能手机验证码登录，无法设置密码，进行密码登录。,我的手机是小米2a，登录软件，退出之后重新登录，必须还要验证码，重复多次做操，现象重现。,审核不通过,5,2016-01-18 20:07:29
168,登录软件之后，在设置页面，点击”退出登录“确认后页面不跳转，无提示是否退出成功。,我的手机是小米2a，登录软件成功之后，点击”我的“点击设置，点击退出登录，确认后页面不跳转，无提示是否退出成功。，重复多次做操，现象重现。,审核不通过,6,2016-01-18 20:08:00
169,首页最下方，没有版权提示，联系方式等信息。,首页最下方，没有版权提示，联系方式等信息，整个页面显得虎头蛇尾，不完整。,审核不通过,11,2016-01-18 20:09:21
170,"首页・顶部三个配图，无法点击。点击无反应。
首页・顶部三个配图，无法点击。点击无反应。","首页・顶部三个配图，无法点击。点击无反应。
首页・顶部三个配图，无法点击。点击无反应。",审核不通过,38,2016-01-18 20:10:34
171,进入“热搜”页面，选择第一个选项“讴歌mdx（汽油）”，点击“分享-微信好友”，系统提示“网络连接不可用，请稍后重试”，但此时网络连接正常，通过“qq空间”可以正常进行分享。,进入“热搜”页面，选择第一个选项“讴歌mdx（汽油）”，点击“分享-微信好友”，系统提示“网络连接不可用，请稍后重试”，但此时网络连接正常，通过“qq空间”可以正常进行分享。,审核不通过,25,2016-01-18 20:15:31
172,进入“热搜”页面，选择第一个选项“讴歌mdx（汽油）”，点击“分享-朋友圈”，系统提示“网络连接不可用，请稍后重试”，但此时网络连接正常，通过“qq空间”可以正常进行分享。,进入“热搜”页面，选择第一个选项“讴歌mdx（汽油）”，点击“分享-朋友圈”，系统提示“网络连接不可用，请稍后重试”，但此时网络连接正常，通过“qq空间”可以正常进行分享。,审核不通过,25,2016-01-18 20:16:08
173,进入“热搜”页面，选择第一个选项“讴歌mdx（汽油）”，点击“分享-新浪微博”，进入页面后，页面提示“访问出错了”，此时网络连接正常。,进入“热搜”页面，选择第一个选项“讴歌mdx（汽油）”，点击“分享-新浪微博”，进入页面后，页面提示“访问出错了”，此时网络连接正常。,审核通过,25,2016-01-18 20:16:27
174,点击“我-用户昵称”，修改用户昵称，输入超长用户昵称，点击“确定”，系统提交不成功，但是软件界面下方出现一个方框，没有任何内容。,点击“我-用户昵称”，修改用户昵称，输入超长用户昵称，点击“确定”，系统提交不成功，但是软件界面下方出现一个方框，没有任何内容。,审核通过,24,2016-01-18 20:17:17
175,在“我-试驾记录”中，选择一条试驾记录进行评价，评价给2.5分（2.5星），评价成功后到对应车型下却显示的是3星。,在“我-试驾记录”中，选择一条试驾记录进行评价，评价给2.5分（2.5星），评价成功后到对应车型下却显示的是3星。,审核通过,27,2016-01-18 20:31:50
176,在“我-试驾记录”中，先填写一条记录，成功后，再次添加一条记录，但是在对应的车型下只显示第一条试驾记录。,在“我-试驾记录”中，先填写一条记录，成功后，再次添加一条试驾记录，但是在对应的车型下只显示第一条试驾记录。,审核不通过,20,2016-01-18 20:36:17
177,多个按钮未配置正确url,"1. 新手引导连接不可用
2. 隐私协议
3. 关于易试驾
4. 微博分享",审核通过,39,2016-01-18 20:36:36
178,高级筛选不满足要求会请求失败,"我要约车试驾--> 高级筛选 --> 选一个没有满足要求的条件组合。
应当显示没有合适车辆等信息，结果却出现请求失败。",审核不通过,36,2016-01-18 20:38:56
179,app首页界面，新手指引，打开提示sorry--具体看图。,app首页界面，新手指引，打开提示sorry--具体看图。,审核通过,13,2016-01-18 20:39:10
180,app首页界面，点击一个立即预约，我在这里可以定位自己的位置，4s店定位确实北京，首页动画图说可以自动定位，就近推荐，可惜推荐的是北京。我在广州。,app首页界面，点击一个立即预约，我在这里可以定位自己的位置，4s店定位确实北京，首页动画图说可以自动定位，就近推荐，可惜推荐的是北京。我在广州。,审核通过,12,2016-01-18 20:39:22
181,app首页界面，我要约车试驾，jeep的车标无法显示出来，黑色图标。,app首页界面，我要约车试驾，jeep的车标无法显示出来，黑色图标。,审核通过,18,2016-01-18 20:39:57
182,"app首页界面，点击一个立即预约，底部的试驾协议，打开显示sorry,看图","app首页界面，点击一个立即预约，底部的试驾协议，打开显示sorry,看图",审核通过,13,2016-01-18 20:40:18
183,app我的界面，设置，关于易试驾，点击提示sorry，显示错误。。。看图,app我的界面，设置，关于易试驾，点击提示sorry，显示错误。。。看图,审核通过,13,2016-01-18 20:40:25
184,登录页面的隐私协议，打开查看，显示sorry---看图。。。,登录页面的隐私协议，打开查看，显示sorry---看图。。。,审核通过,13,2016-01-18 20:40:33
185,app首页界面，新手指引，打开提示sorry--具体看图。,app首页界面，新手指引，打开提示sorry--具体看图。,审核通过,13,2016-01-18 20:40:40
186,app首页界面，点击一个立即预约，我在这里可以定位自己的位置，4s店定位确实北京，首页动画图说可以自动定位，就近推荐，可惜推荐的是北京。我在广州。,app首页界面，点击一个立即预约，我在这里可以定位自己的位置，4s店定位确实北京，首页动画图说可以自动定位，就近推荐，可惜推荐的是北京。我在广州。,审核通过,12,2016-01-18 20:40:49
187,app首页界面，我要约车试驾，jeep的车标无法显示出来，黑色图标。,app首页界面，我要约车试驾，jeep的车标无法显示出来，黑色图标。,审核不通过,18,2016-01-18 20:41:44
188,"app首页界面，点击一个立即预约，底部的试驾协议，打开显示sorry,看图","app首页界面，点击一个立即预约，底部的试驾协议，打开显示sorry,看图",审核不通过,13,2016-01-18 20:41:48
189,app我的界面，设置，关于易试驾，点击提示sorry，显示错误。。。看图,app我的界面，设置，关于易试驾，点击提示sorry，显示错误。。。看图,审核不通过,13,2016-01-18 20:41:52
190,意见反馈输入表情提示为小黑块,"1、点击【我的】-【设置】-【意见反馈】
2、输入表情，观察提示（使用搜狗输入法可输入表情）
实际结果：提示为小黑块",审核通过,9,2016-01-18 20:42:33
191,修改昵称输入超过25个汉字，提示错误,"1、点击【我的】-【用户昵称】
2、输入超过25个汉字，观察提示
实际结果：提示为小黑块",审核通过,24,2016-01-18 20:43:16
192,评价试驾记录输入表情提示错误,"1、进入热榜预约试驾，并取消预约
2、进入【我的】-【试驾记录】-【写评价】
3、输入表情，发布评论（使用搜狗输入法可输入表情）
实际结果：提示‘请求失败’",审核通过,27,2016-01-18 20:43:31
193,从首页外的其他模块返回首页时，首页顶部的广告只显示一半,我使用的是红米1s电信版，打开app，从首页外的其他模块返回首页时，首页顶部的广告只显示一半,审核通过,30,2016-01-18 20:43:53
194,从其他界面，点击首页，首页的上面动态广告和搜索栏，不显示，要下拉才能看到,我的手机是奥克斯v928，打开软件，从其他界面，点击首页，首页的上面动态广告和搜索栏，不显示，要下拉才能看到，复多次操作，现象重复出现。,审核通过,3,2016-01-18 20:44:05
195,在搜索详情界面，点击关键词后返回搜索界面,我的手机是奥克斯v928，打开软件，在主页上点击搜索栏，进入搜索界面，点击别克，进入别克详情界面，再次点击别克，就会返回搜索界面，复多次操作，现象重复出现。,审核通过,1,2016-01-18 20:44:45
196,软件不存在设置密码功能，每次都要验证码登录,我的手机是奥克斯v928，打开软件，登录后退出，在登陆，都要验证码，很麻烦,审核不通过,5,2016-01-18 20:45:03
197,"登陆""易试驾""进入首页,最上边有大图标,一共三张大图可以切换,但点击某一张图片之后没有反映,已经上传图片","登陆""易试驾""进入首页,最上边有大图标,一共三张大图可以切换,但点击某一张图片之后没有反映,已经上传图片",审核不通过,32,2016-01-18 20:46:24
198,手机网络顺畅，点击切换各个界面时，图片信息却不能正常显示,手机网络顺畅，点击切换各个界面时，图片信息却不能正常显示，许多图片为灰色背景上面标有“易试驾”的字样,审核不通过,32,2016-01-18 20:47:19
199,在搜索结果界面，点击搜索词后，直接返回搜索界面,我的手机是小米2a，打开软件，在主页上点击，搜索试驾车型，进入搜索界面，点击本田，进入详情界面，在详情界面点击本田，会返回搜索界面，重复多次做操，现象重现。,审核通过,1,2016-01-18 20:47:47
200,从其他界面点击“首页”，返回首页时，上面的滚屏广告只显示一半，要下拉才能看全,我的手机是小米2a，打开软件，点击”我的“然后点击首页，上面的滚屏广告只显示一半，要下拉才能看全，重复多次做操，现象重现。,审核通过,3,2016-01-18 20:47:54
201,"首页・任意一个立即预约，底部的试驾协议，点击后无法打开，提示sorry,the page yoou are looking for","首页・任意一个立即预约，底部的试驾协议，点击后无法打开，提示sorry,the page yoou are looking for",审核通过,22,2016-01-18 20:48:04
202,式加热榜上不显示缩略图。,"试驾热榜上不显示缩略图，并且测试的时候，在首页、热榜、待试驾、我的等几个页面来回切换的时候出现app闪退的情况。
小米手机3.",审核通过,36,2016-01-18 20:48:20
203,关于登录，每次只能验证码登录，无法设置密码，进行密码登录。,我的手机是中兴努比亚z7max，打开软件，登录软件，之后在退出，再次登录时还要验证码，没有设置密码的功能，复多次操作，现象重复出现。,审核不通过,5,2016-01-18 20:48:38
204,登录软件之后，在设置页面，点击”退出登录“确认后页面不跳转，且无提示是否退出成功。,我的手机是中兴努比亚z7max，打开软件，登录软件，之后我的菜单下的设置页面点击退出，之后点击确定，页面不跳转，无法确定是否退出成功。复多次操作，现象重复出现。,审核不通过,6,2016-01-18 20:48:52
205,从”热榜“点击“首页”，返回首页之后，上面的滚屏广告只显示一半，要下拉才能看全,我的手机是中兴努比亚z7max，打开软件，从”热榜“或其他页面，点击“首页后，上面的滚屏广告只显示一半，要下拉才能看全，复多次操作，现象重复出现。,审核通过,3,2016-01-18 20:48:57
206,在搜索结果界面，点击搜索关键词后，直接返回搜索界面,我的手机是中兴努比亚z7max，打开软件，在主页上点击搜索栏，进入搜索界面，点击本田，进入本田详情界面，再次点击本田，就会返回搜索界面，复多次操作，现象重复出现。,审核通过,1,2016-01-18 20:49:04
207,安装好软件，打开软件立即秒退，根本无法打开，我用的是小米4手机。,安装好软件，打开软件立即秒退，根本无法打开，我用的是小米4手机。,审核通过,33,2016-01-18 20:49:10
208,登录软件之后，在设置页面，点击”退出登录“页面不跳转，且无提示是否退出成功,我的手机是奥克斯v928，打开软件，登录软件，之后我的菜单下的设置页面点击退出，之后点击确定，页面不跳转，无法确定是否退出成功。复多次操作，现象重复出现。,审核不通过,6,2016-01-18 20:49:33
209,"""登陆""页面，没获取验证码的情况下，随意输入验证码，点击登录，提示：验证码错误。这应提示：请先获取验证码，更为合理。","""登陆""页面，没获取验证码的情况下，随意输入验证码，点击登录，提示：验证码错误。这应提示：请先获取验证码，更为合理。",审核不通过,2,2016-01-18 20:49:57
210,“待试驾”页面有个红色框是“登陆/注册”，点击后，进去页面，只有登录，没有注册按钮。,“待试驾”页面有个红色框是“登陆/注册”，点击后，进去页面，只有登录，没有注册按钮。,审核不通过,34,2016-01-18 20:50:16
211,“我的”点击最上面，上传图像，点击返回按钮，页面没有直接返回“我的”主页，而是返回页面是黑色的“最近照片”页面。,“我的”点击最上面，上传图像，点击返回按钮，页面没有直接返回“我的”主页，而是返回页面是黑色的“最近照片”页面。,审核通过,30,2016-01-18 20:51:13
212,从“我的”页面切换到“首页”，首页最上面的图片显示不完整。需要下拉才能显示全。,从“我的”页面切换到“首页”，首页最上面的图片显示不完整。需要下拉才能显示全。,审核通过,40,2016-01-18 20:51:20
213,首页左上角的“北京”按钮，点击无反应，无法选择城市。,首页左上角的“北京”按钮，点击无反应，无法选择城市。,审核通过,16,2016-01-18 20:51:25
