id,bug详情,复现步骤,审核状态,重复情况,提交时间
95,qq号登录，昵称后面自动加上了“-tn”。。。。。。。。。。。,qq号登录，昵称后面自动加上了“-tn”。。。。。。。。。。。,审核通过,14,2016-01-27 20:49:23
96,手机登陆，输入昵称nn时，显示昵称太短，但是有没有显示需要的最短字数,手机登陆，输入昵称nn时，显示昵称太短，但是有没有显示需要的最短字数,审核通过,13,2016-01-27 20:49:33
97,手机注册到了输入昵称时，手机返回，再次登陆软件，输入之前的号码登录，却显示该手机未注册,手机注册到了输入昵称时，手机返回，再次登陆软件，输入之前的号码登录，却显示该手机未注册,审核通过,3,2016-01-27 20:49:38
98,输入的昵称已存在，选择推荐昵称，却点击不动,输入的昵称已存在，选择推荐昵称，却点击不动,审核通过,13,2016-01-27 20:49:41
99,能听到节目声音，信号也是满格的，但是却显示的节目信息玩命儿加载中。。。。,能听到节目声音，信号也是满格的，但是却显示的节目信息玩命儿加载中。。。。,审核不通过,10,2016-01-27 20:49:52
100,宸冰读书，信号也是满格，听到节目声音断断续续，,宸冰读书，信号也是满格，听到节目声音断断续续，,审核通过,10,2016-01-27 20:49:58
101,评论剩余140字，但输入几个字母之后，上面还是剩余140字。。。。。。。。。。。。。。,评论剩余140字，但输入几个字母之后，上面还是剩余140字。。。。。。。。。。。。。。,审核不通过,13,2016-01-27 20:50:08
102,信息满格，听取另一个节目，一直显示的努力加载中。。。。。。。。。,信息满格，听取另一个节目，一直显示的努力加载中。。。。。。。。。,审核不通过,10,2016-01-27 20:50:21
103,我--积分商城--我的积分，但是没有显示积分具体信息，显示的是“兑换记录”,我--积分商城--我的积分，但是没有显示积分具体信息，显示的是“兑换记录”,审核不通过,12,2016-01-27 20:50:32
104,录音--声音剪切，只能剪切后面，不能剪切前面部分。。。。。。。。。,录音--声音剪切，只能剪切后面，不能剪切前面部分。。。。。。。。。,审核不通过,0,2016-01-27 20:50:37
105,草稿箱存了一个声音文件，但是我的页面显示声音0。。。。。。。。。。。,草稿箱存了一个声音文件，但是我的页面显示声音0。。。。。。。。。。。,审核不通过,9,2016-01-27 20:50:42
106,消息中心，点右边的信封，写私信，但没有输入地方。。。。。。。。。。。,消息中心，点右边的信封，写私信，但没有输入地方。。。。。。。。。。。,审核不通过,2,2016-01-27 20:50:45
107,想编辑草稿箱的声音，但是打开声音，编辑，不能剪切或继续编辑，只能编辑声音的名字之类的。。。。,想编辑草稿箱的声音，但是打开声音，编辑，不能剪切或继续编辑，只能编辑声音的名字之类的。。。。,审核通过,9,2016-01-27 20:50:56
108,找回密码时，未注册的号码也显示发送短信。,"找回密码时，未注册的号码也显示发送短信。三星s3,安卓5.1",审核通过,11,2016-01-27 20:51:11
109,找回密码时，填了验证码后，新密码无法输入。,"首页－找回密码－输入已注册手机号－输入验证码后，密码栏无法输入。三星s3,安卓5.1",审核通过,11,2016-01-27 20:51:14
110,再安装时连续多次出现 安装包停止运行的状况  手机型号vivox5l,再安装时连续多次出现 安装包停止运行的状况  手机型号vivox5l,审核通过,15,2016-01-27 20:51:24
111,在使用过程中 切换出来就会出现程序停止运行 发生闪退的状况 手机型号 vivox5l,在使用过程中 切换出来就会出现程序停止运行 发生闪退的状况 手机型号 vivox5l,审核通过,15,2016-01-27 20:51:29
112,头像无法修改，点击修改头像，上传图片，保存之后头像还是灰的。,头像无法修改，点击修改头像，上传图片，保存之后头像还是灰的。,审核通过,1,2016-01-28 15:48:29
113,定时关闭功能失效，播放界面下，点击定时关闭，选择声音播完之后关闭，然而声音播完之后依然没有关闭app。,定时关闭功能失效，播放界面下，点击定时关闭，选择声音播完之后关闭，然而声音播完之后依然没有关闭app。,审核通过,8,2016-01-28 15:48:46
114,评论字数限制失效，显示限制140字数，然而输入很多字数之后依然显示剩余140字。,评论字数限制失效，显示限制140字数，然而输入很多字数之后依然显示剩余140字。,审核通过,13,2016-01-28 15:48:52
115,批量下载时，《斗破苍穹》选集（1301~1350）时，下方显示的是（第1101章~）。,批量下载，《斗破苍穹》选集（1301~1350）时，下方显示的是（第1101章~）。,审核通过,16,2016-01-28 20:07:12
116,建议在专辑里，增加置顶功能，现在翻到下面在回来很费劲。,点击下载听，选择专辑《斗破苍穹》，1000多集声音，翻到下面再回来很麻烦。,审核通过,16,2016-01-28 20:07:21
117,听过的声音，程序会显示“已播完”，但退出程序，清掉内存，在登录，“已播完”的状态就看不到了，导致不知道上次听到哪一集了。,下载听，听几集，查看播放状态，退出，清掉手机内存，在登录，查看之前听过的声音播放状态。,审核通过,15,2016-01-28 20:07:27
118,app在播放喜马拉雅随身听操作演示视频时，广播播音未停止，导致两种声音混杂,订阅听/订阅/广告栏（新声活商城），该广告在播放喜马拉雅随身听操作演示视频时，广播播音未停止，导致两种声音混杂,审核通过,5,2016-01-29 13:29:01
119,订阅页面部分广告出现按返回键无法退出广告的情况,订阅听/订阅/广告栏（sisley），该广告点击浏览后出现按返回键无法退出广告的情况，其他广告页正常,审核通过,5,2016-01-29 13:29:21
120,发布了一个声音进行评论再删除后，评论数还是显示1.,发布了一个声音进行评论再删除后，评论数还是显示1.然而评论已经空了,审核通过,6,2016-01-29 13:29:51
121,刚打开就闪退，就提示程序运行错误,刚打开就闪退，就提示程序运行错误！！！！,审核通过,15,2016-01-29 13:30:16
122,app运行过程中出现停止运行,app运行过程中出现停止运行，手机型号大神f2,审核通过,15,2016-01-29 13:30:41
123,程序退出时发生了异常。,一些都好，当退出时，提示异常，再次尝试，没有发生,审核不通过,15,2016-01-29 13:31:45
124,更换头像(从相册里选取)没有任何反应，操作好几次都还是原始头像。建立专辑时上传照片也没反应，用拍照片上传可以,更换头像(从相册里选取)没有任何反应，操作好几次都还是原始头像。建立专辑时上传照片也没反应，用拍照片上传可以,审核通过,14,2016-01-29 13:31:57
