id,bug详情,复现步骤,审核状态,重复情况,提交时间
1,搜索界面，当输入“好”字时，界面出现结果，次时点击搜索按钮后，出来的结果与好字无关,搜索界面，当输入“好”字时，界面出现结果，次时点击搜索按钮后，出来的结果与好字无关,审核通过,11,2016-01-27 09:52:27
2,已订阅的项目无法在“订阅”中及时显示,进入“订阅”，点击选择“儿歌”进行订阅，切换到右侧栏“订阅”中找不到我已经订阅的项目,审核不通过,5,2016-01-27 11:42:22
3,qq号登录，没有qq头像。。。。。。。。。。。。。。。。。。,qq号登录，没有qq头像。。。。。。。。。。。。。。。。。。,审核不通过,14,2016-01-27 11:49:47
4,播放时，定时退出功能失效。,在播放界面，点击定时关闭，选择当前声音播完之后关闭，但是播完之后app没有关闭。,审核通过,8,2016-01-27 12:02:27
5,输入弹幕时，限定140字数，但是输入很多字之后，还是显示剩余140字。,输入弹幕时，限定140字数，但是输入很多字之后，还是显示剩余140字。,审核通过,13,2016-01-27 12:02:39
6,进入播放时，时间进度条总时间在拉动进度条时发现总时间不一致,点击首页中滚动栏中的其中一个，进入播放，时间进度条总时间原本是正确的，但我拉动进度条，拉动几次，发现总时间有时候是11分28秒，有时候是11分27秒,审核不通过,8,2016-01-27 20:15:14
7,"播放界面中的定时关闭设置“播完当前声音""关闭不能正常关闭","点击首页中滚动栏中的其中一个，进入播放，点击右下角的“定时关闭”，选择""播完当前声音""，但播放完还是在原界面，并没有关闭此界面",审核通过,8,2016-01-27 20:34:37
8,"播放界面中的定时关闭设置“10分钟""后关闭不能正常关闭","点击首页中滚动栏中的其中一个，进入播放，点击右下角的“定时关闭”，选择""10分钟""，但播放到10分钟以后还是在继续播放",审核通过,8,2016-01-27 20:34:46
9,进入“下载听”关闭网络，再开启网络，无法自动下载,进入“下载听”点击进入热门，下载到一半，关闭网络，再开启网络，无法自动下载,审核通过,16,2016-01-27 20:34:56
10,通知栏通知消息显示异常,通知栏通知消息显示异常，手机型号三星schi879,审核不通过,4,2016-01-27 20:35:22
11,声音简介上显示有内容 点进去却是空的,打开app 登录 下移到听音乐 点第一个音乐优品  在列表中下移到 那些迷人摄魂的极致烟嗓女声~优品音乐。下移到声音简介 有内容显示 点进去简介却是空的。,审核通过,7,2016-01-27 20:35:29
12,声音简介中没有歌词显示,打开app 登录 下移到听音乐  点音乐优品 随便点一个 简介中都没有歌词显示,审核通过,7,2016-01-27 20:35:35
13,打开软件，随意进行测试，出现死机状态。画面不动，点击任何按钮都无效。,打开软件，随意进行测试，出现死机状态。画面不动，点击任何按钮都无效。,审核通过,15,2016-01-27 20:35:46
14,写私信功能无法使用。,"1.安装并打开软件，注册登录
2.打开“我-消息中心”点击右上角打开“写私信”功能。
打开写私信功能后，软件界面一片空白，无任何可用功能。
samsung s4 i9500 安卓 4.4.2 wifi",审核通过,2,2016-01-27 20:35:53
15,打开软件，进入登陆界面，点击“忘记密码”，弹出的窗口挂了，不能显示。,打开软件，进入登陆界面，点击“忘记密码”，弹出的窗口挂了，不能显示。,审核通过,11,2016-01-27 20:36:07
16,使用下载功能时，软件报停,"1.安装并打开软件
2.选择任意一音频进行下载
3.打开“下载听“，点击查看“下载中”时，软件自动退出，系统提示“喜马拉雅fm已停止”
samsung s4 i9500 安卓 4.4.2  3g",审核通过,16,2016-01-27 20:36:11
17,使用下载功能时，软件报停,"1.安装并打开软件
2.选择任意一音频进行下载
3.打开“下载听“，点击查看“下载中”时，软件自动退出，系统提示“喜马拉雅fm已停止”
samsung s4 i9500 安卓 4.4.2  3g",审核通过,16,2016-01-27 20:36:15
18,写私信功能无法使用。,"1.安装并打开软件，注册登录
2.打开“我-消息中心”点击右上角打开“写私信”功能。
打开写私信功能后，软件界面一片空白，无任何可用功能。
samsung s4 i9500 安卓 4.4.2 wifi",审核通过,2,2016-01-27 20:36:24
19,在推荐最下方有空白区域,打开软件首页界面下，在推荐最下方有空白区域,审核通过,16,2016-01-27 20:36:29
20,应用下载安装成功，打开应用，选择分类下面里的一个节目，点击下载，点击下载下来的任务，出现闪退,应用下载安装成功，打开应用，选择分类下面里的一个节目，点击下载，在下载听里面点击下载下来的任务，出现闪退,审核通过,16,2016-01-27 20:36:36
21,忘记密码界面与手机屏幕不匹配,"在登陆界面点击忘记密码，进入忘记密码界面，
该界面手机号输入框不在屏幕中间，与手机屏幕不匹配。",审核通过,11,2016-01-27 20:36:49
22,注册界面手机号输入框应只能输入数字,"注册界面手机号输入框应只能输入数字，
现在可输入非数字字符",审核不通过,3,2016-01-27 20:37:05
23,插了耳机，但声音是外放的。,播放课程的时候，耳机是插上的，可以看到手机通知栏上有耳机标志。但是人能听到放出来的声音。,审核通过,9,2016-01-27 20:37:12
24,海南音乐广播页面logo没有显示，算bug吗？,顺利下载、安装、运营，广播那一项里，推荐电台  别的广播电台都有页面logo 唯独海南音乐广播  没有，，刷新页面n遍，也未见到。,审核不通过,7,2016-01-27 20:37:27
25,打开app，点击下载听，点击己下载的声音，app出现自动停止运行现像,打开app，点击进入下载听，点击以下载的声音，app出现自动退出运行现像,审核通过,16,2016-01-27 20:37:35
26,消息中心，点右上角的邮件标识，无法正常写邮件,消息中心，点右上角的邮件标识，无法正常写邮件，不明白该功能是否可用。,审核通过,2,2016-01-27 20:37:41
27,订阅界面，在订阅后，返回订阅界面，仍然为空,订阅界面，在订阅后，返回订阅界面，仍然为空，不能正常显示订阅内容。,审核通过,5,2016-01-27 20:37:47
28,喜马拉雅大学无法正常打开,喜马拉雅大学无法正常打开，看不到正常的内容显示。,审核通过,5,2016-01-27 20:37:53
29,发现页建议增加回顶按钮。,发现页下拉后，无法快速回顶，需要用手滑动回顶。,审核不通过,6,2016-01-27 20:38:06
30,发现页榜单下广告无法刷新。,关闭网络-发现-榜单-打开网络-重新加载，广告无法加载（全球话语播客巅峰榜）,审核不通过,10,2016-01-27 20:38:17
31,播放页定时关闭建议增加“自定义时间”功能,播放页面-定时开关，没有“自定义时间”功能，建议增加。,审核不通过,8,2016-01-27 20:38:26
32,刚刚订阅的内容无法显示,订阅-“喵，你还没有订阅哦”-去看看-点击节目右面订阅-返回-订阅界面内容为空,审核通过,5,2016-01-27 20:38:31
33,我-消息中心未读消息显示不正确,登陆后“我”显示两条未读消息-点击消息中心-返回-显示只有一个未读消息。再次进入消息中心-点击其中一条消息-返回-显示没有未读消息。,审核通过,4,2016-01-27 20:38:36
34,未登录状态，选择下载听模块，选择下载，程序闪退,未登录状态，选择下载听模块，选择下载，程序闪退,审核通过,15,2016-01-27 20:38:40
35,打开app 点击设备 修改密码 输入旧密码 在输入新密码 新旧密码可以完全一样 点击完成不会给任何提示 修改成功 不成功 或者不要输入一样的密码 各种提示都没有,打开app 点击设备 修改密码 输入旧密码 在输入新密码 新旧密码可以完全一样 点击完成不会给任何提示 修改成功 不成功 或者不要输入一样的密码 各种提示都没有,审核通过,11,2016-01-27 20:38:47
36,打开app 点击意见反馈 进入输入框要求输入手机号码和qq号码 这里可以输入任意字符，并且写完了提交反馈也能成功 无任何提示,打开app 点击意见反馈 进入输入框要求输入手机号码和qq号码 这里可以输入任意字符，并且写完了提交反馈也能成功 无任何提示,审核通过,3,2016-01-27 20:38:53
37,打开app 登录 点击录音 录音以后拖动剪辑 无法选取任意两个点进行剪辑 只能走最后往前面进行剪辑,打开app 登录 点击录音 录音以后拖动剪辑 无法选取任意两个点进行剪辑 只能走最后往前面进行剪辑,审核通过,14,2016-01-27 20:38:59
38,打开app 登录 点击录音 进入以后选择加号点击进入 看到的本地音乐和手机中实际的本地音乐数量不符合,打开app 登录 点击录音 进入以后选择加号点击进入 看到的本地音乐和手机中实际的本地音乐数量不符合,审核通过,7,2016-01-27 20:39:07
39,打开app 注册登录以后 在我的页面看到粉丝那里显示1 但是点击进入是没有粉丝数量的,打开app 注册登录以后 在我的页面看到粉丝那里显示1 但是点击进入是没有粉丝数量的,审核通过,7,2016-01-27 20:39:15
40,打开app 点击设备 修改密码 输入旧密码 在输入新密码 新旧密码可以完全一样 点击完成不会给任何提示 修改成功 不成功 或者不要输入一样的密码 各种提示都没有,打开app 点击设备 修改密码 输入旧密码 在输入新密码 新旧密码可以完全一样 点击完成不会给任何提示 修改成功 不成功 或者不要输入一样的密码 各种提示都没有,审核不通过,11,2016-01-27 20:40:12
41,打开app 点击意见反馈 进入输入框要求输入手机号码和qq号码 这里可以输入任意字符，并且写完了提交反馈也能成功 无任何提示,打开app 点击意见反馈 进入输入框要求输入手机号码和qq号码 这里可以输入任意字符，并且写完了提交反馈也能成功 无任何提示,审核通过,3,2016-01-27 20:40:35
42,打开app 登录 点击录音 录音以后拖动剪辑 无法选取任意两个点进行剪辑 只能走最后往前面进行剪辑,打开app 登录 点击录音 录音以后拖动剪辑 无法选取任意两个点进行剪辑 只能走最后往前面进行剪辑,审核通过,14,2016-01-27 20:40:45
43,打开app 注册登录以后 在我的页面看到粉丝那里显示1 但是点击进入是没有粉丝数量的,打开app 注册登录以后 在我的页面看到粉丝那里显示1 但是点击进入是没有粉丝数量的,审核不通过,7,2016-01-27 20:40:52
44,打开app 登录 点击录音 进入以后选择加号点击进入 看到的本地音乐和手机中实际的本地音乐数量不符合,打开app 登录 点击录音 进入以后选择加号点击进入 看到的本地音乐和手机中实际的本地音乐数量不符合,审核不通过,7,2016-01-27 20:41:13
45,使用的是qq号码登录，发现头像是灰色，没有加载上qq头像,使用的是qq号码登录，发现头像是灰色，没有加载上qq头像,审核通过,14,2016-01-27 20:41:31
46,使用的是qq号码登录，发现昵称后面自动加上了“-tn”。。。。。。。。。。。,使用的是qq号码登录，发现昵称后面自动加上了“-tn”。。。。。。。。。。。,审核通过,14,2016-01-27 20:41:36
47,体验app过程中，网络信号满格，却显示“网络异常，请稍后再试”。。。。。。。。,体验app过程中，网络信号满格，却显示“网络异常，请稍后再试”。。。。。。。。,审核通过,10,2016-01-27 20:41:41
48,点击积分商城---我的积分，显示的却是“兑换记录”（不是该显示积分的具体信息吗）,点击积分商城---我的积分，显示的却是“兑换记录”（不是该显示积分的具体信息吗）,审核通过,12,2016-01-27 20:41:46
49,评论的时候，上面写道剩余140字，但是输入3个字之后，上面还是写道剩余140字，。。。。。。。。。。。。。。。。。,评论的时候，上面写道剩余140字，但是输入3个字之后，上面还是写道剩余140字，。。。。。。。。。。。。。。。。。,审核通过,13,2016-01-27 20:41:53
50,能听的节目，信号满格，但是节目信息显示：节目信息玩命儿加载中。。。。。。。。。。。。。。。。,能听的节目，信号满格，但是节目信息显示：节目信息玩命儿加载中。。。。。。。。。。。。。。。。,审核不通过,10,2016-01-27 20:42:11
51,听糗事播报，中途节目自己暂停了一次。需要再次点击听（后面又停了两个节目，也出现了这种情况）。。。。。。。。。。。。,听糗事播报，中途节目自己暂停了一次。需要再次点击听（后面又停了两个节目，也出现了这种情况）。。。。。。。。。。。。,审核通过,10,2016-01-27 20:42:28
52,都换了一个节目收听了（糗事播报变成了你妹电台），但是点击节目信息显示的还是上次的信息，,都换了一个节目收听了（糗事播报变成了你妹电台），但是点击节目信息显示的还是上次的信息，,审核通过,10,2016-01-27 20:42:35
53,都换了一个节目收听了，内容能听到是新的，但是节目进度条的显示也是上次的显示,都换了一个节目收听了，内容能听到是新的，但是节目进度条的显示也是上次的显示,审核通过,10,2016-01-27 20:42:43
54,消息中心--点击右边的信封，有个写私信，但是没有输入的地方啊。。。。。。。。,消息中心--点击右边的信封，有个写私信，但是没有输入的地方啊。。。。。。。。,审核通过,2,2016-01-27 20:42:51
55,"设置---特色闹铃----时间，没有点击“完成”二字，
点击手机的返回键直接看到设置完成（显示太快没有截图到），但是并未点击完成啊","设置---特色闹铃----时间，没有点击“完成”二字，
点击手机的返回键直接看到设置完成（显示太快没有截图到），但是并未点击完成啊",审核通过,8,2016-01-27 20:42:57
56,"逻辑问题，点击好妹妹乐队，看到赞过的（显示为0），但是点击“赞过的”，显示的（你没有赞过任何节目），
这个赞应该是好妹妹乐队对别人点击的赞吧，而不是我点的赞的统计吧","逻辑问题，点击好妹妹乐队，看到赞过的（显示为0），但是点击“赞过的”，显示的（你没有赞过任何节目），
这个赞应该是好妹妹乐队对别人点击的赞吧，而不是我点的赞的统计吧",审核通过,12,2016-01-27 20:43:07
57,录音--声音剪切里面，希望只剪切中间部分，不可以。。。。。。。。。。。。。。,录音--声音剪切里面，希望只剪切中间部分，不可以。。。。。。。。。。。。。。,审核通过,0,2016-01-27 20:43:13
58,点击我---声音---存在草稿箱的声音文件，点击编辑--只能编辑声音标题之类（不能对该文件继续剪切或者往后继续录音）,点击我---声音---存在草稿箱的声音文件，点击编辑--只能编辑声音标题之类（不能对该文件继续剪切或者往后继续录音）,审核通过,9,2016-01-27 20:43:18
59,录音--声音剪切里面，希望只剪切前面部分，不可以。。。。。。。。。。。。。。,录音--声音剪切里面，希望只剪切前面部分，不可以。。。。。。。。。。。。。。,审核通过,0,2016-01-27 20:43:21
60,草稿箱本来有声音文件的，但是我的页面却显示“声音0”。。。。。。。。。。。。。。,草稿箱本来有声音文件的，但是我的页面却显示“声音0”。。。。。。。。。。。。。。,审核通过,9,2016-01-27 20:43:24
61,订阅电台后，点击返回，订阅页内容显示延迟。,"1. 点击下方订阅；
2. 进入空白订阅页，点击去看看；
3. 选择一个电台订阅；
4. 返回订阅页；",审核不通过,5,2016-01-27 20:43:49
62,弹幕滑动太快，文字模糊,"1.打开任意节目
2.打开弹幕开关。 弹幕滑动太快，文字模糊，肉眼追踪困难",审核通过,12,2016-01-27 20:43:59
63,我中广告一直显示在播放页中,最低栏点击我图标，页面中有“每月8元，包流量了哦”，这时候点击最低栏中间的播放图标到播放页面，“每月8元，包流量了哦”没有消失。,审核通过,5,2016-01-27 20:44:06
64,发现-推荐-听音乐-更多-新碟上架-更多-最火-点击其中的歌单，有的声音简介中，没有歌词显示。,发现-推荐-听音乐-更多-新碟上架-更多-最火-点击其中的歌单，有的声音简介中，没有歌词显示。如“不如怀念-陈楚生；混蛋，我想你-李宇春”,审核不通过,7,2016-01-27 20:44:20
65,"进入喜马拉雅fm,点击右下边“我”，进入个人中心，再进入消息中心，读取某条信息，但没有回复的地方。已经上传图片","进入喜马拉雅fm,点击右下边“我”，进入个人中心，再进入消息中心，读取某条信息，但没有回复的地方。已经上传图片",审核通过,4,2016-01-27 20:44:31
66,手机安装软件，因为手机里有早的版本，所以下载要求更换版本，但是更新失败,手机安装软件，因为手机里有早的版本，所以下载要求更换版本，但是更新失败,审核通过,16,2016-01-27 20:44:37
67,订阅功能异常，订阅功能显示异常,进入软件，打开“订阅”界面，可以看到未订阅的节目图标显示是红色，已订阅栏目显示的确实灰色，显示异常。,审核通过,5,2016-01-27 20:44:44
68,我的订阅页面，有空白栏目，显示出错,进入软件，打开“订阅”界面，在我订阅的节目中间，有一栏没有图标的空白栏。,审核通过,5,2016-01-27 20:44:51
69,消息通知没有置顶，消息通知显示异常,进入“我”的页面，打开“消息中心”，点击收到的消息，消息内容没有默认置顶，而是置于底部，显示异常。,审核不通过,4,2016-01-27 20:45:10
70,寻觅多次声音优化让无法找到,喜马拉雅fm移动客户端测试项目多，音频贴片广告播放声音音量优化声音优化功能隐藏很深，不太容易找到。无法进行优化。,审核通过,9,2016-01-27 20:45:28
71,寻觅多次声音优化让无法找到,喜马拉雅fm移动客户端测试项目多，音频贴片广告播放声音音量优化声音优化功能隐藏很深，不太容易找到。无法进行优化。,审核不通过,9,2016-01-27 20:45:39
72,登录界面，选择微信登录后，不能获取到微信的头像,登录界面，选择微信登录后，不能获取到微信的头像,审核通过,1,2016-01-27 20:45:45
73,在我的消息中心界面，点击右上有的信息按钮，进入写私信界面，界面空白，无法弹出输入键盘界面，无法编辑,在我的消息中心界面，点击右上有的信息按钮，进入写私信界面，界面空白，无法弹出输入键盘界面，无法编辑,审核通过,4,2016-01-27 20:45:51
74,下载和缓存设置界面，几个参数的值一直显示0.0m,下载和缓存设置界面，几个参数的值一直显示0.0m,审核通过,16,2016-01-27 20:45:55
75,在消息中心界面，查看收到的消息，进入相应的界面，后，界面显示在最低端，排版不正确且无法回复,在消息中心界面，查看收到的消息，进入相应的界面，后，界面显示在最低端，排版不正确且无法回复,审核通过,4,2016-01-27 20:46:01
76,qq登录后，进入修改界面，输入正确的qq密码后，提示旧密码输入错误，无法修必密码,qq登录后，进入修改界面，输入正确的qq密码后，提示旧密码输入错误，无法修必密码,审核通过,11,2016-01-27 20:46:06
77,订阅一个资源后，在我的界面的已订阅中取消后，再进入相应的界面，查看状态还是已订阅,订阅一个资源后，在我的界面的已订阅中取消后，再进入相应的界面，查看状态还是已订阅,审核通过,5,2016-01-27 20:46:09
78,在我关注的人里面，点击相右侧的灰色按钮后，是取消关注，有相应的提示，再次点击时，按钮又变为灰色，没有任何提示,在我关注的人里面，点击相右侧的灰色按钮后，是取消关注，有相应的提示，再次点击时，按钮又变为灰色，没有任何提示,审核通过,6,2016-01-27 20:46:13
79,订阅听中的订阅功能显示异常,进入软件的“订阅听”页面，未订阅的节目右边图标显示的是黄色，已订阅的显示的却是灰色，功能显示异常。,审核通过,5,2016-01-27 20:46:18
80,消息中心，消息界面显示异常,登录软件后，进入“我”的页面，点击消息中心，点击收到的“喜马”“拉雅”消息，消息默认置底，没有置顶。,审核通过,4,2016-01-27 20:46:23
81,"播放页发表评论或删除评论后,显示的听众点评数不会立即更新","打开app,进入某一播放页,发弹幕或发评论后,评论栏最上面的听众点评数不会立即更新,仍是发表评论前的数",审核通过,6,2016-01-27 20:46:58
82,"2g/3g/4g播放和下载关闭状态下,当手机网络由wifi环境切换到移动网络环境时,系统提示""当前没有wifi,允许用流量播放或下载吗"",点击取消,播放暂停,但拖入播放条后,会继续在移动网络下播放","打开app,进入某一播放页开始播放,当手机网络由wifi环境切换到移动网络环境时,系统提示""当前没有wifi,允许用流量播放或下载吗"",点击取消,播放暂停,点击开始按钮,仍会提示是否流量播放,点击取消,播放暂停,但拖动播放条后,会继续在移动网络下播放",审核通过,8,2016-01-27 20:47:04
83,"查看用户页面,关注或取消关注,下面显示的粉丝数不会立即更新","打开app,进入某一播放页,点击下面别人的评论,选择查看资料,进入查看用户资料页,点击关注或取消关注,下面显示的粉丝数不会立即更新",审核通过,6,2016-01-27 20:47:13
84,能听的节目，信号满格，但是节目信息显示：节目信息玩命儿加载中。。。。。。。。。。。。。。。,能听的节目，信号满格，但是节目信息显示：节目信息玩命儿加载中。。。。。。。。。。。。。。。,审核不通过,10,2016-01-27 20:47:30
85,"点击app最下面的广告条,进入新声活商城,里面的视频不能全屏播放","打开app,点击app最下面的广告条,进入新声活商城,点击最下面的使用视频,播放某一视频,点击视频右下角的全屏标志,不能全屏播放",审核通过,12,2016-01-27 20:47:37
86,"用户反馈,手机和qq号可以输入任意字符","登陆app,进入我->意见反馈,里面手机和qq可以输入任意字符",审核通过,3,2016-01-27 20:47:46
87,"查看用户页面,关注或取消关注,下面显示的粉丝数不会立即更新","打开app,进入某一播放页,点击下面别人的评论,选择查看资料,进入查看用户资料页,点击关注或取消关注,下面显示的粉丝数不会立即更新",审核通过,6,2016-01-27 20:47:52
88,"2g/3g/4g播放和下载关闭状态下,当手机网络由wifi环境切换到移动网络环境时,系统提示""当前没有wifi,允许用流量播放或下载吗"",点击取消,播放暂停,但拖入播放条后,会继续在移动网络下播放","打开app,进入某一播放页开始播放,当手机网络由wifi环境切换到移动网络环境时,系统提示""当前没有wifi,允许用流量播放或下载吗"",点击取消,播放暂停,点击开始按钮,仍会提示是否流量播放,点击取消,播放暂停,但拖动播放条后,会继续在移动网络下播放",审核通过,8,2016-01-27 20:47:59
89,"点击app最下面的广告条,进入新声活商城,里面的视频不能全屏播放","打开app,点击app最下面的广告条,进入新声活商城,点击最下面的使用视频,播放某一视频,点击视频右下角的全屏标志,不能全屏播放",审核通过,12,2016-01-27 20:48:05
90,"用户反馈,手机和qq号可以输入任意字符","登陆app,进入我->意见反馈,里面手机和qq可以输入任意字符",审核不通过,3,2016-01-27 20:48:16
91,"用户头像显示设计的分辨率过高,导致小尺寸的头像显示很小","登陆app,进入我的页面,点击上面头像更改头像,从像册选择后裁剪完,上传后显示的头像很小.裁剪时没做尺寸要求,但上传后就有一定尺寸要求",审核通过,1,2016-01-27 20:48:33
92,"播放页发表评论或删除评论后,显示的听众点评数不会立即更新","打开app,进入某一播放页,发弹幕或发评论后,评论栏最上面的听众点评数不会立即更新,仍是发表评论前的数",审核不通过,6,2016-01-27 20:48:46
93,"用户头像显示设计的分辨率过高,导致小尺寸的头像显示很小","登陆app,进入我的页面,点击上面头像更改头像,从像册选择后裁剪完,上传后显示的头像很小.裁剪时没做尺寸要求,但上传后就有一定尺寸要求",审核不通过,1,2016-01-27 20:48:53
94,录音--声音剪切，只能剪切后面，不能剪切中间部分。。。。。。。。。,录音--声音剪切，只能剪切后面，不能剪切中间部分。。。。。。。。。,审核不通过,0,2016-01-27 20:49:12
