id,bug详情,复现步骤,审核状态,重复情况,提交时间
1,打开app----宝典----亲子吧---一直上拉刷新更多文章，直到提示没有更多文章的为止-----然后我们点击育儿经、宝宝饭、故事会等这些按钮，进行上拉刷新操作，发现都无法在刷新出新的文章出来！,打开app----宝典----亲子吧---一直上拉刷新更多文章，直到提示没有更多文章的为止-----然后我们点击育儿经、宝宝饭、故事会等这些按钮，进行上拉刷新操作，发现都无法在刷新出新的文章出来！,审核不通过,26,2016-02-17 11:19:02
2,宝典模块用户评论功能缺失。,宝典模块在各个栏目没有评论功能，用户不能互动。,审核不通过,35,2016-02-17 11:19:32
3,分享至微信朋友圈和微信好友失败。,点击我的――分享――分享至微信朋友圈或者好友，点击之后没有反应。但是微博、qq分享正常。,审核通过,15,2016-02-17 11:25:45
4,修改头像时，无法使用相册。,点击我的――进入个人详情――修改头像。修改头像时，选择相机拍照修改正常，但是通过相册时却无法加载图片。,审核通过,11,2016-02-17 11:26:00
5,修改头像时不能使用相册,点击我的，进入个人详情，点击头像，修改头像时相机拍照正常，但通过相册无法加载图片。,审核通过,11,2016-02-18 15:27:34
6,音乐无法完成：随机，循环播放一首的功能,进入我的，点击下载，选择音乐，选择播放，右下角的播放模式选择无效，即使切换播放模式也不能循环一首或随机,审核通过,19,2016-02-18 15:27:59
7,软件打开前后内存占用不正常,打开软件前，可用内存为1.62gb，打开软件后可用内存为1.50gb，在使用播放视屏功能后手机可用内存增加了，为1.65gb。,审核不通过,3,2016-02-18 15:28:48
8,”我的“中，分享至微博时失败,点击我的，点击分享，选择微博后没有反应。,审核通过,15,2016-02-18 15:29:02
9,音乐播放页面左上角，返回键迟钝,进入我的，点击下载，选择音乐，选择播放，左上角返回键无反应,审核通过,30,2016-02-18 15:29:24
10,点击修改头像时，通过相机拍照正常修改，但是通过相册导入时却无法加载图片信息。,点击修改头像时，通过相机拍照正常修改，但是通过相册导入时却无法加载图片信息。,审核通过,11,2016-02-19 11:37:54
11,点击分享，分享至新浪微博时没有任何反应，qq、微信可以正常分享。,点击分享，分享至新浪微博时没有任何反应，qq、微信可以正常分享。,审核通过,15,2016-02-19 11:38:08
12,视频无法继续下载资源,"1、点击资源，下载一半退出来
2、在此打开软件，必须重新下载，不能从原来退出的地方下载",审核不通过,16,2016-02-20 19:29:14
13,"下载视频时退出后再进入app不能接着下截,得重新下!系统是4.0.4","下载视频时退出后再进入app不能接着下截,得重新下!系统是4.0.4",审核不通过,36,2016-02-20 19:29:46
14,当有下载视频时退出后重新登录不能继续下载,"机型：魅蓝note
网络：wifi
安装完成后下载资源中的第一个视频不，当下载未完成时退出软件，然后再次打开软件，此时上次下载的视频资源没有显示已经下载过，在我的下载中也没显示下载进度。",审核通过,16,2016-02-20 19:30:33
15,不能分享到新浪微博，点击后闪一下,登陆后-我的-分享，不能分享到新浪微博，点击后闪一下，还在原来页面。,审核不通过,15,2016-02-20 19:30:42
16,登陆后个人详情中宝宝性别跟注册是不一致,登陆后个人详情中宝宝性别跟注册是不一致，注册时是男，进个人详情中宝宝性别却显示女。,审核不通过,34,2016-02-20 19:30:49
17,我的-点击休息时间设置弹出设置框默认30分钟跟默认20分钟不一致,我的-点击休息时间设置弹出设置框默认30分钟跟默认20分钟不一致。本来觉得没什么问题，原来默认30分钟对应跟默认20分钟不一致，但是滑动时间后问题出现了，25对25一致了，一个小瑕疵。,审核不通过,9,2016-02-20 19:31:00
18,进入资源页父母用书，提示搞不懂有点晕,先进入会员专属项，点击获取验证码有弹框，但是在页父母用书项还是要求点击会员专属获取验证码。两项要么合并（跟免费资源对应），要么父母用书有其他资源。,审核不通过,8,2016-02-20 19:31:08
19,视频下载时退出下载页面后再进入下载页面无法继续下载,app/资源/有趣的声音和规律拍拍看，两个视频均出现，视频下载时退出下载页面后再进入下载页面无法继续下载，手机型大神f2,审核不通过,14,2016-02-20 19:32:09
20,耳机模式向外放模式转换时，音乐播放未暂停,耳机模式向外放模式转换时，音乐播放未暂停，该设计不符合其他音乐播放器如天天动听，喜马拉雅等app的设计特点,审核不通过,19,2016-02-20 19:32:33
21,连接页面设计不合理。,打开软件，点击首页滚动图片-打开对应的链接页面-出来的页面是针对电脑设计，而不是针对手机设计的。,审核通过,25,2016-02-20 19:32:51
22,软件摇一摇功能不好使用。,打开软件-点活动-摇一摇功能。这个功用手机摇了很多次，只成功了一次。,审核不通过,35,2016-02-20 19:33:06
23,更换头像功能不全面，有缺陷。,打开软件，点我的-点头像图片更换图片，点头像图片，选相册，显示无法加载此图片。,审核通过,33,2016-02-20 19:33:14
24,功能按纽设计位置不当。,打开软件，点我的-点头像图片，在个人详情的旁边有一个退出按纽。点这个退出按纽是退出这个软件，而不是退出个人详情。所以这个按纽放在这个有歧义。,审核通过,25,2016-02-20 19:33:35
25,注册时无法正常接受到手机验证码，重复无反应,注册时无法正常接受到手机验证码，重复无反应,审核不通过,32,2016-02-20 19:33:39
26,微信分享给好友问题。,分享给微信好友，好友只收到一张图片，没有网络地址。,审核不通过,15,2016-02-20 19:33:47
27,分享后无法返回竹兜育儿app界面,分享给微信好友后提示分享成功，点返回竹兜育儿app无法返回，留在微信界面。,审核不通过,15,2016-02-20 19:33:52
28,下载管理删除问题，无法删除。,在我的下载界面点删除后视频无法删除并自动回到我的签到、积分这个界面。,审核不通过,17,2016-02-20 19:33:56
29,软件稳定性问题，无故停止工作。,在我的下载点删除失败自动返回我的界面后，然后再进入我的下载再次点删除，软件会提示很抱歉，已停止的提示。必须重启软件。,审核不通过,17,2016-02-20 19:34:00
30,分享到qq好友问题，无法返回。,分享给qq好友后提示分享成功，点返回竹兜育儿app无法返回，留在qq界面。,审核不通过,15,2016-02-20 19:34:05
31,资源无法暂停下载，取消下载。,下载资源没有暂停功能，万一下了一点用户想取消呢。,审核不通过,28,2016-02-20 19:34:19
32,资源视频、音乐在线听问题。,为什么资源里面的动画和音乐不能在线观看，而必须下载后才能观看。,审核不通过,21,2016-02-20 19:34:26
33,活动模板用户无法交互。,建议活动模块加入评轮功能，最好能在线对话评论。,审核不通过,35,2016-02-20 19:34:31
34,个人用户发表经验或提问模块,建议开发用户可以发论坛的模块，大家都可以分享经验，提问求助什么的。,审核不通过,26,2016-02-20 19:35:08
35,搜索功能缺失，无法需找自己想要的。,育儿宝典、宝宝饭等都没有搜索功能，检索内容很不便。测试阶段内容少还不是很明显。,审核不通过,23,2016-02-20 19:35:13
36,登录后我的界面内容缺失,登陆后我的界面查询不到用户信息，也没有修改密码等选项。,审核通过,29,2016-02-20 19:35:33
37,退出应用重新打开应用下载内容取消，需重新下载。,退出应用重新打开应用下载内容取消，需重新下载。切换页面下载仍继续。手机：努比亚x503a  miui7系统,审核通过,28,2016-02-20 19:35:48
38,打开应用，资源中点击视频下载，退出应用后重新打开，无法自动下载,打开应用，资源中点击视频下载，退出应用后重新打开，无法自动下载,审核不通过,28,2016-02-20 19:35:57
39,下载动画时，退出应用，再次进入下载同一个动画时，不能从已下载的地方继续下载,"1、在资源页面，任意点击资源下载
2、在资源下载到一半左右时，双击返回键退出
3、再次进入应用-资源中，点击下载
【结果】
资源重新下载
【预期结果】
资源应从已下载的一半处继续下载",审核通过,28,2016-02-20 19:36:16
40,“规律拍拍看”、“排排队”、“拍手歌”点击下载时，都会提示下载失败,“规律拍拍看”、“排排队”、“拍手歌”点击下载时，都会提示下载失败,审核通过,20,2016-02-20 19:36:24
41,播放视频时，在全屏情况下退出视频，tab标签页选中“音乐”但其中的列表则是视频,"1、在我的下载中，播放视频，并且播放时点击全屏播放
2、点击手机返回键，返回我的下载
【结果】
ab标签页选中“音乐”但其中的列表则是视频，这个请看截图",审核通过,27,2016-02-20 19:36:35
42,播放视频时，点击视频列表tab页，列表中的视频大小显示为null,"1、在我的下载中，播放视频
2、点击视频列表tab页
【结果】
列表中的视频大小显示为null",审核通过,27,2016-02-20 19:36:56
43,退出下载页面后再进入下载页面后不能继续下载,退出下载页面后再进入下载页面后不能继续下载，需重新下载，手机型号为红米note4g加强版,审核通过,14,2016-02-20 19:37:05
44,密码可以输入无限个字符，并且注册成功,"在注册界面，输入手机号码，输入密码可以输入无限个字符。并且注册成功
手机:小米3
网络：电信wifi
系统：安卓4.4.4",审核不通过,31,2016-02-20 19:37:18
45,宝宝昵称可以输入无限个字符，并且注册成功。,"在注册界面，输入手机号码，输入宝宝昵称可以输入无限个字符。并且注册成功
手机:小米3
网络：电信wifi
系统：安卓4.4.4",审核不通过,31,2016-02-20 19:37:28
46,打开app---资源----动画----选择一个动画下载----按手机返回键退出软件-----重新打开app----发现刚才没有下载完成的任务没有继续下载，按照上面的步骤下载动画需要从头开始下载，浪费流量。,打开app---资源----动画----选择一个动画下载----按手机返回键退出软件-----重新打开app----发现刚才没有下载完成的任务没有继续下载，按照上面的步骤下载动画需要从头开始下载，浪费流量。,审核通过,37,2016-02-20 19:37:38
47,打开app----资源----音乐---点击一首歌曲----出现下载、取消对话框-----按手机物理返回键没有任何反应。。。。。,打开app----资源----音乐---点击一首歌曲----出现下载、取消对话框-----按手机物理返回键没有任何反应。。。。。,审核通过,12,2016-02-20 19:37:58
48,打开app----我的---签到---幸福登录----立即注册----填好手机号、密码、昵称、验证码这些信息，宝宝月龄不填------提交-----软件会完成注册，但是最重要的月龄我没填，而且登陆后，在软件里面也不能再次修改了。,打开app----我的---签到---幸福登录----立即注册----填好手机号、密码、昵称、验证码这些信息，宝宝月龄不填------提交-----软件会完成注册，但是最重要的月龄我没填，而且登陆后，在软件里面也不能再次修改了。,审核不通过,29,2016-02-20 19:38:15
49,打开app----我的----下载----把里面下载好的音乐都删除了----返回---点击下方中央的音乐播放按钮-----虽然一直在提示暂无音乐，请到免费资源处下载！这个提示，但是手机扬声器还是会有音乐播放的声音。,打开app----我的----下载----把里面下载好的音乐都删除了----返回---点击下方中央的音乐播放按钮-----虽然一直在提示暂无音乐，请到免费资源处下载！这个提示，但是手机扬声器还是会有音乐播放的声音。,审核通过,21,2016-02-20 19:38:26
50,打开app---点击首页上的入园准备，百宝箱广告-----进行缩放操作---页面不能很好的适配，出现了排版混乱的情况！,打开app---点击首页上的入园准备，百宝箱广告-----进行缩放操作---页面不能很好的适配，出现了排版混乱的情况！,审核通过,2,2016-02-20 19:38:56
51,打开app---我的---反馈----软件没有字数提示，当点击提交才会说，字数超过限制，给人感觉非常突兀！,打开app---我的---反馈----软件没有字数提示，当点击提交才会说，字数超过限制，给人感觉非常突兀！,审核通过,18,2016-02-20 19:39:05
52,打开app---我的---帮助-----电视观看竹兜动画（安卓手机适用）-----页面下方的ipazzport蓝色字体超链接点击没有任何反应！,打开app---我的---帮助-----电视观看竹兜动画（安卓手机适用）-----页面下方的ipazzport蓝色字体超链接点击没有任何反应！,审核通过,26,2016-02-20 19:39:41
53,软件的提示框非常缓慢，以至于我已经进入到了另外一个页面软件还在提示。,软件的提示框非常缓慢，以至于我已经进入到了另外一个页面软件还在提示。,审核不通过,36,2016-02-20 19:39:47
54,打开app---播放一段音乐----返回首页----点击下方中央的关闭字样，不能停止音乐播放。,打开app---播放一段音乐----返回首页----点击下方中央的关闭字样，不能停止音乐播放。,审核通过,30,2016-02-20 19:39:52
55,打开app---播放一段视频---全屏----不能进行亮度调节与音量调节等手势操作！,打开app---播放一段视频---全屏----不能进行亮度调节与音量调节等手势操作！,审核不通过,27,2016-02-20 19:39:57
56,下载视频时，提示下载失败。登录和不登录都下载失败。4g网和wifn都试了。,打开竹兜育儿.点击资源.点击某个动画点击下载，出现下载失败，请重试。重试好几次都不行。手机型号zte grand s ii lte,审核通过,37,2016-02-20 19:40:05
57,同视频下载一样..................,同视频下载一样......................................,审核不通过,38,2016-02-20 19:40:10
58,反馈意见的时候，点击方框没反应,打开竹兜育儿，在我的页面，点击反馈进入反馈意见的时候。点击大方框没有反应。必须点击方框里预留的字才可以。,审核不通过,18,2016-02-20 19:40:16
59,分享的时候点击微信好友和微信朋友圈无反应无法分享,打开竹兜育儿，在我的页面，点击分享，点击微信好友和微信朋友圈无反应无法分享,审核不通过,15,2016-02-20 19:40:26
60,视频下载时退出下载页面后再进入下载页面不能继续下载,视频下载时退出下载页面后再进入下载页面不能继续下载。酷派9150，安卓4.1，wifi,审核通过,14,2016-02-20 19:40:33
61,视频下载时退出下载页面后再进入下载页面不能继续下载,视频下载时退出下载页面后再进入下载页面不能继续下载。康佳l826，安卓4.3，wifi,审核不通过,14,2016-02-20 19:40:40
62,软件新手引导页面图片变形,装完软件后，在新手引导页面显示的前三张图片明显被拉长了，文字及图片都变形了，第四张图片就正常。,审核不通过,24,2016-02-20 19:40:50
63,软件首页第一张广告图跳转后的页面排版错乱,软件首页选择顶部第一张广告图“入园准备百宝箱，让宝宝爱上幼儿园”，点击后跳转的页面排版错乱。,审核通过,2,2016-02-20 19:40:55
64,音乐播放页面的图片显示异常,进入软件，选择资源，再选择音乐，任意点击一个音乐下载后进行播放，在播放页面中间的图片像素非常差，基本看不清楚，而且在圆圈外围有两个突出的小白点。,审核不通过,30,2016-02-20 19:41:02
65,文章分享功能有问题，分享的不是文章而是一张软件截图,进入软件，点击任意一篇文章，选择文章右上角分享按钮，选择分享至微信好友，分享的内容不是当前文章，而是一张软件截图。,审核不通过,26,2016-02-20 19:41:17
66,1.宝典-顶部滚动图片，第一轮从第1张连续滚动切换到第4张时，圆圈是实心红点；但第2轮滚动后，图片右下角的圆圈是空心的。,1.宝典-顶部滚动图片，第一轮从第1张连续滚动切换到第4张时，圆圈是实心红点；但第2轮滚动后，图片右下角的圆圈是空心的。,审核通过,25,2016-02-20 19:41:32
67,2.活动，向下滑动屏幕进行刷新时，显示的“上次更新时间:”后没有显示具体时间。,2.活动，向下滑动屏幕进行刷新时，显示的“上次更新时间:”后没有显示具体时间。,审核通过,9,2016-02-20 19:41:36
68,3.未登录，在资源-免费资源-动画，下载了规律排排看。但在我的-下载-视频，点击一下规律排排看，底部弹出播放|删除|取消功能。点击删除，系统提示app已停止运行。,3.未登录，在资源-免费资源-动画，下载了规律排排看。但在我的-下载-视频，点击一下规律排排看，底部弹出播放|删除|取消功能。点击删除，系统提示app已停止运行。,审核通过,17,2016-02-20 19:41:47
69,4.注册页面输入19645786958，点击获取验证码，提示mobile number is invalid，紧接着又提示获取验证码失败。提示语可读性差,4.注册页面输入19645786958，点击获取验证码，提示mobile number is invalid，紧接着又提示获取验证码失败。提示语可读性差,审核通过,8,2016-02-20 19:41:52
70,5.我的-签到-幸福登陆。登陆页面，点击左上角的返回<，没有返回到上一页，而是将app隐藏到了后台。,5.我的-签到-幸福登陆。登陆页面，点击左上角的返回<，没有返回到上一页，而是将app隐藏到了后台。,审核通过,22,2016-02-20 19:42:03
71,视频下载时候并没有明确提示正在下载，也没有可以暂停或停止下载的按钮，用户使用很不方便,视频下载时候并没有明确提示正在下载，也没有可以暂停或停止下载的按钮，用户使用很不方便,审核通过,38,2016-02-20 19:42:12
72,注册页面手机号一栏随便输入中文，在点获取验证码，会有两次错误提示信息，一次英文一次中文,注册页面手机号一栏随便输入中文，在点获取验证码，会有两次错误提示信息，一次英文一次中文,审核通过,8,2016-02-20 19:42:28
73,注册页面手机号一栏竟然能够输入中文，应该限定只能输入数字,注册页面手机号一栏竟然能够输入中文，应该限定只能输入数字,审核通过,31,2016-02-20 19:42:42
74,活动页面最下方提示上啦加载更多，实际上无论上啦还是下啦，内容都没发生变化,活动页面最下方提示上啦加载更多，实际上无论上啦还是下啦，内容都没发生变化,审核不通过,23,2016-02-20 19:42:52
75,下载音乐后，点击下方功能中的关闭，仍然会提示没有音乐，请下载，这个提示信息不正确,下载音乐后，点击下方功能中的关闭，仍然会提示没有音乐，请下载，这个提示信息不正确,审核通过,21,2016-02-20 19:43:04
76,视频下载时候切换到其他功能，等会在切换到视频资源页面，视频有时候会继续下载，有时候会提示下载失败,视频下载时候切换到其他功能，等会在切换到视频资源页面，视频有时候会继续下载，有时候会提示下载失败,审核通过,20,2016-02-20 19:43:10
77,"视频下载时切换到其他界面会继续下载,但退出app后再次进入不会继续下载,而是需要重新开始下载","打开app,资源页面点击视频下载,下载中间切换到其他界面不会停止下载,双击返回键退出app后重新打开app进入下载页面不会继续上次下载,而是需要重新开始",审核通过,14,2016-02-20 19:43:19
78,app里无论分享哪个内容都是显示同一张图片,"打开app,进入宝典,打开某一宝典详情,点右上角分享,选择分享到微信朋友圈,分享任何宝典显示的都是同一张图,而不是宝典详情截图",审核不通过,15,2016-02-20 19:43:25
79,"登陆界面,手机号栏可以输入任意字符","打开app,进入登陆界面,显示的手机号栏可以输入任意字符,未对是否是手机号进行检查",审核不通过,31,2016-02-20 19:43:28
80,"反馈页面,手机号栏可以改为任意字符,也能提交成功","登陆app,进入我的->反馈页面,手机号栏默认是注册的手机号,但可以改成任意字符,也能成功提交",审核不通过,31,2016-02-20 19:43:38
81,"注册页面,验证码输入错误时只提示注册失败,而不是提示具体失败原因","进入app注册页面,输入错误的验证码,提交时只是提示注册失败,而没有具体失败原因",审核不通过,32,2016-02-20 19:43:42
82,"忘记密码页面,输入错误的手机验证码时提示密码长度不够,而不是验证码错误","进入app登陆界面,点右下角""忘记密码"",进入后填写完手机号,获取验证码,如果不小心填入了错误的验证码,提交后提示密码长度不够,而不是验证码错误,提示完全误导",审核不通过,10,2016-02-20 19:43:45
83,"我的下载页面,点击音乐或视频出现""播放,删除,取消""菜单,但按安卓系统的返回键菜单不会退出","进入app,我的->下载,点击某一音乐或视频出现""播放,删除,取消""菜单,但按安卓系统的返回键不能退出菜单,只有按空白处或点了取消才能退出菜单",审核不通过,17,2016-02-20 19:43:48
84,"修改昵称时未对长度进行限制,但输入的昵称长度50字符时保存时失败","进入app,我的,点击头像进入个人详情页,宝宝昵称可以输入任意长度字符,但输入的昵称长度超过50个字符时保存时失败",审核不通过,31,2016-02-20 19:43:50
85,"注册时提示宝宝月龄设置后不能更改,但实际不输入宝宝月龄也能提交注册成功","打开app,进入注册页,显示宝宝月龄设置后不能更改,但实际未强制要求输入宝宝月龄,不输入宝宝月龄也能提交注册成功",审核不通过,7,2016-02-20 19:43:54
86,"播放音时再播放视频,音乐会暂停,但退出视频播放后,音乐仍然暂停,不会继续播放","进入app,播放某一下载的音乐,退回到下载的视频页面播放视频,此时音乐会暂停播放,但退出视频播放后音乐不会自动继续播放,而是停在暂停状态",审核不通过,27,2016-02-20 19:43:58
87,"活动页面,显示上拉加载更多,实际无论怎么上拉也都是这些内容","登陆app,进入活动页面,拉到最下面,显示上拉加载更多,实际无论怎么上拉也都是这些内容,没有更多内容加载",审核不通过,23,2016-02-20 19:44:13
88,下载到一半后退出，又重新开始下载,下载到一半后退出，又重新开始下载，三星s3,审核通过,14,2016-02-20 19:44:24
89,点击资源，动画或者音乐，选择其中任意资源，点击下载，资源开始下载，此时如果用户想要终止该资源继续下载，点击后无终止，资源还继续在下载。,点击资源，动画或者音乐，选择其中任意资源，点击下载，资源开始下载，此时如果用户想要终止该资源继续下载，点击后无终止，资源还继续在下载。,审核不通过,37,2016-02-20 19:44:29
90,选择我的，进入下载项目，对其中操作下载的资源选中，点击删除，弹出程序停止运行的错误提示。手机型号酷派k1。,选择我的，进入下载项目，对其中操作下载的资源选中，点击删除，弹出程序停止运行的错误提示。手机型号酷派k1。,审核不通过,17,2016-02-20 19:44:57
91,活动更新长时间显示正在加载中,在活动中下拉更新活动，始终显示正在加载中。,审核通过,35,2016-02-20 19:45:08
92,音乐播放按钮出现问题。,音乐下载好了，在点击主页面音乐播放时显示无音乐请下载再播放。,审核通过,30,2016-02-20 19:45:21
93,关于视频下载的问题。,"在进入资源界面随机点击某一视频进行下载后，进入我的界面里的下载里没有关于下载进度的显示，返回资源界面后视频下载还在继续，下载完成后在我的界面里的下载里有下载好的视频，如果在下载时推出app重新进入时下载进度丢失，需要重新开始下载。
手机：红米note3 网络：wifi",审核通过,14,2016-02-20 19:45:32
94,在音乐播放时主界面显示可能存在问题,"在音乐播放时，可以正常下载，下载后可以正常播放，但是在播放时主界面中间的圆形按钮还是显示灰色的，并且文字还是“关闭”，可能现实上存在问题或者未设计图形改变。
手机：红米note3 网络：wifi",审核通过,30,2016-02-20 19:45:43
95,登陆后用户名显示和注册手机号不符,"登陆后显示的用户名为注册时填写的宝宝昵称，而不是注册时的手机号。
手机：红米note3，网络：wifi",审核不通过,29,2016-02-20 19:45:57
