id,bug详情,复现步骤,审核状态,重复情况,提交时间
205,下载app 打开 app  在app人意页面顶端看到的小人符号 点击无法进入个人设置界面 无法登录,下载app 打开 app  在app人意页面顶端看到的小人符号 点击无法进入个人设置界面 无法登录,审核通过,21,2016-02-24 06:13:08
206,下载app 打开 app  在游戏中心点击下载游戏有一定几率出错 下载游戏可可点击取消 但是不能点击暂停,下载app 打开 app  在游戏中心点击下载游戏有一定几率出错 下载游戏可可点击取消 但是不能点击暂停,审核通过,30,2016-02-24 06:13:12
207,下载app 打开 app  在游戏中心页面上面搜索框里输入游戏  搜索出来的内容为热血游戏王 但是字体有遮挡 显示不完全的,下载app 打开 app  在游戏中心页面上面搜索框里输入游戏  搜索出来的内容为热血游戏王 但是字体有遮挡 显示不完全的,审核通过,33,2016-02-24 06:13:17
208,下载app 打开 app  在游戏中心页面上面搜索框里输入游戏  出现搜索界面  左上角个人头像和主页同样位置头像不一致,下载app 打开 app  在游戏中心页面上面搜索框里输入游戏  出现搜索界面  左上角个人头像和主页同样位置头像不一致,审核通过,24,2016-02-24 06:13:22
209,下载app 打开 app 点击游戏中心页面排行按钮 进入游戏排行页面 发现游戏排行混乱 第一热度猜39 第二就已经53了 怎么排的,下载app 打开 app 点击游戏中心页面排行按钮 进入游戏排行页面 发现游戏排行混乱 第一热度猜39 第二就已经53了 怎么排的,审核通过,17,2016-02-24 06:13:28
210,下载app 打开 app 点击游戏中心 点击任意游戏下载 发现均无版本号 只有最后更新日期,下载app 打开 app 点击游戏中心 点击任意游戏下载 发现均无版本号 只有最后更新日期,审核通过,30,2016-02-24 06:13:51
211,搜索功能问题，当搜索框不写东西时进行搜索，会出现返回首页提示,安装好软件，打开软件，进入到首页游戏中心，可以看到，顶端的搜索框，在搜索框不写东西进行搜索，会提示系统限制信息，建议去掉信息提示，当不输入东西时点击搜索仍可以进入到搜索页面，像百度搜索一样,审核通过,33,2016-02-24 06:14:00
212,浏览页面时，搜索框移动问题,安装好软件，打开软件，进入到首页游戏中心，可以看到，顶端的搜索框，在浏览其他游戏往下浏览页面，发现搜索框随着移动，并时不时遮住其他游戏，这样会影响浏览效果，建议搜索框固定在顶端，不随浏览而移动,审核通过,3,2016-02-24 06:14:10
213,个人中心页面的内容跟游戏中心的内容一样,安装好软件，打开软件，进入到首页游戏中心，可以看到各种游戏，然后点击个人中心，发现页面跟游戏中心的页面是一模一样的，建议要有区别，比如个人中心显示个人信息等,审核通过,9,2016-02-24 06:14:20
214,文件下载无后台功能，影响浏览其他游戏,安装好软件，打开软件，进入到首页游戏中心，随意点击一个游戏进行下载，自动跳出下载框，但没法返回游戏中心，一旦返回就终止游戏下载了，建议开发后台下载功能，这样在下载游戏时可以浏览其他游戏,审核通过,30,2016-02-24 06:14:25
215,游戏提出的宣传图片过小，点击单独查看后还是一样,安装好软件，打开软件，进入到首页游戏中心，点击任一游戏，可以看到游戏介绍，但是介绍的图片太小，无法引起继续查看的兴趣，单独点击放大查看还是一样，建议放大图片，并使单独点击查看时自动匹配手机页面，引导继续查看,审核通过,26,2016-02-24 06:14:36
216,网页新闻或是游戏攻略新闻无法收藏或点赞,安装好软件，打开软件，进入到首页游戏中心，点击下边的游戏新闻，分别查看游戏攻略或是游戏资讯，发现页面只有文字图片性的述说，并无文章的收藏或是点赞功能，这样会造成在阅读后就忘记了，如果某天要看曾经阅读过的攻略就需要重新找过，这样不方便,审核通过,26,2016-02-24 06:14:43
217,个人头像位置点击无反应,安装好软件，打开软件，进入到首页游戏中心，点击左上角的个人头像，发现无反应，亦即该功能无法使用,审核通过,24,2016-02-24 06:14:50
218,游戏运用平台选择手机平台时出现两个搜索框,安装好软件，打开软件，进入到首页游戏中心，点击页面中的新游，然后运用平台，再点击安卓或是苹果，进行平台选择，待列表出来后，发现页面顶端及下边都有搜索框，容易造成要搜索时困扰，建议只出现一个搜索框即可,审核通过,19,2016-02-24 06:14:59
219,新闻资讯，查看资讯详情页面，左上角的返回按钮不好使,"1、新闻资讯，任意选择一条新闻，查看新闻内容
2、在新闻内容页面。点击左上角的返回
3、返回按钮不好使，无法返回到上一页",审核通过,32,2016-02-24 06:15:06
220,游戏礼包页面，输入关键词，查询后页面出现代码[e:loop],"1、游戏礼包，在搜索文本框中输入关键字“包”，点击搜索按钮
2、搜索结果出现代码[e:loop]",审核通过,25,2016-02-24 06:15:27
221,戏中心页面手指向上滑动页面后，搜索框跟随着移动,进入游戏中心模块，手指向上滑动页面，搜索框跟随着向下移动,审核通过,3,2016-02-24 06:15:46
222,游戏礼包页面点击顶部图片没有成功跳转,进入游戏礼包页面后，点击顶部图片没有成功跳转，页面闪一下,审核通过,15,2016-02-24 06:15:55
223,进入游戏礼包模块，点击右上角头像无响应,进入游戏礼包模块，点击右上角图标后无响应，没有成功跳转页面,审核通过,10,2016-02-24 06:16:02
224,进入大话西游戏下载页面后，点击返回专区提示此信息不存在,进入新闻资讯，点击大话西游手游混元顶通关…………进入功略页面后，下拉页面至底部点击礼包进入下载页面，点击返回专区后提示此信息不存在,审核通过,32,2016-02-24 06:16:09
225,个人中心所有功能模块点击无响应,进入个人中心后，点击任意模块无响应，没有跳转至相关页面,审核通过,22,2016-02-24 06:16:19
226,个人中心页面点击登录注册无响应无法进入登录页面,进入个人中心点击头像无响应，没有进入登录注册页面,审核通过,21,2016-02-24 06:16:26
227,搜索后点击取消无法退出搜索,进入游戏中心输入搜索内容后点击搜索，弹出没有符合条件的游戏后，点击取消搜索无法退出搜索,审核通过,33,2016-02-24 06:16:42
228,搜索结果列表页面，点击左上角的头像图标，页面出现遮盖层，不能点击屏幕,"1、在搜索文本框中输入关键字，点击搜索
2、搜索结果页面，点击左上角的头像图标
3、页面出现遮盖层，不能点击屏幕",审核通过,31,2016-02-24 06:17:47
229,游戏中心左上角头像点击无反应,"app/游戏中心,该页面左上角头像点击app无反应",审核通过,24,2016-02-24 06:17:52
230,首页向下滑动浏览后，搜索框跟随移动，但输入框不能使用,"1、在首页向下浏览
2、观察输入框
测试结果：搜索框跟随向下移动，点击输入区域不能激活输入框",审核通过,3,2016-02-24 06:17:58
231,搜索框在正中间，阻挡游戏介绍,首页面的搜索框在正中间，界面下拉也随之下降至正中间阻挡游戏介绍,审核通过,3,2016-02-24 06:18:07
232,搜索款移到了屏幕的中间,打开app后，在游戏中心上下滑动时，搜索框移到到了屏幕的中间,审核通过,11,2016-02-24 06:18:15
233,搜索栏 在屏幕中下 页面滚动 搜索栏不动,在主界面 向下滑动屏幕 搜索栏 在屏幕中下 页面滚动 搜索栏不动 测试 机型 小米1,审核通过,25,2016-02-24 06:18:24
234,游戏资讯-----查看更多-----但是点击又显示没有更多内容,游戏资讯-----查看更多-----但是点击又显示没有更多内容,审核不通过,6,2016-02-24 06:18:43
235,游戏礼包------更多-----但是点击又显示没有更多内容了,游戏礼包------更多-----但是点击又显示没有更多内容了,审核不通过,6,2016-02-24 06:18:59
236,点击个人中心，页面无反应。。。。。。。。。。。。。。。。。,点击个人中心，页面无反应。。。。。。。。。。。。。。。。。,审核通过,16,2016-02-24 06:19:05
237,新闻资讯左上方的头像，点击页面无反应。。。。。。。。,新闻资讯左上方的头像，点击页面无反应。。。。。。。。,审核通过,20,2016-02-24 06:19:11
238,看不到当前的版本的信息。。。。。。。。。。。。。。。,看不到当前的版本的信息。。。。。。。。。。。。。。。,审核通过,5,2016-02-24 06:19:17
239,不能检测版本有无更新。。。。。。。。。。。。。。。。。,不能检测版本有无更新。。。。。。。。。。。。。。。。。,审核通过,5,2016-02-24 06:19:22
240,第一次打开app的时候，一直转圈显示进度。。。,第一次打开app的时候，一直转圈显示进度。。。,审核不通过,27,2016-02-24 06:19:45
241,无退出键，按手机返回键只是返回上一浏览界面,无退出键，按手机返回键只是返回上一浏览界面,审核通过,23,2016-02-24 06:19:52
242,下载游戏，都不能成功，全都显示，下载出错,下载游戏，都不能成功，全都显示，下载出错,审核通过,30,2016-02-24 06:20:09
243,下载界面，显示游戏更新至，后面就没内容了...什么意思,下载界面，显示游戏更新至，后面就没内容了...什么意思,审核通过,6,2016-02-24 06:20:17
244,游戏下载，不能显示游戏大小，不能却定是否用手机流量下载,游戏下载，不能显示游戏大小，不能却定是否用手机流量下载,审核通过,35,2016-02-24 06:20:26
245,游戏下载进度条，左面显示百分数，右面也显示百分数，重复了,游戏下载进度条，左面显示百分数，右面也显示百分数，重复了,审核通过,35,2016-02-24 06:20:31
246,"打开app,个人中心，点击可无法进入，回到app主界面。","打开app,个人中心，点击可无法进入，回到app主界面。",审核通过,22,2016-02-24 06:20:38
247,游戏中心―升级―进去后开测表和开服表都是空白，刷新多次，网络无问题。,游戏中心―升级―进去后开测表和开服表都是空白，刷新多次，网络无问题。,审核通过,34,2016-02-24 06:20:46
248,游戏中心，点击左上角图标，点击可无反应，，，，，，,游戏中心，点击左上角图标，点击可无反应，，，，，，,审核通过,20,2016-02-24 06:20:58
249,搜索框输入包含单引号“'”进行查询，显示一个白色页面,"1.首页搜索框输入包含单引号“'”的字符（如熊猫'），点击查询按钮
2.跳转到一个白色页面，并不是正常的查询结果页面
柱：app所有搜索框都有该问题",审核通过,25,2016-02-24 06:21:06
250,首页个人中心点击后闪屏无反应，又进入首页。,首页个人中心点击后闪屏无反应，又进入首页。,审核通过,22,2016-02-24 06:21:11
251,首页左上角的头像，点击后反应，没有链接。,首页左上角的头像，点击后反应，没有链接。,审核通过,20,2016-02-24 06:21:17
252,安装app后第一次无法打开，打开显示页面为空白。,网络状态wifi，手机型号huawei c8817e，系统版本：andriod 4.4.4。下载app安装完成后打开app，显示页面为空白，无法打开。,审核通过,1,2016-02-24 06:21:25
253,在wifi状态下无法打开app。,网络状态wifi，手机型号huawei c8817e，系统版本：andriod 4.4.4。第一次使用打开app显示无法显示页面，将网络切换为4g移动数据，app顺利打开。,审核不通过,1,2016-02-24 06:24:07
254,个人中心页面与游戏中心页面完全相同。,打开app，在个人中心页面与游戏中心页面中显示的内容完全相同、一致。,审核通过,9,2016-02-24 06:24:12
255,游戏中心排行热门游戏未按照热度进行排序。,打开app-游戏中心-游戏排行-热门游戏。其中的游戏未按照热度进行排序。,审核通过,17,2016-02-24 06:24:19
256,游戏中心排行热门游戏、最新游戏、其他游戏的排序完全一致。,打开app-游戏中心-游戏排行-热门游戏、最新游戏、其他游戏。其中每个标签下的游戏排行完全一致。,审核通过,17,2016-02-24 06:24:26
257,游戏礼包中的内容点击进去后加载在90%不在加载。,打开app-游戏礼包-点击功夫熊猫-高级新手礼包。其中的内容点击进去后加载在90%不再加载，一直停留在90%。,审核通过,6,2016-02-24 06:24:36
258,点击左上方个人图标时下方屏幕自动变黑。,打开app-新闻咨询-点击功夫熊猫手游蓝色真气-点击搜索图标-点击左上方个人图标。此时下方屏幕自动变黑。,审核通过,28,2016-02-24 06:24:46
259,点击左上方个人图标，屏幕变黑，但下方游戏的广告图片被突出显示。,游戏中心-大话西游-点击左上方个人图标，屏幕变黑，但下方游戏的广告图片被突出显示。,审核通过,28,2016-02-24 06:24:53
260,温馨提示不能显示完整，只能显示一半。,点击搜索框，不输入任何文字和内容，点击搜索。出现温馨提示，但提示内容只能显示一半，不能显示完整。,审核通过,33,2016-02-24 06:24:59
261,网络连接断开时，无法打开app。,在网络连接断开的情况下，打开app显示页面为空白，无法正常显示页面。,审核通过,1,2016-02-24 06:25:06
262,无法看到输入在底部搜索框中的内容。,游戏中心-新游-运营状态-拉到最底-点击搜索框。此时键盘弹起，无法看到输入在搜索框中的内容。,审核通过,14,2016-02-24 06:25:13
263,底部搜索框中会出现黄色的两条横线,游戏中心-新游-运营状态-拉到最底-点击搜索框。此时搜索框中会出现黄色的两条横线，影响美观。,审核通过,14,2016-02-24 06:25:22
264,点击下载热血游戏王，下载完成后，安装的确是uc浏览器。,点击下载热血游戏王，下载完成后，进行安装安装完成确是uc浏览器。,审核通过,30,2016-02-24 06:25:28
265,下载时前方百分比与后面的显示内容重复。,点击游戏下载，下载时，前方显示游戏下载完成度百分比，后方显示的也是下载完成度，二者之间重复。,审核通过,30,2016-02-24 06:25:34
266,在多次操作遍历程序完成后，多次点击返回键无法退出程序。,在多次操作遍历程序完成后，多次点击返回键无法退出程序，没按一次返回键，均返回至上一次操作界面，不能退出。,审核通过,7,2016-02-24 06:25:48
267,点击个人中心无法进入，点击个人中心无法进入，点击个人中心无法进入，,点击个人中心无法进入，点击个人中心无法进入，点击个人中心无法进入，,审核通过,22,2016-02-24 06:25:59
268,游戏中心左上角头像，点击后无反应，游戏中心左上角头像，点击后无反应，,游戏中心左上角头像，点击后无反应，游戏中心左上角头像，点击后无反应，,审核通过,24,2016-02-24 06:26:09
269,新闻资讯左上角头像，点击后无反应，新闻资讯左上角头像，点击后无反应，,新闻资讯左上角头像，点击后无反应，新闻资讯左上角头像，点击后无反应，,审核通过,24,2016-02-24 06:26:14
270,游戏礼包右上角头像，点击后无反应，游戏礼包右上角头像，点击后无反应，,游戏礼包右上角头像，点击后无反应，游戏礼包右上角头像，点击后无反应，,审核不通过,24,2016-02-24 06:26:44
271,游戏中心下载游戏例如星球大战，已经下载安装好，再点击下载，还是会继续下载，按理说下载安装好不应该还可以重复下载，除非卸载。,游戏中心下载游戏例如星球大战，已经下载安装好，再点击下载，还是会继续下载，按理说下载安装好不应该还可以重复下载，除非卸载。,审核通过,30,2016-02-24 06:26:53
272,进入软件界面，搜索框没有显示在最顶端，而是跑到了屏幕中间，,进入软件界面，搜索框没有显示在最顶端，而是跑到了屏幕中间，,审核通过,11,2016-02-24 06:27:14
273,个人中心・无法进入操作，也无法完成注册登录。,个人中心・无法进入操作，也无法完成注册登录。,审核通过,21,2016-02-24 06:27:37
274,点击个人中心实际打开的是游戏中心界面,"步骤：
1，打开app
2，点击个人中心
期望结果：
打开个人中心界面
实际结果：
打开游戏中心界面",审核通过,12,2016-02-24 06:27:46
275,点击界面左上角图标打开一个灰色蒙版,"步骤：
1，打开app
2，打开游戏中心界面，点击左上角头像图标
期望结果：
打开个人中心界面
实际结果：
打开一个灰色蒙版",审核通过,12,2016-02-24 06:27:51
276,输入空格搜索打开另一个提示界面,"步骤：
1，打开app
2，打开游戏中心，点击搜索，输入空格，点击搜索
期望结果：
提示搜索内容不能为空
实际结果：
跳转到另一个提示界面",审核通过,33,2016-02-24 06:27:58
277,上下滑动游戏中心界面搜索框显示到界面中间位置,"步骤：
1，打开app
2，打开游戏中心界面
3，上下滑动界面
期望结果：
搜索框始终显示在界面最顶端或最底端
实际结果：
搜索框始终显示在界面中间位置",审核通过,11,2016-02-24 06:28:05
278,游戏无法切换到后台下载,"步骤：
1，打开app
2，打开游戏中心，选择任意一款游戏下载
期望结果：
游戏可以在后台下载
实际结果：
游戏无法在后台下载，只能等待游戏下载完才能进行其他操作",审核通过,30,2016-02-24 06:28:11
279,点击右下角的“个人中心”四个字，没有进入个人中心页面，而是进入了“游戏中心”页面。只有点击“个人中心”文字上的图标才能进入个人中心。,点击右下角的“个人中心”四个字，没有进入个人中心页面，而是进入了“游戏中心”页面。只有点击“个人中心”文字上的图标才能进入个人中心。,审核通过,22,2016-02-24 06:28:18
280,个人中心界面有排版错误,"安装打开软件，打开“个人中心”界面，可见明显文字位置排版错误。
samsung s4 i9500 安卓4.4.2 wifi",审核通过,12,2016-02-25 01:19:31
281,进入个人中心界面右上角的设置小齿轮点击没有反应。,进入个人中心界面――右上角的设置小齿轮――点击没有反应,审核通过,16,2016-02-25 01:19:50
282,在首页面一直下滑，点击查看更多按钮，在搜索框输入任意一个字，比如啊，点击搜索按钮，跳转至空白页面，点击左上角按钮，出现灰色空白页面,在首页面一直下滑，点击查看更多按钮，在搜索框输入任意一个字，比如啊，点击搜索按钮，跳转至空白页面，点击左上角按钮，出现灰色空白页面，如截图所示,审核通过,18,2016-02-25 01:19:59
283,在首页面一直下滑，点击查看更多按钮，接着点击右上角的搜索按钮，出现提示页面，该页面显示不全,在首页面一直下滑，点击查看更多按钮，接着点击右上角的搜索按钮，出现提示页面，该页面显示不全，如截图所示,审核通过,18,2016-02-25 01:20:06
284,点击导航栏的个人中心按钮，进入该页面，发现在该页面内，点击任何按钮都没有响应,点击导航栏的个人中心按钮，进入该页面，发现在该页面内，点击任何按钮都没有响应,审核通过,34,2016-02-25 01:20:12
285,点击首页面最上方的游戏图片，进入页面之后点击网游新闻右边的搜索按钮，进入搜索页面，发现左上角的头像和返回按钮重叠在了一起,点击首页面最上方的游戏图片，进入页面之后点击网游新闻右边的搜索按钮，进入搜索页面，发现左上角的头像和返回按钮重叠在了一起，如截图所示,审核通过,18,2016-02-25 01:20:18
286,在wifi环境下，点击首页面最上方的游戏图片，进入网游新闻页面，点击左上角的返回按钮也没响应,在wifi环境下，点击首页面最上方的游戏图片，进入网游新闻页面，点击左上角的返回按钮也没响应,审核通过,32,2016-02-25 01:20:24
287,在wifi环境下，点击首页面最上方的游戏图片，发现在加载时，进度条显示是由100，然后再从15逐渐增加的,在wifi环境下，点击首页面最上方的游戏图片，发现在加载时，进度条显示是由100，然后再从15逐渐增加的,审核通过,26,2016-02-25 01:20:32
288,在游戏礼包页面，点击右上角的头像按钮，没有任何响应,在游戏礼包页面，点击右上角的头像按钮，没有任何响应,审核通过,10,2016-02-25 01:20:37
289,在游戏礼包页面，在搜索框输入功夫熊猫，点击搜索按钮，出现错误页面,在游戏礼包页面，在搜索框输入功夫熊猫，点击搜索按钮，出现错误页面，如截图所示,审核通过,18,2016-02-25 01:20:42
290,点击导航栏的游戏礼包按钮，进入该页面，搜索框的搜索按钮显示有问题，搜索图片下方没有和输入框下方对齐，超出了一部分,点击导航栏的游戏礼包按钮，进入该页面，搜索框的搜索按钮显示有问题，搜索图片下方没有和输入框下方对齐，超出了一部分，如截图所示,审核通过,18,2016-02-25 01:20:47
291,点击下方导航栏的新闻资讯按钮，接着点击任意一条资讯，进入页面之后点击左上角的返回按钮，没有任何响应,点击下方导航栏的新闻资讯按钮，接着点击任意一条资讯，进入页面之后点击左上角的返回按钮，没有任何响应,审核通过,32,2016-02-25 01:20:52
292,点击任意一个游戏进行下载，在下载过程中点击取消，接着点击关闭按钮，出现无响应,点击任意一个游戏进行下载，在下载过程中点击取消，接着点击关闭按钮，出现无响应，如截图所示,审核通过,30,2016-02-25 01:20:56
293,wifi环境下，点击下方导航栏的个人中心按钮，加载过程中最上方的个人中心四个字字体过大,wifi环境下，点击下方导航栏的个人中心按钮，加载过程中最上方的个人中心四个字字体过大，如截图所示,审核通过,34,2016-02-25 01:21:02
294,首页面点击左上角的头像按钮没有任何响应,在首页面，点击左上角的头像按钮，发现没有任何响应,审核通过,10,2016-02-25 01:21:06
295,进入98仙游左上角的个人头像点击没有反应。,进入98仙游――游戏中心――左上角的个人头像――点击没有反应,审核通过,20,2016-02-25 01:21:12
