id,bug详情,复现步骤,审核状态,重复情况,提交时间
105,新闻资讯界面的新闻的来源都是空的，进入某个网游新闻，拉到最下面点击其中一条新闻，多次操作后，点击返回button，回不到主界面了,新闻资讯界面的新闻的来源都是空的，进入某个网游新闻，拉到最下面点击其中一条新闻，多次操作后，点击返回button，回不到主界面了,审核通过,32,2016-02-24 01:12:47
106,每一篇文章或者地址加载都非常慢，是不是没有做缓存，这样非常影响操作者的耐心,每一篇文章或者地址加载都非常慢，是不是没有做缓存，这样非常影响操作者的耐心,审核不通过,26,2016-02-24 01:13:42
107,点击菜单栏中的某一个功能后，希望此功能的图标显示能有别于希望，符合用户操作习惯；游戏中心的前四个和中间的横屏图和整合成滚动图。让下面的今天推荐早点给用户看到,点击菜单栏中的某一个功能后，希望此功能的图标显示能有别于希望，符合用户操作习惯；游戏中心的前四个和中间的横屏图和整合成滚动图。让下面的今天推荐早点给用户看到,审核通过,27,2016-02-24 01:13:51
108,2016.02.20 华为g610测试,2016.02.20 华为g610测试   无法进入个人中心，一直都是和游戏中心界面相同,审核通过,22,2016-02-24 01:14:01
109,在搜索结果页面，按手机返回键，不能返回到应用首页。,在搜索结果页面，按手机返回键，不能返回到应用首页。有跳转动作，但是仍然跳转回搜索结果页面，部分测试了其他的页面，也是这样。,审核通过,31,2016-02-24 01:14:10
110,点击首页左上角头像，应用没有任何动作。,点击首页左上角头像，应用没有任何动作。不能跳转到个人中心或注册页面。在其他页面的左上角或者右上角的头像，同样。,审核通过,10,2016-02-24 01:14:14
111,右下角“个人中心”点击后，有跳转动作，但是仍跳转回主页。,右下角“个人中心”点击后，有跳转动作，但是仍跳转回主页。没有个人中心页面。,审核通过,8,2016-02-24 01:14:20
112,"所有的页面跳转都不太流畅，都有1,2秒钟的延时。","所有的页面跳转都不太流畅，都有1,2秒钟的延时。尤其是第一次打开的页面，延时更长。",审核不通过,15,2016-02-24 01:14:59
113,“游戏礼包”页面广告位被页面标题栏遮挡大约四分之一左右。,“游戏礼包”页面广告位被页面标题栏遮挡大约四分之一左右，对广告的展示有影响。,审核通过,14,2016-02-24 01:15:04
114,所有页面向下划屏时，没有刷新。,所有页面向下划屏时，没有刷新。页面没有更新的结果。,审核通过,15,2016-02-24 01:15:09
115,“新闻资讯”页面，打开一条具体的新闻，点击页面左上角“返回”图标，不能返回到上一级菜单。,“新闻资讯”页面，打开一条具体的新闻，点击页面左上角“返回”图标，不能返回到上一级菜单。但是点击手机返回键，可以返回到上一级。,审核通过,32,2016-02-24 01:15:14
116,部分页面，左上角头像图标和返回图标重合在一起。,部分页面，左上角头像图标和返回图标重合在一起。点击后也没有任何动作。,审核通过,10,2016-02-24 01:15:19
117,搜索框，框线显示不完整。,点击搜索框后，原搜索框里面又出现了一层框，并且框线显示不完整，被右边放大镜图标截断一部分。,审核通过,14,2016-02-24 01:15:25
118,“查看更多”游戏，点击底部搜索框，搜索框会被弹出的键盘遮挡。,一些底部有搜索框的页面，比如“查看更多”游戏，点击底部搜索框，搜索框会被弹出的键盘遮挡。,审核通过,14,2016-02-24 01:15:39
119,搜索字符不符合要求时，弹出的提示页面过大。,搜索字符不符合要求时，弹出的提示页面过大，只能看到页面的三分之一左右。,审核通过,33,2016-02-24 01:15:54
120,游戏搜索页面，点击热搜词，直接跳转到结果页面。,游戏搜索页面，点击热搜词，直接跳转到结果页面。用户的期望结果是，热搜词进入搜索框，等待用户继续输入。,审核不通过,31,2016-02-24 01:16:47
121,点击现在太极熊猫2，显示出错了！清稍候再试！点击手机返回键，无反应，无法返回到上级页面，点击刷新试试，手机全屏白屏，然后只能退出软件。我用的是小米4。,点击现在太极熊猫2，显示出错了！清稍候再试！点击手机返回键，无反应，无法返回到上级页面，点击刷新试试，手机全屏白屏，然后只能退出软件。我用的是小米4。,审核通过,23,2016-02-24 01:17:02
122,一般软件左右滑动屏幕可以在游戏中心、游戏礼包、新闻资讯、个人中心选项中切换，建议增加这项功能。,一般软件左右滑动屏幕可以在游戏中心、游戏礼包、新闻资讯、个人中心选项中切换，建议增加这项功能。,审核不通过,34,2016-02-24 01:17:19
123,点击个人中心显示的页面跟游戏中心的页面一模一样。,点击个人中心显示的页面跟游戏中心的页面一模一样。,审核通过,9,2016-02-24 01:17:25
124,在任何页面游戏中心、游戏礼包、新闻资讯、个人中心选项字体全是灰色，按常理在哪个选项的页面，哪个选项的字体应该变颜色，方便用户知道自己所在的页面。,在任何页面游戏中心、游戏礼包、新闻资讯、个人中心选项字体全是灰色，按常理在哪个选项的页面，哪个选项的字体应该变颜色，方便用户知道自己所在的页面。,审核不通过,34,2016-02-24 01:17:39
125,点击左上角的人物头像，软件无反应。,点击左上角的人物头像，软件无反应。点击左上角的人物头像，软件无反应。,审核通过,20,2016-02-24 01:17:44
126,建议在新闻资讯里面的游戏攻略、游戏资讯的具体页面里增加点赞、评论的功能，方便大家交流游戏心得。,建议在新闻资讯里面的游戏攻略、游戏资讯的具体页面里增加点赞、评论的功能，方便大家交流游戏心得。,审核通过,26,2016-02-24 01:18:14
127,游戏下载排行里的周榜跟月榜一模一样，现在是2月第3周，应该是信息没有及时更新。,游戏下载排行里的周榜跟月榜一模一样，现在是2月第3周，应该是信息没有及时更新。,审核通过,17,2016-02-24 01:18:19
128,游戏下载排行里只有周榜跟月榜，建议增加个总下载排行榜。,游戏下载排行里只有周榜跟月榜，建议增加个总下载排行榜。,审核不通过,30,2016-02-24 01:18:32
129,建议在每个游戏的下载页面增加个网友评论，方便大家提前了解此游戏的好坏。,建议在每个游戏的下载页面增加个网友评论，方便大家提前了解此游戏的好坏。,审核不通过,35,2016-02-24 01:18:45
130,每个游戏的下载页面里没有写明该游戏的大小，大家很在意这点，建议写明游戏大小。,每个游戏的下载页面里没有写明该游戏的大小，大家很在意这点，建议写明游戏大小。,审核通过,35,2016-02-24 01:18:52
131,在无线网情况下，直接进入锦江之星，打不开游戏主界面。,在无线网情况下，直接进入锦江之星，打不开游戏主界面。,审核通过,28,2016-02-24 01:19:25
132,点击搜索输入“太极熊猫”弹出画面，发现页面的左上方返回键（小人头像与其它物重合）非返回键。,在首页中点击点击搜索输入“太极熊猫”弹出画面，发现页面的左上方返回键（小人头像与其它物重合）非返回键。,审核通过,33,2016-02-24 01:19:30
133,点击排行榜在跳转胡页面上点击最新游戏，其他游戏页面与热门游戏一致，没有进行跳转。,在首页中点击排行榜在跳转胡页面上点击最新游戏，其他游戏页面与热门游戏一致，没有进行跳转,审核通过,15,2016-02-24 01:19:36
134,在点击周榜、月榜页面没有进行跳转,在首页中点击排行榜在跳转胡页面上点击周榜、月榜页面一致，没有进行跳转。,审核通过,15,2016-02-24 01:19:40
135,点击搜索，页面100%缓冲后，弹出页面后跳转至首页。,从首页中点击搜索，页面100%缓冲后，弹出页面后跳转至首页。,审核通过,33,2016-02-24 01:19:49
136,点击开服表、开测表页面一致没有进行跳转。,从首页中点击开服，在跳转胡页面中点击开服表、开测表页面一致没有进行跳转。,审核通过,0,2016-02-24 01:20:03
137,主界面按钮在高分辨率屏幕上显示模糊,"进入app发现主界面下面四个选项按钮以及左上角个人中心按钮显示模糊，轮廓不清楚，边缘有锯齿出现，手机屏幕为1920*1080分辨率其他的界面上各个图标也有同样的问题，有部分出现模糊的现象。
手机：红米note3 网络：wifi
手机：",审核通过,18,2016-02-24 01:20:14
138,个人中心无法打开点击无响应,在进入app点击主界面下方最后面的一个“我的”项，出现加载界面，但是加载结束后还是首页的界面，没有进入“我的”界面或者个人中心。,审核通过,22,2016-02-24 05:49:44
139,主界面左上角按钮点击无反馈,"在主界面左上角有一个和右下角”我的“选项相同的按钮（个人认为应该也是个人中心之类的），但是点击后完全无反应，无任何界面加载或跳转。
手机：红米note3 网络：wifi",审核通过,34,2016-02-24 05:49:51
140,游戏下载机制存在问题,"在进入app后，选择游戏下载后下载界面是弹出形式，只有一个下载进度条和一个取消按钮，游戏下载速度正常，但是在下载期间无法在app内进行其他操作，效率较低，无法在后台下载。
手机：红米note3 网络：wifi",审核通过,30,2016-02-24 05:49:57
141,app内游戏详情页面信息不足,"在进入app内选择游戏进入详情页没有游戏的大小，评价等详情，在游戏名下标的类型和平台也未显示，只有时间一项显示，游戏下载界面只有简单的百分比显示，没有实时的数据接收量显示，在飞wifi网络下浏览下载游戏时可能会因判断失误造成流量浪费。（因微任务图片数量问题未附图片）
手机：红米note3 网络：wifi",审核通过,35,2016-02-24 05:50:02
142,在进入游戏详情页图标显示问题,"在进入游戏详情页后，左上角出现返回按钮和人形个人中心按钮重合现象，点击后未返回或进入个人中心，而是浮现详情页中的图片，再次点击则响应，按物理返回按键后返回可以返回详情页，再次按物理返回按键返回主界面。
手机”红米note3 网络：wifi",审核通过,32,2016-02-24 05:50:24
143,运行软件，下拉软件。上面的搜索框自图案跳到屏莫下方，,运行软件，下拉软件。上面的搜索框自图案跳到屏莫下方，,审核通过,19,2016-02-24 05:50:32
144,运行软件，左上角的头像点击无反应。,运行软件，左上角的头像点击无反应。运行软件，右上角的头像点击无反应。,审核通过,20,2016-02-24 05:50:37
145,运行软件，右下角的个人中心，无任务反应与提示,运行软件，右下角的个人中心，无任务反应与提示,审核不通过,16,2016-02-24 05:51:42
146,运行软件，点右上角的风云再起再点右上角的搜索，出来的页面左上角的个人头象与返回箭头重合,运行软件，点右上角的风云再起再点右上角的搜索，出来的页面左上角的个人头象与返回箭头重合,审核通过,4,2016-02-24 05:52:25
147,运行软件，点右上角的风云再起进入的页面，最上肌的网游新闻没有居中显示,运行软件，点右上角的风云再起进入的页面，最上肌的网游新闻没有居中显示,审核通过,4,2016-02-24 05:52:32
148,运行软件，点右上角的风云再起再点右上角的搜索，选择大话西游。然后点左上角的返回键，跳出的是放大的游戏图片介绍,运行软件，点右上角的风云再起再点右上角的搜索，选择大话西游。然后点左上角的返回键，跳出的是放大的游戏图片介绍,审核通过,4,2016-02-24 05:52:40
149,运行软件，点右上角的风云再起再点右上角的搜索，选择大话西游。然后点个人中心，页面直接返回软件的着页,运行软件，点右上角的风云再起再点右上角的搜索，选择大话西游。然后点个人中心，页面直接返回软件的着页,审核通过,4,2016-02-24 05:53:26
150,个人中心点不了，别的都能点。,个人中心点不了，别的都能点。手机型号是魅蓝2。,审核通过,28,2016-02-24 05:53:31
151,安装运行软件点击个人中心没有转跳到个人中心，而是刷新主页,安装运行软件点击个人中心没有转跳到个人中心，而是刷新主页,审核通过,8,2016-02-24 05:53:39
152,安装运行软件点击左上角头像没有转跳到个人中也无任何提示,安装运行软件点击左上角头像没有转跳到个人中也无任何提示,审核通过,24,2016-02-24 05:53:47
153,安装运行软件搜索框输入aa点搜索，左上角的左箭头与头像图标重叠,安装运行软件搜索框输入aa点搜索，左上角的左箭头与头像图标重叠,审核通过,31,2016-02-24 05:53:55
154,安装运行软件点游戏礼包，选择第一个礼包，进入后，搜索框怎么到最下面去了,安装运行软件点游戏礼包，选择第一个礼包，进入后，搜索框怎么到最下面去了,审核通过,19,2016-02-24 05:54:02
155,安装运行软件点游戏礼包，右上角的头像点击无反应,安装运行软件点游戏礼包，右上角的头像点击无反应,审核通过,24,2016-02-24 05:54:07
156,安装运行软件点游戏礼包，中间的搜索框输入新，点搜索，上面出现页面报错。,安装运行软件点游戏礼包，中间的搜索框输入新，点搜索，上面出现页面报错。,审核通过,19,2016-02-24 05:54:12
157,安装运行软件点中间大话西游，最上面的网游新闻没有显示在中间,安装运行软件点中间大话西游，最上面的网游新闻没有显示在中间,审核通过,4,2016-02-24 05:57:52
158,软件app界面最下端个人中心点击无反应，左上角人头像点击无反应。,软件app界面最下端个人中心点击无反应，左上角人头像点击无反应。测试手机：小米note。wifi环境……,审核通过,13,2016-02-24 05:57:57
159,从首页中点击搜索，页面弹跳后返回至首页，没有搜索页面。,从主页面首页中点击搜索，页面弹跳后返回至首页，没有搜索页面。,审核通过,31,2016-02-24 05:58:10
160,在搜索中搜索“大话西游”页面弹跳出来后，发现返回键非返回键是（小人头像与某物重合）。,在首页中搜索中搜索“大话西游”页面弹跳出来后，发现返回键非返回键是（小人头像与某物重合）。,审核通过,31,2016-02-24 05:58:15
161,点击开服表、开测表页面一致没有进行跳转。,在首页中点击开服页面弹跳后，点击开服表、开测表页面一致没有进行跳转。,审核通过,0,2016-02-24 05:58:20
162,开服表、开测表页面一致没有进行跳转。,从首页中点击排行在弹出的页面中开服表、开测表页面一致没有进行跳转。,审核通过,0,2016-02-24 05:58:25
163,在首页中下载了游戏大话西游游戏，没有发现下载记录时间。,从首页中下载了大话西游游戏，没有发现下载记录时间。,审核通过,30,2016-02-24 05:58:33
164,游戏中心，最左上角是一个个人头像图标，点击该图标无任何反应，不能正常调转，同时在右下礼包模块里，该图片在右上角，点击同样也无反应，四个模块中均无正常跳转。,游戏中心，最左上角是一个个人头像图标，点击该图标无任何反应，不能正常调转，同时在右下礼包模块里，该图片在右上角，点击同样也无反应，四个模块中均无正常跳转。,审核通过,13,2016-02-24 05:58:56
165,游戏礼包模块，点右上角头像图标，可点但是点了之后没作用,游戏礼包模块，点右上角头像图标，可点但是点了之后没作用,审核通过,10,2016-02-24 05:59:04
166,游戏中心模块，点排行，上下滑动排行板，搜索框会下滑，并且回不到最上方,游戏中心模块，点排行，上下滑动排行板，搜索框会下滑，并且回不到最上方,审核通过,18,2016-02-24 05:59:09
167,打开软件，点个人中心，跟首页一样，也就是游戏中心页面,打开软件，点个人中心，跟首页一样，也就是游戏中心页面,审核通过,9,2016-02-24 05:59:14
168,运行软件后，选择大话西游进去后，左上角的头像与左箭头显示在一起,运行软件后，选择大话西游进去后，左上角的头像与左箭头显示在一起,审核通过,2,2016-02-24 05:59:21
169,运行软件后，选择大话西游进去后，再点左上角的头像与左箭头的图标，不能还回而是把游戏图片放大显示,运行软件后，选择大话西游进去后，再点左上角的头像与左箭头的图标，不能还回而是把游戏图片放大显示,审核通过,2,2016-02-24 05:59:34
170,运行软件后，选择新闻资讯，默认是全部，为什么全部不像选择后面的游戏攻略加底色标训目前显示的是全部,运行软件后，选择新闻资讯，默认是全部，为什么全部不像选择后面的游戏攻略加底色标训目前显示的是全部,审核不通过,27,2016-02-24 06:00:24
171,下载游戏注册时，输入用户名，点击注册才提醒“用户名最少6个字符”，之前都没有说明,下载游戏注册时，输入用户名，点击注册才提醒“用户名最少6个字符”，之前都没有说明,审核通过,29,2016-02-24 06:00:46
172,输入用户名“西瓜西瓜西瓜”有6个字符了后，点击注册才提醒又才说“用户名只能由数字和字母组成”这个不能一次性提醒到位吗,输入用户名“西瓜西瓜西瓜”有6个字符了后，点击注册才提醒又才说“用户名只能由数字和字母组成”这个不能一次性提醒到位吗,审核通过,29,2016-02-24 06:01:38
173,下载的是大话西游的游戏，但是注册进去看到的却是98仙游新用户注册,下载的是大话西游的游戏，但是注册进去看到的却是98仙游新用户注册,审核通过,29,2016-02-24 06:02:23
174,进入大话西游的游戏，左上角的“用户中心”，点击没有反应，点击不动,进入大话西游的游戏，左上角的“用户中心”，点击没有反应，点击不动,审核通过,20,2016-02-24 06:02:29
175,进入大话西游的游戏，点击开始游戏，也无法进入游戏,进入大话西游的游戏，点击开始游戏，也无法进入游戏,审核不通过,29,2016-02-24 06:03:10
176,大话西游的游戏，点击退出游戏，还是在大话西游游戏界面，没有退出画面，要点击两次退出游戏，直接退出到了手机界面，到不到98仙游的画面,大话西游的游戏，点击退出游戏，还是在大话西游游戏界面，没有退出画面，要点击两次退出游戏，直接退出到了手机界面，到不到98仙游的画面,审核不通过,7,2016-02-24 06:03:35
177,点击“个人中心”没有反应。。。。。。。。。。。。。,点击“个人中心”没有反应。。。。。。。。。。。。。,审核不通过,16,2016-02-24 06:04:31
178,点击左上角人头像，没有反应。。。。。。。。。。。,点击左上角人头像，没有反应。。。。。。。。。。。,审核通过,13,2016-02-24 06:04:38
179,点击游戏礼包，有个“更多”，但是点击后发现有没有更多内容了，第一：如果还有的话，页面完全够显示完，第二，明明就没有更多内容了，还在提示更多,点击游戏礼包，有个“更多”，但是点击后发现有没有更多内容了，第一：如果还有的话，页面完全够显示完，第二，明明就没有更多内容了，还在提示更多,审核不通过,6,2016-02-24 06:05:20
180,新闻资讯里面，有个“查看更多”但是没有更多内容了，还在提示更多,新闻资讯里面，有个“查看更多”但是没有更多内容了，还在提示更多,审核不通过,6,2016-02-24 06:05:31
181,打开“古剑缘”，可以看到更新时间，但是看不到“类型”的介绍,打开“古剑缘”，可以看到更新时间，但是看不到“类型”的介绍,审核不通过,5,2016-02-24 06:05:42
182,打开“古剑缘”，”平台“右边没有介绍。就显示了个“平台：”,打开“古剑缘”，”平台“右边没有介绍。就显示了个“平台：”,审核通过,27,2016-02-24 06:05:58
183,有时，退出，出现问题，一直显示70%，（见截图）,有时，退出，出现问题，一直显示70%，（见截图）,审核不通过,7,2016-02-24 06:07:23
184,不能看到app的版本信息。。。。。。。。。。。。,不能看到app的版本信息。。。。。。。。。。。。,审核通过,5,2016-02-24 06:07:32
185,不能检查到app有不有更新。。。。。。。。。。。。。。。,不能检查到app有不有更新。。。。。。。。。。。。。。。,审核通过,5,2016-02-24 06:07:42
186,体验大话西游的游戏过程中，有出现白板的情况。。。。。。。。,体验大话西游的游戏过程中，有出现白板的情况。。。。。。。。,审核不通过,29,2016-02-24 06:08:00
187,点击游戏中心--一直显示90%--要隔一阵才显示内容,点击游戏中心--一直显示90%--要隔一阵才显示内容,审核不通过,6,2016-02-24 06:09:00
188,看不到版本的信息。。。。。。。。。。。。,看不到版本的信息。。。。。。。。。。。。,审核通过,5,2016-02-24 06:09:09
189,看不到版本有不有更新。。。。。。。。。。。。。。。。。,看不到版本有不有更新。。。。。。。。。。。。。。。。。,审核通过,5,2016-02-24 06:09:15
190,点击游戏礼包--也是显示90%--要隔一阵才显示全部内容,点击游戏礼包--也是显示90%--要隔一阵才显示全部内容,审核不通过,6,2016-02-24 06:09:23
191,新闻资讯左上方的头像是灰色的，点击不开。。。。。。。。,新闻资讯左上方的头像是灰色的，点击不开。。。。。。。。,审核通过,2,2016-02-24 06:09:28
192,点击个人中心，没反应。。。。。。。。。。。。。。。。。,点击个人中心，没反应。。。。。。。。。。。。。。。。。,审核通过,16,2016-02-24 06:09:35
193,游戏礼包----更多---点击又显示没有更多内容了，那还显示更多干嘛,游戏礼包----更多---点击又显示没有更多内容了，那还显示更多干嘛,审核通过,6,2016-02-24 06:09:51
194,游戏资讯---查看更多---点击又显示没有更多内容了，那还显示更多干嘛,游戏资讯---查看更多---点击又显示没有更多内容了，那还显示更多干嘛,审核不通过,6,2016-02-24 06:10:02
195,下载功夫熊猫3---在58%时，就不动了，退出也没有反应，后来就显示无响应了,下载功夫熊猫3---在58%时，就不动了，退出也没有反应，后来就显示无响应了,审核不通过,13,2016-02-24 06:11:06
196,下载功夫熊猫2---一直不动。。。。。。。。。。。。。。。。,下载功夫熊猫2---一直不动。。。。。。。。。。。。。。。。,审核不通过,13,2016-02-24 06:11:20
197,看不到版本有不有更新。。。。。。。。。。。。。。。。。,看不到版本有不有更新。。。。。。。。。。。。。。。。。,审核通过,5,2016-02-24 06:11:55
198,新闻资讯左上方的头像-点击不开。。。。。。。。。。,新闻资讯左上方的头像-点击不开。。。。。。。。。。。。。。,审核通过,2,2016-02-24 06:12:01
199,点击个人中心--------没反应------------------------------------,点击个人中心---------没反点击个人中心，没反应------------------------------------,审核通过,16,2016-02-24 06:12:07
200,游戏礼包----更多---又显示没有更多内容了,游戏礼包----更多---又显示没有更多内容了,审核不通过,6,2016-02-24 06:12:18
201,游戏资讯---查看更多---又显示没有更多内容了,游戏资讯---查看更多---又显示没有更多内容了,审核不通过,6,2016-02-24 06:12:31
202,看不到版本的信息。。。。。。。。。。。。。。。,看不到版本的信息。。。。。。。。。。。。。。。,审核通过,5,2016-02-24 06:12:47
203,下载app 打开 app 点击物理返回按键 发现无法直接退出游戏 需要多次重复按返回键不断返回上级页面到了最后才能退出 很麻烦的,下载app 打开 app 点击物理返回按键 发现无法直接退出游戏 需要多次重复按返回键才能退出 很麻烦的,审核通过,7,2016-02-24 06:12:56
204,下载app 打开 app 发现个人中心和游戏中心页面完全相同 无任何差异点击上面小头像发现无法登录账号,下载app 打开 app 发现个人中心和游戏中心页面完全相同 无任何差异点击上面小头像发现无法登录账号,审核通过,21,2016-02-24 06:13:02
